"0","2","26","4294967295","0.5","4","0.5","4","","","","又……做那个梦了……"
"","","","","7","12","7","12","","","","那个充满了无法抵御的痛苦和悲伤的梦。"
"","","","","15.5","22","15.5","22","","","","我……感觉自己好像忘了什么重要的事……"
"","","","","24.9","31","24.9","31","","","","每次看到折断的剑，我都会想起和魔王那场惨烈的战斗。"
"","","","","37.4","41.5","37.4","41.5","","","","救了少女悠娜之后，已经过了三年……"
"","","","","46","51","46","51","","","","我……应该已经完成了使命。"
"","","","","61.1","65.5","61.1","65.5","","","","可是，我当时为什么在哭……"
"","","","","71.9","79.5","71.9","79.5","","","","已经过去三年了，那一天的疑问至今依然没有答案。"
""