"0","2","26","4294967295","1.8","5.8","0.6","5.8","","","","Lorsque le grand livre noir, le Grimoire Noir, plongera le monde dans le chaos..."
"","","","","6","10.1","7","11.5","","","","Le livre blanc, le Grimoire Weiss, apparaîtra avec ses Vers scellés."
"","","","","10.3","16.7","13.5","20","","","","Grâce à eux, il triomphera du Grimoire Noir et de la calamité qu'il a causée.<LF>C'est en tout cas ce que raconte la légende..."
"","","","","17","20.3","21","22.5","","","","Qu'est-ce qu'un ""Vers scellé"" ?"
"","","","","20.5","24.9","23","26","","","","Il ne reste aucune trace écrite à ce sujet, alors je n'en suis pas certaine."
"","","","","25.1","30","28","30.5","","","","Cependant, il semblerait que ça soit une forme de magie."
""