"0","","","","41.06","45.13","41","45","","","","Unsere Reise war vielleicht bedeutungslos."
"","","","","46.28","51.13","46.5","50","","","","Unsere Vergangenheit war vielleicht ein Fehler."
"","","","","51.27","55.17","51.5","55","","","","Aber es gibt kein Zurück mehr."
"","","","","56.07","60.1","56.07","60.1","","","","Selbst wenn unsere Welt eine Ende findet."
"","","","","61.08","63.11","61.08","63.11","","","","Denn dies ..."
"","","","","66.05","70.16","66.05","70.16","","","","Dies ist die Welt mit den Menschen, die wir gernhaben."
""