"0","2","26","4294967295","4.7","6","4.7","6","","","","Qu'est-ce qui se passe ?"
"","","","","32.8","37.7","33","37.7","","","","Je n'en crois pas mes pages... Cette créature est-elle également une Ombre ?"
"","","","","38.8","41.5","38.8","41","","","","Cette chose a absorbé les villageois..."
"","","","","42.8","48","42.8","47.5","","","","N-non ! Si ça continue, nous allons tous les tuer !"
"","","","","49","51.7","49","51","","","","On ne peut pas faire ça !"
"","","","","53","58.9","53","58.9","","","","Notre village... Notre monde... Où suis-je... ? Qui... suis-je ?"
""