"0","2","26","4294967295","4.7","6","4.7","6","","","","What's happening?"
"","","","","32.8","37.7","33","37.7","","","","By my pages... Is this beast a Shade as well?"
"","","","","38.8","41.5","38.8","41","","","","That thing sucked up the villagers..."
"","","","","42.8","48","42.8","47.5","","","","N-no! If we keep this up, we're gonna kill them all!"
"","","","","49","51.7","49","51","","","","We can't let that happen!"
"","","","","53","58.9","53","58.9","","","","Our village... Our world... Where am I? Who...am I?"
""