"Ahh. Que bom que se juntou a nós!","Ahh. How nice of you to join us.","Aah. Qué bien que hayas venido."
"Sim. Que bom que se juntou a nós!","Yes. How nice of you to join us.","Sí. Qué bien que hayas venido."
"Somos os guard—","We are the administr—","Somos los administradores de este bosque."
"Você é tão cheio de vida.","How full of life you are.","Qué llena de vida estás."
"Não vamos chegar a nenhum lugar assim.","We won't get anywhere like this.","Así nunca llegaremos a ninguna parte."
"Então é isso. Vamos lutar.","Now then. Let us fight.","Pues nada. Luchemos."