"1327","","0","1","0","EID_1500_a0001_00011_YONAH010_X","","","","","0","-1","1002","0","5","Mas da próxima vez, você me conta uma história para dormir?"
"1328","","0","1","0","EID_1500_a0001_00013_NIER010_X","","","","","0","1002","-1","0","2","Com certeza."
"","","0","1","0","EID_1500_a0001_00012_YONAH010_X","","","","","0","-1","1002","0","5","Sério? Você vai ficar comigo? DE VERDADE!?"
"","","0","1","0","RID_NIER_01810","","","","","0","1002","-1","0","2","Heh. Sim, Yonah, vou ficar."
"","","0","1","0","EID_1500_a0001_00014_YONAH010_X","","","","","0","-1","1002","0","5","Yaaay!"
"","","0","1","0","EID_1500_a0001_00015_NIER010_X","","","","","0","1002","-1","0","2","Agora volte para a cama."
"","","0","1","0","EID_1500_a0001_00016_YONAH010_X","","","","<CB=EID_1500_a0005_010_01_Start>","0","-1","1002","0","5","Ok!"
"1329","","0","1","0","NV_ID_1414","","","","","-1","0","0","0","2","(Só um sonho...)"
"","","0","1","0","NV_ID_1415","","","","","-1","0","0","0","2","(Mesmo em meus sonhos, estou caçando os Versos Selados.)"
"1330","1331","0","2","0","RID_YONAH_00100","","","","","-1","-1","1002","0","5","Bom dia!"
"","","0","1","0","EID_1500_a0001_00018_NIER010_X","","","","","-1","1002","-1","0","2","Nnngh. B-bom dia, Yonah."
"","","0","1","0","EID_1500_a0001_00019_YONAH010_X","","","","","-1","-1","1002","0","5","O que foi? Você também está se sentindo mal?"
"","","0","1","0","EID_1500_a0001_00020_NIER010_X","","","","","-1","1002","-1","0","2","Não, eu apenas... Eu tive um sonho estranho."
"","","0","1","0","EID_1500_a0001_00021_YONAH010_X","","","","","-1","-1","1002","0","5","Sobre o que era?"
"","","0","1","0","EID_1500_a0001_00022_NIER010_X","","","","","-1","1002","-1","0","2","Não é nada. Não se preocupe com isso."
"","","0","1","0","EID_1500_a0001_00023_YONAH010_X","","","","","-1","-1","1002","0","5","Porque eu também tive um sonho!"
"","","0","1","0","EID_1500_a0001_00024_NIER010_X","","","","","-1","1002","-1","0","2","Ah é?"
"","","0","1","0","EID_1500_a0001_00025_YONAH010_X","","","","","-1","-1","1002","0","5","É! Eu e esse menino estávamos jogando um jogo juntos."
"","","0","1","0","EID_1500_a0001_00026_NIER010_X","","","","","-1","1002","-1","0","2","Que tipo de jogo?"
"","","0","1","0","EID_1500_a0001_00027_YONAH010_X","","","","","-1","-1","1002","0","5","Era chamado Adivinhe as Palavras. ...Acho que ele inventou, porque nunca ouvi falar antes."
"","","0","1","0","EID_1500_a0001_00028_NIER010_X","","","","","-1","1002","-1","0","2","Como funcionava?"
"","","0","1","0","EID_1500_a0001_00029_YONAH010_X","","","","","-1","-1","1002","0","5","O menino mexia a boca, mas nenhuma palavra saía. Então eu tinha que adivinhar o que ele estava tentando dizer.."
"","","0","1","0","EID_1500_a0001_00030_YONAH010_X","","","","","-1","-1","1002","0","5","Foi difícil. Eu queria brincar de esconde-esconde, mas tivemos que jogar o jogo idiota dele.."
"","","0","1","0","EID_1500_a0001_00031_NIER010_X","","","","","-1","1002","-1","0","2","Então o que ele <FONT=ITALIC>disse</FONT>?"
"1331","","0","1","0","EID_1500_a0001_00032_YONAH010_X","","","","","-1","-1","1002","0","5","Eu não sei. Tudo o que consegui entender foi ""sonho"" e ""Floresta dos Mitos""."
"","","0","1","0","EID_1500_a0001_00033_YONAH010_X","","","","","-1","-1","1002","0","5","Mas não se preocupe. Vou estudar muito para na próxima vez entender tudo."
"","","0","1","0","EID_1500_a0001_00034_YONAH010_X","","","","","-1","-1","1002","0","5","Nós deveríamos jogar um jogo juntos também!"
"","","0","1","0","EID_1500_a0001_00035_NIER010_X","","","","<CB=EID_1500_a0005_060_End>","-1","1002","-1","0","2","Claro, Yonah."
"1332","","0","1","0","EID_1500_a0001_00034_YONAH010_X","","","","","0","-1","1002","0","5","Nós deveríamos jogar um jogo juntos também!"
"1333","","0","1","0","EID_1500_a0001_00036_NIER010_X","","","","","-1","0","0","0","2","......"
"","","0","1","0","EID_1500_a0001_00037_BOOKW010_X","","","","","-1","0","0","0","26","Algum problema, rapaz?"
"","","0","1","0","EID_1500_a0001_00038_NIER010_X","","","","","-1","0","-1","0","2","Não é nada. Não se preocupe com isso."
"","","0","1","0","EID_1500_a0001_00039_NIER010_X","","","","","-1","0","-1","0","2","Vamos lá. Preciso ir perguntar algo para a Popola."
"1334","","0","2","0","RID_POPOL_00070","","","","","-1","0","0","0","24","Hmmm..."
"","","0","1","0","EID_1500_a0005_0020_X","","","","","0","1004","-1","0","2","O que foi, Popola?"
"","","0","1","0","EID_1500_a0005_0030_X","","","","<CB=EID_1500_a0005_080_Start>","0","-1","1004","0","24","Ah, oi. Acabei de receber uma carta estranha no correio."
"1335","","0","1","0","EID_1500_a0005_0040_X","","","","","0","1004","1025","0","26","Certamente é uma peça de escrita bizarra."
"","","0","1","0","EID_1500_a0005_0050_X","","","","","0","1004","-1","0","2","De quem é a carta?"
"","","0","1","0","EID_1500_a0005_0060_X","","","","","0","-1","1004","0","24","Do prefeito de uma pequena vila na Floresta dos Mitos. É uma área arborizada no norte."
"","","0","1","0","EID_1500_a0005_0065_X","","","","","0","1004","-1","0","2","A Floresta dos Mitos!?"
"","","0","1","0","EID_1500_a0005_0070_X","","","","","0","-1","1004","0","24","Eles geralmente são um grupo de pessoas alegres e animadas. Algo assim é muito fora de caráter para eles."
"","","0","1","0","EID_1500_a0005_0071_X","","","","","0","-1","1004","0","24","Eu tenho um mau pressentimento sobre isso."
"","","0","1","0","EID_1500_a0005_0072_X","","","","","0","1004","-1","0","2","Eu vou dar uma olhada."
"","","0","1","0","EID_1500_a0005_0073_X","","","","","0","-1","1004","0","24","Er, você vai? Mas..."
"","","0","1","0","EID_1500_a0005_0074_X","","","","","0","1004","-1","0","2","Não se preocupe. Eu tenho negócios lá de qualquer forma."
"","","0","1","0","EID_1500_a0005_0075_X","","","","<CB=EID_1500_a0005_080_End>","0","-1","1004","0","24","Oh. Bem, tudo bem. Obrigado."
"1336","","0","1","0","RID_POPOL_00080","","","","","0","-1","1004","0","24","A Floresta dos Mitos fica ao norte, depois de atravessar a pequena ponte de madeira nas planícies do norte. "
"1337","1338","0","2","0","EXID_MMD_POPOL_00010","","","","","0","-1","1004","0","24","O Sonho da Morte certamente é uma doença estranha..."
"","","0","1","0","EXID_MMD_NIER010_00010","","","","","0","1004","-1","0","2","Sim, foi algo, com certeza."
"","","0","1","0","EXID_MMD_BOOKW_00010","","","","","0","1004","1025","0","26","Mesmo eu, com meu amor natural pelas palavras, não tenho desejo de visitar aquele lugar novamente."
"","","0","1","0","EXID_MMD_POPOL_00020","","","","","0","-1","1004","0","24","Vocês se saíram bem."
"1338","","0","1","0","EXID_MMD_POPOL_00030","","","","","0","-1","1004","0","24","Você tem feito muitas viagens longas ultimamente. Tem certeza de que não está se esforçando demais?"
"","","0","1","0","EXID_MMD_NIER010_00020","","","","","0","1004","-1","0","2","Eu estou bem. Não posso ficar sentado o dia todo enquanto Yonah está doente, afinal."
"","","0","1","0","EXID_MMD_POPOL_00040","","","","","0","-1","1004","0","24","Se você diz..."
"","","0","1","0","EXID_MMD_NIER010_00030","","","","","0","1004","-1","0","2","Então...há algo que eu possa fazer por você?"
"","","0","1","0","EXID_MMD_POPOL_00050","","","","","0","-1","1004","0","24","Bem, eu suponho que <FONT=ITALIC>haja</FONT> algo que eu poderia usar ajuda. Você já ouviu falar sobre nossos planos para reparar o canal?"
"","","0","1","0","EXID_MMD_POPOL_00060","","","","","0","-1","1004","0","24","O trabalho provavelmente não acontecerá por um tempo, mas uma vez que estiver feito, podemos usar o canal para comércio, viagem e todo tipo de coisas úteis."
"","","0","1","0","EXID_MMD_POPOL_00070","","","","","0","-1","1004","0","24","Infelizmente, porém, estamos um pouco atrasados no momento."
"","","0","1","0","EXID_MMD_POPOL_00080","","","","","0","-1","1004","0","24","Se você estiver disposto a ajudar, eu realmente apreciaria."
"","","0","1","0","EXID_MMD_NIER010_00040","","","","","0","1004","-1","0","2","Sem problemas! O que você precisa?"
"","","0","1","0","EXID_MMD_POPOL_00090","","","","","0","-1","1004","0","24","Ótimo."
"","","0","1","0","EXID_MMD_POPOL_00100","","","","","0","-1","1004","0","24","Então, o homem que eu originalmente pedi para ajudar neste projeto não apareceu para trabalhar há alguns dias."
"","","0","1","0","EXID_MMD_POPOL_00110","","","","","0","-1","1004","0","24","Estou começando a ficar um pouco preocupado, então talvez você possa ir para Beira-Mar e verificar como ele está?"
"","","0","1","0","EXID_MMD_POPOL_00120","","","","","0","-1","1004","0","24","Vou marcar a localização da casa dele no seu mapa."
"","","0","1","0","EXID_MMD_POPOL_00130","","","","","0","-1","1004","0","24","Ele sempre carrega uma bolsa vermelha no ombro, então ele deve ser fácil de encontrar."
"","","0","1","0","EXID_MMD_NIER010_00050","","","","<CB=EID_9300_a0010g_0010_End>","0","1004","-1","0","2","Entendi!"
"1339","1340","0","1","0","EID_4500_a0400_0041_X_ex","","","","<CB=Motion_Turn_to_Nier>","0","-1","1004","0","24","Ei, espera—"
"1340","","0","1","0","EID_4500_a0400_0042_X","","","","","0","1004","-1","0","2","Hã?"
"","","0","1","0","EID_4500_a0400_0043_X_ex","","","","","0","-1","1004","0","24","Eu quase esqueci: Yonah está procurando por você."
"","","0","1","0","EID_4500_a0400_0044_X","","","","","0","1004","-1","0","2","Ah?"
"","","0","1","0","EID_4500_a0400_0045_X_ex","","","","","0","-1","1004","0","24","Ela disse que precisava de algo de você. Hora de ser um irmão mais velho por um tempo, não é mesmo?"
"","","0","1","0","EID_4500_a0400_0046_X","","","","<CB=EID_1500_a0200_End>","0","1004","-1","0","2","Acho que sim. Obrigado, Popola."
"1341","","0","1","0","RID_POPOL_00090_ex","","","","","0","-1","1004","0","24","Obrigado, pessoal."
"1342","","0","2","0","EID_1100_a0005g_035_010","","","","","0","-1","1004","0","24",""
"","","0","1","0","EID_1100_a0005g_035_020","","","","<CB=EID_1100_a0005g_010_Start>","0","1004","-1","0","2","sem texto"
"1343","","0","1","0","RID_POPOL_00100_ex","","","","","0","-1","1004","0","24","Ela não disse do que se tratava, mas parecia bastante preocupada."
"1344","1345","0","2","0","RID_YONAH_00110","","","","","0","-1","1002","0","5","Uhu! Você voltou!"
"","","0","1","0","EID_1100_a0005g_00002_NIER010_X","","","","","0","1002","-1","0","2","Popola disse que você precisava de algo?"
"","","0","1","0","EID_1100_a0005g_00003_YONAH010_X","","","","","0","-1","1002","0","5","Sim. Um favor, na verdade."
"","","0","1","0","EID_1100_a0005g_00004_NIER010_X","","","","","0","1002","-1","0","2","O que é?"
"","","0","1","0","EID_1100_a0005g_00005_YONAH010_X","","","","","0","-1","1002","0","5","Um..."
"","","0","1","0","EID_1100_a0005g_00006_NIER010_X","","","","","0","1002","-1","0","2","Eu não posso ajudar se você não me disser, Sis."
"","","0","1","0","EID_1100_a0005g_00007_YONAH010_X","","","","","0","-1","1002","0","5","Ok, eu vou dizer. Pronto?"
"","","0","1","0","EID_1100_a0005g_00008_NIER010_X","","","","","0","1002","-1","0","2","Estou pronto, Yonah."
"","","0","1","0","EID_1100_a0005g_00009_YONAH010_X","","","","","0","-1","1002","0","5","Eu preciso que você ajude meu amigo!"
"","","0","1","0","EID_1100_a0005g_00010_NIER010_X","","","","","0","1002","-1","0","2","Seu... amigo?"
"","","0","1","0","EID_1100_a0005g_00011_YONAH010_X","","","","","0","-1","1002","0","5","Sim! Eu tenho um amigo, e nós temos escrito cartas um para o outro."
"","","0","1","0","EID_1100_a0005g_00012_NIER010_X","","","","","0","1002","-1","0","2","Sério?"
"","","0","1","0","EID_1100_a0005g_00013_BOOKW010_X","","","","","0","1002","1025","0","26","Um amigo por correspondência! Que encantador!"
"","","0","1","0","EID_1100_a0005g_00014_NIER010_X","","","","","0","1002","-1","0","2","Então quem é esse amigo?"
"","","0","1","0","EID_1100_a0005g_00015_YONAH010_X","","","","","0","-1","1002","0","5","Um, bem, ele é meio que..."
"","","0","1","0","EID_1100_a0005g_00016_NIER010_X","","","","","0","1002","-1","0","2","Ele!? É um cara?"
"1345","","0","1","1","EID_1100_a0005g_00017_YONAH010_X","","","","","0","-1","1002","0","5","Sim, e ele está doente e em grande apuros!"
"","","0","1","0","EID_1100_a0005g_00018_YONAH010_X","","","","","0","-1","1002","0","5","E eu sei que você e Weissey são os únicos que podem ajudá-lo!"
"","","0","1","0","EID_1100_a0005g_00019_BOOKW010_X","","","","","0","1002","1025","0","26","Weissey..."
"","","0","1","0","EID_1100_a0005g_00020_NIER010_X","","","","","0","1002","-1","0","2","Me fale sobre esse cara."
"","","0","1","0","EID_1100_a0005g_00021_YONAH010_X","","","","","0","-1","1002","0","5","Ele mora em uma casa muito grande lá no sul, e ele é super legal, e ele é meu amigo."
"","","0","1","0","EID_1100_a0005g_00022_YONAH010_X","","","","","0","-1","1002","0","5","Então você tem que ajudá-lo. Por favor?"
"","","0","1","0","EID_1100_a0005g_00023_NIER010_X","","","","","0","1002","-1","0","2","Yonah, escute..."
"","","0","1","0","EID_1100_a0005g_00024_YONAH010_X","","","","","0","-1","1002","0","5","Por favor!?!"
"","","0","1","0","EID_1100_a0005g_00025_NIER010_X","","","","<CB=EID_1100_a0005g_Selsect>","0","1002","-1","0","2","Ótimo. E agora o que eu faço?"
"1346","","0","1","1","EID_1100_a0005g_00026_SYS_X<LF>EID_1100_a0005g_00027_SYS_X","","","","","-1","0","0","0","","<LIST=2769>Eu não posso dizer não para ela.</LIST><LF><LIST=2770>Curar a Rabisco Negro dela é mais importante.</LIST>"
"1347","","0","1","0","EID_1100_a0005g_00028_NIER010_X","","","","","0","1002","-1","0","2","Ok. Vou ver o que posso fazer."
"","","0","1","0","EID_1100_a0005g_00029_YONAH010_X","","","","<CB=EID_1100_a0005g_010_Start>","0","-1","1002","0","5","Yaaay! Obrigado!"
"1348","1349","3","1","1","EID_1100_a0005g_00030_NIER010_X","","","","","0","1002","-1","0","2","Yonah, agora mesmo a sua doença é mais importante..."
"1349","","0","1","0","EID_1100_a0005g_00031_YONAH010_X","","","","","0","-1","1002","0","5","Por favor! Apenas desta vez!"
"","","0","1","0","EID_1100_a0005g_00032_NIER010_X","","","","<CB=EID_1100_a0005g_Selsect>","0","1002","-1","0","2","Urgh..."
"1350","","0","1","0","RID_YONAH_00120","","","","","0","-1","1002","0","5","Por favor, ajude ele, ok?"
"1351","","0","1","0","EID_1100_a0005g_00034_NIER010_X","","","","","-1","0","-1","0","2","Ótimo. Yonah tem um namorado..."
"","","0","1","0","EID_1100_a0005g_00035_BOOKW010_X","","","","","-1","0","0","0","26","Alguma coisa está errada, rapaz? Sua voz está tremendo."
"","","0","1","0","EID_1100_a0005g_00036_NIER010_X","","","","","-1","0","-1","0","2","N-não está! Cale a boca!"
"1352","1353","0","2","0","EID_1100_a0020_0010_BUTLER_X","","","<CB=EID_1100_a0020_01_Start>","","-1","0","1028","0","34","Nós estávamos esperando por vocês, senhores."
"1353","","0","1","0","EID_1100_a0020_0020_BUTLER_X","","","","<CB=EID_1100_a0020_01_End>","-1","0","1028","0","34","Por favor, siga por aqui."
"1354","","0","1","0","EID_1100_a0030_0010_BUTLER_X","","","","","-1","0","1028","0","34","Por favor, espere aqui."
"1355","","0","1","0","EID_1100_a0030_0020_KAINE010_X","","","","","-1","0","0","0","28","Esperar é um saco. Me avise se algum Sombras aparecer, tá bom?"
"1356","","0","1","0","EID_1100_a0030_0025_NIER010_X_1","","","","","-1","0","0","0","2","......"
"","","0","1","0","EID_1100_a0035g_0010_NIER010_X_1","","","","","-1","0","0","0","2","Kainé com certeza é algo, não é?"
"","","0","1","0","EID_1100_a0035g_0020_BOOKW010_X","","","","","-1","0","0","0","26","Ela deve ter nervos de aço puro."
"1357","","0","1","0","EID_1100_a0035g_0030_BOOKW010_X","","","","","-1","0","0","0","26","T-talvez devêssemos voltar, sim?"
"","","0","1","0","EID_1100_a0035g_0040_NIER010_X","","","","","-1","0","0","0","2","Hmm..."
"1358","","0","1","0","EID_1100_a0035g_0050_NIER010_X","","","","","-1","0","0","0","2","Está trancado."
"1359","","0","1","0","EID_1100_a0040_0010_NIER010_X","","","","","-1","0","0","0","2","Ei, para onde Kainé foi?"
"","","0","1","0","EID_1100_a0040_0020_BOOKW010_X","","","","","-1","0","0","0","26","Eu sabia que isso era uma ideia terrível! Mansões assombradas e tal... Ah, por que ninguém nunca me ouve!?"
"1360","","0","1","0","EID_1100_a0030_0031_NIER010_X","","","","","-1","0","0","0","2","Hmm. Parece que está com dor. É meio assustador."
"","","0","1","0","EID_1100_a0030_0032_BOOKW010_X","","","","","-1","0","0","0","26","S-s-sim... Vamos lá! Coragem! Avante e para cima, hein?"
"1361","","0","1","0","EID_1100_a0030_0032_BOOKW010_X2","","","","","-1","0","0","0","26","S-s-sim... Vamos lá! Coragem! Avante e para cima, hein?"
"1362","1363","0","1","0","EID_1100_a0060_0010_NIER010_X","","","","","0","1001","-1","0","2","Você descobriu isso pelos meus passos?"
"","","0","1","0","EID_1100_a0060_0020_SNOW010_X","","","","","0","-1","1001","0","25","Não é difícil, uma vez que você sabe como."
"","","0","1","0","EID_1100_a0060_0030_NIER010_X","","","","","0","1001","-1","0","2","Então eu suponho que devo lhe falar sobre meu amigo Weiss."
"","","0","1","0","EID_1100_a0060_0040_SNOW010_X","","","","","0","-1","1001","0","25","Eu... eu só ouvi um conjunto de passos..."
"","","0","1","0","EID_1100_a0060_0050_BOOKW010_X","","","","","-1","0","0","0","26","Grimório Weiss não caminha como um mamífero terrestre comum!"
"","","0","1","0","EID_1100_a0060_0060_SNOW010_X","","","","","0","-1","1001","0","25","Eek!"
"","","0","1","0","EID_1100_a0060_0070_BOOKW010_X","","","","","-1","0","0","0","26","Mas chega de conversa introdutória. Deixe-nos ouvir sua história."
"","","0","1","0","EID_1100_a0060_0080_SNOW010_X","","","","","0","-1","1001","0","35","Meu nome é Emil. Sou o mestre desta mansão."
"","","0","1","0","EID_1100_a0060_0090_NIER010_X","","","","","0","1001","-1","0","2","Então você é o responsável pelas cartas?"
"1363","","0","1","0","EID_1100_a0060_0100_SNOW010_X","","","","","0","-1","1001","0","35","Cartas? Do que você está falando?"
"","","0","1","0","EID_1100_a0060_0110_BOOKW010_X","","","","","-1","0","0","0","26","É claro que você não sabe. Tal coisa seria muito simples."
"1364","1365","0","2","0","EID_1100_a0062g_0010_SNOW010_X","","","","","-1","0","0","0","35","Não! Fique longe!"
"1365","","0","1","0","EID_1100_a0064_0010_NIER010_X","","","","","-1","0","0","0","2","Hein?"
"","","0","1","0","EID_1100_a0064_0020_SNOW010_X","","","","","-1","0","0","0","35","Me desculpe. São meus olhos. Tudo o que eu olho vira pedra."
"","","0","1","0","EID_1100_a0064_0030_SNOW010_X","","","","","0","-1","1001","0","35","Por isso que eu uso esta venda."
"","","0","1","0","EID_1100_a0064_0040_BOOKW010_X","","","","","0","1001","0","0","26","Que habilidade notável! Eu nunca ouvi falar de algo assim."
"","","0","1","0","EID_1100_a0064_0050_SNOW010_X","","","","","0","-1","1001","0","35","De qualquer forma, suponho que meu mordomo possa saber mais sobre as cartas que você recebeu."
"","","0","1","0","EID_1100_a0064_0060_SNOW010_X","","","","","0","-1","1001","0","35","Esta chave aqui pode abrir qualquer porta da mansão, então se você quiser minha ajuda..."
"","","0","1","0","EID_1100_a0064_0070_NIER010_X","","","","","0","1001","-1","0","2","Não, por favor, não se incomode. Nós podemos nos virar sozinhos."
"","","0","1","0","EID_1100_a0064_0080_SNOW010_X","","","","","0","-1","1001","0","35","Ah! Certo...claro. Bem, aqui está a chave então."
"","","0","1","0","EID_1100_a0064_0090_SNOW010_X","","","","","0","-1","1001","0","35","Os aposentos do mordomo ficam no fim da mansão."
"","","0","1","0","EID_1100_a0064_0091_SNOW010_X","","","","<CB=EID_1100_a0064_01_End>","0","-1","1001","0","35","Deixe-me pelo menos te dar um mapa. É um lugar grande, e eu não quero que você se perca."
"1366","","0","1","0","EID_1100_a0064_0092_NIER010_X","","","","","-1","0","0","0","2","Nós ainda não terminamos de falar com ele."
"1367","","0","1","0","EID_1100_a0064_0090_SNOW010_X","","","","","-1","0","0","0","35","Os aposentos do mordomo ficam no fim da mansão."
"1368","","0","1","0","EID_1100_a0067g_0031_NIER010_X","","","","","-1","0","0","0","2","O que é isso?"
"","","0","1","0","EID_1100_a0067g_0032_BOOKW010_X","","","","","-1","0","0","0","26","Um mordomo... Ou pelo menos uma semelhança notável de um."
"","","0","1","0","EID_1100_a0067g_0040_BOOKW010_X","","","","","-1","0","0","0","26","Eu <FONT=ITALIC>sabia</FONT> que isso era uma armadilha. Maldita minha intuição brilhante..."
"1369","","0","2","0","EID_1100_a0070_0010_NIER010_X","","","","","-1","0","0","0","2","Nossa."
"","","0","1","0","EID_1100_a0070_0020_BOOKW010_X","","","","","-1","0","0","0","26","Aquilo...é outro?"
"","","0","1","0","EID_1100_a0070_0030_BUTLER_X","","","","","-1","0","0","0","34","......"
"1370","","0","1","0","EID_1100_a0070_0040_NIER010_X","","","","","-1","0","0","0","2","Aaaah!"
"","","0","1","0","EID_1100_a0070_0050_BOOKW010_X","","","","","-1","0","0","0","26","Blaaargh!"
"","","0","1","0","EID_1100_a0070_0055_BOOKW010_X","","","","","-1","0","0","0","26","Gah! Está se mexendo!"
"1371","1372","0","1","0","EID_1100_a0070_0060_SNOW010_X","","","","<CB=ScriptMode_to_Nier_07>","-1","0","1001","0","35","O-q-que está acontecendo aqui?"
"","","0","1","0","EID_1100_a0070_0070_BUTLER_X","","","","","0","1001","1028","0","34","Senhor?"
"","","0","1","0","EID_1100_a0070_0080_BOOKW010_X","","","","","0","1028","1025","0","26","O-q-q-que é isso!?"
"","","0","1","0","EID_1100_a0070_0090_SNOW010_X","","","","","0","-1","1001","0","35","Ah, este é meu mordomo. Ele me ajuda pela mansão."
"","","0","1","0","EID_1100_a0070_0100_SNOW010_X","","","","","0","-1","1001","0","35","Ele é um homem bom por natureza, mas um pouco...inflexível. Quase como uma estátua."
"","","0","1","0","EID_1100_a0070_0110_BUTLER_X","","","","<CB=ScriptMode_to_Nier_08>","0","1001","1028","0","34","Sim, e peço desculpas por isso, Mestre Emil."
"1372","1377","0","1","0","EID_1100_a0070_0120_BOOKW010_X","","","","","0","1028","1025","0","26","Hmph! Duvido que ele seja sequer humano."
"","","0","1","0","EID_1100_a0070_0130_NIER010_X","","","","","0","1028","-1","0","2","Estamos aqui porque minha irmã recebeu algumas cartas desta mansão..."
"","","0","1","0","EID_1100_a0070_0140_BUTLER_X","","","","","0","-1","1028","0","34","Sim, fui eu quem escreveu aquelas cartas. Por favor, perdoe minha impertinência."
"","","0","1","0","EID_1100_a0070_0160_BUTLER_X","","","","","0","-1","1028","0","34","Como você sabe, Mestre Emil, profundamente atormentado por seus olhos, ele se isolou do mundo."
"","","0","1","0","EID_1100_a0070_0170_BUTLER_X","","","","","0","-1","1028","0","34","Ele sofre muito por trás daquela venda e sinto que é meu dever ajudar como puder."
"","","0","1","0","EID_1100_a0070_0171_BUTLER_X","","","","","0","-1","1028","0","34","Ouvi falar das façanhas de um herói emergente, e então enviei uma carta para você em nome do Mestre Emil..."
"","","0","1","0","EID_1100_a0070_0172_BUTLER_X","","","","","0","-1","1028","0","34","Mas recebi uma resposta de uma tal de Yonah."
"","","0","1","0","EID_1100_a0070_0173_NIER010_X","","","","","0","1028","-1","0","2","Espera, então a correspondente de Yonah é <FONT=ITALIC>você?</FONT>"
"","","0","1","0","EID_1100_a0070_0174_BUTLER_X","","","","","0","-1","1028","0","34","Sim, senhor."
"","","0","1","0","EID_1100_a0070_0175_BUTLER_X","","","","","0","-1","1028","0","34","Minhas cartas apenas pediam que você viesse para a mansão. Não tive intenções maliciosas."
"","","0","1","0","EID_1100_a0070_0176_BOOKW010_X","","","","","0","1028","1025","0","26","Acredito que Yonah tenha interpretado a situação de forma diferente."
"","","0","1","0","EID_1100_a0070_0177_NIER010_X","","","","","0","1028","-1","0","2","Sim, parece que ela entendeu a situação de maneira equivocada."
"","","0","1","0","EID_1100_a0070_0178_BUTLER_X","","","","","0","-1","1028","0","34","Independentemente disso, estou muito satisfeito em vê-lo aqui. Há muito tempo sonho com o dia em que possamos fazer algo pelos olhos do Mestre Emil."
"","","0","1","0","EID_1100_a0070_0190_NIER010_X","","","","","0","1028","-1","0","2","Entendo..."
"","","0","1","0","EID_1100_a0070_0200_BOOKW010_X","","","","","0","1028","1025","0","26","Sim, bem, receio que nós - ou pelo menos o jovem ao meu lado - não sejamos nem herói nem médico, então, se nos der licença..."
"1373","","0","2","0","EID_1100_a0070_0010_NIER010_X","","","","","-1","0","0","0","2","Uau."
"","","0","1","0","EID_1100_a0070_0030_BUTLER_X","","","","","-1","0","0","0","34","......"
"","","0","1","0","RA_EID_9999_NoSound","","","","","-1","0","0","0","34","......"
"","","0","1","0","RA_EID_9999_NoSound","","","","","-1","0","0","0","34","......"
"1374","","0","1","0","EID_1100_a0070_0040_NIER010_X","","","","","-1","0","0","0","2","Aaaah!"
"","","0","1","0","EID_1100_a0070_0050_BOOKW010_X","","","","","-1","0","0","0","26","Blaaargh!"
"","","0","1","0","EID_1100_a0070_0055_BOOKW010_X","","","","","-1","0","0","0","26","Gah! Ele se mexe!"
"1375","1376","0","1","0","EID_1100_a0070_0060_SNOW010_X","","","","<CB=ScriptMode_to_Nier_07>","-1","0","1001","0","35","O que está acontecendo aqui?"
"","","0","1","0","EID_1100_a0070_0070_BUTLER_X","","","","","0","1001","1028","0","34","Senhor?"
"","","0","1","0","EID_1100_a0070_0080_BOOKW010_X","","","","","0","1028","1025","0","26","Qu-qu-o que é isso!?"
"","","0","1","0","EID_1100_a0070_0090_SNOW010_X","","","","","0","-1","1001","0","35","Ah, este é meu mordomo. Ele me ajuda na mansão."
"","","0","1","0","EID_1100_a0070_0100_SNOW010_X","","","","","0","-1","1001","0","35","Ele é um bom homem, mas um pouco...inflexível. Quase como uma estátua."
"","","0","1","0","EID_1100_a0070_0110_BUTLER_X","","","","<CB=ScriptMode_to_Nier_08>","0","1001","1028","0","34","Sim, e peço desculpas por isso, Mestre Emil."
