"1674","","0","1","0","SEID_1410_S0070_0050_X","","","","","0","1103","-1","0","2","Para algo assim? Claro!"
"","","0","1","0","RID_MSKWOMI_00070","","","","","0","-1","1103","0","146","(Muito obrigado.)"
"","","0","1","0","RID_MSKWOMI_00080","","","","","0","-1","1103","0","146","(Eu preciso que você me traga dez objetos redondos e listrados de comida.)"
"","","0","1","0","SEID_1410_S0070_0080_X","","","","","-1","0","0","0","26","Hum, acho que você precisa ser mais específico."
"","","0","1","0","RID_MSKWOMI_00090","","","","","0","-1","1103","0","146","(Desculpe, mas a Regra 27.229 diz que, ao enviar alguém em uma tarefa, você não pode mencionar o nome do item que deseja que eles comprem.)"
"","","0","1","0","SEID_1410_S0070_0100_X","","","","<CB=SEID_1410_S0030_a0070g_Start><LF><CB=LIB_SET_END_SUBQUEST>","0","1103","-1","0","2","Bem, essa é uma regra louca. Mas se eu conseguir descobrir, com certeza vou trazer para você."
"1675","","0","2","0","RID_NIER_00780","","","","","0","1103","-1","0","2","Essas melancias são o que você estava procurando?"
"","","0","1","0","RID_MSKWOMI_00100","","","","","0","-1","1103","0","146","(Sim! Muito obrigado.)"
"","","0","1","0","SEID_1410_S0070_0130_X","","","","","0","1103","-1","0","2","Ótimo! Espero que você possa fazer algo saboroso para sua filha."
"","","0","1","0","RID_MSKWOMI_00110","","","","<CB=SEID_1410_S0070_a0030_End01>","0","-1","1103","0","146","(Ah, ela ama bolo de melancia mais do que qualquer coisa. Agora, por favor, pegue essa recompensa.)"
"1676","","0","2","0","RID_NIER_00790","","","","","0","1103","-1","0","2","Algum disso é o que você estava procurando?"
"","","0","1","0","RID_MSKWOMI_00120","","","","","0","-1","1103","0","146","(Não, desculpe.)"
"","","0","1","0","SEID_1410_S0070_0170_X","","","","<CB=SEID_1410_S0070_a0030_End02>","0","1103","-1","0","2","Ah, bem, acho que vou continuar procurando..."
"1677","","0","2","0","RID_VILRAFA_00010","","","","","0","-1","1358","0","8","Com licença, você viu meu filho?"
"","","0","1","0","SEID_1410_S0130_0020_X","","","","","0","1358","-1","0","2","Acho que não. Por quê, algo de errado aconteceu?"
"","","0","1","0","RID_VILRAFA_00021","","","","","0","-1","1358","0","8","Quando cheguei em casa, encontrei um bilhete dele dizendo que ele estava indo embora e para não procurá-lo. E se ele deixou a vila!?"
"","","0","1","0","RID_VILRAFA_00030","","","","","0","-1","1358","0","8","Por favor, você tem que me ajudar! Eu vou te pagar o que você quiser!"
"","","0","1","0","RID_VILRAFA_00040","","","","<CB=LIB_SET_START_SUBQUEST,1712,40,2,1358,1678>","0","-1","1358","0","8","Meu filho não deve ser muito difícil de encontrar. Ele usa um chapéu muito estranho. Você pode vê-lo a uma milha de distância."
"1678","","0","1","0","SEID_1410_S0130_0050_X","","","","<CB=LIB_SET_END_SUBQUEST>","0","1358","-1","0","2","Ok. Se eu vê-lo, vou avisá-lo que o pai dele está preocupado com ele."
"1679","","0","1","0","RID_VILRAFA_00050","","","","","0","-1","1358","0","8","Por favor. Me avise imediatamente se o encontrar!"
"1680","","0","2","0","RID_NIER_00510","","","","","0","1359","-1","0","2","Ei. Você é o garoto que fugiu de casa?"
"","","0","1","0","RID_VILRASN_00010","","","","","0","-1","1359","0","19","Hã? Ah, cara, como você soube?"
"","","0","1","0","SEID_1410_S0130_0090_X","","","","","0","1359","-1","0","2","Seu pai está preocupado doente com você. Por que você saiu, afinal?"
"","","0","1","0","RID_VILRASN_00020","","","","","0","-1","1359","0","19","Porque ele quer que eu, tipo, assuma os negócios da família. E eu não vou fazer isso, cara! Eu sou um rebelde!"
"","","0","1","0","SEID_1410_S0130_0110_X","","","","","-1","0","0","0","26","Sim, podemos ver isso. Bem, talvez você deva informar seu pai que está vivo e bem, e também explicar a ele por que você saiu."
"","","0","1","0","RID_VILRASN_00030","","","","","0","-1","1359","0","19","Ah, cara, por que as pessoas sempre têm que me incomodar! Sim, tudo bem. Vou fazer isso. Mas primeiro você tem que fazer algo por MIM, cara!"
"","","0","1","0","RID_VILRASN_00040","","","","","0","-1","1359","0","19","O cara que comanda a taverna tem me ajudado desde que cheguei aqui, e eu quero dar a ele algo legal."
"","","0","1","0","RID_VILRASN_00050","","","","","0","-1","1359","0","19","Eu estava pensando que poderia, tipo, cozinhar o jantar ou algo assim? Mas eu não tenho nenhum ingrediente ou algo assim, então... sim."
"","","0","1","0","SEID_1410_S0130_0150_X","","","","","0","1359","-1","0","2","Se isso vai te fazer voltar para casa do seu pai mais cedo, então tudo bem, eu vou ajudar. O que você precisa?"
"","","0","1","0","RID_VILRASN_00060","","","","","0","-1","1359","0","19","Esse cara, cara, ele não come nada além de peixe. O tempo todo, todos os dias, peixe, peixe, peixe. Então eu estava pensando que ele talvez queira experimentar comer carne ou algo assim? Você sabe, por uma mudança."
"","","0","1","0","RID_VILRASN_00070","","","","","0","-1","1359","0","19","Então você poderia me conseguir, tipo, cinco pedaços de carneiro e três pedaços de carne de cabra?"
"","","0","1","0","RID_VILRASN_00080","","","","<CB=SEID_1410_S0130_a0020_End>","0","-1","1359","0","19","Eu posso encontrar as panelas e colheres e tal, então só traga a carne para o lugar dele quando quiser, cara."
"1681","","0","1","0","RID_NIER_00520","","","","","0","1351","-1","0","2","Aguenta aí. Vou ter suas coisas antes que você perceba!"
"","","0","1","0","RID_SEALIQ_00050","","","","<CB=SEID_1410_S0130_a0040_End02>","0","-1","1351","0","16","Minhas 'coisas'? E que coisas seriam essas...?"
"1682","","0","2","0","RID_NIER_00531","","","","","0","1351","-1","0","2","Oi! Você é o cara que está cuidando daquele fugitivo?"
"","","0","1","0","RID_SEALIQ_00060","","","","","0","-1","1351","0","16","Fugitivo? Do que você está falando?"
"","","0","1","0","SEID_1410_S0130_0195_X","","","","","-1","0","0","0","2","......"
"","","0","1","0","SEID_1410_S0130_0200_X","","","","","-1","0","0","0","26","Parece que fomos enganados."
"","","0","1","0","SEID_1410_S0130_0210_X","","","","<CB=SEID_1410_S0130_a0040_End01>","-1","0","0","0","2","Oh, você tem que estar brincando comigo! Sério? Aff... ainda assim, eu acho que podemos dizer ao pai dele que ele está vivo, pelo menos."
"1683","","0","2","0","RID_NIER_00540","","","","","0","1358","-1","0","2","E aí. Seu filho já voltou?"
"","","0","1","0","RID_VILRAFA_00060","","","","","0","-1","1358","0","8","Não, eu não o vi. Oh, onde ele poderia estar!?"
"","","0","1","0","SEID_1410_S0130_0240_X","","","","","0","1358","-1","0","2","Ele está em Beira-Mar - ou estava, até que ele fugiu novamente."
"","","0","1","0","RID_VILRAFA_00070","","","","","0","-1","1358","0","8","Oh, droga. Deixa eu adivinhar - ele contou uma história elaborada e pediu ajuda?"
"","","0","1","0","RID_VILRAFA_00080","","","","","0","-1","1358","0","8","Aquele garoto é... Bem, ele é um mentiroso sujo. Provavelmente deveria ter mencionado isso."
"","","0","1","0","SEID_1410_S0130_0270_X","","","","","0","1358","-1","0","2","Então toda aquela história foi uma armadilha. Ele nos fez perder tempo e fugiu..."
"","","0","1","0","SEID_1410_S0130_0280_X","","","","","-1","0","0","0","26","Já que não consigo imaginar você deixando isso pra lá, talvez devêssemos voltar para Beira-Mar? Ainda pode haver uma pista ou duas para seguir."
"","","0","1","0","SEID_1410_S0130_0290_X","","","","<CB=SEID_1410_S0130_a0060_End>","0","1358","-1","0","2","Boa ideia. Não podemos deixá-lo escapar impune."
"1684","","0","2","0","RID_SEAMANK_00080","","","","","0","-1","1135","0","19","Você está procurando por um garoto que fugiu de casa?"
"","","0","1","0","RID_SEAMANK_00090_mainA","","","","","0","-1","1135","0","19","Havia um garoto estranho fazendo perguntas para as pessoas mais cedo. Acho que ele estava tentando aprender como entrar em Facade."
"","","0","1","0","SEID_1410_S0130_0315_X","","","","<CB=SEID_1410_S0130_a0070g_0010_End>","0","1135","-1","0","2","Facade, huh? Talvez devêssemos dar uma olhada."
"1685","","0","2","0","RID_MSKWIFB_00050","","","","","0","-1","1090","0","146","(Um homem se mudou para aquela casa outro dia. Ele certamente usa um chapéu muito estranho!)"
"","","0","1","0","RID_MSKWIFB_00060","","","","<CB=SEID_1410_S0130_a0070g_0020_End>","0","-1","1090","0","146","(Surpreendentemente, ele se encaixa perfeitamente. Ele até fala nossa língua e conhece a maioria das regras.)"
"1686","","0","2","0","RID_MSKWIFA_00060","","","","<CB=SEID_1410_S0130_a0070g_0030_End>","0","-1","1091","0","146","(Ouvi dizer que esse novo estrangeiro veio aqui depois de fugir de uma vida doméstica terrível.)"
"1687","","0","2","0","RID_NIER_00550","","","","","0","1359","-1","0","2","Ei! Você! Você está vindo conosco!"
"","","0","1","0","RID_VILRASN_00100","","","","","0","-1","1359","0","19","Ah, cara! Por que você tem que ficar me seguindo e tal?"
"1688","","0","1","0","RID_VILRASN_00110","","","","","0","-1","1359","0","19","Ta bom, deixa eu só fazer minha mala e depois eu... AI MEU DEUS, TEM UMA SOMBRA GIGANTE ATRÁS DE VOCÊ!"
"1689","","0","1","0","SEID_1410_S0130_0380_X","","","","","-1","0","0","0","2","Ah, você tá brincando comigo!?"
"","","0","1","0","SEID_1410_S0130_0391_X","","","","","-1","0","0","0","26","Certamente ele pretende fugir da cidade, embora não tenha ido muito longe ainda."
"1690","","0","1","0","RID_VILRASN_00120","","","","","0","-1","1359","0","19","Ah, cara! De novo!? Tá bom, deixa eu só..."
"1691","","0","1","0","RID_VILRASN_00160","","","","","0","-1","1359","0","19","Eu não achei que realmente encontraria lobos de verdade..."
"","","0","1","0","SEID_1410_S0130_0480_X","","","","","0","1359","-1","0","2","Você está pronto para ir para casa agora?"
"","","0","1","0","RID_VILRASN_00170","","","","","0","-1","1359","0","19","Pô, com certeza. Essas coisas de aventura são assustadoras demais pra mim. De agora em diante, vou ficar mais perto de casa e tal."
"","","0","1","0","SEID_1410_S0130_0500_X","","","","","-1","0","0","0","2","Ótimo. Agora vamos contar para a família."
"1692","1693","0","1","0","RID_NIER_00560","","","","","-1","0","0","0","2","...Não tem ninguém aqui."
"","","0","1","0","SEID_1410_S0130_0520_X","","","","","-1","0","0","0","26","Acho que eles nos deixaram um bilhete."
"","","0","1","0","EID_9999_NoSound","","","","","-1","0","0","0","","""Graças à sua ajuda, meu filho voltou para assumir os negócios da família."""
"","","0","1","0","EID_9999_NoSound","","","","","-1","0","0","0","","""Decidimos nos mudar para uma nova terra para começar de novo e treiná-lo totalmente para dar continuidade ao nome da família."""
"1693","","0","1","0","SEID_1410_S0130_0550_X","","","","","-1","0","0","0","2","Bom, isso é meio...anticlímax. Eu me pergunto que negócio era, afinal?"
"","","0","1","0","RID_VILGUB_00070","","","","","0","-1","1058","0","9","Ei! Você é amigo das pessoas que moravam aqui!?"
"1694","","0","1","0","SEID_1410_S0130_0570_X","","","","","-1","1058","-1","0","2","Não, não muito. Por quê?"
"","","0","1","0","RID_VILGUB_00080","","","","","0","-1","1058","0","9","Porque os malditos pediram dinheiro emprestado para todos da vila e depois fugiram!"
"","","0","1","0","RID_VILGUB_00090","","","","","0","-1","1058","0","9","Aparentemente, o filho deles fugiu porque queria escapar de uma vida de crime, mas depois algum idiota o trouxe de volta."
"","","0","1","0","SEID_1410_S0130_0590_X","","","","","-1","1058","-1","0","2","...Bom, eu acho que agora sabemos qual era o negócio da família."
"","","0","1","0","SEID_1410_S0130_0600_X","","","","","-1","0","0","0","26","Pensar que nem sequer fomos pagos por essa absurda desventura! Ah, bem. Talvez devêssemos considerar isso como uma lição de vida cara e seguir em frente."
"1695","","0","1","0","RID_VILRASN_00090","","","","","0","-1","1359","0","19","Eu posso encontrar as panelas, colheres e coisas assim, então apenas leve a carne para o lugar dele quando puder."
"1696","","0","1","0","SEID_1410_S0130_0402_X","","","","","-1","0","0","0","26","Então ele se disfarçou como um dos Povos Mascarados, né? Não é de se surpreender que sua trilha tenha esfriado."
"","","0","1","0","SEID_1410_S0130_0404_X","","","","","-1","0","0","0","2","Ele passou por muitos problemas tentando nos despistar. Mal posso esperar para finalmente capturá-lo!"
"1697","","0","2","0","SEID_1410_S0130_0406_X","","","","<CB=SEID_1410_S0130_a0110_End>","-1","0","0","0","26","Ele está indo para a estrada leste! Temos que pegá-lo antes que ele saia do deserto!"
"1698","","0","2","0","RID_MSKSTR_00070","","","","","0","-1","1094","0","48","(Ei, você quer fazer um favor para um coitado?)"
"","","0","1","0","SEID_1450_S0070_0020_X","","","","","0","1094","-1","0","2","Nossa. Você parece bem depressivo."
"","","0","1","0","RID_MSKSTR_00080","","","","","0","-1","1094","0","48","(Eu tenho traído minha esposa, e ela descobriu. Então ela me expulsou de casa.)"
"","","0","1","0","SEID_1450_S0070_0040_X","","","","","-1","0","0","0","26","Espero que não espere nossa simpatia!"
"","","0","1","0","RID_MSKSTR_00090","","","","","0","-1","1094","0","48","(Não, não. Eu sei que fui um idiota egoísta. Eu só quero que ela me aceite de volta, então estava esperando dar um presente a ela.)"
"","","0","1","0","RID_MSKSTR_00100","","","","","0","-1","1094","0","48","(Eu quero fazer um casaco de pele de lobo para ela, mas não consegui obter os materiais necessários.)"
"","","0","1","0","SEID_1450_S0070_0070_X","","","","","0","1094","-1","0","2","Então você quer que a gente cace alguns lobos para você?"
"","","0","1","0","RID_MSKSTR_00110","","","","<CB=LIB_SET_START_SUBQUEST,1724,41,8,1094,1699>","0","-1","1094","0","48","(Essa é a ideia. Eu posso contar com você?)"
"1699","","0","1","0","SEID_1450_S0070_0090_X","","","","","0","1094","-1","0","2","Bem, você parece reconhecer que errou, então eu suponho que podemos ajudar."
"","","0","1","0","RID_MSKSTR_00120","","","","<CB=LIB_SET_END_SUBQUEST>","0","-1","1094","0","48","(Obrigado. Eu só preciso de dez peles de lobo.)"
"1700","","0","2","0","RID_NIER_00800","","","","","0","1094","-1","0","2","Eu tenho suas dez peles de lobo."
"","","0","1","0","RID_MSKSTR_00140","","","","","0","-1","1094","0","48","(Muito obrigado. Agora só falta criar o casaco e tentar fazer as pazes.)"
"","","0","1","0","SEID_1450_S0070_0130_X","","","","","0","1094","-1","0","2","Ela está muito brava com você, certo? Ela vai deixar você falar com ela tempo suficiente para dar o presente?"
"","","0","1","0","RID_MSKSTR_00150","","","","","0","-1","1094","0","48","(Hrm. Bem, ela jogou algo em mim da última vez que me aproximei, então... eu não sei, talvez você possa perguntar a ela por mim?)"
"","","0","1","0","SEID_1450_S0070_0150_X","","","","","0","1094","-1","0","2","Ah, pelo amor de Deus, sério!? *suspiro* Olha, se for só para entregar uma mensagem, tudo bem, mas o presente fica por sua conta."
"","","0","1","0","RID_MSKSTR_00160","","","","<CB=SEID_1450_S0070_a0030_End01>","0","-1","1094","0","48","(Claro, claro. Sinto muito por toda a dificuldade. De qualquer forma, você pode encontrá-la no andar logo acima de nós.)"
"1701","","0","1","0","RID_MSKSTR_00130","","","","<CB=SEID_1450_S0070_a0030_End02>","0","-1","1094","0","48","(Eu preciso de dez peles de lobo. E obrigado.)"
"1702","","0","2","0","RID_NIER_00810","","","","","0","1111","-1","0","2","Olá. Eu, ah, tenho uma mensagem para você."
"","","0","1","0","RID_MSKWOMC_00050","","","","","0","-1","1111","0","146","(Do meu marido trapaceiro e sem valor, aposto!)"
"","","0","1","0","SEID_1450_S0070_0200_X","","","","","0","1111","-1","0","2","Er, sim. De qualquer forma, ele diz que sabe que estava errado e quer lhe dar um presente de desculpas."
"","","0","1","0","RID_MSKWOMC_00060","","","","","0","-1","1111","0","146","(Oh, isso é TÃO como ele!)"
"","","0","1","0","RID_MSKWOMC_00070","","","","","0","-1","1111","0","146","(Ele deveria saber melhor do que trapacear em primeiro lugar. Ele é muito burro para conseguir fazer isso.)"
"","","0","1","0","RID_MSKWOMC_00080","","","","<CB=SEID_1450_S0070_a0050_Start>","0","-1","1111","0","146","(Ainda assim, parece que ele aprendeu a lição, então talvez eu o perdoe apenas desta vez.)"
"1703","","0","1","0","RID_MSKSTR_00180","","","","","0","-1","1094","0","48","(Consegui resolver as coisas... mais ou menos. De qualquer forma, obrigado. Eu não poderia ter feito isso sem a sua ajuda.)"
"","","0","1","0","SEID_1450_S0070_0250_X","","","","","0","1094","-1","0","2","Não trapaceie com ela novamente, está bem?"
"","","0","1","0","RID_MSKSTR_00190","","","","<CB=SEID_1450_S0070_a0050_End>","0","-1","1094","0","48","(Oh, eu não vou! A partir de agora, dedico toda a minha vida a fazê-la feliz!)"
"1704","","0","1","0","RID_MSKSTR_00170","","","","","0","-1","1094","0","48","(Minha esposa está no andar de cima. Você pode por favor conversar com ela e fazê-la ver sentido?)"
"1705","","0","1","0","RID_MSKSTR_00190","","","","","0","-1","1094","0","48","(A partir de agora, toda a minha vida é dedicada a fazê-la feliz!)"
"1706","","0","1","0","RID_MSKWOMC_00090","","","","","0","-1","1111","0","146","(Ele é um bom marido quando não está correndo por aí com outras mulheres. Espero que isso o tenha colocado no caminho certo.)"
"1707","","0","2","0","RID_SEAYTHG_00040","","","","","0","-1","1168","0","19","Ei! Você precisa me ajudar aqui, você só precisa! Estou tendo sérios problemas com uma garota!"
"","","0","1","0","RID_SEAYTHG_00050","","","","","0","-1","1168","0","19","Olha, tem essa garota por quem eu sou completamente louco, então eu a convidei para sair. Mas ela nem sequer considera a ideia a não ser que eu a leve para um restaurante bem bacana."
"","","0","1","0","SEID_1450_S0130_0030_X","","","","","-1","0","0","0","26","Parece um pouco exigente."
"","","0","1","0","RID_SEAYTHG_00060","","","","","0","-1","1168","0","19","Ela realmente aprecia as coisas finas da vida. Lugares de primeira classe para uma dama de primeira classe! Ela é muito legal!"
"","","0","1","0","SEID_1450_S0130_0050_X","","","","<CB=SEID_1450_S0130_a0010_End>","0","1168","-1","0","2","Bom, cada um tem seu gosto, eu acho."
"1708","","0","2","0","RID_SEAYTHG_00070","","","","","0","-1","1168","0","19","Ei, adivinha só!? Eu fui fazer compras com minha garota um tempo atrás!"
"","","0","1","0","SEID_1450_S0130_0070_X","","","","","0","1168","-1","0","2","Você quer dizer aquela que só vai a lugares super caros?"
"","","0","1","0","RID_SEAYTHG_00080","","","","","0","-1","1168","0","19","Essa mesmo! De qualquer forma, tinha esse acessório bonito que eu achei que ficaria ótimo nela e não custava muito, então eu comprei para ela."
"","","0","1","0","RID_SEAYTHG_00090","","","","","0","-1","1168","0","19","Mas ela se recusou a pegá-lo! Ela disse que não usa acessórios baratos!"
"","","0","1","0","SEID_1450_S0130_0100_X","","","","","0","1168","-1","0","2","Bem, isso não é muito surpreendente..."
"","","0","1","0","RID_SEAYTHG_00100","","","","","0","-1","1168","0","19","Sim, eu devia ter imaginado que não ia impressioná-la com essa porcaria vagabunda."
"","","0","1","0","RID_SEAYTHG_00110","","","","","0","-1","1168","0","19","Da próxima vez, vou conseguir algo de alta classe. Vai custar duas vezes meu salário anual! Não, TRÊS vezes!"
"","","0","1","0","SEID_1450_S0130_0130_X","","","","","-1","0","0","0","26","Você tem certeza de que essa mulher realmente se importa com você?"
"","","0","1","0","RID_SEAYTHG_00120","","","","","0","-1","1168","0","19","Claro que sim!"
"","","0","1","0","SEID_1450_S0130_0150_X","","","","<CB=SEID_1450_S0130_a0020_End>","-1","0","0","0","26","Vocês humanos certamente têm rituais de acasalamento complexos e exaustivos."
"1709","","0","2","0","RID_SEAYTHG_00130","","","","","0","-1","1168","0","19","Ei! Ouvi dizer que você pode entrar em Facade, certo?"
"","","0","1","0","SEID_1450_S0130_0170_X","","","","","0","1168","-1","0","2","Claro, mas..."
"","","0","1","0","RID_SEAYTHG_00140","","","","","0","-1","1168","0","19","Ah, perfeito! Escuta, tem algo lá dentro que você <FONT=ITALIC>tem</FONT> que conseguir para mim!"
"","","0","1","0","RID_SEAYTHG_00150","","","","","0","-1","1168","0","19","Minha garota quer um novo acessório, mas tem que ser feito a partir deste minério raro que eles vendem na loja de coisas estranhas de Facade."
"","","0","1","0","RID_SEAYTHG_00160","","","","<CB=LIB_SET_START_SUBQUEST,1734,42,8,1168,1710>","0","-1","1168","0","19","Então, da próxima vez que você for lá, pode comprar para mim? Acho que é chamado de fluorita. Por favor!?"
"1710","","0","1","0","SEID_1450_S0130_0210_X","","","","","0","1168","-1","0","2","Quer dizer... eu acho que sim?"
"","","0","1","0","RID_SEAYTHG_00170","","","","<CB=SEID_1450_S0130_a0030_End><LF><CB=LIB_SET_END_SUBQUEST>","0","-1","1168","0","19","Ah, obrigado! Isso é fantástico!"
"1711","","0","1","0","RID_SEAYTHG_00180","","","","","0","-1","1168","0","19","Cara, minha garota vai pirar quando ver esse acessório!"
"","","0","1","0","SEID_1450_S0130_0240_X","","","","<CB=SEID_1450_S0130_a0080_End01>","0","1168","-1","0","2","Parece que o parceiro desse cara mede amor pelo preço..."
"1712","","0","2","0","RID_NIER_00711","","","","","0","1094","-1","0","2","Ei, você tem fluorita para vender?"
"","","0","1","0","RID_MSKSTR_00050","","","","","0","-1","1094","0","48","(Desculpe, senhor, mas a mina que nos fornecia esse material esgotou-se.)"
"","","0","1","0","SEID_1450_S0130_0270_X","","","","","0","1094","-1","0","2","Ah, entendi..."
"","","0","1","0","RID_MSKSTR_00060","","","","","0","-1","1094","0","48","(Pode ser que haja um pouco dentro do Templo Árido. As regras, é claro, me proíbem de entrar no templo, mas se você fosse...)"
"","","0","1","0","SEID_1450_S0130_0290_X","","","","<CB=SEID_1450_S0130_a0040_End>","-1","0","0","0","2","Bom, já chegamos até aqui. Vamos terminar o trabalho."
"1713","1714","0","2","0","RID_NIER_00721","","","","","0","1168","-1","0","2","Aqui está o minério que você queria."
"","","0","1","0","RID_SEAYTHG_00190","","","","","0","-1","1168","0","19","Oh, obrigado! Agora talvez minha garota me deixe segurar sua mão!"
"","","0","1","0","RID_SEAYTHG_00200","","","","<CB=SEID_1450_S0130_a0080_01>","0","-1","1168","0","19","Aqui está o dinheiro pelo material, e um pouco a mais pelo seu tempo!"
"1714","","0","1","0","SEID_1450_S0130_0330_X","","","","","0","1168","-1","0","2","Hã!? Espere, isso é demais!"
"","","0","1","0","RID_SEAYTHG_00210","","","","","0","-1","1168","0","19","Você está brincando? É isso que fluorita custa no mercado aberto! Eu só adicionei algumas moedas pelo seu problema."
"","","0","1","0","SEID_1450_S0130_0350_X","","","","","0","1168","-1","0","2","É realmente tão caro assim?"
"","","0","1","0","RID_SEAYTHG_00220","","","","","0","-1","1168","0","19","Ei, aprendi minha lição da última vez. Daqui para frente, é só o melhor para a minha garota!"
"","","0","1","0","SEID_1450_S0130_0370_X","","","","","-1","0","0","0","26","A alma humana é realmente algo incompreensível."
"","","0","1","0","SEID_1450_S0130_0380_X","","","","<CB=SEID_1450_S0130_a0080_End02>","0","1168","-1","0","2","Você está certo."
"1715","","0","1","0","RID_SEAYTHG_00230","","","","","0","-1","1168","0","19","Digo-lhe, não há outra garota tão refinada quanto a minha."
"1716","","0","2","0","RID_MSKWEP_00120","","","","","0","-1","1089","0","51","(Ei! Você! Preciso que traga meu filho idiota de volta aqui, imediatamente!)"
"","","0","1","0","SEID_1450_S0160_0020_X","","","","","0","1089","-1","0","2","Uau. Você sempre começa conversas assim?"
"","","0","3","0","RID_MSKWEP_00130","","","","","0","-1","1089","0","51","(Sinto muito! Sinto muito. Estou tão zangado e preocupado agora. Por favor, me perdoe.)"
"","","0","3","0","RID_MSKWEP_00140","","","","","0","-1","1089","0","51","(Meu filho foi para o deserto sozinho. Ele está tentando construir um nome para si mesmo e se tornar um verdadeiro Homem da Máscara, ou o que vocês, estrangeiros, chamam de soldado.)"
"","","0","1","0","SEID_1450_S0160_0050_X","","","","","-1","0","0","0","26","Ele deve ser uma criança imprudente de fato para se aventurar no deserto sozinho."
"","","0","3","0","RID_MSKWEP_00150","","","","<CB=LIB_SET_START_SUBQUEST,1738,43,8,1089,1717>","0","-1","1089","0","51","(Preciso que alguém o traga de volta antes que ele se machuque. Você pode me ajudar, por favor?)"
"1717","","0","1","0","SEID_1450_S0160_0070_X","","","","","0","1089","-1","0","2","Claro, nós cuidaremos disso."
"","","0","3","0","RID_MSKWEP_00160","","","","<CB=LIB_SET_END_SUBQUEST>","0","-1","1089","0","51","(Ah, muito obrigado!)"
"1718","","0","3","0","RID_MSKWEP_00170","","","","","0","-1","1089","0","51","(Por favor, tragam meu filho para casa!)"
"1719","","0","2","0","SEID_1450_S0160_0100_X","","","","","0","1032","-1","0","2","Ei, você é aquele que quer se tornar um Homem da Máscara? Seu pai está preocupado com você."
"","","0","1","0","RID_MSKWSN_00010","","","","","0","-1","1347","0","46","(Meu pai te enviou para me trazer de volta, não é mesmo?)"
"","","0","1","0","SEID_1450_S0160_0120_X","","","","","0","1347","-1","0","2","O deserto é perigoso. Deveríamos voltar juntos."
"","","0","1","0","RID_MSKWSN_00020","","","","","0","-1","1347","0","46","(Não! Eu não vou embora! Acabei de encontrar uma toca de lobos. Se eu for agora, posso eliminá-los todos e ser um herói!)"
"","","0","1","0","SEID_1450_S0160_0140_X","","","","","0","1347","-1","0","2","O quê!? Isso é ainda MAIS perigoso!"
