"Eu não sei, mas temos que derrotá-lo!","I don't know, but we gotta take it down!","¡No lo sé, pero tenemos que derrotarla!"
"Olhe para onde está indo!","Look where it's headed!","¡Mirad adónde se dirige!"
"Como se eu fosse deixar!","Like hell it is!","¡No si yo puedo impedirlo!"
"Nos subestime por sua conta e risco, monstro!","Underestimate us at your own peril, fiend!","¡Atrévete a subestimarnos, engendro!"
"Continua batendo! Em algum momento deve começar a funcionar!","Keep hitting it! At some point, it's gotta start working!","¡Seguid golpeando! ¡En algún momento tiene que dar resultado!"
"Estaria ela tentando elevar nossa moral, ou é genuinamente insana assim?","Is she trying to raise our morale, or is she honestly that insane?","¿Está intentando subirnos la moral o está así de chalada?"
"Qualquer uma delas funciona pra mim. Vamos lá!","Either one works for me. Let's go!","Sea lo que sea, a mí me vale. ¡Vamos!"
"Hoje você vai morrer, merdol!","You're gonna die today, shit-hog!","¡Te ha llegado la hora, tragamierdas!"
"Merdol? Oh, fala sério, nem é uma palavra real!","Shit-hog? Oh come now, that's not even a real word!","¿Tragamierdas? Por favor, ¡esa palabra ni siquiera existe!"
"Parece que você aprendeu a manejar essa coisa.","Looks like you've learned how to swing that thing.","Parece que has aprendido a manejar esa cosa."
"Fico feliz que você percebeu!","I'm glad you noticed!","¡Me alegro de que te hayas dado cuenta!"
"Você está quase lá! Continue pressionando!","You're almost there! Keep pushing!","¡Ya casi está! ¡Sigue así!"
"Você realmente sabe como lutar, Kainé!","You really know how to put up a fight, Kainé!","¡Tú sí que sabes repartir, Kainé!"
"Seu teimoso filho de uma puta!","You stubborn son of a bitch!","¡Muere, maldita cabrona!"
"Merda!","Shit!","¡Joder!"
"Está regenerando muito rápido!","It's healing too quickly!","¡Se está curando demasiado rápido!"
"Por favor, me diga que você tem uma ideia!","Please tell me you have an idea!","¡Dime que tienes una idea!"
"Talvez possamos encurralá-lo perto do porão e selá-lo lá.","Perhaps we could chase it to the basement and seal it there.","Quizá podríamos ir hasta el sótano y encerrarla allí."
"Aquelas paredes são de rocha grossa; duvido muito que essa fera consiga quebrá-la.","Those walls are thick rock; I doubt even this beast could break them.","Esos muros son de piedra gruesa; dudo que incluso esta bestia pueda romperlos."
"Pode ser que funcione!","Works for me!","¡Me vale!"
"Ótimo! Eu adoro porões!","Great! I love basements!","¡Genial! ¡Me encantan los sótanos!"
"Faça isso! Jogue-o dentro do porão!","Do it! Knock it down the basement!","¡Pues venga! ¡Bajemos al sótano!"
"Seu maldito!","Damn you!","¡Maldita sea!"
"Nossas verdadeiras memórias ainda estão aí! Como se atreve a ignorá-las!?","Our true memories are still there! How dare you ignore them!?","¡Nuestros verdaderos recuerdos siguen allí! ¡¿Cómo osas ignorarlos?!"
"Talvez você só as tenha anotado em minhas margens, hmmm?","Perhaps you should have scribbled them in my margins, hmmm?","A lo mejor deberías haberlos garabateado en mis márgenes, ¿no te parece?"
"Droga. A biblioteca não vai aguentar muito tempo!","Damn. This library isn't gonna hold for long!","Mierda. ¡Esta biblioteca no va a aguantar mucho!"
"Devemos acabar com isso rápido!","We must finish this quickly!","¡Tenemos que acabar con esto rápido!"
"E você é o último que resta, Noir!","And you are the last one left, Noir!","¡Y tú eres el único que queda, Noir!"
"N-Noir...? Refira-se a mim pelo nome correto, idiota!","N-Noir...? Address me by my proper name, fool!","¿N-Noir...? ¡Dirígete a mí de manera apropiada, idiota!"
"Não tenho tempo para rodeios.","I don't have time for sightseeing.","No tengo tiempo para ver el paisaje."
"Não preciso sair ainda.","I don't need to go out quite yet.","No quiero despedirme tan pronto."
"Ela não podia ter deixado a vila...","She couldn't have left the village...","No puede haberse marchado de la aldea..."
"Acho que a Popola disse para irmos para leste...","I think Popola said to head east...","Creo que Popola dijo que se fue hacia el este..."
"Melhor eu procurar novamente pela cidade.","I'd better look around town some more.","Será mejor que registre un poco más la zona."
"Preciso de mais informações dos aldeões.","I need to gather more info from the villagers.","Necesito recabar más información de los aldeanos."
"Tenho que matar aquela Sombra!","I have to kill that Shade!","¡Tengo que acabar con esa Sombra!"
"Não posso entrar ainda...","I can't get in yet...","No puedo entrar todavía..."
"Tenho que salvar os aldeões!","I have to save the villagers!","¡Tengo que salvar a los aldeanos!"
"Não é para onde eu preciso ir.","This isn't where I need to be going.","No se me ha perdido nada por ahí."
"Acho que você não pode se aventurar aqui novamente.","I don't think you can venture in here again.","No creo que puedas volver a aventurarte por aquí."
"A tempestade de areia está muito intensa para continuar.","The sandstorm's too intense to go any further.","Es imposible avanzar más con esta gran tormenta de arena."
"Outra Sombra...? Elas simplesmente não desistem, né?","Another Shade...? They just don't give up, do they?",
"Vamos logo!","Let's move!",
"Mmm? A Sombra tinha uma flor?","Mmm? The Shade had a flower?","¿Mmm? ¿La Sombra llevaba una flor?"
"Essa é uma Frésia - a mesma flor que estávamos entregando para a mulher.","This is a freesia—the same flower we were delivering to the woman.","Es una fresia... La misma flor que fuimos a entregarle a la mujer."
"Oh-oh. Talvez a namorada dele tenha sido atacada por uma Sombra...","Uh oh. Maybe his girlfriend was attacked by a Shade...","Oh, oh. Puede que una Sombra haya atacado a su novia..."
"Olhe...","Look...",
"Seria aquele o cão que estávamos procurando?","Would that be the canine we were looking for?",
"Malditas Sombras!","Damn Shades!",
"Cara, isso é difícil. O que a gente faz, Weiss? O que a gente faz!?","Oh man, this is tough. What do we do, Weiss? What do we do!?","Buf, menudo berenjenal. ¿Y ahora qué hacemos, Weiss? ¡¿Y ahora qué hacemos?!"
"Recomponha-se, rapaz! Não há necessidade de se preocupar com um problema criado por outra pessoa.","Calm yourself, lad! There's no need to get in a froth over a problem of someone else's making.","¡Calma, muchacho! ¡No hace falta desesperarse por un problema ajeno!"
"Será que fizemos a coisa certa?","Did we do the right thing?","¿Hicimos lo correcto?"
"Ela estava feliz?","Was she happy?","¿Era feliz?"
"Não sei.","I do not know.","No lo sé."
"Ninguém pode dizer o que é a verdadeira felicidade.","None can say what true happiness is.","Nadie sabe en qué consiste la verdadera felicidad."
"Os humanos e talvez até tomos mágicos são criaturas muito mais incertas do que imaginamos.","Humans—and perhaps even magical tomes—are far more uncertain creatures than we know.","Los humanos y los tomos mágicos son criaturas más inciertas de lo que creemos."
,,
"Sim, eu acho.","Yeah, I guess.","Sí, supongo."
"MEU DEUS, TEM UM MONTE DE SOMBRAS À DIRE-","OHMIGOSH! THERE'S A HUGE PACK OF SHADES RIGHT—",
"Cala a boca.","Shut up.",
"Uh... O que é aquela coisa grande ali na direita?","Uh... What's that big thing on the right?",
"Me engane uma vez e você deveria se envergonhar! Engane-me duas vezes<LF>e eu o punirei com magia profana!","Fool me once, shame on you! Fool me twice,<LF>and I shall smite you with unholy magic!",
"É uma matilha de lobos, cara!","It's a pack of wolves!",
"Talvez se eu cortar sua língua, você não seja tão... <LF>Ah, droga. É uma MATILHA de lobos!","Maybe if I cut out your tongue, you won't be so... <LF>Oh, crap. It IS a pack of wolves!","Si te corto la lengua, no serás tan... ¡Joder! ¡Una manada de lobos!"
,"no text","no text"
"Bem, com esse são dez. Melhor levar isso de volta ao cliente.","Well, that makes ten. Better take these back to the client.",
"(Aqui, seus malditos sarnentos! Essa matilha virou história hoje!)","(Over here, you mangy curs! Your entire pack is history today!)","(¡Venid aquí, chuchos sarnosos! ¡Despedíos de este mundo!)."
"Estamos muito atrasados! Vamos, temos que evitar que ele seja morto!","We're too late! Come on, we have to keep him from getting killed!",
"Não há corpo para ser encontrado.","There is no body to be found.",
"O que está acontecendo aqui?","What's going on here?",
"Ela deve ter sido carregada pelas areias. ... Ou pelos lobos.","She must have been carried off by the sands. ...Or the wolves.",
"Faz sentido, eu suponho.","Makes sense, I suppose.",
"Ou talvez o homem estivesse enganado o tempo todo.","Or perhaps the man was mistaken all along.",
"De qualquer forma, é melhor voltarmos e contar a ele.","Either way, we better go back and tell him.",
"Por que ela o ignorou assim?","Why did she ignore him like that?",
"Eles não estavam apaixonados?","Weren't they in love?",
"Talvez o raciocínio deles seja mais profundo do que nosso conhecimento da situação.","Perhaps their reasoning runs deeper than our knowledge of the situation.",
"O amor verdadeiro costuma ser cercado de mal-entendidos.","True love is often beset with misunderstandings.",
"Tanto faz. Isso é estúpido.","Whatever. This is stupid.",
"Que dor de cabeça.","What a headache.",
"O que é?","What is?",
"Não temos tempo para nos preocupar com bandidos aleatórios!","We've not the time to worry about random bandits!",
"O templo é muito importante para o Povo Mascarado, sabia?.","The temple is really important to the Masked People, you know.",
"Então talvez eles devessem colocar alguns guardas na entrada!","Then perhaps they should station some guards at the entrance!",
"Provavelmente há uma regra sobre isso. Saco, eles não podem nem entrar no lugar.","There's probably a rule about that. Hell, they can't even go inside the place.",
"E daí minha dor de cabeça.","And thus my headache.",
"Parem de reclamar e começem a se mexer.","Stop bitching and get moving.",
"Ahem. Lembra do que ele disse sobre uma Presa de Javali? É melhor procurarmos uma antes de irmos.","Ahem. Remember what he said about a boar tusk? We had best procure one before we go.","¿Recuerdas lo que dijo sobre un colmillo? Hay que pillar uno antes de partir."
"Olha, você lembra de algo sobre o livro preto ainda?","Look, you remember anything about the black book yet?",
"Mmm, receio que não seja tão simples. ...Coisas dessa importância raramente são.","Mmm, I fear it will not be that simple. ...Things of this import rarely are.",
"Devemos conversar com a Popola.","We should go talk to Popola.",
"Espere... Essa música...","Wait... That song...",
"O ataque da espada deles não é brincadeira!","Their sword attack is not to be trifled with!",
"Mantenha sua distância! Deixe sua magia fazer o trabalho aqui.","Keep your distance! Let your magic do the work here.",
"As criaturas se movem com uma velocidade surpreendente!","The creatures move with surprising speed!",
"Circule ao redor deles e ataque!","Circle around them and attack!",
"Talvez você devesse parar de dar ordens e me ajudar!","Maybe you should stop shoutin' orders and help me out!",
"Eu lhe concedi o poder do Grimório Weiss!","I have granted you the power of Grimoire Weiss!",
"Como eu já sabia que você ia dizer isso?","How did I know you were gonna say that?",
"Fica longe da minha irmã!","Stay away from my sister!","¡Alejaos de mi hermana!"
"Eu tenho que salvar a Yonah.","I have to save Yonah.",
"Aí está.","There we go.",
,,
"Tem algo ali...","Something's there...",
"Cuidado! A estátua de um chifre perdeu o controle!","Take heed! The one-horned statue has gone berserk!","¡Ten cuidado! ¡La estatua de un cuerno se ha vuelto loca!"
"Entendi!","Got it!","¡Entendido!"
"O de dois chifres parece intocável!","The two-horned one seems untouchable!","¡La estatua de dos cuernos parece intocable!"
"Ignore aquele! Você não pode quebrar sua guarda!","Ignore that one! You can't break its guard!","¡Ignora a esa! ¡No puedes romper su guardia!"
"Você parece contente. Qualquer um até pensaria que você está se divertindo.","You look pleased. A random passerby might even think you're enjoying yourself.","Pareces contento. Hasta podría decirse que te lo estás pasando bien."
"Bem, mas eu não tô!","Well, I'm not!","¡Pues no es así!"
"Vamos lá!","Come on!","¡Vamos!"
"Tire vantagem do atraso nos ataques dele!","Take advantage of the delay in its attacks!","¡Aprovecha la demora en sus ataques!"
"Ele não vai parar!","It won't stop!","¡No va a parar!"
"Pense nisso apenas como um teste de vontades! Ah, e tente não ser derrotado.","Think of it as but a test of wills! Oh, and do try not to lose.","¡Piensa que está poniendo tu voluntad a prueba! Ah, e intenta no perder."
"Este parece ter excelência no combate corpo-a-corpo. Mantenha certa distância!","This one excels at close combat. Keep your distance!","Esta es muy buena en el combate cuerpo a cuerpo. ¡Mantén la distancia!"
"Hora de atacar de longe, então!","Time to strike from afar, then!","¡Es el momento de atacar desde lejos!"
"Aquela estátua NÃO PARECE tá feliz.","That statue does NOT look happy.","Esta estatua no parece muy contenta."
"A raiva é somente uma forma de energia negativa. Nada a temer!","Anger is but a form of negative energy. Nothing to fear!","La ira es una forma de energía negativa. ¡Nada que temer!"
"Caramba, olha só todos eles!","Man, look at all of 'em!","¡Uf, míralos a todos!"
"Eles não são nada além de uma horda de lacaios sem rosto. <LF> Derrote-os!","They are naught but a horde of faceless minions.<LF>Swat them aside!","No son más que una horda de esbirros sin rostro. ¡Aplástalos!"
"O que está acontecendo, Weiss!?","What's going on, Weiss!?",
"Estas são... minhas memórias?","Is this...my memory?",
"Você está bem, Weiss? Aguente firme!","You all right, Weiss? Hang in there!",
"...Hmm. Parece que posso reaver meus poderes<LF>derrotando esses monstros.","...Hmm. It would seem I can regain my powers<LF>by defeating these monsters.",
"Acho que você não pode se aventurar aqui novamente.","I don't think you can venture in here again.",
"De todas as pessoas, por que minha única filha!?","Of all people, why my only daughter!?",
"Que droga, isso não está acontecendo!","Dammit, this isn't happening!",
"Yonah... Ela ainda é apenas uma criança...","Yonah... She's still just a child...",
"E pensar que eu ia usar você como lenha.","And to think I was going to use you for kindling.",
"Você deveria tratar seres mágicos onipotentes com mais respeito.","You really should treat omnipotent magical beings with more respect.",
"Por acaso tem alguém aqui?","Is anyone even here?","¿Hay alguien aquí?"
"Seu ataque deve ser implacável!","Your attack must be unrelenting!",
"Ela é vulnerável quando ataca! Ataque então!","She's vulnerable when she attacks! Strike then!",
"Nossos ataques estão falhando!","Our attacks are failing!",
"Maldição...","Goddammit...",
"Pare, idiota! Ataques mágicos são inúteis contra esse!","Stop, fool! Magical attacks are useless against this one!",
"Essa mulher certamente não deve ser subestimada!","This woman is certainly not to be trifled with!",
"Não baixe sua guarda!","Don't let your guard waver!",
"Minha esposa costumava fazer pão... Yonah nunca teve a chance de experimentar.","My wife used to make bread. ...Yonah never had a chance to try it.",
"Parece que há uma boa variedade de trigo para escolher.","It seems there's a fair assortment of wheat from which to choose.",
"Ela assa o próprio pão agora. Popola a ensinou.","She bakes her own bread now. Popola taught her how.",
"Será que eu vou gostar de alguns desses pães?","I wonder if there is any bread here that I might enjoy?",
"Está com mau funcionamento!","It's malfunctioning!","¡No funciona bien!"
"Sim, isso pode ser um problema.","Yeah, this might be a problem.","Sí, esto podría ser problemático."
"Máquina estúpida!","Stupid machine!","¡Máquina estúpida!"
"Boa! Continue assim!","Good! Keep after it!","¡Bien! ¡Sigue así!"
"Ah-ha! Eu SABIA que era uma armadilha! Maldita seja minha brilhante intuição.","Ah-ha! I KNEW this was a trap! Curse my brilliant intuition.",
"Aaaaaah!","Aaaaaah!","¡Aaah!"
"Yaaaaaahhh!","Yaaaaaahhh!","¡Yaaah!"
"Mas hey, pelo menos posso petrificar seus inimigos.<LF>Isso deve ajudar, certo?","But hey, at least I can petrify your enemies.<LF>That's gotta be some help right?","Lo siento. Mi mayordomo se preocupa mucho por mí, pero pedir algo así..."
"Não posso deixar você fazer isso sozinho, então estarei aqui se precisar de mim.","I can't let you do this on your own,<LF>so I'll be right here if you need me.","Bueno, que voy contigo. No puedo dejar que te encargues tú solo."
"Quem sabe meus olhos possam ser úteis pela primeira vez...","Maybe my eyes can be useful for once...","A lo mejor mis ojos pueden ser útiles por una vez."
"Eu petrificarei as páginas! Você dá o golpe final!","I'll petrify the pages! You strike the final blow!",
"Mas que droga! Não consigo ferir essa coisa!","Dammit! I can't hurt this thing!",
"Óh, destino! Será o fim para Grimório Weiss!?","O, fated day! Is this the end for Grimoire Weiss!?",
"Sim, se acalma, Weiss.","Yeah, calm down, Weiss.","Sí. Tranquilo, Weiss."
"Conseguimos colocar as mãos em todos os Versos Selados agora.","We've got our hands on all the Sealed Verses now.","Ahora ya nos hemos hecho con todos los Versos sellados."
"Tudo que resta é encontrar este Grimório Noir.","All that remains is to find this Grimoire Noir.","Lo único que nos queda es encontrar a ese tal Grimoire Noir."
"E, então, finalmente salvar Yonah.","Then we can finally save Yonah.","Y así podremos salvar Yonah de una vez."
"Quem são esses caras?","Who are these guys?",
"Eu não sei, mas eles parecem estar nos impedindo de entrar.","I do not know, but they appear to be preventing us from entering.",
"Que tipo de lugar é esse?","What manner of place is this?",
"Parece um cemitério...","Looks like a graveyard...",
"As lápides parecem não ter nomes.","The headstones seem to be lacking names.",
"Além disso, por que elas brilham como se fossem novas?","Also, why do they shine as if they were carved from the rock just yesterday?",
"...Não há nada aqui.","...There's nothing here.",
"Vamos nos apressar! Seremos enterrados na areia se ficarmos aqui por muito tempo.","Make haste! We shall be buried in sand if we remain here any longer.",
"Então isso era um cemitério, certo?","So this was a graveyard, eh?",
"Estranho... Todas as lápides parecem novas.","Strange... All the headstones look new.",
"Os lobos devem ter matado todas essas pessoas. Que destino cruel.","The wolves must have brought down all these people. What a cruel fate.",
"O que tem de tão estranho sobre essa outra cidade? Idioma diferente? Costumes diferentes?","What's so strange about this other town? Different language? Different customs?",
"Talvez mais do que sabemos. Que tipo de cidade se fecha para o mundo exterior?","Perhaps more than we know. What kind of city shuts itself off from the outside world?",
"Eu quero ajudar Popola, mas...","I want to help Popola, but...",
"Uma cidade trancada no deserto...","A town locked away in the desert...",
"Precisamos entrar para podermos encontrar um filtro de água.","We have to get in so we can find a water filter.",
"L-livro! Como se atreve! Eu nunca fui tratado com tanta falta de decência e—","B-book! How dare you! I have never been treated with such an utter lack of decency and—",
"Calma, Weiss. Vamos ver o que ela está planejando.","Easy, Weiss. Let's see what she's planning.",
"Talvez eu devesse ter estudado línguas quando era criança...","Maybe I should have studied languages when I was a kid...",
"Você poderia falar mil línguas e ainda assim falhar se não conhecer a cultura dos outros.","You could speak a thousand tongues and still fail if you lack knowledge of another's culture.",
"Fyra... Aguente firme... Preciso descansar...","Fyra... Hold on... I need to rest...",
"Essa garota deve ser extremamente patriota. Veja a entrega dela pelo bem do seu príncipe!","This girl must possess extreme patriotism. Look how she gives all for the sake of her prince!","Vaya patriotismo. ¡Fíjate cómo lo da todo por el bien de su príncipe!"
"Que diabos está acontecendo!?","The hell's going on!?",
"Vão fechar o portão! Mexam-se!","Go seal the gate! Move!",
"Alguém se certifica de que Yonah esteja segura!","Someone make sure Yonah's safe!",
"Não se preocupe! Eu irei buscá-la!","Don't worry! I'll go and get her!",
"Só não morra, beleza?","Just don't get yourself killed, all right?",
"Eu lidarei com as Sombras!","I'll deal with the Shades!",
"Vão fechar o portão! Mexam-se!","Go seal the gate! Move!",
"Ok!","Okay!",
"Eu não deixarei nenhum de vocês passar por mim!","I won't let any of you past me!","¡No dejaré que ninguno de vosotros me venza!"
"Vamos Devola. Depressa!","Go, Devola. Hurry!",
"Vamos lá! Continuem empurrando!","Come on! Keep pushing it!","¡Vamos! ¡Sigue así!"
"Não! Você deve pressionar o ataque!","No! You must press the attack!","¡No! ¡Debes presionar con el ataque!"
"Nossa magia não tem efeito!","Our magic has no effect!",
,,
,,
"Foi intenso. Não sei como que selaram essa coisa.","That was intense. No wonder they sealed that thing up.",
"Mesmo assim, não deveria ter sido nossa luta, em primeiro lugar.","Still, it should not have been our fight in the first place.",
"Isso é um fato. Vamos pegar o ladrão que sobreviveu e levá-lo de volta para Facade.","True enough. Let's grab the surviving bandit and take him back to Facade.",
"Caça de ovelhas!? Não existe trabalho ruim para você!","Sheep hunting!? There really is no task too immodest for you!",
"É muito mais difícil do que parece, Weiss. ...Esses miseraveizinhos são rápidos.","It's a lot harder than it sounds, Weiss. ...These little bastards are fast.",
"Então os apunhale com magia!","So smite them with magic!",
"Ah, droga!","Aw, crap!",
"O que é isso!? Sombras!?","What is it!? Shades!?",
"Você tá certo. Eu TENHO que usar magia!","You're right. I SHOULD use magic!",
"Poderia eu dar outra sugestão?","Might I make another suggestion?",
"O quê!?","What!?",
"Pare de gritar como um lunático toda vez que você descobre algo.","Stop yelling like a madman every time you come to a realization.",
"Você recebe muitos pedidos como esses, para viagens de compras inúteis?","Do you often get asked to handle such inane shopping trips?",
"Não acho que essas viagens sejam inúteis.","I don't think these trips are inane.",
"Eu sou um pai em um mundo definhando. Aceitarei qualquer trabalho que eu possa conseguir.","I'm a father in a dying world. I'll take whatever job I can get.",
"Todos têm dificuldades por aqui, logo, não tenho direito de reclamar.","Everyone has it tough around here, so I've no right to complain.",
"Eles me dão trabalho honesto e eu sou grato.","They give me honest work, and I'm grateful.",
"Entendo. Bem, então, continue com o bom trabalho!","I see. Well, then, keep up the good work!",
"Sim.","Yeah.",
"Ei.","Hey.",
"Sim?","Yes?",
"Você não é todo poderoso? Não pode, apenas... sabe? Usar magia para consertar este lugar?","Aren't you all-powerful? Can't you just...you know? Use magic to zap this place into shape?",
"O poder infinito do Grimório Weiss não deve ser usado para fins tão triviais!","The infinite power of Grimoire Weiss is not to be used for such trivial tasks!",
"Mas eu não tô pedindo muito.","I'm not asking for much.",
"Você que é o único encantado com trabalho duro e honesto!","You are the one so enamored with hard, honest work!",
"Realmente não existe nada que possa curar o Rabisco Negro?","Is there really nothing that can cure the Black Scrawl?",
"Nenhum medicamento feito pelo homem fará efeito contra essa doença.","No medicine in the works of man can hope to stand against it.",
"Mas tem que ter algo!","There has to be something!",
"Talvez exista um remédio para aliviar a dor por um tempo, mas nenhum pode verdadeiramente erradicar a doença.","Perhaps a drug exists to temporarily ease the pain, but none can truly eradicate the disease.",
"Mas que droga...","Dammit...",
"Mas se a lenda for real, então eu tenho a chave para salvar a menina!","But if the legend is true, then I hold the key to saving your girl!",
"Você está certo. Tenho que me apegar a isso.","You're right. I have to hold on to that.",
"Ha! Esse é o espírito!","Ha! That's the spirit!",
"Que uso possível tem essa semente?","What possible use is that bulb?",
"Você a planta no solo e o broto torna-se uma linda flor.","You plant it in the ground and it sprouts into a pretty flower.",
"Do processo botânico eu já sei! Apenas me pergunto onde alguém plantaria tal flor.","I am aware of the botanical process! I merely wonder where one would plant such a flower.",
"Tem um jardim ao lado da minha casa.","There's a garden at my place.",
"Yonah gosta de flores, então plantarei-a para ela quando chegar em casa.","Yonah likes flowers, so I'm gonna plant it for her when I get home.",
"Comida para uma refeição caseira... hmm?","Food for a home-cooked...meal, hmm?",
"Quer dizer alguma coisa?","You got something to say?",
"Oh, não! Não, não! Nadica de nada! La da dum da de...","Oh, no! No, no! Nothing at all! La da dum da de...",
"Olha, eu sei que a Yonah não é uma chef de quatro estrelas ou algo assim, mas ela coloca o coração nisso, e eu amo ela por isso.","Look, I know Yonah's not a four-star chef or anything, but she puts her heart into it, and I love her for it.",
