"Só um verdadeiro idiota não apreciaria o esforço! Que tipo de pai você acha que eu sou!?","Only a real jerk wouldn't appreciate the effort!  What kind of father do you think I am!?",
"...Você me ouviu apontar algo assim?","...Did you hear me imply anything of the sort?",
"Acho que não.","I guess not.",
"Apenas... Bem... Boa sorte","Just... Well... Good luck",
"...Sim.","...Yeah.",
"Essa é uma quantia significativa de dinheiro.","That is a princely sum of money.",
"Vou dar um jeito.","I'll find a way.",
"Você deve fazer isso, senão não teremos como chegar na vila no topo do penhasco.","You must, elsewise we have no way to reach that cliffside village.",
"Não consigo acreditar em quão caras são as barras de ferro.","I can't believe how expensive iron bars are.",
"Coisas assim não são fabricadas há séculos.","Such things have not been manufactured in an age.",
"Então, de onde elas vêm?","So where do they come from?",
"A maioria delas escavadas de ruínas.","Excavated from ruins, most likely.",
"Pessoas fizeram essas coisas no passado?","People made these in the past?",
"Certamente.","Indeed.",
"Mas não há como fazê-las agora...","But there's no way to make them now...",
"Santo Deus, não.","Dear heavens, no.",
"Estranho...","Strange...",
"São vestígios do mundo antigo. Aqueles que as fizeram devem ter possuído grande conhecimento tecnológico.","They are remnants of the old world. Those who made them must have possessed great technological knowledge.",
"O conhecimento é inútil uma vez que você o esquece.","Knowledge is useless once you forget it.",
"Oh ho ho! Deveras verdade, muito verdade.","Oh ho ho! Quite true, quite true.",
"Ugh... Você assumiu um trabalho muito difícil desta vez.","Ugh... You have certainly taken on a rather trying job this time.",
"Oh, pare de reclamar.","Oh, quit moaning.",
"Imagino que esse ovo deva valer uma boa quantia se vendido a quem der o maior lance.","I imagine this egg would fetch quite a sum if you sold it to the highest bidder.",
"Não podemos fazer isso. Aquela senhora está esperando por ele.","We can't do that. The old woman is waiting for it.",
"Talvez devêssemos colocar nossa própria situação financeira à frente das preocupações de uma mulher idosa, hmmm?","Perhaps we should place our own financial situation ahead of the concerns of an elderly woman, hmmm?",
"Eu disse para você parar de reclamar.","I told you to quit moaning.",
"Ah...","Ah...",
"Ah, droga!","Ah, crap!",
"Isso não parece bom...","That did not sound good...",
"Acho que quebramos algo.","I think we broke something.",
"Bem, não há motivos para terminarmos a entrega agora. É melhor voltarmos e nos desculparmos.","Well, there is little point in finishing the delivery now. We had best go back and apologize.",
"... Sim, acho que sim.","...Yeah, I guess.",
"Sua Yonah certamente tem gostos...excêntricos.","Your Yonah certainly has some...eccentric tastes.",
"Ela sempre foi assim.","She's always been that way.",
"Mas se é isso que ela quer, então é isso que eu vou conseguir.","But if that's what she wants, then that's what I'll get.",
"Ser o guardião dela deve apresentar alguns desafios únicos.","Being her guardian must present some unique challenges.",
"Eu só preciso vê-la sorrir; então, tudo vale a pena.","I just need to see her smile; then it's all worth it.",
"Oh, não. Essa tarefa de novo não...","Oh, no. Not this task again...",
"Ficaremos bem. Só precisamos ir devagar e com calma.","We'll be fine. We just need to go slow and take it easy.",
"Eu sou uma criatura de talentos fenomenais, mas esses dois são fora da curva.","I am a creature of phenomenal talents, but those are two that escape me.",
"Bem, com certeza não vou deixar a Kainé lidar com isso.","Well, I'm sure as hell not going to let Kainé handle it.",
"De fato. Tenho certeza de que a linguagem vulgar da petulante reduziria nossa preciosa carga a poeira.","Indeed. I'm sure the hussy's foul language would reduce our precious cargo to dust.",
"Reclamem menos e andem mais.","Less bitching, more moving.",
"AINDA sem peixe!?","STILL no fish!?",
"Shhhhh! Você está assustando eles!","Shhhhh! You're scaring them away!",
"Ah. Eu...entendi.","Oh. I...I see.",
"A pesca bem-sucedida requer paciência, concentração, determinação, ambição...","Successful fishing requires patience, concentration, drive, ambition—",
"Shhhhh! Você está assustando eles!","Shhhhh! You're scaring them away!",
"Ah. ...Sim, entendi.","Oh. ...Yes, right.",
"Uma missão comercial, hein?","A trading mission, huh?",
"Tem algo lhe incomodando?","Is something the matter?",
"Não, é só que... Bem, eu nunca saí daqui antes.","No, it's just that... Well, I've never left here before.",
"Só tô aqui imaginando como é ver um lugar novo.","I'm just wondering what it's like to see a new place.",
"Algum dia espero levar Yonah em uma jornada como essa.","Someday I hope to take Yonah on a journey like this.",
"E algum dia você fará isso!","And someday you shall!",
"Eu vou. Tenho certeza disso.","I will. I'm sure of it.",
"Desta vez, vou ficar em silêncio! Porque esses peixes não terão ideia de que...","This time I shall be silent! Why, those fish will have no idea that─",
"Shhhh! Você está assustando eles!","Shhhh! You're scaring them away!",
"Ah. ...Certo.","Oh. ...Right.",
"......","......",
"Você está muito quieto, Weiss.","You're really quiet, Weiss.",
"Senão os peixes vão se assustar, não é mesmo?","The fish will be scared away otherwise, no?",
"Sim, mas... é estranho.","Yeah, but...it's just weird.",
"Posso falar livremente, então?","May I talk freely, then?",
"Não.","No.",
"Então o que você quer que eu faça!?","Then what would you have me do!?",
"Shhhhh! Você está assustando eles!","Shhhhh! You're scaring them away!",
"...Droga.","...Damn.",
"Talvez eu possa usar um pouco da minha magia para tirar os peixes da água.","Perhaps I could use some of my magic to scoop up the fish from the water.",
"Peraí, você consegue fazer isso?","Wait, you can do that?",
"Se eu puder visualizar onde estão os peixes, então sim.","If I can establish a line of sight with the fish, then yes.",
"...Você consegue vê-los?","...Can you see them?",
"...Não.","...No.",
"...De volta à pesca, então.","...Back to fishing, then.",
"...Com certeza.","...Indeed.",
"Uma bebida com uma cauda de lagarto parece ser impressionante!","A drink with a lizard's tail inside certainly sounds impressive!",
"Ha ha! Ela pode não parecer, mas depois de algumas bebidas, Popola é a mulher mais forte da terra.","Ha ha! She may not look it, but get a few in her, and Popola's the strongest woman in the land.",
"Certamente você está brincando!","Surely you jest!",
"Nenhuma brincadeira. Uma vez ela ficou tão bêbada que praticamente destruiu a loja. Derrubou uma parede e tudo.","No joke. Once she got so plastered that she practically destroyed the shop. Knocked down a wall and everything.",
"O álcool afeta Devola da mesma maneira?","Does alcohol affect Devola in the same manner?",
"Devola é mais sensível.","Devola's more of a lightweight.",
"Se ela tomar um pouco, começa a ficar um pouquinho... hum... amigável demais...","If she has even a little, she starts getting a bit too...um...friendly...",
"A Devola!? Sério!?","Devola!? For true!?",
"...Sério mesmo.","...Oh yeah.",
"O álcool é uma substância temível mesmo.","Alcohol is a fearsome chemical indeed.",
"Bem, nós o encontramos... mas parece que chegamos tarde demais.","Well, we found him...but it looks like we're too late.",
"Isso será difícil para o velho lidar.","This is gonna be hard for that old timer to deal with.",
"Sejam eles cachorro ou homem, nenhuma criatura viva pode escapar do seu destino final.","Be they dog or man, no living thing can escape their ultimate fate.",
"Isso inclui você, Weiss?","That include you, Weiss?",
"Mmm... Na verdade, nunca considerei essa questão.","Mmm... In truth, I have never considered the question.",
"Suponho que em algum momento eu possa simplesmente... desaparecer da existência.","I suppose at some point in time I may simply...wink out of existence.",
"Duvido que eu viva tempo suficiente para ver isso acontecer.","I doubt I'll live long enough to see that happen.",
"Um... Diga aí...","Um... Say there...",
"Sim?","Yeah?",
"Veja bem, se eu algum dia me encontrar... deixando este mundo...","See here, if I ever find myself...departing this world—",
"Oh, pare de ser mórbido, Weiss! ...Além disso, você não pode morrer. Você é feito de papel.","Oh, stop being morbid, Weiss! ...Besides, you can't die. You're made of paper.",
"É mesmo? ...Nunca tinha pensado nisso antes.","Indeed? ...I've never looked at it like that before.",
"Se eu puder...","If I may...",
"O que é?","What is it?",
"O que estamos fazendo aqui?","What are we doing here?",
"Estamos organizando todas essas coisas.","We're organizing all this stuff.",
"Deixe-me reformular. Isso é por causa do comerciante em treinamento, correto?","Let me rephrase myself. This is for the sake of the merchant in training, yes?",
"Sim.","Yes.",
"Então não seria mais apropriado ele cuidar de suas próprias coisas?","Then would it not be more appropriate for him to take care of his own belongings?",
"O cara está em um momento delicado, Weiss. Só estamos ajudando ele.","The man's in a pinch, Weiss. We're just helping him out.",
"Mal posso esperar pelo dia em que alguém mostre tamanha bondade para nós.","I yearn for the day when someone shows such kindness to us.",
"Que desperdício enorme de nosso tempo.","What a tremendous waste of our time.",
"Quem diria que o cara ficaria enjoado no mar?","Who knew the guy would get seasick?",
"Talvez da próxima vez ele possa tentar encontrar trabalho que não envolva o oceano.","Maybe next time he can try finding work that doesn't involve the ocean.",
"Talvez da próxima vez ele tente ficar sentado em casa sem fazer nada!","Maybe next time he'll try sitting at home and doing nothing!",
"É difícil acreditar que toda a cidade estava mentindo para ela...","It's hard to believe the entire town was lying to her...","Resulta difícil creer que toda la ciudad la tuviera engañada..."
"Aposto que suas intenções eram boas. Caso contrário, eles não teriam mantido a farsa por cinquenta anos.","I wager their intentions were good. Elsewise, they would not have carried on with the ruse for fifty years.","Debían tener buena intención o no habrían podido hacerlo durante tantos años."
"Isso também explica o porquê de eles encarregarem-na de manter o farol funcionando: para que a notícia da morte de seu amor não chegasse até ela.","It also explains why they tasked her with keeping the lighthouse running: so news of her love's demise would not reach her. ","Y, al endosarle el faro, no podía enterarse de la noticia del fallecimiento. "
"Talvez essa tenha sido a coisa mais gentil a se fazer...?","Maybe that really was the kind thing to do...?","Tal vez eso era lo que había que hacer, ¿no?"
"Entregar uma correspondência é mais difícil do que parece.","Delivering the mail is harder than it seems.",
"Mas não há outra maneira de se comunicar com pessoas que estão longe.","But it's not like there's another way to communicate with people over long distances.",
"Há muito tempo, havia muitas maneiras de se comunicar.","Long ago, there were many ways to engage in such communications.",
"As coisas devem ter sido realmente fáceis naquela época.","Things must have been really easy back then.",
"Sim, imagino que sim.","Yes, I imagine so.",
"Eu gostaria de poder falar com Yonah sempre que estivesse preocupado com ela.","I wish I could speak with Yonah whenever I was worried about her.",
"A menina nunca sai da sua mente, não é mesmo?","The girl is never far from your mind, is she?",
"Uma carta para Popola? Que interessante...","A letter for Popola? How interesting...",
"Você não está nem um pouco curioso sobre o conteúdo?","Are you not the least bit curious about the contents?",
"É problema dela, não meu. Não posso me preocupar com essas insignificâncias.","It's her business, not mine. I can't worry about inconsequential stuff like that.",
"""Insignificâncias""? Nossa, seu vocabulário melhorou ultimamente!","""Inconsequential""? My, your vocabulary has improved lately!",
"Popola me ensinou essa.","Popola taught me that one.",
"Talvez eu tenha subestimado essa mulher.","Perhaps I have underestimated this woman.",
"Tô morrendo de fome.","I'm starving.",
"Uma cidade desse tamanho deve ter algum tipo de restaurante por perto.","A city of this size must have some manner of eatery nearby.",
"Você quer tentar sua sorte nesse trabalho, Kainé?","You want to try your hand at this job, Kainé?",
"Cê tá falando sério? Porra nenhuma.","Are you serious? Hell no.",
"Ah! Vadias só servem para quebrar coisas, de qualquer forma.","Pah! Hussies are only good for breaking things, anyway.",
"Talvez eu comece com você.","Maybe I'll start with you.",
"Este é um jogo estranho.","This is one strange game.",
"Esta é uma cidade estranha.","This is one strange city.",
"Você me pegou nessa.","You got me there.",
"Ah, falando nisso...","Ah, speaking of which...",
"O que?","What?",
"Eu espero que você não tenha esquecido a mensagem.","I trust you have not forgotten the message.",
"Não...","No...",
"Essas regras são absolutamente ridículas!","These rules are absolutely preposterous!",
"Nós nem podemos dizer à pessoa o que queremos comprar! Nunca na minha vida vi tamanha tolice!","We cannot even tell that person what we wish to purchase! Never in my life have I seen such foolishness!",
"Ah, não é grande coisa.","Ah, it's no big deal.",
"Fala sério. Isso não te incomoda!?","Come now. This must bother you!?",
"Incomoda sim, mas acredito que eles tenham uma razão para isso. Algo significativo que nós simplesmente não entendemos ainda.","It does, but I trust they have a reason for it. Something meaningful that we just don't understand yet.",
"Isso é uma coisa muito mente aberta de se dizer. ...Você está se sentindo bem?","That is a very broad-minded thing to say. ...Are you feeling well?",
"Isso foi quase um elogio.","That was almost a compliment.",
"*Suspiro*","*Sigh*",
"O que houve?","What's wrong?",
"Como um filho pode trazer tanta desesperança para seus pais?","How can a son bring so much despair to his parents?",
"Ele parece não compreender a dor que causou a eles. É deplorável!","He seems completely ignorant of the pain he has brought them. It's deplorable!",
"Eu adoro quando você soa como um velho rabugento, Weiss.","I love it when you sound like a grumpy old man, Weiss.",
"Talvez eu soe assim só porque existo desde tempos imemoriais!","Perhaps I only sound that way because I have existed since time immemorial!",
"E quantos anos você tem, então?","How old are you, anyway?",
"Mmm... Sabe, não tenho certeza exata.","Mmm... You know, I'm not exactly sure.",
"Dizem que a perda de memória é um sinal de velhice.","They say memory loss is a sure sign of old age.",
"Aquela pobre família...","That poor family...",
"Ele realmente acha que vai ser perdoado só por dar uma pele pra ela?","Does he really think she'll forgive him if he just gives her a fur?",
"Isso parece, de certa forma, materialista.","It does seem somewhat materialistic.",
"Cês tão falando sério? Quando alguém me dá algo de graça, eu fico feliz como um pinto no lixo!","Are you guys for real? When someone gives me something for free, I'm happy as a pig in shit!",
"Este mundo seria muito mais simples se só existissem Kainés nele.","This world would be a great deal simpler if nothing but Kainés lived in it.",
"E eu vou fingir que isso é um elogio.","I'll pretend that's a compliment.",
"Tem alguma receita escrita em você, Weiss?","Do you have any recipes written inside you, Weiss?",
"Como você se atreve a me comparar com um livro de receitas comum! Não há espaço dentro das minhas páginas para assuntos tão triviais.","How dare you compare me to a common cookbook! There is no room within my pages for such trivial matters.",
"Que amor! Esse homem claramente foi enfeitiçado por seu amante.","Such affection! This man has clearly been entranced by his lover.",
"Se me permite dizer, acho que ele está sendo manipulado.","If you ask me, I think he's being played.",
"Hmm? O que você quer dizer?","Hmmm? Whatever do you mean?",
"Ha! Talvez isso seja uma daquelas coisas que um grimório mágico simplesmente não entende.","Ha! Maybe this is one of those things that a magical grimoire just can't understand.",
"Ridículo! Não há nada além do meu conhecimento!","Ridiculous! There is nothing beyond my knowledge!",
"Heh. Deve ser bom.","Heh. Must be nice.",
"Você acha possível que este homem esteja sendo enganado pela amante?","Do you think it possible that this man is being deceived by his lover?",
"Sim, acho possível.","Yeah, I think it possible.",
"Então vamos informá-lo imediatamente!","Then we shall inform him at once!",
"...Acho melhor não.","...We'd better not.",
"Por que não!? Você finalmente encontrou alguém que não está disposto a ajudar?","Why not!? Have you finally found someone you are unwilling to aid?",
"Relacionamentos são...complicados. Eu sei que é difícil de entender, mas...","Relationships are...complicated. I know it's hard to understand, but—",
"Não há nada no mundo que Grimório Weiss não possa entender!","There is nothing in the world that Grimoire Weiss cannot understand!",
"É, sei...","Yeah, yeah...",
"É do meu conhecimento dizer que juventude é apenas um sinônimo para estupidez!","It is my experience that youth is simply a synonym for stupidity!",
"Ah, fala sério! Ele só quer proteger sua cidade. Acho isso legal.","Oh, come on! He just wants to protect his city. I think it's nice.","¡Venga, hombre! Tan solo quiere proteger su ciudad. A mí me parece bonito."
"Oh, sim. Sim, isso realmente é bom.","Oh, yeah. Yeah, that's really great.",
"O quê? Não era você a guardiã da sua aldeia, Kainé?","What? Weren't you the guardian of your village, Kainé?",
"Sim, mas... Olha, o que posso dizer agora, é... Não fale comigo.","Yeah, but... Look, all I'm saying is... Don't talk to me.",
"Sua boca está muito cheia de areia para formular uma resposta rude!?","Is your mouth too full of sand to formulate a crude response!?",
"Livro, você quer morrer?","Book, do you wanna die?",
"Você não tem medo dessas Sombras?","Do you not fear these Shades?","¿No te asustan esas Sombras?"
"É claro! Seria estúpido não ter medo.","Of course! I'd be stupid not to.","¡Pues claro! Sería estúpido si no les tuviera miedo."
"Mas tenho que salvar Yonah, não importa como.","But I have to save Yonah, no matter what.","Pero tengo que salvar a Yonah como sea."
"Entendi. Então não vou tentar impedi-lo.","I see. Then I won't try to stop you.","Ya veo. Entonces, no intentaré detenerte."
"Você é um bom ouvinte para um idoso, Weiss.","You're a pretty good listener for such an old-timer, Weiss.","Para ser un viejales se te da muy bien escuchar, Weiss."
"Bah! Deveria me sentir ofendido!","Bah! I should be offended!","¡Bah! ¡Debería sentirme ofendido!"
"Eu não sabia que Sombras podiam ficar tão grandes!","I didn't know Shades could get that big!","¡No sabía que las Sombras podían hacerse tan grandes!"
"Comparando tamanhos, nunca vimos nada parecido com essa coisa! Fique em guarda!","The scale of this one is like nothing you've encountered before! Ready your guard!","¡No te las has visto nunca contra algo tan grande! ¡Ponte en guardia!"
"Morra! Morra, morra, morra!","Die! Die, die, die!","¡Muere! ¡Muere, muere, muere!"
"Eu vou arrancar seus dentes e enfiá-los no seu rabo!","I'm gonna pull out your teeth and cram 'em up your ass!","¡Te voy a sacar los dientes para metértelos por el culo!"
"A boca dessa mulher é tão feroz quanto sua habilidade com a espada!","That woman's mouth is as fierce as her swordwork!","¡Esa mujer es tan dura con la boca como con la espada!"
"Vamos nos concentrar em derrotar essa coisa!","Let's just focus on defeating this thing!","¡Centrémonos en cargarnos a esta cosa!"
"Este lugar não é digno de uma pessoa da minha grandeza.","This place is hardly befitting one of my grand stature.","Este lugar no es adecuado para alguien de mi talla."
"Você realmente gosta de reclamar, Weiss.","You sure do like to complain, Weiss.","Desde luego, cómo te gusta quejarte, Weiss."
"Essa areia está impossível. Mal consigo abrir meus olhos!","This sand is too much. I can barely open my eyes!","Estoy harto de tanta arena. ¡Apenas puedo abrir los ojos!"
"Pth! Blech! No momento em que abro a boca, a areia corre para dentro!","Pth! Blech! The moment I open my mouth, the sand rushes inside!","¡Puf! ¡Buaj! ¡En cuanto abro la boca, se me mete arena dentro!"
"Você TEM ATÉ boca!? Spth! Plllth!","Do you even HAVE a mouth!? Spth! Plllth!","¡¿Pero tú tienes boca?! ¡Sput! ¡Puf!"
"Como a Fyra lida com isso?","How does Fyra deal with this?","¿Cómo se las apaña Fyra?"
"Deve haver algum tipo de filtro dentro daquela máscara dela.","Perhaps there is some manner of filter inside that mask of hers.","Quizá tenga algún tipo de filtro dentro de la máscara."
"Essa quantidade absurda de regras não parece diminuir!","This madcap barrage of rules shows no signs of slowing!","¡Este bombardeo de reglas absurdas no tiene fin!"
"Calma, Weiss. Precisamos de silêncio ou vamos estragar tudo de novo!","Easy, Weiss. We need quiet or we're gonna mess this up again!","Tranquilo, Weiss. ¡Será mejor guardar silencio o volveremos a meter la pata!"
"Pah. Esse povo mascarado certamente gosta de seus costumes bizarros...","Pah. These Masked folk certainly enjoy their bizarre customs...","Bah. Esta gente enmascarada sí que aprecia sus extraños hábitos..."
"Fico pensando no quê que os levou a criar regras tão complicadas?","I wonder what drove them to make such complicated rules?","¿Qué los habrá llevado a crear unas reglas tan complicadas?"
"Sem regras para nos prender, somos livres para liberar todo o nosso poder!","Without any rules to bind us, we are free to unleash the entirety of our powers!","¡Sin reglas que nos aten, somos libres para desplegar todos nuestros poderes!"
"Já estava na hora!","It's about time!","¡Ya es casi la hora!"
"É bem silencioso aqui.","It sure is quiet here.","Qué silencio hay aquí."
"Tal silêncio não augura nada de bom. Problemas estão a caminho. Tenho certeza disso.","Such silence bodes ill. There's trouble on the way—I'm certain of it.","Tanto silencio no puede traer nada bueno. Se avecinan problemas, seguro."
"Sabe, um <FONT=ITALIC>pouco</FONT> de otimismo de vez em quando não faria mal, Weiss.","You know, a <FONT=ITALIC>little</FONT> optimism now and then wouldn't hurt, Weiss.","Un <FONT=ITALIC>pelín</FONT> de optimismo de vez en cuando no viene nada mal, ¿sabes, Weiss?"
"Que atrevimento!","Such cheek!","¡Qué insolencia!"
"Quanta insolência! Como ele se atreve a nos dar ordens!","The nerve! How dare he boss us around!","¡Menudo descaro! ¿Cómo se atreve a darnos órdenes?"
"Está tudo bem, Weiss. Pelo menos estamos ajudando as pessoas.","It's okay, Weiss. At least we're helping people.","No pasa nada, Weiss. Al menos, estamos ayudando."
"Pah! Você é muito molenga!","Pah! You are far too soft!","¡Bah! ¡Menudo blandengue estás hecho!"
"E você é apenas um velho reclamão... livro!","And you're just a cranky old man...book!","¡Y tú eres un viejo cascarrabias! ¡Un libro viejo y cascarrabias!"
"Como você se atreve a me fazer caçar cabras!","How dare you make me hunt down goats!","¡Cómo te atreves a ponerme a cazar cabras!"
"Eles não são cabras, são ovelhas.","They're not goats, they're sheep.","Son ovejas."
"Qual é a diferença?","What is the difference?","¿Cuál es la diferencia?"
"Eles são totalmente diferentes! As brancas e fofas são ovelhas, e as magras e peludas são cabras!","They're totally different! The white, fluffy ones are sheep, and the scrawny, hairy ones are goats!","¡No se parecen en nada! Las esponjosas son ovejas; las escuálidas, cabras."
"As pessoas também são diferentes, mas todas são chamadas de humanas...","People are different as well, yet you're all just called humans...","La gente también es diferente y todos os llamáis humanos..."
"É, pois é...","Yeah, yeah...","Que sí, que sí..."
"Tantos lugares por aí, como as Sombras vieram parar aqui?","How could there be Shades here, of all places?","¿Cómo puede haber Sombras en un sitio como este?"
"Aposto que eles aparecem sempre que o sol deixa de brilhar.","I wager they appear whenever the sun stops shining.","Apuesto a que aparecen cuando el sol deja de brillar."
"Eu preferiria que tivessem escolhido permanecer em qualquer buraco úmido que chamam de lar...","Though I would prefer it if they had chosen to remain in whatever dank hole they call home...","Aunque preferiría que se hubieran quedado en el agujero del que han salido..."
"Saia da minha frente! Eu tenho que salvar Yonah!","Get out of my way! I have to save Yonah!","¡Fuera de mi camino! ¡Tengo que salvar a Yonah!"
"Acalme-se! Você não vai vencer se estiver cego pela raiva.","Calm down! You cannot prevail if you are blinded with rage.","¡Relájate! No puedes vencer si te ciega la ira."
"Como essas criaturas nos deixam matá-las sem reclamar!?","How can these creatures let us dispatch them without complaint!?","¡¿Cómo pueden estas criaturas dejar que las despachemos sin quejarse?!"
"E o que faz com que eles apareçam nesta área, pra começo de conversa?","And what would make them appear in this area in the first place?","Y, sobre todo, ¿por qué han aparecido en este lugar?"
