"","","0","1","0","SEID_4430_S0021_0310_X","","","","","-1","1226","1025","0","26","Allora dicci: dove NON hai visto l'Ombra?"
"","","0","1","0","RID_VILGIRLC_00110","","","","<CB=SEID_4430_S0020_a0080_0010_End>","0","-1","1226","0","171","Sei strano... Ma penso di non averla vista vicino alla porta settentrionale o sulla collina a ovest."
"1800","","0","1","0","RID_VILGIRLC_00120","","","","","0","-1","1226","0","171","Il mostro non è alla porta settentrionale o sulla collina a ovest, capito?"
"","","0","1","0","SEID_4430_S0020_0340_X","","","","","-1","1226","1025","0","26","D'accordo."
"1801","","0","1","0","SEID_4430_S0020_0350_X","","","","","0","0","0","0","2","Ed eccola."
"","","0","1","0","SEID_4430_S0020_0360_X","","","","","0","0","0","0","2","Quella bambina sta cercando di proteggerla."
"","","0","1","0","SEID_4430_S0020_0370_X","","","","","-1","0","0","0","26","Una storia toccante, ma uomini e Ombre non possono coesistere. Dobbiamo sconfiggere quel mostro ora che sappiamo dov'è."
"","","0","1","0","SEID_4430_S0020_0380_X","","","","","0","0","0","0","2","Hai ragione."
"1802","","0","2","0","RID_VILGUG_00080","","","","<CB=SEID_4430_S0020_a0080_0050_End>","0","-1","1214","0","9","Grazie mille. Sapere che c'erano delle Ombre nascoste in città mi aveva fatto perdere il sonno!"
"1803","","0","1","0","RID_VILGUG_00090","","","","","0","-1","1214","0","9","Spero sia l'ultima volta che troviamo le Ombre nel villaggio..."
"1804","","0","1","0","RID_VILGIRLC_00130","","","","","0","-1","1226","0","171","Mmm... Non è qui. Dov'è andato?"
"1805","","0","2","0","RID_NIER_01300","","","","","0","1280","-1","0","2","È da un po' che non ci vediamo. Come stai?"
"","","0","1","0","RID_SEAYTHA_00200","","","","","0","-1","1280","0","19","Benissimo, grazie! Le mie fresie si vendono come il pane!"
"","","0","1","0","SEID_4430_S0030_0030_X","","","","","0","1280","-1","0","2","Mi fa piacere. Mmm... E loro chi sono?"
"","","0","1","0","RID_SEAYTHA_00210","","","","","0","-1","1280","0","19","Mia moglie e mio figlio."
"","","0","1","0","SEID_4430_S0030_0050_X","","","","","0","1280","-1","0","2","Aspetta, ti sei sposato?"
"","","0","1","0","RID_SEAYTHA_00220","","","","<CB=LIB_SET_START_SUBQUEST,1965,78,17,1280,1806>","0","-1","1280","0","19","Sì, era tempo di voltare pagina. A proposito, cerchi lavoro?"
"1806","","0","1","0","SEID_4430_S0030_0070_X","","","","","0","1280","-1","0","2","Sempre. Che cosa ti serve?"
"","","0","1","0","RID_SEAYTHA_00230","","","","","0","-1","1280","0","19","Ho un cliente di Facciata che ha bisogno di una fresia e speravo che potessi consegnargliela."
"","","0","1","0","RID_SEAYTHA_00240","","","","","0","-1","1280","0","19","Il mio cliente è il proprietario del negozio di materiali. So che è piuttosto lontano, ma..."
"","","0","1","0","SEID_4430_S0030_0100_X","","","","","0","1280","-1","0","2","Posso farcela."
"","","0","1","0","RID_SEAYTHA_00250","","","","<CB=SEID_4430_S0030_a0010_End>","0","-1","1280","0","19","Grazie! "
"1807","","0","1","0","RID_SEAYTHA_00260","","","","","0","-1","1280","0","19","Consegna una fresia a Facciata per me."
"1808","","0","2","0","RID_NIER_01310","","","","","0","1246","-1","0","2","Hai ordinato una fresia?"
"","","0","1","0","RID_MSKMAT_00060","","","","","0","-1","1246","0","150","(Oh, cielo... Quanti ricordi.)"
"","","0","1","0","SEID_4430_S0030_0150_X","","","","","0","1246","-1","0","2","Ricordi di che cosa?"
"","","0","1","0","RID_MSKMAT_00070","","","","","0","-1","1246","0","150","(Di molti eventi, sia felici che tristi. Sai, in passato vivevo al Nido.)"
"","","0","1","0","SEID_4430_S0030_0170_X","","","","","0","1246","-1","0","2","Oh, allora dovrei dirti che..."
"","","0","1","0","RID_MSKMAT_00080","","","","","0","-1","1246","0","150","(Che è stato distrutto? Sì, lo so...)"
"","","0","1","0","RID_MSKMAT_00090","","","","","0","-1","1246","0","150","(La ragazza della casa accanto amava le fresie. Ce le mettevamo tra i capelli e...)"
"","","0","1","0","RID_MSKMAT_00100","","","","","0","-1","1246","0","150","(Comunque, un giorno è stata attaccata da un'Ombra). "
"","","0","1","0","RID_MSKMAT_00110","","","","","0","-1","1246","0","150","(Prima che potessi fare qualcosa, si è trasformata in un mostro.)"
"","","0","1","0","RID_MSKMAT_00120","","","","","0","-1","1246","0","150","(Gli adulti non mi hanno mai creduto, ma io sapevo quello che era successo. Lo sapevo.)"
"","","0","1","0","RID_MSKMAT_00130","","","","<CB=SEID_4430_S0030_a0030_End>","0","-1","1246","0","150","(Ma ora basta. Grazie per il fiore.)"
"1809","","0","1","0","SEID_4430_S0030_0240_X","","","","","-1","0","0","0","26",""
"","","0","1","0","SEID_4430_S0030_0250_X","","","","","-1","0","0","0","2",""
"1810","","0","1","0","RID_MSKMAT_00140","","","","","0","-1","1246","0","150","(Questo fiore riporta alla mente ricordi terribili, ma anche ricordi felici.)"
"1811","","0","2","0","RID_NIER_01320","","","","","0","1280","-1","0","2","Ho consegnato la fresia."
"","","0","1","0","RID_SEAYTHA_00270","","","","<CB=SEID_4430_S0030_a0050_01>","0","-1","1280","0","19","Grazie, ecco il tuo compenso."
"1812","","0","1","0","SEID_4430_S0030_0290_X","","","","<CB=SEID_4430_S0030_a0050_SELECT>","0","1280","-1","0","2","......"
"1813","","0","1","0","SEID_4430_S0030_0300_X","","","","","-1","0","0","0","","<LIST=1814>Parla della fidanzata.</LIST><LF><LIST=1815>Vai via.</LIST>"
"1814","","2","1","0","","","","","<CB=SEID_4430_S0030_a0050_0030_Talk>","-1","0","0","0","",""
"1815","","2","1","0","","","","","<CB=SEID_4430_S0030_a0050_0080_Talk>","-1","0","0","0","",""
"1816","","0","1","0","SEID_4430_S0030_0310_X","","","","<CB=SEID_4430_S0030_a0050_02>","0","1280","-1","0","2","Ascolta, non sarà facile, ma dovresti sapere una cosa..."
"1817","","0","1","0","RID_SEAYTHA_00300","","","","","0","-1","1280","0","19","Cosa? No. Oh, no..."
"","","0","1","0","SEID_4430_S0030_0330_X","","","","","-1","0","0","0","26","Mi dispiace."
"","","0","1","0","RID_SEAYTHA_00310","","","","","0","-1","1280","0","19","Se solo l'avessi portata qui prima..."
"","","0","1","0","SEID_4430_S0030_0350_X","","","","","-1","0","0","0","2","......"
"","","0","1","0","SEID_4430_S0030_0360_X","","","","","-1","0","0","0","26","Meglio lasciarlo da solo."
"","","0","1","0","SEID_4430_S0030_0370_X","","","","<CB=SEID_4430_S0030_a0050_End02>","0","0","-1","0","2","Già. "
"1818","","0","1","0","RID_NIER_01330","","","","","0","1349","-1","0","2","Dov'è tuo marito?"
"","","0","1","0","RID_SEAWOMF_00041","","","","","0","-1","1349","0","119","Ieri sera ha afferrato una spada ed è corso fuori di casa! Non l'ho mai visto così arrabbiato!"
"","","0","1","0","SEID_4430_S0030_0400_X","","","","","0","1349","-1","0","2","Non è un buon segno."
"","","0","1","0","RID_SEAWOMF_00050","","","","<CB=SEID_4430_S0030_a0055_End>","0","-1","1349","0","119","Tornerà, lo so. Mio figlio e io lo aspetteremo fino ad allora."
"1819","","0","1","0","RID_SEAWOMF_00050","","","","","0","-1","1349","0","119","Tornerà, lo so. Mio figlio e io lo aspetteremo fino ad allora."
"1820","","0","1","0","RID_SEABOYL_00030","","","","","0","-1","1348","0","71","Dov'è andato papà?"
"1821","","0","1","0","SEID_4430_S0030_0440_X","","","","","0","1280","-1","0","2","Hai una moglie e un figlio meravigliosi. Prenditi cura di loro, d'accordo?"
"","","0","1","0","RID_SEAYTHA_00280","","","","<CB=SEID_4430_S0030_a0050_End01>","0","-1","1280","0","19","Lo farò! La mia famiglia è importantissima per me e farò tutto il possibile perché sia felice."
"1822","","0","1","0","RID_SEAYTHA_00290","","","","","0","-1","1280","0","19","Farò tutto il possibile per rendere felice la mia famiglia."
"1823","","0","2","0","RID_NIER_01450","","","<CB=SEID_5000_S0020_a0030_Start>","","0","1004","-1","0","2","Hai mai sentito parlare di una pietra utilizzata dai chiaroveggenti?"
"","","0","1","0","SEID_5000_S0020_0130_X","","","","","0","-1","1004","0","24","Oh, intendi l'Occhio del potere?"
"","","0","1","0","SEID_5000_S0020_0132_X","","","","","0","-1","1004","0","24","So che è un nome ridicolo, ma non l'ho inventato io."
"","","0","1","0","SEID_5000_S0020_0134_X","","","","","0","-1","1004","0","24","Perché me lo chiedi?"
"","","0","1","0","SEID_5000_S0020_0140_X","","","","","0","1004","-1","0","2","Sto facendo un favore a una persona. Hai idea di dove possa trovarne uno?"
"","","0","1","0","SEID_5000_S0020_0150_X","","","","","0","-1","1004","0","24","Hmm... So che alcuni erano sul tetto del Santuario perduto, li troverai ancora lì."
"","","0","1","0","SEID_5000_S0020_0160_X","","","","<CB=SEID_5000_S0020_a0030_End>","0","1004","-1","0","2","Va bene. Proverò al Santuario perduto."
"1824","","0","1","0","SEID_5000_S0020_0170_X","","","","","-1","0","0","0","2","Questo dev'essere un Occhio del potere."
"","","0","1","0","SEID_5000_S0020_0180_X","","","","","0","-1","-3","0","35","Oh, cielo! Sento il potere sprigionarsi dalla pietra!"
"","","0","1","0","SEID_5000_S0020_0190_X","","","","","0","-1","1025","0","26","Sono colpito, lo ammetto. Predire la sorte con una pietra così potente può dare risultati molto precisi."
"1825","","0","1","0","SEID_5000_S0020_0250_X","","","","","-1","0","0","0","2","Nnngh..."
"","","0","1","0","SEID_5000_S0020_0260_X","","","","","-1","0","0","0","28","Ma che... ? Dove siamo?"
"","","0","1","0","SEID_5000_S0020_0270_X","","","","","-1","0","0","0","35","Non ho mai visto niente del genere."
"","","0","1","0","SEID_5000_S0020_0280_X","","","","","-1","0","0","0","26","Non è questo il momento di mettersi a esplorare! Le Ombre si avvicinano!"
"1826","","2","1","0","","","","","","-1","0","0","0","",""
"1827","","0","2","0","RID_VILOLMA_00070","","","","","0","-1","1038","0","8","Oh, meno male che siete qui! Siamo nei guai!"
"","","0","1","0","SEID_9900_S0010_9020_X_NIER020","","","","","0","1038","-1","0","2","Che succede?"
"","","0","1","0","RID_VILOLMA_00080","","","","","0","-1","1038","0","8","Un cinghiale sta attaccando gli abitanti della pianura settentrionale!"
"","","0","1","0","RID_VILOLMA_00090","","","","","0","-1","1038","0","8","Le vittime dell'attacco sono riuscite a fare ritorno, ma quel cinghiale è una continua minaccia!"
"","","0","1","0","SEID_9900_S0010_9050_X_NIER020","","","","","0","1038","-1","0","2","Volete che vada a ucciderlo?"
"","","0","1","0","RID_VILOLMA_00100","","","","<CB=LIB_SET_START_SUBQUEST,1603,13,2,1038,1828>","0","-1","1038","0","8","Sì! E ti pagheremo molto bene!"
"1828","","0","1","0","SEID_9900_S0010_9071_X","","","","","0","1038","-1","0","2","D'accordo."
"","","0","1","0","RID_VILOLMA_00110","","","","","0","-1","1038","0","8","Ah, un consiglio: quando l'avrai ucciso, prendi una zanna."
"","","0","1","0","RID_VILOLMA_00120","","","","<CB=LIB_SET_END_SUBQUEST>","0","-1","1038","0","8","Fidati, ti tornerà utile."
"1829","","0","1","0","RID_VILOLMA_00130","","","","","0","-1","1038","0","8","Corri! Vai a uccidere quel cinghiale!"
"1830","","0","2","0","RID_VILOLMA_00140","","","","","0","-1","1038","0","8","Hai ucciso il cinghiale? Oh, grazie!"
"","","0","1","0","RID_VILOLMA_00150","","","","","0","-1","1038","0","8","E ti sei procurato anche una zanna!"
"","","0","1","0","RID_VILOLMA_00160","","","","","0","-1","1038","0","8","Dicono che i cinghiali siano docili con chi ne possiede una."
"","","0","1","0","RID_VILOLMA_00170","","","","","0","-1","1038","0","8","Anzi, si fanno persino cavalcare!"
"","","0","1","0","RID_VILOLMA_00180","","","","<CB=B_SEID_9900_S0010_a0050_End>","0","-1","1038","0","8","Secondo me sono panzane, ma se hai coraggio potresti anche provarci."
"1831","","0","1","0","RID_VILOLMA_00190","","","","","0","-1","1038","0","8","Finalmente possiamo di nuovo viaggiare in santa pace."
"1832","","0","1","0","RID_VILWOMB_00040","","","","","0","-1","1388","0","108","Nessuno compra più vestiti nuovi, vogliono solo che io ripari quelli vecchi."
"1833","","0","1","0","RID_VILLIQ_00030","","","","","0","-1","1185","0","116","Dopo che i bambini di cui si occupava vicino alla fontana hanno perso la vita, mia nonna ha iniziato a perdere colpi."
"","","0","1","0","RID_VILLIQ_00040","","","","","0","-1","1185","0","116","Sono preoccupato per te. Sei cambiato da quando Yonah è stata portata via."
"","","0","1","0","NID_1010_v0011_0050_X","","","","","0","1185","-1","0","2","Grazie, ma non devi preoccuparti per me."
"1834","","0","1","0","EID_all_worry02_VILLNOG_X_2","","","","","0","-1","1038","0","8","*sospira* Sono anni che aspetto una ripresa delle vendite..."
"1835","","0","3","0","RID_VILTOOL_00070","","","","","0","-1","1203","0","10","Stai lasciando il villaggio? Ricordati di fare scorta di provviste."
"1836","","0","3","0","RID_VILTOOL_00081","","","","","0","-1","1203","0","10","Compra qui più spesso, d'accordo? Sono sul lastrico!"
"1837","","0","3","0","RID_VILMAT_00040","","","","","0","-1","1187","0","11","Grazie per essere passato! Ho dei materiali meravigliosi in vendita!"
"1838","","0","3","0","RID_VILMAT_00050","","","","","0","-1","1187","0","11","Le cose vanno male ultimamente."
"1839","","0","1","0","RID_VILFLOW_00030","","","","","0","-1","1188","0","112","So che è un mondo difficile, ma è proprio per questo che esistono i fiori!"
"1840","","0","1","0","RID_VILFLOW_00040","","","","","0","-1","1188","0","112","Mio marito mi dice che non è il momento giusto per coltivare dei fiori."
"1841","","0","1","0","RID_NIER_00151","","","","","0","1189","-1","0","2","Sono passati cinque anni da quando le Ombre hanno attaccato. Ora sono nella pianura settentrionale."
"","","0","1","0","NID_1010_v0010_0130_X","","","","","0","1189","-1","0","2","Potevo uccidere il Signore delle Ombre e non ci sono riuscito..."
"","","0","1","0","RID_VILGUNB_00030","","","","","0","-1","1189","0","9","Ehi, non buttarti giù! Se ti deprimi proprio TU, allora noi non abbiamo nessuna speranza!"
"1842","","0","1","0","RID_VILGUSA_00030","","","","","0","-1","1190","0","9","Prima le Ombre iniziano a indossare armature resistenti alla luce e ora le poste sono sempre in ritardo! Il mondo sta per finire, te lo dico io!"
"","","0","1","0","RID_VILGUSA_00040","","","","","0","-1","1190","0","9","È un peccato non poter comunicare con Frontemare. Erano il nostro partner commerciale principale e ora non abbiamo mai abbastanza cibo."
"1843","","0","1","0","RID_VILGUEB_00030","","","","","0","-1","1191","0","9","Terremo noi il villaggio al sicuro. Tu vai a salvare Yonah."
"","","0","1","0","NID_1010_v0010_0180_X","","","","","0","1191","-1","0","2","Sarà fatto."
"1844","","0","1","0","RID_VILGUSB_00050","","","","","0","-1","1192","0","9","Le Ombre hanno invaso Frontemare. Ho sentito che la gente non se la passa bene."
"1845","","0","1","0","RID_VILGUA_00020","","","","","0","-1","1193","0","9","Te ne vai di nuovo?"
"","","0","1","0","NID_1010_v0010_0210_X","","","","","0","1193","-1","0","2","Sì. Oggi scoprirò dove si trova Yonah, me lo sento."
"1846","","0","1","0","RID_VILGUEA_00020","","","","","0","-1","1194","0","9","Sempre più Ombre resistono alla luce del sole ultimamente. Tra poco, non ci sarà più un luogo sicuro dove vivere!"
"1847","","0","1","0","RID_VILOLMC_00040","","","","","0","-1","1195","0","8","Accidenti. Ora che devo fare la spesa tutta in una volta, sono costretta a portare queste borse pesanti!"
"1848","","0","1","0","EID_all_worry02_VILLNOW_X_2","","","","","0","-1","1196","0","108","Oggi la vita è molto più difficile per gli anziani! I prezzi aumentano a dismisura e non riesco a risparmiare su niente."
"1849","","0","3","0","RID_VILWEP_00040","","","","","0","-1","1197","0","14","Benvenuto! Oggi abbiamo in vendita dei nuovi oggetti!"
"1850","","0","3","0","RID_VILWEP_00050","","","","","0","-1","1197","0","14","Questi sono i tempi migliori per i fabbri. È la dura legge del mercato."
"1851","","0","1","0","RID_VILWIFC_00050","","","","","0","-1","1198","0","108","Vuoi comprare qualcosa?"
"1852","","0","1","0","RID_VILWOME_00020","","","","","0","-1","1199","0","108","Perché è morto? Non sappiamo neanche che cos'è la Necrografia! Perché succede sempre e solo a noi? Perché?!"
"","","0","1","0","NID_1010_v0010_0560_X","","","","","-1","0","0","0","2","......"
"","","0","1","0","NID_1010_v0010_0290_X","","","","","-1","0","0","0","26","Forse dovremmo andare."
"1853","","0","1","0","RID_VILWOMD_00040","","","","","0","-1","1390","0","108","Con l'aumento delle Ombre e la morte degli animali, anche la carne di montone è costosa."
"1854","","0","1","0","RID_VILOLMB_00030","","","","","0","-1","1200","0","8","Di questi tempi, non penso ad altro che al cibo. Darei la vita per poter mangiare carne ancora una volta..."
"1855","","0","1","0","RID_VILGUB_00030","","","","","0","-1","1201","0","9","Le Ombre possono colpire in qualsiasi momento, quindi devo stare sempre all'erta. Ricordo ancora quando la ronda nel quartiere del mercato era facile..."
"1856","","0","1","0","RID_VILMANA_00070","","","","","0","-1","1202","0","8","Non è che potresti uccidere una capra o un cinghiale per noi? Te ne saremmo davvero grati!"
"1857","","0","1","0","RID_VILMANB_00030","","","","","0","-1","1186","0","8","Le Ombre ci impediscono di cacciare come facevamo un tempo, quindi le nostre fonti di cibo si stanno esaurendo."
"1858","","0","1","0","RID_VILFOOD_00050","","","","","0","-1","1204","0","113","So che è tutto molto costoso, ma non abbiamo scelta!"
"1859","","0","1","0","RID_VILFOOD_00060","","","","","0","-1","1204","0","113","Torna presto."
"1860","","0","1","0","RID_VILOLMD_00040","","","","","0","-1","1391","0","8","Ogni giorno, i nostri figli e le nostre figlie vanno a caccia sempre più numerosi e non fanno mai ritorno. Che cosa dovremmo fare?"
"1861","","0","1","0","RID_VILOLWC_00030","","","","","0","-1","1205","0","108","Voi bambini avete certamente una scorta infinita d'energia! Se continuate a correre così, finirete per cadere e farvi male."
"","","0","1","0","NID_1010_v0010_0380_X","","","","","-1","0","0","0","2","......"
"","","0","1","0","NID_1010_v0010_0390_X","","","","","-1","0","0","0","26","Lasciamola stare. Dovunque sia la sua mente, è in un luogo più felice di questo. "
"1862","","0","1","0","RID_VILBOYB_00030","","","","","0","-1","1392","0","71","Perché non posso uscire dal quartiere del mercato per giocare?"
"1863","","0","1","0","RID_VILWIFA_00040","","","","","0","-1","1206","0","108","Un altro cacciatore è scomparso. Sono così preoccupata per mio marito..."
"1864","","0","1","0","RID_VILWIFB_00050","","","","","0","-1","1207","0","108","Se non vai a caccia, muori di fame. Ma se vai a caccia, vieni ucciso dalle Ombre! Odio questo posto."
"1865","","0","1","0","EID_all_worry03_VILLNMG_X_1","","","","","0","-1","1208","0","9","Se continua così, dovrò andare via dal villaggio. È vero, non conosco molto il mondo esterno, ma <FONT=ITALIC>deve</FONT> per forza essere meglio di questo."
"1866","","0","1","0","RID_VILGUNA_00020","","","","","0","-1","1209","0","9","Se cinque anni fa non avessi salvato il villaggio, nessuno di noi sarebbe qui. Grazie."
"1867","","0","1","0","RID_VILGUC_00030","","","","","0","-1","1210","0","9","Sono state avvistate delle Ombre intorno al Cumulo di ciarpame. Pensi che abbiano imparato a utilizzare i macchinari? Per noi sarebbe la fine!"
"1868","","0","1","0","RID_VILYTHE_00040","","","","","0","-1","1211","0","8","Le Ombre sono molto più forti ora, specialmente quelle corazzate. Fai attenzione!"
"1869","","0","1","0","RID_VILYTHD_00030","","","","","0","-1","1212","0","8","Da anni ormai dedico la mia vita a proteggere Popola. Lei è troppo importante e bella per preoccuparsi delle Ombre!"
"","","0","1","0","RID_VILYTHD_00040","","","","","0","-1","1212","0","8","Mi ha incaricato di proteggere la biblioteca e forse, in futuro, si fiderà abbastanza da affidarmi... altro."
"","","0","1","0","NID_1010_v0010_0500_X","","","","","-1","0","0","0","26","Immagino sia meglio avere false speranze che nulla."
"1870","","0","1","0","RID_VILWOMC_00060","","","","","0","-1","1393","0","108","Molti libri della biblioteca sono stati rovinati dopo la caduta del tetto. È una tragedia!"
"1871","","0","1","0","EID_all_greeting01_VILLNMG02_X_2.wav","","","","","0","-1","0","0","9","Spiacente, in questo momento la barca è fuori servizio."
"","","0","1","0","NID_1010_v0010_0520_X","","","","","0","-1","0","0","9","Sono qui solo per tenere alla larga i bambini: potrebbero salire a bordo e fare qualche marachella."
"1872","","0","1","0","RID_VILMAND_00040","","","","","0","-1","1213","0","8","Se mai riuscissimo a sconfiggere le Ombre, vorrei coltivare un campo proprio qui."
"1873","","0","1","0","RID_VILGUG_00010","","","","","0","-1","1214","0","9","Non importa quante guardie abbiamo. Se quell'Ombra gigantesca ci attacca ancora..."
"","","0","1","0","NID_1010_v0010_0280_X","","","","","0","1214","-1","0","2","Se succederà, ce ne occuperemo noi."
"","","0","1","0","NID_1010_v0010_0570_X","","","","","-1","0","0","0","26","Fa bene a un vecchio libro come me vederti così cresciuto."
"1874","","0","1","0","RID_VILGIRLE_00010","","","","","0","-1","1215","0","171","Mamma ha detto che non posso giocare fuori dal quartiere del mercato."
"1875","","0","1","0","RID_VILBOYC_00030","","","","","0","-1","1216","0","71","Il quartiere del mercato fa schifo! È piccolo, pieno di gente e gli anziani hanno un odore strano."
"1876","","0","1","0","RID_VILGIRLD_00010","","","","","0","-1","1217","0","171","Vorrei tanto giocare in un posto più grande."
"1877","","0","1","0","RID_VILGUE_00010","","","","","0","-1","1218","0","9","Le difese del villaggio sono più forti che in passato. Ma se penso che le Ombre possono attaccare ancora..."
"1878","","0","1","0","RID_VILGUF_00010","","","","","0","-1","1219","0","9","Il quartiere del mercato era un luogo così vivace. Non riavremo più quell'atmosfera, per quanto ci sforziamo."
"1879","","0","1","0","RID_VILGUSB_00060","","","","","0","-1","1220","0","9","Gli abitanti del villaggio si muovono a gruppi. Non si può mai sapere cosa potrebbe succedere."
"1880","","0","1","0","RID_VILWIFD_00010","","","","","0","-1","1221","0","108","Di questi tempi, ogni filo d'erba è prezioso. Io raccolgo quello che trovo, ma non è molto."
"1881","","0","1","0","RID_VILGUH_00010","","","","","0","-1","1222","0","9","Sono sempre nervoso ultimamente. Vedo Ombre dietro ogni angolo!"
"1882","","0","1","0","RID_VILMANG_00010","","","","","0","-1","1223","0","8","Le persone che vanno a caccia continuano a essere attaccate! Siamo messi malissimo: non c'è quasi più nessuno in grado di imbracciare un'arma."
"","","0","1","0","RID_VILMANG_00020","","","","","0","-1","1223","0","8","Non dovremmo vivere così, se le Ombre non esistessero!"
"1883","","0","1","0","RID_VILMANF_00021","","","","","0","-1","1224","0","8","Di questi tempi, ogni risorsa è importante. Se penso a tutto quello che abbiamo sprecato..."
"1884","","0","1","0","RID_VILWIFE_00010","","","","","0","-1","1225","0","108","Le Ombre hanno invaso il villaggio dove abitavo. L'ho scampata per un soffio!"
"1885","","0","1","0","RID_VILGIRLC_00010","","","","","0","-1","1226","0","171","Non so dove siano i miei amici ora. Spero stiano bene..."
"1886","","0","1","0","RID_VILMANH_00021","","","","","0","-1","1227","0","8","Se non possiamo andare a caccia, la nostra unica speranza è la pesca. Grazie al cielo abitiamo vicino al mare!"
"1887","","0","1","0","RID_VILBOYE_00010","","","","","0","-1","1356","0","71","Che cosa vuoi?"
"1888","","0","1","0","RID_VILBOYD_00010","","","","","0","-1","1357","0","71","Non... non stiamo facendo niente di male!"
"1889","1833","0","1","0","NID_1010_v0010_0020_X","","","","","-1","0","0","0","8",""
"1890","1857","0","1","0","NID_1010_v0010_0330_X","","","","","-1","0","0","0","8",""
"1891","1868","0","1","0","NID_1010_v0010_0450_X","","","","","-1","0","0","0","8",""
"1892","1869","0","1","0","NID_1010_v0010_0470_X","","","","","-1","0","0","0","8",""
"1893","1872","0","1","0","NID_1010_v0010_0530_X","","","","","-1","0","0","0","8","Accidenti, è diventato difficile coltivare i campi con tutte queste Ombre."
"1894","1881","0","1","0","NID_1010_v0010_0650_X","","","","","-1","0","0","0","8",""
"1895","1882","0","1","0","NID_1010_v0010_0670_X","","","","","-1","0","0","0","8",""
"1896","","0","1","0","RID_SEAMANK_00060","","","","","0","-1","1272","0","19","Qual è la situazione fuori dal villaggio? Ho sentito che le Ombre si stanno avvicinando."
"1897","","0","1","0","RID_SEAYTHF_00020","","","","","0","-1","1273","0","19","Abbiamo riparato il cancello prima di notare che conduceva a un'area piena di Ombre, così abbiamo direttamente chiuso il passaggio."
"1898","","0","1","0","RID_SEAWOMG_00040","","","<CB=Snow_NPC3_Talk_Start>","","0","-1","1274","0","119","Questo posto è cambiato molto."
"","","0","1","0","RID_SEAWOMG_00050","","","","<CB=Snow_NPC3_Talk_End>","0","-1","1274","0","119","Le Ombre nella pianura meridionale hanno reso il commercio difficile. Per non parlare della Necrografia che si sta diffondendo ovunque!"
"1899","","0","1","0","RID_SEABOYF_00020","","","","","0","-1","1394","0","71","Dove si stanno nascondendo tutti...?"
"1900","","0","1","0","RID_SEAGIRLC_10010","","","","","0","-1","1395","0","171","Aaah! Mi hai spaventato a morte!"
"1901","","0","1","0","RID_SEABOYG_00020","","","","","0","-1","1396","0","71","Nessuno riuscirà a trovarmi qui! Eh eh!"
"1902","","0","1","0","RID_SEABOYA_00020","","","","","0","-1","1397","0","71","Mmm... Non mi hanno ancora trovato, vero?"
"1903","","0","1","0","RID_SEAOLMC_00030","","","","","0","-1","1275","0","19","Da quando le Ombre hanno invaso la pianura, il porto è praticamente deserto..."
"1904","","0","1","0","RID_SEAWOME_00040","","","","","0","-1","1276","0","119","Non ci sono molti ingressi al villaggio, quindi siamo riusciti a tenere sotto controllo i danni provocati dalle Ombre."
