"","","0","1","0","EID_1450_a0110_0071_BOOKW010_X","","","","","-1","0","0","0","26","Gut, gut. Allmählich klingt der Junge wie ein Mann!"
"","","0","1","0","EID_1450_a0110_0080_NIER010_X","","","","","-1","0","0","0","2","Junge? Ich bin doch kein Kind ..."
"","","0","1","0","EID_1450_a0110_0090_KAINE010_X","","","","","-1","0","0","0","28","Hey. Weniger reden, mehr gehen."
"1316","1317","0","1","0","EID_1480_a0010_0010_TCK010_X","","","","","-1","0","0","0","45","(Ach, Ihr seid wieder da! Oh, hier! Passt auf ...)"
"","","0","1","0","EID_1480_a0010_0020_NIER010_X","","","","","-1","0","-1","0","2","Äh, seid Ihr sicher, dass Ihr das tun solltet? Die scheint mir recht wichtig zu sein."
"","","0","1","0","EID_1480_a0010_0030_TCK010_X","","","","","-1","0","0","0","45","(Ach, ist sie auch. Aber es wäre eine Verschwendung nicht <FONT=ITALIC>alles</FONT> damit zu machen.)"
"1317","1318","0","1","0","EID_1480_a0010_0040_MASKADV_X","","","","","-1","0","1007","0","43","(Mein Gebieter, die Maske sollte nicht in einer solchen Weise herumgewirbelt werden!)"
"1318","","0","1","0","EID_1480_a0010_0050_BOOKW010_X","","","","<CB=EID_1480_a0010_End>","-1","0","0","0","26","Ich nehme an, man kann nicht erwarten, dass jemand über Nacht sein Verhalten ändert. Nicht einmal ein König."
"1319","","0","1","0","EID_1480_a0020_0010_TCK010_X","","","","","0","-1","1009","0","45","(Was?! Was wollt ihr?!)"
"","","0","1","0","EID_1480_a0020_0020_NIER010_X","","","","","0","1009","-1","0","2","Entschuldigung. Falscher Zeitpunkt?"
"","","0","1","0","EID_9999_NoSound","","","","","0","-1","1005","0","42","(Nein, schon gut. In Ordnung?)"
"","","0","1","0","EID_1480_a0020_0040_TCK010_X","","","","","0","-1","1009","0","45","(Ich werde Euch nicht wegschicken, aber es würde mir auch nichts ausmachen, wenn Ihr gehen würdet.)"
"","","0","1","0","EID_1480_a0020_0050_BOOKW010_X","","","","","-1","0","0","0","26","Eine ehrliche Antwort, wie sie einem König geziemt."
"","","0","1","0","EID_1480_a0020_0060_NIER010_X","","","","<CB=EID_1480_a0020_01>","-1","0","-1","0","2","Weiss! Lass uns aufbrechen."
"1320","","0","1","0","EID_1480_a0020_0070_BOOKW010_X","","","","","-1","0","0","0","26","Sie machen sich bereit, die gesamte Gesellschaft neu zu strukturieren. Und doch ist der König damit beschäftigt, einem Mädchen den Hof zu machen!"
"","","0","1","0","EID_1480_a0020_0080_NIER010_X","","","","","-1","0","0","0","2","Ja, aber hast du gesehen, wie glücklich Fyra aussah?"
"","","0","1","0","EID_1480_a0020_0090_BOOKW010_X","","","","","-1","0","0","0","26","Natürlich nicht! Sie trug doch diese infernale Maske!"
"","","0","1","0","EID_1480_a0020_0100_NIER010_X","","","","","-1","0","0","0","2","Ach, ja. Richtig."
"1321","1322","0","2","0","RID_NIER_00110_NIER010","","","","","-1","1002","-1","0","2","Yonah?"
"","","0","1","0","EID_1500_a0001_00002_YONAH010_X","","","","","-1","-1","1002","0","5","Ach, hey."
"","","0","1","0","EID_1500_a0001_00003_NIER010_X","","","","","-1","1002","-1","0","2","Wie geht es dir?"
"","","0","1","0","EID_1500_a0001_00004_YONAH010_X","","","","","-1","-1","1002","0","5","Seit ich die Medizin nehme, die du mir gebracht hast, geht es mir besser."
"","","0","1","0","EID_1500_a0001_00005_NIER010_X","","","","","-1","1002","-1","0","2","Gut."
"1322","","0","2","0","EID_1500_a0001_00006_YONAH010_X","","","","","-1","-1","1002","0","5","Ähm, übrigens ..."
"","","0","1","0","EID_1500_a0001_00007_NIER010_X","","","","<CB=EID_1500_a0005_020_Select>","-1","-1","1002","0","5","Bleibst du heute hier?"
"1323","","0","1","0","EID_9999_NoSound","","","","","-1","0","0","0","","<LIST=1324>Klar, ich werde bleiben.</LIST><LF><LIST=1325>Ich kann heute nicht bleiben.</LIST>"
"1324","","2","1","0","EID_9999_NoSound","","","<CB=EID_1500_a0005_040_Select01>","","-1","0","0","0","",""
"1325","","2","1","0","EID_9999_NoSound","","","<CB=EID_1500_a0005_030_Select02>","","-1","0","0","0","",""
"1326","","0","1","0","RID_NIER_01820","","","","","0","1002","-1","0","2","Tut mir leid, Yonah, aber ich habe ein paar Dinge zu erledigen."
"","","0","1","0","EID_1500_a0001_00010_YONAH010_X","","","","","0","-1","1002","0","5","Oh. Na gut. Ich verstehe."
"","","0","1","0","EID_1500_a0001_00011_YONAH010_X","","","","<CB=EID_1500_a0005_010_02_Start>","0","-1","1002","0","5","Aber nächstes Mal erzählst du mir eine Bettgeschichte?"
"1327","","0","1","0","EID_1500_a0001_00011_YONAH010_X","","","","","0","-1","1002","0","5","Aber nächstes Mal erzählst du mir eine Bettgeschichte?"
"1328","","0","1","0","EID_1500_a0001_00013_NIER010_X","","","","","0","1002","-1","0","2","Da kannst du drauf wetten."
"","","0","1","0","EID_1500_a0001_00012_YONAH010_X","","","","","0","-1","1002","0","5","Wirklich? Du bleibst hier? WIRKLICH?!"
"","","0","1","0","RID_NIER_01810","","","","","0","1002","-1","0","2","Ha. Ja, Yonah, ich bleibe hier."
"","","0","1","0","EID_1500_a0001_00014_YONAH010_X","","","","","0","-1","1002","0","5","Hurra!"
"","","0","1","0","EID_1500_a0001_00015_NIER010_X","","","","","0","1002","-1","0","2","Und jetzt geh wieder ins Bett."
"","","0","1","0","EID_1500_a0001_00016_YONAH010_X","","","","<CB=EID_1500_a0005_010_01_Start>","0","-1","1002","0","5","In Ordnung!"
"1329","","0","1","0","NV_ID_1414","","","","","-1","0","0","0","2","(Nur ein Traum ...)"
"","","0","1","0","NV_ID_1415","","","","","-1","0","0","0","2","(Selbst im Traum jage ich den Versiegelten Versen nach.)"
"1330","1331","0","2","0","RID_YONAH_00100","","","","","-1","-1","1002","0","5","Morgen, <NIER>!"
"","","0","1","0","EID_1500_a0001_00018_NIER010_X","","","","","-1","1002","-1","0","2","Nnngh. M-Morgen, Yonah."
"","","0","1","0","EID_1500_a0001_00019_YONAH010_X","","","","","-1","-1","1002","0","5","Was ist los? Fühlst du dich auch krank?"
"","","0","1","0","EID_1500_a0001_00020_NIER010_X","","","","","-1","1002","-1","0","2","Nein, ich hatte nur ... Ich hatte nur einen seltsamen Traum."
"","","0","1","0","EID_1500_a0001_00021_YONAH010_X","","","","","-1","-1","1002","0","5","Was war das denn für ein Traum?"
"","","0","1","0","EID_1500_a0001_00022_NIER010_X","","","","","-1","1002","-1","0","2","Schon gut. Mach dir keine Gedanken darum."
"","","0","1","0","EID_1500_a0001_00023_YONAH010_X","","","","","-1","-1","1002","0","5","Ich hatte nämlich auch einen Traum!"
"","","0","1","0","EID_1500_a0001_00024_NIER010_X","","","","","-1","1002","-1","0","2","Ach, ja?"
"","","0","1","0","EID_1500_a0001_00025_YONAH010_X","","","","","-1","-1","1002","0","5","Ja! Dieser Junge und ich spielten zusammen ein Spiel."
"","","0","1","0","EID_1500_a0001_00026_NIER010_X","","","","","-1","1002","-1","0","2","Was für ein Spiel?"
"","","0","1","0","EID_1500_a0001_00027_YONAH010_X","","","","","-1","-1","1002","0","5","Es nannte sich ""Wörter raten""! Ich glaube, er hatte es sich ausgedacht, denn ich habe nie zuvor davon gehört."
"","","0","1","0","EID_1500_a0001_00028_NIER010_X","","","","","-1","1002","-1","0","2","Wie funktionierte es?"
"","","0","1","0","EID_1500_a0001_00029_YONAH010_X","","","","","-1","-1","1002","0","5","Der Junge bewegte seinen Mund, aber es kamen keine Worte heraus. Und dann musste ich raten, was er zu sagen versuchte."
"","","0","1","0","EID_1500_a0001_00030_YONAH010_X","","","","","-1","-1","1002","0","5","Ganz schön knifflig. Ich wollte Verstecken spielen, aber stattdessen mussten wir dieses blöde Spiel spielen."
"","","0","1","0","EID_1500_a0001_00031_NIER010_X","","","","","-1","1002","-1","0","2","Und was <FONT=ITALIC>hat</FONT> er gesagt?"
"1331","","0","1","0","EID_1500_a0001_00032_YONAH010_X","","","","","-1","-1","1002","0","5","Ich weiß es nicht. Das Einzige, was ich verstanden habe, war ""Traum"" und ""Märchenwald""."
"","","0","1","0","EID_1500_a0001_00033_YONAH010_X","","","","","-1","-1","1002","0","5","Aber keine Sorge. Ich werde fleißig lernen, damit ich nächstes Mal alles herausfinden kann."
"","","0","1","0","EID_1500_a0001_00034_YONAH010_X","","","","","-1","-1","1002","0","5","Wir sollten auch mal irgendwann ein Spiel spielen!"
"","","0","1","0","EID_1500_a0001_00035_NIER010_X","","","","<CB=EID_1500_a0005_060_End>","-1","1002","-1","0","2","Klar, Yonah."
"1332","","0","1","0","EID_1500_a0001_00034_YONAH010_X","","","","","0","-1","1002","0","5","Wir sollten auch mal irgendwann ein Spiel spielen!"
"1333","","0","1","0","EID_1500_a0001_00036_NIER010_X","","","","","-1","0","0","0","2","..."
"","","0","1","0","EID_1500_a0001_00037_BOOKW010_X","","","","","-1","0","0","0","26","Irgendwas beschäftigt dich doch, Junge. Raus damit!"
"","","0","1","0","EID_1500_a0001_00038_NIER010_X","","","","","-1","0","-1","0","2","Es ist nichts. Mach dir keine Sorgen."
"","","0","1","0","EID_1500_a0001_00039_NIER010_X","","","","","-1","0","-1","0","2","Komm schon. Ich muss Popola etwas fragen."
"1334","","0","2","0","RID_POPOL_00070","","","","","-1","0","0","0","24","Hmmm ..."
"","","0","1","0","EID_1500_a0005_0020_X","","","","","0","1004","-1","0","2","Was gibt's, Popola?"
"","","0","1","0","EID_1500_a0005_0030_X","","","","<CB=EID_1500_a0005_080_Start>","0","-1","1004","0","24","Oh, hi, <NIER>. Ich hatte gerade einen merkwürdigen Brief in der Post."
"1335","","0","1","0","EID_1500_a0005_0040_X","","","","","0","1004","1025","0","26","Das ist jedenfalls ein ziemlich bizarres Schreiben."
"","","0","1","0","EID_1500_a0005_0050_X","","","","","0","1004","-1","0","2","Von wem ist er?"
"","","0","1","0","EID_1500_a0005_0060_X","","","","","0","-1","1004","0","24","Vom Bürgermeister eines Dorfes im Märchenwald. Der liegt im Norden."
"","","0","1","0","EID_1500_a0005_0065_X","","","","","0","1004","-1","0","2","Der Märchenwald?!"
"","","0","1","0","EID_1500_a0005_0070_X","","","","","0","-1","1004","0","24","Die Leute dort sind in der Regel fröhlich und aufgeweckt. So etwas passt gar nicht zu ihnen."
"","","0","1","0","EID_1500_a0005_0071_X","","","","","0","-1","1004","0","24","Ich habe ein ungutes Gefühl bei der Sache."
"","","0","1","0","EID_1500_a0005_0072_X","","","","","0","1004","-1","0","2","Ich werde mir das mal ansehen."
"","","0","1","0","EID_1500_a0005_0073_X","","","","","0","-1","1004","0","24","Äh, das wirst du? Aber ..."
"","","0","1","0","EID_1500_a0005_0074_X","","","","","0","1004","-1","0","2","Mach dir darum keine Sorgen. Ich habe dort sowieso etwas zu erledigen."
"","","0","1","0","EID_1500_a0005_0075_X","","","","<CB=EID_1500_a0005_080_End>","0","-1","1004","0","24","Oh. Na ja, alles klar. Danke schön."
"1336","","0","1","0","RID_POPOL_00080","","","","","0","-1","1004","0","24","Der Märchenwald liegt im Norden, hinter der kleinen Holzbrücke bei den Nordfeldern."
"1337","1338","0","2","0","EXID_MMD_POPOL_00010","","","","","0","-1","1004","0","24","Der Todestraum ist solch eine seltsame Krankheit. Ich bin so froh, dass ihr diese Leute gerettet habt."
"","","0","1","0","EXID_MMD_NIER010_00010","","","","","0","1004","-1","0","2","Tja, das war schon was, da hast du recht."
"","","0","1","0","EXID_MMD_BOOKW_00010","","","","","0","1004","1025","0","26","Selbst ich möchte diesen Ort nicht wieder aufsuchen, und das trotz meiner Vorliebe für Wörter."
"","","0","1","0","EXID_MMD_POPOL_00020","","","","","0","-1","1004","0","24","Ihr habt gute Arbeit geleistet."
"1338","","0","1","0","EXID_MMD_POPOL_00030","","","","","0","-1","1004","0","24","Du bist in letzter Zeit ziemlich viel unterwegs. Bist du sicher, dass du dir nicht zu viel zumutest?"
"","","0","1","0","EXID_MMD_NIER010_00020","","","","","0","1004","-1","0","2","Mir geht es gut. Schließlich kann ich nicht den ganzen Tag nur herumsitzen, wenn Yonah so krank ist."
"","","0","1","0","EXID_MMD_POPOL_00040","","","","","0","-1","1004","0","24","Tja, wenn du meinst ..."
"","","0","1","0","EXID_MMD_NIER010_00030","","","","","0","1004","-1","0","2","Also dann! Kann ich etwas für dich tun?"
"","","0","1","0","EXID_MMD_POPOL_00050","","","","","0","-1","1004","0","24","Tja, ich denke, es <FONT=ITALIC>gibt</FONT> eine Sache, bei der ich Hilfe bräuchte.<LF>Hast du von unseren Plänen gehört, den Kanal zu reparieren?"
"","","0","1","0","EXID_MMD_POPOL_00060","","","","","0","-1","1004","0","24","Die Arbeit wird vermutlich in nächster Zeit nicht vorangehen, aber sobald sie erledigt ist,<LF>können wir den Kanal für Handel, Reisen und mehr nutzen. Das sollte ganz nützlich sein."
"","","0","1","0","EXID_MMD_POPOL_00070","","","","","0","-1","1004","0","24","Leider hinken wir derzeit dem Zeitplan etwas hinterher."
"","","0","1","0","EXID_MMD_POPOL_00080","","","","","0","-1","1004","0","24","Wenn du bereit wärst, dabei zu helfen, würde ich mich sehr freuen."
"","","0","1","0","EXID_MMD_NIER010_00040","","","","","0","1004","-1","0","2","Kein Problem. Was muss denn gemacht werden?"
"","","0","1","0","EXID_MMD_POPOL_00090","","","","","0","-1","1004","0","24","Danke schön."
"","","0","1","0","EXID_MMD_POPOL_00100","","","","","0","-1","1004","0","24","Also, der Mann, den ich ursprünglich für dieses Projekt um Hilfe gebeten hatte,<LF>ist seit Tagen nicht zur Arbeit erschienen."
"","","0","1","0","EXID_MMD_POPOL_00110","","","","","0","-1","1004","0","24","So langsam mache ich mir Sorgen. Könntest du vielleicht nach Meeresfront gehen und nach ihm sehen?"
"","","0","1","0","EXID_MMD_POPOL_00120","","","","","0","-1","1004","0","24","Die Lage seines Hauses markiere ich auf deiner Karte."
"","","0","1","0","EXID_MMD_POPOL_00130","","","","","0","-1","1004","0","24","Er trägt immer eine rote Tasche über seiner Schulter, daher sollte er leicht zu finden sein."
"","","0","1","0","EXID_MMD_NIER010_00050","","","","<CB=EID_9300_a0010g_0010_End>","0","1004","-1","0","2","Alles klar!"
"1339","1340","0","1","0","EID_4500_a0400_0041_X_ex","","","","<CB=Motion_Turn_to_Nier>","0","-1","1004","0","24","Warte, <NIER>!"
"1340","","0","1","0","EID_4500_a0400_0042_X","","","","","0","1004","-1","0","2","Hä?"
"","","0","1","0","EID_4500_a0400_0043_X_ex","","","","","0","-1","1004","0","24","Fast hätte ich es vergessen: Yonah sucht dich."
"","","0","1","0","EID_4500_a0400_0044_X","","","","","0","1004","-1","0","2","Ach?"
"","","0","1","0","EID_4500_a0400_0045_X_ex","","","","","0","-1","1004","0","24","Sie meinte, sie bräuchte etwas von dir. Ist an der Zeit, mal wieder ein wenig den großen Bruder zu spielen, hm?"
"","","0","1","0","EID_4500_a0400_0046_X","","","","<CB=EID_1500_a0200_End>","0","1004","-1","0","2","Scheint so. Danke, Popola."
"1341","","0","1","0","RID_POPOL_00090_ex","","","","","0","-1","1004","0","24","Ihr habt gute Arbeit geleistet."
"1342","","0","2","0","EID_1100_a0005g_035_010","","","","","0","-1","1004","0","24",""
"","","0","1","0","EID_1100_a0005g_035_020","","","","<CB=EID_1100_a0005g_010_Start>","0","1004","-1","0","2","no text"
"1343","","0","1","0","RID_POPOL_00100_ex","","","","","0","-1","1004","0","24","Sie sagte nicht, worum es geht, sah aber recht besorgt aus."
"1344","1345","0","2","0","RID_YONAH_00110","","","","","0","-1","1002","0","5","Hurra! Du bist wieder da!"
"","","0","1","0","EID_1100_a0005g_00002_NIER010_X","","","","","0","1002","-1","0","2","Popola meinte, du brauchst etwas?"
"","","0","1","0","EID_1100_a0005g_00003_YONAH010_X","","","","","0","-1","1002","0","5","Ja. Du musst mir einen Gefallen tun."
"","","0","1","0","EID_1100_a0005g_00004_NIER010_X","","","","","0","1002","-1","0","2","Was denn?"
"","","0","1","0","EID_1100_a0005g_00005_YONAH010_X","","","","","0","-1","1002","0","5","Ähm ..."
"","","0","1","0","EID_1100_a0005g_00006_NIER010_X","","","","","0","1002","-1","0","2","Ich kann dir nicht helfen, wenn du es mir nicht sagst, Schwesterchen."
"","","0","1","0","EID_1100_a0005g_00007_YONAH010_X","","","","","0","-1","1002","0","5","Na gut, ich werde es dir sagen. Bereit?"
"","","0","1","0","EID_1100_a0005g_00008_NIER010_X","","","","","0","1002","-1","0","2","Absolut."
"","","0","1","0","EID_1100_a0005g_00009_YONAH010_X","","","","","0","-1","1002","0","5","Du musst meinem Freund helfen!"
"","","0","1","0","EID_1100_a0005g_00010_NIER010_X","","","","","0","1002","-1","0","2","Deinem ... Freund?"
"","","0","1","0","EID_1100_a0005g_00011_YONAH010_X","","","","","0","-1","1002","0","5","Ja! Ich habe einen Freund und wir schreiben uns immer Briefe."
"","","0","1","0","EID_1100_a0005g_00012_NIER010_X","","","","","0","1002","-1","0","2","Im Ernst?"
"","","0","1","0","EID_1100_a0005g_00013_BOOKW010_X","","","","","0","1002","1025","0","26","Ein Brieffreund! Wie reizend!"
"","","0","1","0","EID_1100_a0005g_00014_NIER010_X","","","","","0","1002","-1","0","2","Und wer ist dieser Freund?"
"","","0","1","0","EID_1100_a0005g_00015_YONAH010_X","","","","","0","-1","1002","0","5","Ähm, na ja, er ist irgendwie ─"
"","","0","1","0","EID_1100_a0005g_00016_NIER010_X","","","","","0","1002","-1","0","2","Es ist ein Junge?"
"1345","","0","1","1","EID_1100_a0005g_00017_YONAH010_X","","","","","0","-1","1002","0","5","Ja, und er ist krank und steckt mächtig in Schwierigkeiten!"
"","","0","1","0","EID_1100_a0005g_00018_YONAH010_X","","","","","0","-1","1002","0","5","Und ich weiß, dass du und Weissi die Einzigen seid, die ihm helfen können!"
"","","0","1","0","EID_1100_a0005g_00019_BOOKW010_X","","","","","0","1002","1025","0","26","Weissi ..."
"","","0","1","0","EID_1100_a0005g_00020_NIER010_X","","","","","0","1002","-1","0","2","Erzähl mir von diesem Typen."
"","","0","1","0","EID_1100_a0005g_00021_YONAH010_X","","","","","0","-1","1002","0","5","Er lebt in einem großen Haus im Süden, ist total nett, und er ist mein Freund."
"","","0","1","0","EID_1100_a0005g_00022_YONAH010_X","","","","","0","-1","1002","0","5","Du musst ihm also helfen. Bitte?"
"","","0","1","0","EID_1100_a0005g_00023_NIER010_X","","","","","0","1002","-1","0","2","Yonah, hör zu ..."
"","","0","1","0","EID_1100_a0005g_00024_YONAH010_X","","","","","0","-1","1002","0","5","Biiiiitte?!"
"","","0","1","0","EID_1100_a0005g_00025_NIER010_X","","","","<CB=EID_1100_a0005g_Selsect>","0","1002","-1","0","2","Na toll. Was mache ich jetzt?"
"1346","","0","1","1","EID_1100_a0005g_00026_SYS_X<LF>EID_1100_a0005g_00027_SYS_X","","","","","-1","0","0","0","","<LIST=2769>Ich kann es ihr nicht abschlagen.</LIST><LF><LIST=2770>Ihre Runenpest zu heilen, ist wichtiger.</LIST>"
"1347","","0","1","0","EID_1100_a0005g_00028_NIER010_X","","","","","0","1002","-1","0","2","Also gut. Ich werde sehen, was ich tun kann."
"","","0","1","0","EID_1100_a0005g_00029_YONAH010_X","","","","<CB=EID_1100_a0005g_010_Start>","0","-1","1002","0","5","Juhu! Danke schön!"
"1348","1349","3","1","1","EID_1100_a0005g_00030_NIER010_X","","","","","0","1002","-1","0","2","Yonah, im Moment ist deine Krankheit wichtiger ..."
"1349","","0","1","0","EID_1100_a0005g_00031_YONAH010_X","","","","","0","-1","1002","0","5","Bitte! Nur das eine Mal!"
"","","0","1","0","EID_1100_a0005g_00032_NIER010_X","","","","<CB=EID_1100_a0005g_Selsect>","0","1002","-1","0","2","Äh ..."
"1350","","0","1","0","RID_YONAH_00120","","","","","0","-1","1002","0","5","Bitte hilf ihm!"
"1351","","0","1","0","EID_1100_a0005g_00034_NIER010_X","","","","","-1","0","-1","0","2","Na toll. Yonah hat einen Freund ..."
"","","0","1","0","EID_1100_a0005g_00035_BOOKW010_X","","","","","-1","0","0","0","26","Stimmt irgendwas nicht, Junge? Deine Stimme zittert ja."
"","","0","1","0","EID_1100_a0005g_00036_NIER010_X","","","","","-1","0","-1","0","2","N-Nein, alles gut! Halt die Klappe!"
"1352","1353","0","2","0","EID_1100_a0020_0010_BUTLER_X","","","<CB=EID_1100_a0020_01_Start>","","-1","0","1028","0","34","Wir haben Euch erwartet, Herrschaften."
"1353","","0","1","0","EID_1100_a0020_0020_BUTLER_X","","","","<CB=EID_1100_a0020_01_End>","-1","0","1028","0","34","Bitte, hier entlang."
"1354","","0","1","0","EID_1100_a0030_0010_BUTLER_X","","","","","-1","0","1028","0","34","Bitte wartet hier."
"1355","","0","1","0","EID_1100_a0030_0020_KAINE010_X","","","","","-1","0","0","0","28","Warten ist öde. Sagt mir Bescheid, wenn irgendwelche Schatten auftauchen, ja?"
"1356","","0","1","0","EID_1100_a0030_0025_NIER010_X_1","","","","","-1","0","0","0","2","..."
"","","0","1","0","EID_1100_a0035g_0010_NIER010_X_1","","","","","-1","0","0","0","2","Kainé ist schon eine Erscheinung, hm?"
"","","0","1","0","EID_1100_a0035g_0020_BOOKW010_X","","","","","-1","0","0","0","26","Ihre Nerven müssen aus purem Stahl sein."
"1357","","0","1","0","EID_1100_a0035g_0030_BOOKW010_X","","","","","-1","0","0","0","26","V-Vielleicht sollten wir umkehren, hm?"
"","","0","1","0","EID_1100_a0035g_0040_NIER010_X","","","","","-1","0","0","0","2","Hmm ..."
"1358","","0","1","0","EID_1100_a0035g_0050_NIER010_X","","","","","-1","0","0","0","2","Verschlossen."
"1359","","0","1","0","EID_1100_a0040_0010_NIER010_X","","","","","-1","0","0","0","2","Hey, wo ist Kainé hin?"
"","","0","1","0","EID_1100_a0040_0020_BOOKW010_X","","","","","-1","0","0","0","26","Ich wusste, das war eine schreckliche Idee! Verfluchte Anwesen und dergleichen ... Ach, warum hört denn nie jemand auf mich?!"
"1360","","0","1","0","EID_1100_a0030_0031_NIER010_X","","","","","-1","0","0","0","2","Hm. Das Gesicht wirkt schmerzverzerrt. Irgendwie unheimlich."
"","","0","1","0","EID_1100_a0030_0032_BOOKW010_X","","","","","-1","0","0","0","26","J-J-Ja ... Na los! Mut fassen, weitergehen, hm?"
"1361","","0","1","0","EID_1100_a0030_0032_BOOKW010_X2","","","","","-1","0","0","0","26","J-J-Ja ... Na los! Mut fassen, weitergehen, hm?"
"1362","1363","0","1","0","EID_1100_a0060_0010_NIER010_X","","","","","0","1001","-1","0","2","Das hast du aus meinen Schritten gehört?"
"","","0","1","0","EID_1100_a0060_0020_SNOW010_X","","","","","0","-1","1001","0","25","Das geht, wenn man erst mal weiß, wie es funktioniert."
"","","0","1","0","EID_1100_a0060_0030_NIER010_X","","","","","0","1001","-1","0","2","Dann sollte ich dir wohl mal von meinem Freund Weiss erzählen."
"","","0","1","0","EID_1100_a0060_0040_SNOW010_X","","","","","0","-1","1001","0","25","Ich ... Ich habe nur die Schritte einer Person gehört ..."
"","","0","1","0","EID_1100_a0060_0050_BOOKW010_X","","","","","-1","0","0","0","26","Grimoire Weiss stapft nicht durch die Gegend wie ein gewöhnliches Landsäugetier!"
"","","0","1","0","EID_1100_a0060_0060_SNOW010_X","","","","","0","-1","1001","0","25","Waah!"
"","","0","1","0","EID_1100_a0060_0070_BOOKW010_X","","","","","-1","0","0","0","26","Aber genug des netten Geplauders. Lass uns deine Geschichte hören."
"","","0","1","0","EID_1100_a0060_0080_SNOW010_X","","","","","0","-1","1001","0","35","Ich heiße Emil. Ich bin der Herr dieses Hauses."
"","","0","1","0","EID_1100_a0060_0090_NIER010_X","","","","","0","1001","-1","0","2","Dann bist du also derjenige, der die Briefe geschickt hat?"
"1363","","0","1","0","EID_1100_a0060_0100_SNOW010_X","","","","","0","-1","1001","0","35","Briefe? Wovon redest du da?"
"","","0","1","0","EID_1100_a0060_0110_BOOKW010_X","","","","","-1","0","0","0","26","Natürlich weißt du nichts davon. Das wäre ja auch viel zu einfach."
"1364","1365","0","2","0","EID_1100_a0062g_0010_SNOW010_X","","","","","-1","0","0","0","35","Nein! Bleibt, wo ihr seid!"
"1365","","0","1","0","EID_1100_a0064_0010_NIER010_X","","","","","-1","0","0","0","2","Hä?"
"","","0","1","0","EID_1100_a0064_0020_SNOW010_X","","","","","-1","0","0","0","35","Tut mir leid. Es liegt an meinen Augen. Alles, was ich ansehe, erstarrt zu Stein."
"","","0","1","0","EID_1100_a0064_0030_SNOW010_X","","","","","0","-1","1001","0","35","Darum trage ich diese Augenbinde."
"","","0","1","0","EID_1100_a0064_0040_BOOKW010_X","","","","","0","1001","0","0","26","Was für eine bemerkenswerte Fähigkeit! Von so etwas habe ich noch nie zuvor gehört."
"","","0","1","0","EID_1100_a0064_0050_SNOW010_X","","","","","0","-1","1001","0","35","Wie auch immer, ich nehme an, mein Butler weiß vielleicht mehr über die Briefe, die ihr erhalten habt."
"","","0","1","0","EID_1100_a0064_0060_SNOW010_X","","","","","0","-1","1001","0","35","Dieser Schlüssel hier passt in sämtliche Türen des Anwesens, falls ihr also meine Hilfe benötigt ..."
"","","0","1","0","EID_1100_a0064_0070_NIER010_X","","","","","0","1001","-1","0","2","Nein, bitte mach dir keine Umstände. Wir finden uns alleine zurecht."
"","","0","1","0","EID_1100_a0064_0080_SNOW010_X","","","","","0","-1","1001","0","35","Oh! Gut ... Klar. Nun ja, hier ist der Schlüssel."
"","","0","1","0","EID_1100_a0064_0090_SNOW010_X","","","","","0","-1","1001","0","35","Die Kammer des Butlers ist am anderen Ende des Anwesens."
"","","0","1","0","EID_1100_a0064_0091_SNOW010_X","","","","<CB=EID_1100_a0064_01_End>","0","-1","1001","0","35","Lasst mich euch wenigstens eine Karte geben. Das Anwesen ist sehr groß, und ich möchte nicht, dass ihr euch verlauft."
"1366","","0","1","0","EID_1100_a0064_0092_NIER010_X","","","","","-1","0","0","0","2","Unser Gespräch mit ihm ist noch nicht beendet."
"1367","","0","1","0","EID_1100_a0064_0090_SNOW010_X","","","","","-1","0","0","0","35","Die Kammer des Butlers ist am anderen Ende des Anwesens."
"1368","","0","1","0","EID_1100_a0067g_0031_NIER010_X","","","","","-1","0","0","0","2","Was ist das?"
"","","0","1","0","EID_1100_a0067g_0032_BOOKW010_X","","","","","-1","0","0","0","26","Ein Butler ... Oder zumindest etwas bemerkenswert Ähnliches."
"","","0","1","0","EID_1100_a0067g_0040_BOOKW010_X","","","","","-1","0","0","0","26","Ich WUSSTE, das ist eine Falle! Verflucht sei meine brillante Intuition ..."
"1369","","0","2","0","EID_1100_a0070_0010_NIER010_X","","","","","-1","0","0","0","2","Huah."
"","","0","1","0","EID_1100_a0070_0020_BOOKW010_X","","","","","-1","0","0","0","26","Ist das ... noch einer?"
"","","0","1","0","EID_1100_a0070_0030_BUTLER_X","","","","","-1","0","0","0","34","..."
"1370","","0","1","0","EID_1100_a0070_0040_NIER010_X","","","","","-1","0","0","0","2","Aaaah!"
"","","0","1","0","EID_1100_a0070_0050_BOOKW010_X","","","","","-1","0","0","0","26","Aaaaahhh!"
