"1360","1356","0","1","0","EID_6000_a0015g_0240_BOOKW010_X","","","","","-1","0","0","0","26","Rispondo: sono nella terra promessa, traboccanti di luce."
"1361","","0","1","0","EID_6000_a0015g_0250_BOOKW010_X","","","","","-1","0","0","0","26","Accidenti! Credo di aver sbagliato."
"1362","","0","1","0","EID_6000_a0015g_0050_BIRD_X","","","","","-1","0","0","0","66","A chi parla la vera voce?"
"","","0","1","0","EID_6000_a0015g_0060_BIRD_X","","","","","-1","0","0","0","66","A chi si mostra la vera forma?"
"","","0","1","0","EID_6000_a0015g_0090_BIRD_X","","","","","-1","0","0","0","66","Chiedo..."
"","","0","1","0","EID_6000_a0015g_0100_BIRD_X","","","","","-1","0","0","0","66","Perché gli esseri umani scompaiono da questo mondo?"
"","","0","1","0","EID_6000_a0015g_0070_BIRD_X","","","","","-1","0","0","0","66","Rispondete."
"1363","","0","1","0","EID_6000_a0020_0010_BOOKW010_X","","","","","-1","0","0","0","26","Uh? Sono le gemelle del tuo villaggio."
"","","0","1","0","EID_6000_a0020_0020_NIER020_X","","","","","1","0","-1","0","2","Popola? Devola? Che cosa ci fate qui?"
"","","0","1","0","EID_6000_a0020_0031_DEBOL010_X","","","","","0","-1","1345","0","23","Ehi. Non sarebbe meglio se tornassi al villaggio?"
"","","0","1","0","EID_6000_a0020_0040_POPOL010_X","","","","","0","-1","1346","0","24","Questo è un luogo estremamente pericoloso."
"","","0","1","0","EID_6000_a0020_0051_DEBOL010_X","","","","","1","-1","1345","0","23","Anche se trovassi Yonah, probabilmente non riusciresti a portarla via."
"","","0","1","0","EID_6000_a0020_0060_BOOKW010_X","","","","","-1","0","0","0","26","Come siete arrivate qui?"
"","","0","1","0","EID_6000_a0020_0071_POPOL010_X","","","","","1","-1","1346","0","24","Shhh... Siamo noi a fare le domande."
"1364","","2","1","0","","","","","<CB=EID_6000_a0020_Select01>","-1","0","0","0","",""
"1365","","2","1","0","","","","","<CB=EID_6000_a0020_Select02>","-1","0","0","0","",""
"1366","","2","1","0","","","","","<CB=EID_6000_a0020_Select03>","-1","0","0","0","",""
"1367","","2","1","0","","","","","<CB=EID_6000_a0030_Select01>","-1","0","0","0","",""
"1368","","2","1","0","","","","","<CB=EID_6000_a0030_Select02>","-1","0","0","0","",""
"1369","","0","1","0","EID_6000_a0020_007049_SYS_X","","","","","-1","0","0","0","","<LIST=1365>Siamo qui per salvare Yonah!</LIST><LF><LIST=1366>Che ci fate qui?</LIST><LF><LIST=1364>Hanno ragione. Torniamo al villaggio.</LIST>"
"1370","","0","1","0","EXID_ADD_NIER020_00050","","","","","-1","0","0","0","2","Hanno ragione. Torniamo al villaggio."
"","","0","1","0","EID_6000_a0020_0080_BOOKW010_X","","","","","-1","0","0","0","26","Vuoi davvero tornare indietro?"
"1371","","0","1","0","EID_4230_a0095g_00095_SYS_X","","","","","-1","0","0","0","","<LIST=1367>Sì</LIST><LF><LIST=1368>No</LIST>"
"1372","","0","1","0","EXID_ADD_NIER020_00060","","","","","-1","0","0","0","2","... Ok. Torniamo indietro."
"1373","","0","1","0","EXID_ADD_NIER020_00070","","","","","-1","0","0","0","2","No! Siamo a un passo da Yonah!"
"1374","","0","1","0","EXID_ADD_NIER020_00030","","","","","0","1345","-1","0","2","Siamo qui per salvare Yonah!"
"","","0","1","0","EID_6000_a0020_0091_DEBOL010_X","","","","","0","-1","1345","0","23","Niente da fare? Allora non abbiamo scelta."
"","","0","1","0","EID_6000_a0020_0101_POPOL010_X","","","","<CB=EID_6000_a0020_02_Start>","0","-1","1346","0","24","Credo di no. Che peccato."
"1375","","2","1","0","","","","","<CB=EID_6000_a0020_01_End>","-1","0","0","0","",""
"1376","","2","1","0","","","","","<CB=RETURN_VILLAGE>","-1","0","0","0","",""
"1377","","0","1","0","EXID_ADD_NIER020_00040","","","","","0","1346","-1","0","2","Che ci fate qui?"
"","","0","1","0","EXID_ADD_POPOL_00010","","","","<CB=EID_6000_a0020_Select03_01>","0","-1","1346","0","24","Non te lo dico. Fai due più due."
"1378","1379","0","1","0","EID_6000_a0112_0010_NIER020_X","","","","","0","0","-1","0","2","Devola! Popola!"
"1379","","0","1","0","EID_6000_a0112_0020_DEBOL010_X","","","","","0","-1","1345","0","23","Oh, ce l'avete fatta!"
"","","0","1","0","EID_6000_a0112_0031_POPOL010_X","","","","","0","-1","1346","0","24","Ci avete fatto aspettare tanto."
"","","0","1","0","EID_6000_a0112_0040_NIER020_X","","","<CB=snow_Nier_No>","","-1","0","0","0","2","Perché lo state facendo?!"
"","","0","1","0","EID_6000_a0112_0050_DEBOL010_X","","","","","0","-1","1345","0","23","È iniziato tutto milletrecento anni fa."
"","","0","1","0","EID_6000_a0112_0060_POPOL010_X","","","","","0","-1","1346","0","24","L'umanità, sull'orlo dell'estinzione, sviluppò un ultimo e disperato piano di salvezza: il Progetto Gestalt."
"","","0","1","0","EID_6000_a0112_0070_BOOKW010_X","","","","","-1","0","0","0","26","Ges...talt...?"
"","","0","1","0","EID_6000_a0112_0080_POPOL010_X","","","","","0","-1","1346","0","24","Non ricordi ancora, Grimoire Weiss?"
"","","0","1","0","EID_6000_a0112_0090_DEBOL010_X","","","","<CB=EID_6000_a0112_01_Next>","0","-1","1345","0","23","Allora è tempo di rinfrescarti la memoria."
"1380","1381","0","1","0","EID_6000_a0112_0100_BOOKW010_X","","","","","-1","0","0","0","26","Ngh..."
"","","0","1","0","EID_6000_a0112_0110_NIER020_X","","","<CB=snow_Look_White>","","-1","0","0","0","2","Weiss!"
"","","0","1","0","EID_6000_a0112_0120_BOOKW010_X","","","","","-1","0","0","0","26","Aaah... La mia... mente..."
"1381","1382","0","1","0","EID_6000_a0112_0130_BOOKW010_X","","","<CB=snow_White_Stop>","","-1","0","0","0","26","Ora... ricordo..."
"","","0","1","0","EID_6000_a0112_0140_BOOKW010_X","","","","","-1","0","0","0","26","Devola... Popola... Voi non siete umane. Siete... Oh, no..."
"","","0","1","0","EID_6000_a0112_0150_DEBOL010_X","","","<CB=snow_Look_White_End>","","0","-1","1345","0","23","Già, a volte la verità fa male.<LF>Vuoi aiutarlo a elaborare gli eventi, sorella?"
"","","0","1","0","EID_6000_a0112_0160_POPOL010_X","","","","","0","-1","1346","0","24","Noi tutti in questa stanza in realtà siamo solo involucri creati dai veri esseri umani."
"","","0","1","0","EID_6000_a0112_0170_NIER020_X","","","","","0","0","-1","0","2","Che cosa intendi?"
"","","0","1","0","EID_6000_a0112_0180_DEBOL010_X","","","","","0","-1","1345","0","23","Non hai <FONT=ITALIC>ancora</FONT> capito? Non sei umano!"
"","","0","1","0","EID_6000_a0112_0190_SNOW020_X","","","","","0","0","-3","0","35","Quindi gli esseri umani, quelli veri intendo, si sono estinti?"
"1382","","0","1","0","EID_6000_a0112_0200_BOOKW010_X","","","","","-1","0","0","0","26","No, continuano a esistere. Voi li chiamate Ombre."
"","","0","1","0","EID_6000_a0112_0210_BOOKW010_X","","","","","-1","0","0","0","26","Ogni Ombra è il residuo corrotto di quello che prima era un essere umano."
"","","0","1","0","EID_6000_a0112_0220_DEBOL010_X","","","","","0","-1","1345","0","23","Incredibile, vero? Ora risparmiateci le vostre indecorose facce da pesci lessi e mettiamoci subito al lavoro."
"","","0","1","0","EID_6000_a0112_0230_NIER020_X","","","","","-1","0","0","0","2","No... Aspettate!"
"","","0","1","0","EID_6000_a0112_0241_DEBOL010_X","","","","","0","-1","1345","0","23","Mi spiace tanto, ma abbiamo bisogno del tuo involucro.<LF>Il suo legittimo proprietario lo sta aspettando da molto tempo."
"","","0","1","0","EID_6000_a0112_0250_POPOL010_X","","","","","0","-1","1346","0","24","Non arrabbiarti con noi. Stiamo solo facendo il nostro dovere."
"","","0","1","0","EID_6000_a0112_0260_DEBOL010_X","","","","<CB=EID_6000_a0112_01_End>","0","-1","1345","0","23","Secondo il volere dei veri umani, lo scopo delle nostre interminabili esistenze è quello di controllare la vita degli altri."
"1383","","0","1","0","EID_7000_a0010_0010_NIER020_X","","","<CB=LIB_SetProhibitionTalkMotion,1>","","-1","0","-1","0","2","Yonah sta bene?"
"1384","1385","0","1","0","EID_7000_a0010_0020_NIER020_X","","","","","-1","0","-1","0","2","Oh, no..."
"1385","","0","1","0","EID_7000_a0010_0030_BOOKW010_X","","","","<CB=EID_7000_a0010_02_02>","-1","0","0","0","26","Oh, smettila! La ragazzina sta bene."
"1386","1387","0","1","0","EID_7000_a0010_0040_NIER020_X","","","","","-1","0","-1","0","2","Weiss?!"
"1387","1388","0","1","0","EID_7000_a0010_0050_NIER020_X","","","","","-1","0","-1","0","2","Dove sei? Stai bene?"
"","","0","1","0","EID_7000_a0010_0060_BOOKW010_X","","","","","-1","0","0","0","26","Considerando che ho perso la mia forma fisica, non me la passo male."
"","","0","1","0","EID_7000_a0010_0070_BOOKW010_X","","","","","-1","0","0","0","26","La mia voce sarà la prossima a scomparire, quindi ascoltami bene!"
"","","0","1","0","EID_7000_a0010_0080_BOOKW010_X","","","","","-1","0","0","0","26","Tua sorella sta bene."
"","","0","1","0","EID_7000_a0010_0090_BOOKW010_X","","","","<CB=EID_7000_a0010_02_03>","-1","0","0","0","26","Non piangerla e non perdere la speranza. Devi chiamarla a te."
"1388","","0","1","0","EID_7000_a0010_0100_NIER020_X","","","","","-1","0","-1","0","2","Come?"
"","","0","1","0","EID_7000_a0010_0110_BOOKW010_X","","","","","-1","0","0","0","26","Attraverso i ricordi dei momenti passati insieme a lei."
"","","0","1","0","EID_7000_a0010_0120_BOOKW010_X","","","","","-1","0","0","0","26","Dimostrale che siete ancora vivi e che le vostre vite significano qualcosa."
"","","0","1","0","EID_7000_a0010_0130_NIER020_X","","","","","-1","0","-1","0","2","Io... Io non so..."
"","","0","1","0","EID_7000_a0010_0140_BOOKW010_X","","","","<CB=EID_7000_a0010_02_04><LF><CB=LIB_SetProhibitionTalkMotion,0>","-1","0","0","0","26","Ovvio... Ma devi fidarti! So che puoi farcela."
"1389","1390","0","1","0","EID_9000_a0011g_0020_NIER020_X","","","","","-1","0","-1","0","2","Kainé? Qual è il problema?"
"","","0","1","0","EID_9000_a0011g_0030_KAINE010_X","","","","","-1","0","-2","0","28","Ascoltami."
"1390","","0","1","0","EID_9000_a0011g_0040_KAINE010_X","","","","","-1","0","-2","0","28","L'Ombra dentro di me sta crescendo e non posso fermarla."
"","","0","1","0","EID_9000_a0011g_0050_KAINE010_X","","","","","-1","0","-2","0","28","Presto... molto presto... impazzirò."
"","","0","1","0","EID_9000_a0011g_0060_TYRANN_X","","","","","-1","0","0","0","58","Non posso più soffocarla..."
"","","0","1","0","EID_9000_a0011g_0070_NIER020_X","","","","","-1","0","-1","0","2","Kainé, non arrenderti! Devi..."
"","","0","1","0","EID_9000_a0011g_0080_KAINE010_X_R","","","","","-1","0","-2","0","28","Sta' zitto e ascoltami!"
"1391","1392","0","1","0","EID_9000_a0030_0010_KAINE010_X","","","","","-1","0","0","0","28","Io... Io..."
"1392","","0","1","0","EID_9000_a0030_0020_TYRANN_X","","","<CB=BGM_EID_9000_a0030>","","-1","0","0","0","58","In realtà, ci sarebbe un modo per salvarla..."
"","","0","1","0","EID_9000_a0030_0030_NIER020_X","","","","","1","0","-1","0","2","Chi ha parlato?"
"","","0","1","0","EID_9000_a0030_0040_TYRANN_X","","","","","-1","0","0","0","58","Non importa, non fare domande. Zitto e ascolta!"
"","","0","1","0","EID_9000_a0030_0050_NIER020_X","","","","<CB=EID_9000_a0030_01_End>","1","0","-1","0","2","Aspetta, che cosa..."
"1393","","0","1","0","EID_9000_a0030_0060_TYRANN_X","","","","","-1","0","0","0","58",""
"","","0","1","0","EID_9000_a0030_0070_TYRANN_X","","","","","-1","0","0","0","58",""
"","","0","1","0","EID_9000_a0030_0080_TYRANN_X","","","","","-1","0","0","0","58",""
"","","0","1","0","EID_9000_a0030_0090_NIER020_X","","","","","1","0","-1","0","2",""
"","","0","1","0","EID_9000_a0030_0100_TYRANN_X","","","","","-1","0","0","0","58",""
"","","0","1","0","EID_9000_a0030_0110_TYRANN_X","","","","","-1","0","0","0","58",""
"","","0","1","0","EID_9000_a0030_0120_NIER020_X","","","","","1","0","-1","0","2",""
"","","0","1","0","EID_9000_a0030_0130_TYRANN_X","","","","","-1","0","0","0","58",""
"","","0","1","0","EID_9000_a0030_0140_NIER020_X","","","","","1","0","-1","0","2",""
"1394","","0","1","0","EID_9000_a0040_0120_SYS_X","","","","","-1","0","0","0","","Che cosa dovrei fare?<LF><LIST=1395>Uccidi Kainé e liberala da questo supplizio.</LIST><LF><LIST=1396>Sacrifica la tua esistenza per rendere Kainé di nuovo umana.</LIST>"
"1395","","2","1","0","","","","","<CB=Ending_BA>","-1","0","0","0","",""
"1396","","2","1","0","","","","","<CB=Ending_BB>","-1","0","0","0","",""
"1397","1398","1","1","0","NV_ID_0521","","","<CB=BGM_EID_3200_a0015_01>","","-1","0","0","0","","Il rumore della pioggia pervadeva il villaggio."
"","","1","1","0","NV_ID_0522","","","","","-1","0","0","0","","Era amplificato dalle ripide scogliere circostanti, che rendevano scrosciante come un nubifragio anche la più lieve pioggerella."
"","","1","1","0","NV_ID_0523","","","","","-1","0","0","0","","Dalle capanne si levavano volute di fumo mentre gli abitanti del villaggio attendevano la fine del temporale rintanati nelle loro case."
"","","1","1","0","NV_ID_0524","","","","","-1","0","0","0","","Solo una piccola figura ebbe il coraggio di sfidare il nubifragio e camminava lentamente verso la banderuola lignea a forma di falco che svettava al centro della città. "
"","","1","1","0","NV_ID_0525","","","","","-1","0","0","0","","Una volta raggiunta la banderuola, fissa in quel luogo da tempo immemorabile, si fermò a fissarla. <STOP>Il viso della giovane figura era al contempo delicato e fiero, come una tazzina sopravvissuta a un naufragio. Quei tratti, combinati con una pelle diafana, rendevano il suo viso quasi androgino. "
"","","1","1","0","NV_ID_0526","","","","","-1","0","0","0","","<FONT=ITALIC>Se il becco punta a est, torno a casa.</FONT> <STOP><FONT=ITALIC>Se rimane puntato a ovest, allora...</FONT>"
"","","1","1","0","NV_ID_0527","","","","","-1","0","0","0","","Esitò. I capelli grondavano di pioggia e l'acqua si riversava ai suoi piedi."
"1398","1399","1","1","0","NV_ID_0531","","","","","-1","0","0","0","","<FONT=ITALIC>Ti prego.</FONT> <STOP><FONT=ITALIC>Dai, ti prego!</FONT>"
"","","1","1","0","NV_ID_0533","","","","","-1","0","0","0","","Il ventò sferzò la banderuola che iniziò a muoversi. <STOP>Ruotando velocemente su se stessa, si arrestò con il becco puntato saldamente vesto est."
"","","1","1","0","NV_ID_0534","","","","","-1","0","0","0","","<FONT=ITALIC>Est?</FONT> <STOP><FONT=ITALIC>... Davvero?</FONT>"
"","","1","1","0","NV_ID_0535","","","","","-1","0","0","0","","Prima che la banderuola potesse girare ancora, una roccia aguzza sferzò l'aria roteando e colpì quella testolina fradicia. <STOP>Cadde a terra a causa della forza del colpo, mentre una pioggia di rocce iniziò a cadere tutt'intorno."
"","","1","1","0","NV_ID_0536","","","","","-1","0","0","0","","<FONT=ITALIC>Oh, no. Mi hanno trovata.</FONT>"
"1399","1400","1","1","0","NV_ID_0537","","","","","-1","0","0","0","","Un sorriso straziante le solcò il viso, mentre le pietre continuavano a cadere. <STOP>Un rumore di passi si aggiunse a quello della pioggia e una voce urlò: "
"","","1","1","0","NV_ID_0538","","","","","-1","0","0","0","","""Eeehi! Kaiiiné!"""
"","","1","1","0","NV_ID_0539","","","","","-1","0","0","0","","La voce apparteneva a Dimo, il bullo peggiore del Nido."
"","","1","1","0","NV_ID_0540","","","","","-1","0","0","0","","Mentre Kainé si alzava a fatica, un'ultima pietra schizzò nel fango colpendole il piede. <STOP>Il sangue colava da un taglio sopra l'occhio e la sua vista era annebbiata, ma riuscì a distinguere le sagome di Dimo e della sua banda di canaglie. <STOP>Per un attimo, il ragazzo sembrò sorpreso dall'indifferenza di Kainé verso le sue ferite, ma recuperò presto la spavalderia."
"","","1","1","0","NV_ID_0541","","","","","-1","0","0","0","","""Che cosa c'è, mostro? Ti piace la pioggia? Ti piace bagnarti fino al midollo, eh? O hai finalmente deciso di scappare di casa?""<PAGE>"
"","","1","1","0","NV_ID_0542","","","","","-1","0","0","0","","Pur sapendo che era un tentativo inutile, Kainé cercò di andarsene. <STOP>Ma prima che potesse muovere più di qualche passo, gli altri bambini la circondarono, con gli sguardi ardenti di crudeltà."
"","","1","1","0","NV_ID_0546","","","","","-1","0","0","0","","Kainé sapeva che anche i genitori dei bulli la fissavano dal caldo delle loro case. Ci era abituata, perché succedeva di continuo."
"","","1","1","0","NV_ID_0547","","","","","-1","0","0","0","","E se alcuni abitanti del villaggio facevano finta di non vedere le azioni dei propri figli,<LF>altri le incoraggiavano apertamente.<LF><STOP>In una società governata da superstizioni e paura, Kainé era una creatura da odiare ed eliminare."
"1400","1401","1","1","0","NV_ID_0548","","","","","-1","0","0","0","","""Ho forse detto che potevi andartene, mostro?"""
"","","1","1","0","NV_ID_0549","","","","","-1","0","0","0","","Ogni parola di Dimo era una pugnalata al cuore. <STOP><FONT=ITALIC>Non può ferirmi</FONT>, mentì a se stessa. <FONT=ITALIC>Sono forte. Sono coraggiosa. Non può ferirmi. Non può ferirmi. Non può...</FONT>"
"","","1","1","0","NV_ID_0550","","","","","-1","0","0","0","","""Guardate! Il mostriciattolo sta per scoppiare in lacrime! Cosa c'è? Sei triste perché tutti ti odiano e vogliono che tu muoia?"""
"","","1","1","0","NV_ID_0551","","","","","-1","0","0","0","","Kainé pregò che l'acqua la trascinasse via da un mondo in cui sembrava non esserci posto per lei."
"","","1","1","0","NV_ID_0552","","","","","-1","0","0","0","","Ma se gli dei erano in ascolto, decisero di ignorarla. Mentre Dimo si avvicinava, le nuvole iniziarono a diradarsi e la pioggia si fece più sottile."
"","","1","1","0","NV_ID_0553","","","","","-1","0","0","0","","<FONT=ITALIC>Anche il tempo mi odia. Sono inutile. Un fallimento.</FONT><LF><STOP><FONT=ITALIC>Vorrei che la roccia lanciata da Dimo mi avesse staccato la testa.</FONT>"
"","","1","1","0","NV_ID_0554","","","","","-1","0","0","0","","Kainé non riusciva a guardare Dimo negli occhi e fissò lo sguardo sul terreno fangoso ai suoi piedi. <STOP>Il bullo si avvicinò così tanto che lei riusciva a sentire l'olezzo di carne vecchia del suo alito. "
"1401","1402","1","1","0","NV_ID_0558","","","","","-1","0","0","0","","Il ragazzo afferrò il viso di Kainé con le sue dita grassocce, costringendola a guardarlo. La giovane cercò di divincolarsi, ma Dimo le conficcò un pollice nella palpebra, aprendogliela a forza."
"","","1","1","0","NV_ID_0559","","","","","-1","0","0","0","","""Fammi vedere."""
"","","1","1","0","NV_ID_0560","","","","","-1","0","0","0","","""... N-No."""
"","","1","1","0","NV_ID_0561","","","","","-1","0","0","0","","""Hai detto di no?"" <STOP>Dimo le sorrise malignamente. ""Non osare dirmi di no. <FONT=ITALIC>Nessuno</FONT> mi dice di no.""<STOP>E senza distogliere l'attenzione da Kainé, gridò alla sua banda: ""Diamo al mostro quello che si merita, ragazzi!"""
"1402","1403","1","1","0","NV_ID_0562","","","","","-1","0","0","0","","Appena Dimo finì di parlare, i suoi compagni si avventarono su Kainé con calci e pugni. "
"","","1","1","0","NV_ID_0563","","","","","-1","0","0","0","","Mentre Kainé si rannicchiava in posizione fetale per proteggersi dall'attacco, Dimo osservava la scena sorridendo."
"","","1","1","0","NV_ID_0564","","","","","-1","0","0","0","","""Non ti capisco, mostro. Perché ti comporti come una femminuccia, eh? Lo sanno tutti cosa sei!"""
"","","1","1","0","NV_ID_0565","","","","","-1","0","0","0","","Kainé lo ignorò, continuando a fissare la banderuola. Era sempre puntata verso est, come se fosse certa della decisione che aveva preso per lei."
"","","1","1","0","NV_ID_0566","","","","","-1","0","0","0","","<FONT=ITALIC>Andare a casa?</FONT> <STOP><FONT=ITALIC>Scelta curiosa per qualcuno senza genitori o una casa a cui tornare.</FONT>"
"","","1","1","0","NV_ID_0567","","","","","-1","0","0","0","","""Mostro"" urlavano i bambini. ""Mostro, mostro, mostro!"""
"1403","1404","1","1","0","NV_ID_0568","","","","","-1","0","0","0","","Kainé chiuse gli occhi ascoltando la pioggia e preparandosi al dolore. <STOP>E mentre il gruppo le era addosso, si concentrò sul rumore della pioggia affinché le riempisse la mente."
"1404","1405","1","1","0","NV_ID_0572","","","","","-1","0","0","0","","La pioggia cadeva..."
"","","1","1","0","NV_ID_0574","","","","","-1","0","0","0","","Ma il dolore non arrivò."
"","","1","1","0","NV_ID_0575","","","","","-1","0","0","0","","Solo quando le risate dei bulli si trasformarono in urla di terrore Kainé ebbe il coraggio di aprire un occhio pesto."
"","","1","1","0","NV_ID_0576","","","","","-1","0","0","0","","Kainé rimase sconvolta quando vide Dimo che urlava di dolore disteso nel fango, coprendosi con una mano il viso grondante di sangue. "
"","","1","1","0","NV_ID_0577","","","","","-1","0","0","0","","<FONT=ITALIC>Oddio, sta piangendo! Sta piangendo</FONT> per davvero!"
"","","1","1","0","NV_ID_0578","","","<CB=BGM_B_CENTER_LIBRARY_FO_T>","","-1","0","0","0","","Senza il loro capo, i bambini iniziarono a guardarsi, aspettando che qualcuno prendesse il comando. <STOP>Quando nessuno si fece avanti, incominciarono ad allontanarsi lentamente da Kainé. "
"","","1","1","0","NV_ID_0579","","","<CB=BGM_EID_3200_a0015_02>","","-1","0","0","0","","Ma la loro attenzione non era più sulla bambina, bensì sulla donna anziana in piedi a pochi passi dal gruppo. <STOP>Dopo aver preso fiato a fatica, la donna parlò con una voce carica di rabbia."
"1405","1406","1","1","0","NV_ID_0583","","","","","-1","0","0","0","","""Fa un male cane, vero? Vi suggerirei di sloggiare, prima che ne tiri un'altra. <STOP>E se uno di voi stronzetti tocca la mia Kainé un'altra volta, potete star certi che farò molto peggio che lanciare pietre!""<PAGE>"
"","","1","1","0","NV_ID_0584","","","","","-1","0","0","0","","L'anziana si chinò a toccare delicatamente la mano che copriva la faccia di Dimo. <STOP>Prima che il ragazzino potesse protestare, conficcò la mano nella ferita, premendo con forza. "
"","","1","1","0","NV_ID_0585","","","","","-1","0","0","0","","""Ahia!"" urlò il bullo, saltando in piedi. ""Smettila! Cosa stai facendo?"""
"","","1","1","0","NV_ID_0586","","","","","-1","0","0","0","","""Non piagnucolare! Nessuno è mai morto per un taglietto."""
"","","1","1","0","NV_ID_0587","","","","","-1","0","0","0","","""Mi hai colpito con una roccia enorme, vecchiaccia maledetta! Avresti potuto uccidermi!"""
"","","1","1","0","NV_ID_0588","","","","","-1","0","0","0","","L'anziana si limitò a scrollare le spalle. "
"","","1","1","0","NV_ID_0589","","","","","-1","0","0","0","","""La morte è la cura migliore per la stupidità."""
"1406","1407","1","1","0","NV_ID_0590","","","","","-1","0","0","0","","Il volto di Dimo si accese di rabbia. Iniziò a indietreggiare fissando Kainé e, sputando nel fango, gridò:"
"","","1","1","0","NV_ID_0591","","","","","-1","0","0","0","","""Andatevene dal villaggio! Nessuno vi vuole qui!"""
"","","1","1","0","NV_ID_0592","","","<CB=BGM_B_CENTER_LIBRARY_FO>","","-1","0","0","0","","Vedendo che l'anziana si chinava per raccogliere un'altra pietra, Dimo e la sua banda scapparono impauriti. <STOP>Mentre correvano via, l'anziana donna rise con le mani strette sui fianchi."
"","","1","1","0","NV_ID_0593","","","","","-1","0","0","0","","""Ah, guarda come scappa il grassone! <STOP>Con tutta quella ciccia, non pensavo potesse correre così veloce."""
"1407","1408","1","1","0","NV_ID_0594","","","","","-1","0","0","0","","Ma, alla vista di Kainé, il suo viso si corrugò di nuovo. <STOP>Piegatasi a terra, si tolse lo scialle per posarlo intorno alle spalle della ragazza. Poi, trovato un fazzoletto nelle tasche del vestito, iniziò a pulirle il sangue dalla fronte."
"","","1","1","0","NV_ID_0595","","","","","-1","0","0","0","","""Oh, Kainé. Perché non ti sei difesa? Sei molto più forte di tutti loro"", disse.<PAGE>"
"","","1","1","0","NV_ID_0596","","","","","-1","0","0","0","","Kainé fu estremamente amareggiata dalle parole di sua nonna. "
"","","1","1","0","NV_ID_0597","","","","","-1","0","0","0","","""Non fare la gentile. Non me lo merito. Niente... Niente ha più importanza."""
"1408","1409","1","1","0","NV_ID_0601","","","<CB=BGM_EID_3200_a0015_03>","","-1","0","0","0","","E le lacrime trattenute troppo a lungo cominciarono infine a scorrerle lungo le guance."
"","","1","1","0","NV_ID_0602","","","","","-1","0","0","0","","""Tutti mi odiano... Pensano che sia colpa mia se accade qualcosa di male. Dicono che sono un mostro. <STOP>Vorrei essere morta."""
"","","1","1","0","NV_ID_0603","","","","","-1","0","0","0","","Mentre singhiozzava, sua nonna le posò le mani sulle spalle. <STOP>Nonostante l'età e la bassa statura, era una donna dotata di una forza straordinaria e Kainé non riuscì a divincolarsi."
"1409","1410","1","1","0","NV_ID_0604","","","","","-1","0","0","0","","""Non dire così, Kainé. <STOP>Quello che scorre tra il nostro mondo e l'aldilà è un fiume ampio e profondo che non ha pietà per chi prova ad attraversarlo. Devi combattere fino alla fine. <STOP>Capito?"""
"","","1","1","0","NV_ID_0605","","","","","-1","0","0","0","","L'anziana serrò ancora di più la presa e cercò di controllare il tremito nella sua voce."
"","","1","1","0","NV_ID_0606","","","","","-1","0","0","0","","""Tu sai cosa si prova a perdere qualcuno che si ama, Kainé. <STOP>Lo sai perché sei sopravvissuta."""
"1410","1411","1","1","0","NV_ID_0607","","","","","-1","0","0","0","","Nel sentire queste parole, Kainé si ricordò perché amava così tanto sua nonna. <STOP>Da piccola non sapeva neanche della sua esistenza, ma quando i suoi genitori erano morti, quella donna l'aveva accolta e cresciuta come una figlia. <STOP>Nonnina, come la chiamava Kainé, era furba, sboccata e pronta all'ira, cose che avevano reso difficili i primi anni insieme. <STOP>Ma, anno dopo anno, Kainé e sua nonna si erano avvicinate. "
