"","","0","1","0","SEID_4030_S0010_0175_X","","","","<CB=SEID_4030_S0010_a0040_End>","0","1332","-1","0","2","Dann müssen wir wohl nach Meeresfront zurück."
"1070","","0","1","0","RID_FRYTHA_00160","","","","","0","-1","1332","0","8","Allein der Gedanke daran macht mich so wahnsinnig, dass ich TÖTEN möchte!<LF>... Natürlich nicht Euch. Aber irgendjemanden vielleicht!<LF>"
"1071","","0","1","0","RID_FRWOMA_00080","","","","","0","-1","1331","0","108","Oh, ja. Dieser Typ kam in die Stadt und verkaufte einen Haufen gefälschter Waren. Keine Ahnung, wie er Käufer für den Schrott gefunden hat, aber anscheinend hat es funktioniert."
"1072","","0","1","0","RID_FRWOMA_00060","","","","","0","-1","1331","0","108","Ja, ich habe vor einem Weilchen ein Kind gesehen."
"","","0","1","0","RID_FRWOMA_00070","","","","","0","-1","1331","0","108","Ich meine, er hat beim Heiligen Baum gespielt."
"1073","","0","1","0","RID_FRYTHA_00070","","","","","0","-1","1332","0","8","Ein Fluch auf dem Wald? Also bitte! Ihr wisst selbst, dass es so etwas nicht gibt."
"","","0","1","0","RID_FRYTHA_00080","","","","","0","-1","1332","0","8","... Aber wenn sich das so zugetragen hat, ist ""Fluch"" vermutlich ein angemessener Begriff."
"1074","","0","1","0","SEID_3200_S0010_0250_X","","","","","0","0","-1","0","2","Hier scheint alles normal zu sein."
"","","0","1","0","SEID_3200_S0010_0260_X","","","","","-1","0","0","0","26","Offenbar sind wir in eine Sackgasse geraten."
"","","0","1","0","SEID_3200_S0010_0265_X","","","<CB=Look_at_Nut>","<CB=SEID_3200_S0010_a0050_01_Start>","-1","0","0","0","26","Moment mal. Was ist das da auf dem Boden?"
"1075","","0","1","0","SEID_3200_S0010_0270_X","","","","","0","0","-1","0","2","Nur ein paar merkwürdig aussehende Beeren."
"","","0","1","0","SEID_3200_S0010_0280_X","","","","","-1","0","0","0","26","Ah. Giftige Beeren, möchte ich wetten."
"","","0","1","0","SEID_3200_S0010_0290_X","","","","","0","0","-1","0","2","Tja, die werde ich bestimmt nicht essen, um es herauszufinden."
"1076","","0","1","0","SEID_3200_S0010_0300_X","","","<CB=Nier_Walking>","","0","-1","1000","0","28","Habt ihr Jungs das Rätsel schon gelöst?"
"","","0","1","0","SEID_3200_S0010_0310_X","","","","","0","1000","-1","0","2","Nein. Wir stecken fest."
"","","0","1","0","SEID_3200_S0010_0320_X","","","","<CB=Talking_End>","0","-1","1000","0","28","Schade. Hey, was ist mit diesen Beeren?"
"1077","1078","0","1","0","SEID_3200_S0010_0330_X","","","","","0","1000","-1","0","2","Die hier? Wir haben sie drüben bei dem großen Baum gefunden. Ich dachte, sie könnten vielleicht ..."
"1078","","0","1","0","SEID_3200_S0010_0340_X","","","","","0","-1","1000","0","28","Gib her. Ich verhungere ja förmlich."
"","","0","1","0","SEID_3200_S0010_0350_X","","","","","0","1000","1025","0","26","Bist du verrückt?! Diese Beeren sind eindeutig giftig! Nicht einmal jemand wie du sollte ..."
"","","0","1","0","SEID_3200_S0010_0360_X","","","","","0","-1","1000","0","28","Verdammt, sind die köstlich! Gib mir mehr davon!"
"","","0","1","0","SEID_3200_S0010_0370_X","","","","","0","1000","-1","0","2","Tja, wenn das so ist, dann könnte ich ja auch mal eine probieren ..."
"","","0","1","0","EID_9999_NoSound","","","<CB=Nier_Nod>","<CB=Nier_Dead>","0","1000","-1","0","2","..."
"1079","","0","1","0","SEID_3200_S0010_0380_X","","","","","0","1000","-1","0","2","Argh ... Ich glaube, Weiss hatte recht, was die Beeren angeht ... Mein Magen fühlt sich an, als hätte jemand ein Schwert reingestoßen ..."
"","","0","1","0","RID_FRYTHA_00090","","","<CB=Nier_Looking_Villager><CB=Look_at_Villager>","","0","-1","1332","0","8","Hey, was ist los? ... Oh nein. Ihr habt doch nicht etwa eine dieser Beeren gegessen?!"
"","","0","1","0","RID_FRYTHA_00100","","","","<CB=Snow_SEID_3200_S0010_a0060_0041>","0","-1","1332","0","8","Um Baumeswillen, diese Dinger sind tödlich! Schnell! Nehmt dieses Gegengift, bevor Ihr sterbt!"
"1080","","0","1","0","SEID_3200_S0010_0410_X","","","","","0","1332","-1","0","2","Puh. Ich dachte, es wäre um mich geschehen ..."
"","","0","1","0","RID_FRYTHA_00110","","","","","0","-1","1332","0","8","Was seid Ihr auch für ein Idiot?! Habt Ihr die Knollen nicht gesehen? Die ungewöhnlichen Farben? Nur ein Kind würde so etwas probieren!"
"","","0","1","0","SEID_3200_S0010_0430_X","","","","","0","1332","-1","0","2","Ein Kind ... Ach, Mist! Ich wette, dieses Kind hat eine der Beeren gegessen."
"","","0","1","0","SEID_3200_S0010_0440_X","","","","","0","-1","1025","0","26","Ja, ziemlich wahrscheinlich. Und wenn das Gift schon einem Erwachsenen so starke Schmerzen bereitet, mag ich mir gar nicht vorstellen, was es bei einem Kind anrichtet."
"","","0","1","0","SEID_3200_S0010_0470_X","","","<CB=Nier_Looking_Kaine_02><LF><CB=Look_at_Kaine>","","0","1000","-1","0","2","Hey, Kainé! Hast du das Gegenmittel eingenommen?"
"","","0","1","0","SEID_3200_S0010_0480_X","","","","","0","-1","1000","0","28","Das brauche ich nicht. Mann, diese Beeren sind unglaublich."
"","","0","1","0","SEID_3200_S0010_0490_X","","","","","0","1000","1025","0","26","Wahrhaft unglaublich ist vielmehr, dass dein Magen noch verdorbener als dein Modegeschmack ist!"
"","","0","1","0","SEID_3200_S0010_0500_X","","","","<CB=SEID_3200_S0010_a0060_End>","0","1025","1000","0","28","Wenn du Geschlechtsteile hättest, würde ich dir diese nun so was von abhacken."
"1081","","0","1","1","SEID_5000_S0020_0240_X","","","","","-1","0","0","0","","<LIST=1082>Höre dein Schicksal.</LIST><LF><LIST=1063>Lehne das Angebot fürs Erste ab.</LIST>"
"1082","","2","1","1","","","","","<CB=SEID_5000_S0020_a0070_01>","-1","0","0","0","",""
"1083","","0","1","0","RID_FRYTHA_10030","","","","","-1","-1","1332","0","8","In letzter Zeit habe ich überhaupt nicht geträumt ..."
"1084","","0","1","0","RID_FRWOMA_10030","","","","","-1","-1","1331","0","108","Kennt Ihr den Heiligen Baum? Das ist der große Baum, der in unserem Dorf steht."
"1085","","0","1","0","RID_FRHEAD_00190","","","","","-1","-1","1330","0","127","Wie ist es Euch in letzter Zeit ergangen? Ich selber kann nicht gerade klagen."
"1086","","0","1","0","RID_NIER_01770","","","","","0","1335","-1","0","2","Äh, danke, vielleicht später."
"","","0","1","0","RID_FRFORTUN_00110","","","","","0","-1","1335","0","21","In Ordnung. Kommt wieder, wann immer Ihr mögt."
"1087","1062","0","1","0","RID_NIER_01780","","","","","0","1335","-1","0","2","Klar, das können wir machen."
"1088","","0","1","0","RID_FRHEAD_00080","","","","","0","-1","1362","0","127","Ach, danke! Vielen, vielen Dank!"
"1089","","0","1","0","EID_4500_a0400_0121_X_3","","","<CB=BGM_D_FOREST_FIELD_FO>","","-1","0","0","0","25","Wir sind das Gras ... Wir sind die Bäume ... Wir sind die Wälder ..."
"","","0","1","0","EID_4500_a0400_0130_X","","","","","-1","0","0","0","26","..."
"","","0","1","0","EID_4500_a0400_0140_X","","","","","-1","0","0","0","2","..."
"","","0","1","0","EID_4500_a0400_0150_X","","","","","-1","0","0","0","26","Wie kommt es, dass wir in letzter Zeit nur noch auf seltsame Leute treffen?"
"","","0","1","0","EID_4500_a0400_0160_X","","","","","-1","0","0","0","2","Du solltest das Reden übernehmen, Weiss."
"","","0","1","0","EID_4500_a0400_0170_X","","","","","-1","0","0","0","26","Pah! Als ob Grimoire Weiss solch einen ausgemachten Unsinn von sich geben könnte!"
"","","0","1","0","EID_4500_a0400_0180_X","","","","","-1","0","0","0","2","Augenblick mal. Ich denke nicht, dass er fertig ist."
"","","0","1","0","EID_4500_a0400_0191_X_3","","","","","-1","0","0","0","25","... Die dunkle Gestalt, die über alle Erinnerungen herrscht."
"","","0","1","0","EID_4500_a0400_0201_X_3","","","","","-1","0","0","0","25","... Mögen die Worte sich formen, wie es euch gefällt."
"","","0","1","0","EID_4500_a0400_0210_X","","","","<CB=LIB_SET_CLOSE_2D_GAUGE><LF><CB=BG_AND_ENV_FADE_OUT><LF><CB=CHANGE_WINDOW_SIZE,9,-1,1009>","-1","0","0","0","2","Soll das heißen, wir werden alles erfahren, was wir wissen wollen? Das wäre schön."
""