"","","0","1","0","RID_SEAYTHI_00040","","","","","1","-1","1307","0","19","Oh ... Nun, zumindest habt Ihr mit ihr <FONT=ITALIC>geredet</FONT>, nicht wahr? Könnte ich Euch um einen Gefallen bitten?"
"","","0","1","0","SEID_3000_S0080_0040_X","","","","","0","1307","-1","0","2","Um was geht es denn?"
"","","0","1","0","RID_SEAYTHI_00050","","","","","1","-1","1307","0","19","Der Leuchtturm befindet sich derzeit in einem guten Zustand, aber er wird mit der Zeit verfallen. Wir hätten für den Fall der Fälle gerne Ersatzteile parat."
"","","0","1","0","RID_SEAYTHI_00060","","","","","1","-1","1307","0","19","Könntet Ihr die Teile im Schrotthaufen besorgen?"
"","","0","1","0","RID_SEAYTHI_00070","","","","<CB=LIB_SET_START_SUBQUEST,1755,45,17,1307,1515>","1","-1","1307","0","19","Ich bin mir sicher, die Leuchtturmdame weiß das zu schätzen. Wo auch immer sie jetzt ist."
"1515","","0","1","0","SEID_3000_S0080_0070_X","","","","","1","1307","-1","0","2","Ja, in Ordnung."
"","","0","1","0","RID_SEAYTHI_00080","","","","","1","-1","1307","0","19","Vielen Dank. Ich denke, wir werden zehn kaputte Linsen und zehn kaputte Batterien benötigen."
"","","0","1","0","RID_SEAYTHI_00090","","","","<CB=LIB_SET_END_SUBQUEST>","1","-1","1307","0","19","Und wenn Ihr schon mal dabei seid: Zehn rätselhafte Schalter wären auch ganz gut."
"1516","","0","2","0","RID_NIER_01210","","","","","0","1307","-1","0","2","Ich habe Euer Material."
"","","0","1","0","RID_SEAYTHI_00110","","","","<CB=SEID_3000_S0080_a0030_01>","0","-1","1307","0","19","Vielen Dank. Hier ist Euer Lohn."
"1517","","0","1","0","RID_SEAYTHI_00120","","","","<CB=SEID_3000_S0080_a0030_End01>","1","-1","1307","0","19","Die alte Dame ist von uns gegangen, aber wir müssen den Leuchtturm in Gang halten."
"1518","","0","1","0","RID_SEAYTHI_00100","","","","<CB=SEID_3000_S0080_a0030_End02>","0","-1","1307","0","19","Wir benötigen zehn kaputte Linsen, zehn kaputte Batterien und zehn rätselhafte Schalter. "
"1519","","0","2","0","RID_SEAOLWA_00040","","","","","0","-1","1277","0","119","Ah, Ihr seid es! Ich habe viele tolle Geschichten über Euch gehört. Ihr habt Euch ganz schön einen Namen gemacht, wie?"
"","","0","1","0","SEID_3000_S0170_0020_X","","","","","0","1277","-1","0","2","Tja, das kann ich nicht beurteilen."
"","","0","1","0","RID_SEAOLWA_00050","","","","","0","-1","1277","0","119","Ach, nicht so bescheiden. Immerhin habe ich vielleicht einen Auftrag für Eure besonderen ... Talente."
"","","0","1","0","SEID_3000_S0170_0040_X","","","","","0","1277","-1","0","2","Ich höre."
"","","0","1","0","RID_SEAOLWA_00060","","","","","0","-1","1277","0","119","Ich möchte, dass Ihr drei Kisten eines bestimmten Imports von einem Boot bergt, das Schiffbruch erlitten hat."
"","","0","1","0","RID_SEAOLWA_00070","","","","<CB=LIB_SET_START_SUBQUEST,1758,46,17,1277,1520>","0","-1","1277","0","119","Die Ladung wurde wahrscheinlich in den entlegensten Gegenden der Welt angespült, es wird also nicht einfach werden. Kann ich auf Eure Hilfe zählen?"
"1520","","0","1","0","SEID_3000_S0170_0070_X","","","","","0","1277","-1","0","2","Klar."
"","","0","1","0","RID_SEAOLWA_00080","","","","","0","-1","1277","0","119","Ah, ausgezeichnet, ausgezeichnet. Oh, und was immer Ihr auch tut, Ihr dürft die Ladung nicht öffnen."
"","","0","1","0","SEID_3000_S0170_0090_X","","","","","0","1277","-1","0","2","Also, jetzt bin ich neugierig. Warum darf ich sie nicht öffnen?"
"","","0","1","0","RID_SEAOLWA_00090","","","","","0","-1","1277","0","119","Nun, ich habe ein paar ziemlich ... einzigartige Produkte verschickt. Wenn Ihr sie zu Gesicht bekommt, könnte ich in Schwierigkeiten geraten."
"","","0","1","0","SEID_3000_S0170_0110_X","","","","<CB=LIB_SET_END_SUBQUEST>","0","1277","-1","0","2","Hey, es ist Euer Geld. Ihr wollt nicht, dass ich reinschaue? Kein Problem."
"1521","","0","1","0","RID_SEAOLWA_00100","","","","","0","-1","1277","0","119","Ah, und auch noch ein vernünftiger Mann obendrein! Ach, ich weiß Eure Hilfe in dieser Sache wahrlich zu schätzen."
"1522","","0","1","0","SEID_3000_S0170_0130_X","","","","","-1","0","0","0","2","Ich denke, dies ist ein Teil der Ladung, die angespült wurde."
"1523","","0","1","0","SEID_3000_S0170_0140_X","","","","","-1","0","0","0","","<LIST=1548>Mitnehmen ohne hineinzuschauen.</LIST><LF><LIST=1549>Hineinschauen und dann mitnehmen.</LIST>"
"1524","","0","1","0","SEID_3000_S0170_0150_X","","","","<CB=SEID_3000_S0170_a0020g_End01>","-1","0","0","0","2","Sie bat mich, nicht hineinzuschauen. Es wird einfacher sein, wenn ich das auch so mache."
"1525","","0","1","0","SEID_3000_S0170_0160_X","","","","","-1","0","0","0","2","Nichts gegen diese Dame, aber ich trage keine Kiste herum, wenn ich nicht weiß, was darin ist."
"","","0","1","0","SEID_3000_S0170_0170_X","","","","","-1","0","0","0","26","Hast du deine Schuldgefühle mit dieser schwachen Ausrede besänftigt? Dann schlage ich vor, wir ... Hallo! Was haben wir denn hier?"
"","","0","1","0","SEID_3000_S0170_0180_X","","","","","-1","0","0","0","2","Solche Blumen habe ich noch nie zuvor gesehen. Die riechen ... merkwürdig."
"","","0","1","0","SEID_3000_S0170_0190_X","","","","<CB=SEID_3000_S0170_a0020g_End02>","-1","0","0","0","26","Ich glaube, aus ihnen lässt sich eine starke, aber giftige Droge raffinieren. Ich bezweifele jedoch, dass diese Pflanzen legal sind."
"1526","","0","1","0","SEID_3000_S0170_0200_X","","","","","-1","0","0","0","2","Ich denke, dies ist ein Teil der Ladung, die angespült wurde."
"1527","","0","1","0","SEID_3000_S0170_0210_X","","","","","-1","0","0","0","","<LIST=1550>Mitnehmen ohne hineinzuschauen.</LIST><LF><LIST=1551>Hineinschauen und dann mitnehmen.</LIST>"
"1528","","0","1","0","SEID_3000_S0170_0220_X","","","","<CB=SEID_3000_S0170_a0030g_End01>","-1","0","0","0","2","Sie hat uns gebeten, nicht hineinzuschauen. Also lassen wir es auch besser."
"1529","","0","1","0","SEID_3000_S0170_0230_X","","","","","-1","0","0","0","2","Tut mir leid, meine Dame, aber ich muss wissen, was ich hier transportiere."
"","","0","1","0","SEID_3000_S0170_0240_X","","","","","-1","0","0","0","26","Ist das wirklich etwas, das wir ... Hallo? Ja, was haben wir denn hier?"
"","","0","1","0","SEID_3000_S0171_0250_X","","","","","-1","0","0","0","2","Was immer es auch ist, es wurde wasserdicht verpackt ... Und es riecht nach Sprengstoff."
"","","0","1","0","SEID_3000_S0170_0260_X","","","","<CB=SEID_3000_S0170_a0030g_End02>","-1","0","0","0","26","Das ist eine ziemlich gefährliche Ladung, die wir hier bergen sollen."
"1530","","0","1","0","SEID_3000_S0170_0270_X","","","","","-1","0","0","0","2","Ich denke, dies ist ein Teil der Ladung, die angespült wurde."
"1531","","0","1","0","SEID_3000_S0170_0280_X","","","","","-1","0","0","0","","<LIST=1552>Mitnehmen ohne hineinzuschauen.</LIST><LF><LIST=1553>Hineinschauen und dann mitnehmen.</LIST>"
"1532","","0","1","0","SEID_3000_S0171_0290_X","","","","<CB=SEID_3000_S0170_a0040g_End01>","-1","0","0","0","2","Ich habe gesagt, dass ich nicht hineinschauen würde. Bringen wir es also hinter uns."
"1533","","0","1","0","SEID_3000_S0170_0300_X","","","","","-1","0","0","0","2","Ein kurzer Blick wird schon nicht schaden. Du weißt schon, nur für den Fall."
"","","0","1","0","SEID_3000_S0170_0310_X","","","","","-1","0","0","0","26","Nur für den Fall? Was für ein Fall genau? Muss ich dich daran erinnern, dass ... Ähm. Was ist das denn?"
"","","0","1","0","SEID_3000_S0170_0320_X","","","","","-1","0","0","0","2","Unbeschriftete Medizinfläschchen mit einer Art weißem Pulver darin."
"","","0","1","0","SEID_3000_S0170_0330_X","","","","<CB=SEID_3000_S0170_a0040g_End02>","-1","0","0","0","26","Oh! So sorgfältig, wie sie verpackt worden sind, wird da wohl kaum Zucker drin sein!"
"1534","","0","1","0","SEID_3000_S0170_0410_X","","","","<CB=SEID_3000_S0170_a0070_End01>","-1","0","0","0","2","In Ordnung, die Ladung ist vollständig. Bringen wir sie zur Kundin zurück."
"1535","","0","1","0","SEID_3000_S0170_0420_X","","","","","-1","0","0","0","2","Tja, das scheint alles zu sein."
"","","0","1","0","SEID_3000_S0170_0430_X","","","","","-1","0","0","0","26","Ein gewaltiges Lager illegaler Waren und gefährlicher Materialien! Ich würde meine Titelseite darauf verwetten, dass unsere Klientin eine Schmugglerin ist."
"","","0","1","0","SEID_3000_S0170_0440_X","","","","","-1","0","0","0","2","Also was sollen wir machen?"
"1536","","0","1","0","SEID_3000_S0170_0450_X","","","","","-1","0","0","0","","<LIST=1556>Die Ladung bei der Kundin abliefern.</LIST><LF><LIST=1557>Sie bei den Behörden von Meeresfront melden.</LIST>"
"1537","","0","1","0","SEID_3000_S0170_0460_X","","","","<CB=SEID_3000_S0170_a0070_End01>","-1","0","0","0","2","Geschmuggelt oder nicht, ich halte mein Wort. Lass uns das Zeug zur Kundin bringen."
"1538","","0","1","0","SEID_3000_S0170_0470_X","","","","<CB=SEID_3000_S0170_a0070_End02>","-1","0","0","0","2","Ich möchte nichts mit Schmuggel oder Schlimmerem zu tun haben. Lass uns mit dem Wächter am Eingang sprechen."
"1539","","0","2","0","RID_NIER_01230","","","","","0","1277","-1","0","2","Wir haben Eure Ladung."
"","","0","1","0","RID_SEAOLWA_00110","","","","","0","-1","1277","0","119","Ach, ausgezeichnet! Und alles scheint in einem guten Zustand zu sein."
"","","0","1","0","RID_SEAOLWA_00120","","","","<CB=SEID_3000_S0170_a0080_01_End01_01>","0","-1","1277","0","119","Hier ist Eure Bezahlung. Bitte nehmt sie."
"1540","","0","1","0","RID_SEAOLWA_00130","","","","","0","-1","1277","0","119","Außerdem kenne ich den Besitzer des Warenladens in dieser Stadt. Ich denke, Eure zukünftigen Geschäfte dort sollten ein wenig angenehmer verlaufen."
"","","0","1","0","SEID_3000_S0170_0520_X","","","","","0","1277","-1","0","2","Das sind gute Nachrichten."
"","","0","1","0","RID_SEAOLWA_00140","","","","","0","-1","1277","0","119","Ach ja, Ihr wisst ja, wie es ist. In meinem Bereich gibt es immer Leute, die einem einen Gefallen schulden. Wie auch immer, ich sollte besser gehen!"
"1541","","0","3","0","RID_SEATOOL_00070","","","","","0","-1","1304","0","10","Die Import-Export-Frau sagt, Ihr wärt ein netter Kerl. Also hört zu, ich habe ein paar Sachen im Hinterzimmer, wenn Ihr versteht, was ich meine, und ich würde Euch einen guten Preis machen."
"1542","","0","3","0","RID_SEATOOL_00080","","","","","0","-1","1304","0","10","Und grüßt die Dame von mir, ja?"
"1543","","0","2","0","RID_NIER_01240","","","","","0","1272","-1","0","2","Entschuldigung, aber diese Sachen wurden an der Küste angespült, und ..."
"","","0","1","0","RID_SEAMANK_00090_mainB","","","","","0","-1","1272","0","19","Heiliges Kanonenrohr! Das ist illegal! ALL DIESE DINGE sind illegal! Wo habt Ihr das her?!"
"","","0","1","0","SEID_3000_S0170_0580_X","","","","","0","1272","-1","0","2","Nun, das ist eine lange Geschichte ..."
"","","0","1","0","RID_SEAMANK_00100","","","","","0","-1","1272","0","19","... HA! Also hat das alte Weib endlich einen Fehler gemacht!"
"","","0","1","0","SEID_3000_S0170_0600_X","","","","","0","0","0","0","26","Ihr seid mit ihrem kleinen Import-Export-Geschäft vertraut?"
"","","0","1","0","RID_SEAMANK_00110","","","","","0","-1","1272","0","19","Oh, wir beobachten sie seit Jahren. Auf dem nächsten Kontinent ist ein ordentliches Kopfgeld auf sie ausgesetzt."
"","","0","1","0","RID_SEAMANK_00120","","","","","0","-1","1272","0","19","Wir hatten sie schon immer im Verdacht, aber es fehlten die Beweise, dass sie es wirklich ist."
"","","0","1","0","RID_SEAMANK_00130","","","","<CB=SEID_3000_S0170_a0080_01_02>","0","-1","1272","0","19","Aber nun haben wir mehr als genug Beweismaterial, um sie hinter Gitter zu bringen. Das habt Ihr gut gemacht, Bürger!"
"1544","","0","2","0","RID_SEAMANK_00140","","","","","0","-1","1272","0","19","Hallo! Dank Eurer Hilfe ist die alte Frau hinter Gittern. Und dort wird sie auch verrotten!"
"","","0","1","0","SEID_3000_S0170_0650_X","","","","","0","1272","-1","0","2","Oh. Tja, das sind also gute Neuigkeiten?"
"","","0","1","0","RID_SEAMANK_00150","","","","","0","-1","1272","0","19","Aber sicher. Wir haben sie schon ewig gejagt. Ach, und außerdem habe ich Anweisung erhalten, Euch Eure Belohnung zu geben."
"","","0","1","0","RID_SEAMANK_00160","","","","<CB=SEID_3000_S0170_a0080_01_End02>","0","-1","1272","0","19","Sie wartet im Postamt auf Euch."
"1545","","0","1","0","RID_SEAMANK_00170","","","","","0","-1","1272","0","19","Eure Belohnung könnt Ihr im Postamt entgegennehmen."
"1546","","0","2","0","SEID_3000_S0170_0680_X","","","","","0","-1","1027","0","41","Hallöchen! Ihr müsst ein sehr guter Kopfgeldjäger sein, wenn Ihr diese aalglatte Frau erwischen konntet!"
"","","0","1","0","SEID_3000_S0170_0690_X","","","","","0","1027","-1","0","2","Ach, das war mehr Glück als Verstand."
"","","0","1","0","SEID_3000_S0170_0700_X","","","","<CB=SEID_3000_S0170_a0080_02_01>","0","-1","1027","0","41","Da braucht es mehr, als nur Glück, um jemanden wie sie zu erwischen! Wie auch immer, wartet. Eure Belohnung habe ich gleiiiich ... Ja, hier ist sie."
"1547","","0","1","0","SEID_3000_S0170_0710_X","","","","","0","1027","-1","0","2","Oha. Das ist aber viel Geld."
"","","0","1","0","SEID_3000_S0170_0720_X","","","","","0","-1","1027","0","41","Und das ist nur Euer Anteil!"
"","","0","1","0","SEID_3000_S0170_0730_X","","","","<CB=SEID_3000_S0170_a0080_02_End>","-1","0","0","0","26","Die Frau muss zu den meistgesuchten Verbrechern der Welt gehört haben."
"1548","","2","1","0","","","","","<CB=SEID_3000_S0170_a0020g_0020_Talk>","-1","0","0","0","",""
"1549","","2","1","0","","","","","<CB=SEID_3000_S0170_a0020g_0030_Talk>","-1","0","0","0","",""
"1550","","2","1","0","","","","","<CB=SEID_3000_S0170_a0030g_0020_Talk>","-1","0","0","0","",""
"1551","","2","1","0","","","","","<CB=SEID_3000_S0170_a0030g_0030_Talk>","-1","0","0","0","",""
"1552","","2","1","0","","","","","<CB=SEID_3000_S0170_a0040g_0020_Talk>","-1","0","0","0","",""
"1553","","2","1","0","","","","","<CB=SEID_3000_S0170_a0040g_0030_Talk>","-1","0","0","0","",""
"1554","","2","1","0","","","","","<CB=SEID_3000_S0170_a0050g_0020_Talk>","-1","0","0","0","",""
"1555","","2","1","0","","","","","<CB=SEID_3000_S0170_a0050g_0030_Talk>","-1","0","0","0","",""
"1556","","2","1","0","","","","","<CB=SEID_3000_S0170_a0070_0030_Talk>","-1","0","0","0","",""
"1557","","2","1","0","","","","","<CB=SEID_3000_S0170_a0070_0040_Talk>","-1","0","0","0","",""
"1558","","0","2","0","RID_SEAJWEL_00010","","","","","0","-1","1354","0","119","Entschuldigung. Äh, Herr?"
"","","0","1","0","SEID_3000_S0180_0020_X","","","","","0","1354","-1","0","2","Meint Ihr mich?"
"","","0","1","0","RID_SEAJWEL_00020","","","","","0","-1","1354","0","119","Ja, ja. Die Leute reden über Euch. Sie sagen, Ihr wärt ein äußerst versierter Freiberufler."
"","","0","1","0","RID_SEAJWEL_00030","","","","","0","-1","1354","0","119","Ich handele mit Juwelen, versteht Ihr, und derzeit suche ich einen wertvollen Stein, der als Meerjungfrauenträne bekannt ist."
"","","0","1","0","RID_SEAJWEL_00040","","","","","0","-1","1354","0","119","Habt Ihr schon mal davon gehört, Herr?"
"","","0","1","0","SEID_3000_S0180_0060_X","","","","","0","1354","-1","0","2","Ich verstehe nicht viel von Juwelen, tut mir leid."
"","","0","1","0","RID_SEAJWEL_00050","","","","","0","-1","1354","0","119","Nun, dann lasst mich Euch sagen, dass ich glaube, die Träne befindet sich irgendwo in dieser Stadt. Ich bin so nah dran. So nah ..."
"","","0","1","0","SEID_3000_S0180_0080_X","","","","","0","1354","-1","0","2","Das scheint für Euch mehr als nur ein Geschäft zu sein."
"","","0","1","0","RID_SEAJWEL_00060","","","","","0","-1","1354","0","119","Ihr habt mich durchschaut, Herr. Die Meerjungfrauenträne ist ein wertvolles Familienerbstück."
"","","0","1","0","RID_SEAJWEL_00070","","","","","0","-1","1354","0","119","Ursprünglich besaß mein Großvater sie, doch seit seinem Tod vor ungefähr fünfzig Jahren ist das Juwel spurlos verschwunden."
"","","0","1","0","RID_SEAJWEL_00080","","","","","0","-1","1354","0","119","Ich habe mein Leben der Suche danach gewidmet, und diese Mission hat mich hierher geführt. Es muss in dieser Stadt sein!"
"","","0","1","0","SEID_3000_S0180_0120_X","","","","","0","1354","-1","0","2","Nun, wenn es so wichtig ist, dann helfe ich gerne."
"","","0","1","0","RID_SEAJWEL_00090","","","","<CB=LIB_SET_START_SUBQUEST,1772,47,17,1354,1559>","0","-1","1354","0","119","Tausend Dank, guter Herr! Die Hilfe eines Ortskundigen wie Euch wird die Suche mit Sicherheit sehr vereinfachen."
"1559","","0","1","0","SEID_3000_S0180_0140_X","","","","<CB=LIB_SET_END_SUBQUEST>","0","1354","-1","0","2","Kein Problem."
"1560","","0","1","0","RID_SEAJWEL_00100","","","","","0","-1","1354","0","119","Ah, der edle Herr ist zurückgekehrt! Wie geht die Suche voran?"
"1561","","0","1","0","RID_SEAOLWC_00050","","","","","0","-1","1297","0","119","Die Meerjungfrauenträne? Ja, ich weiß, ich habe davon schon einmal gehört. Vielleicht hat jemand in der Stadt sie erwähnt?"
"1562","","0","2","0","RID_SEAWIFA_00050","","","","","0","-1","1279","0","119","Die Meerjungfrauenträne? Nie davon gehört."
"","","0","1","0","RID_SEAWIFA_00060","","","","<CB=SEID_3000_S0180_a0020g_End>","0","-1","1279","0","119","Die Leuchtturmdame wäre die richtige Ansprechpartnerin dafür gewesen. Sie wusste alles über wertvolle Steine."
"1563","","0","1","0","SEID_3000_S0180_0180_X","","","","","-1","0","0","0","2","Hier sind zwei Briefe für die Leuchtturmdame. Den Poststempeln zufolge sind sie fünfzig Jahre alt."
"","","0","1","0","SEID_3000_S0180_0190_X","","","","","-1","0","0","0","2","Meinte die Juwelierin nicht, die Meerjungfrauenträne sei vor fünfzig Jahren verloren gegangen?"
"","","0","1","0","SEID_3000_S0180_0200_X","","","","","-1","0","0","0","26","Vielleicht ist das mehr als nur Zufall. Es könnte hilfreich sein, mal einen Blick in diese Briefe zu werfen."
"","","0","1","0","SEID_3000_S0180_0210_X","","","","","-1","0","0","0","2","Tja, wird wohl nicht schaden ..."
"","","0","1","0","SEID_3000_S0180_0215_X","","","","","-1","0","0","0","2","Hier ist der erste Brief."
"","","0","1","0","SEID_3000_S0180_0220_X","","","","","-1","0","0","0","","""... Ich werde dem nächsten Brief die Meerjungfrauenträne beilegen. Sie ist das Einzige in dieser Welt, das auch nur annähernd an Deine Schönheit heranreicht."""
"","","0","1","0","SEID_3000_S0180_0225_X","","","","","-1","0","0","0","2","Und hier ist der zweite."
"","","0","1","0","SEID_3000_S0180_0230_X","","","","","-1","0","0","0","","""Meine Liebste, ich fürchte, ich kann Dir die Meerjungfrauenträne dieses Mal nicht schicken. Ich hoffe, Du kannst mir diesen unglücklichen Umstand vergeben."""
"","","0","1","0","SEID_3000_S0180_0240_X","","","","","-1","0","0","0","2","Also sollte die Meerjungfrauenträne zur Leuchtturmdame gebracht werden, kam aber nie dort an."
"","","0","1","0","SEID_3000_S0180_0250_X","","","","","-1","0","0","0","26","Und doch ist die Träne nicht länger bei ihrem ursprünglichen Besitzer. Was schließen wir daraus?"
"","","0","1","0","SEID_3000_S0180_0260_X","","","","","-1","0","0","0","2","Nun, der zweite Brief wurde in Meeresfront abgeschickt. Das heißt der Vater des Postboten hat zu dieser Zeit angefangen, die Briefe zu schreiben."
"","","0","1","0","SEID_3000_S0180_0271_X","","","","","-1","0","0","0","26","Und daher <FONT=ITALIC>muss</FONT> das Juwel in diese Stadt gelangt sein. Die Sache stinkt zum Himmel. Auf zum Postamt!"
"1564","","0","2","0","SEID_3000_S0180_0280_X","","","","","0","-1","1027","0","41","Ach, hallo. Was kann ich für Euch tun?"
"","","0","1","0","SEID_3000_S0180_0290_X","","","","","0","1027","-1","0","2","Ich suche nach einem Paket für die Leuchtturmdame. Es müsste so etwa fünfzig Jahre alt sein."
"","","0","1","0","SEID_3000_S0180_0300_X","","","","","0","-1","1027","0","41","Äh, Ihr wollt ein Paket von vor einem halben Jahrhundert?"
"","","0","1","0","SEID_3000_S0180_0310_X","","","","","0","1027","-1","0","2","Euer Vater war der vorherige Postbote, nicht wahr? Hat er Euch gegenüber jemals so etwas erwähnt?"
"","","0","1","0","SEID_3000_S0180_0320_X","","","","","0","-1","1027","0","41","Nein. Er sagte mir nur, dass ich weiterhin Briefe schreiben sollte."
"","","0","1","0","SEID_3000_S0180_0330_X","","","","","0","-1","1027","0","41","Aber wir bewahren alle Pakete, die nicht abgeholt werden, im Lagerraum auf. Also wenn sie es nicht abgeholt hat, ist es vermutlich noch immer dort."
"","","0","1","0","SEID_3000_S0180_0340_X","","","","<CB=SEID_3000_S0180_a0050_End>","0","1027","-1","0","2","Großartig. Wenn es Euch nichts ausmacht, werde ich mich mal umschauen."
"1565","","0","1","0","SEID_3000_S0180_0350_X","","","","","0","-1","1027","0","41","Habt Ihr das Paket gefunden?"
"1566","","0","1","0","SEID_3000_S0180_0360_X","","","","","-1","0","0","0","2","Ein fünfzig Jahre altes Paket ... Ich hoffe, die Ratten haben es nicht gefressen."
"1567","","0","1","0","SEID_3000_S0180_0370_X","","","","","-1","0","0","0","2","Moment, ist es das?"
"","","0","1","0","SEID_3000_S0180_0380_X","","","","","-1","0","0","0","26","Es steht ihr Name drauf und der Poststempel ist fünfzig Jahre alt ... Sieh nur! Das Juwel ist da drin! Schnell, was steht in dem Brief?"
"","","0","1","0","SEID_3000_S0180_0390_X","","","","","-1","0","0","0","","""Wie versprochen, habe ich die Meerjungfrauenträne beigefügt. Leider habe ich zugleich auch schlechte Neuigkeiten."""
"","","0","1","0","SEID_3000_S0180_0400_X","","","","","-1","0","0","0","","Meine Liebste, ich fürchte, die Krankheit, die in meinem Körper wütet, wird mich bald besiegt haben. Meine Träume, zu Dir zu reisen, werden sich nicht erfüllen."
"","","0","1","0","SEID_3000_S0180_0410_X","","","","","-1","0","0","0","","""Ich hätte mir so gewünscht, Dir diesen Stein persönlich überreichen zu können. Dass ich es nicht tun kann, bedauere ich zutiefst."""
"","","0","1","0","SEID_3000_S0180_0420_X","","","","","-1","0","0","0","2","Das Familienerbstück war ein Abschiedsgeschenk."
"","","0","1","0","SEID_3000_S0180_0430_X","","","","","-1","0","0","0","26","Moment mal. Da ist noch ein Brief."
"","","0","1","0","SEID_3000_S0180_0440_X","","","","","-1","0","0","0","2","Sieht nach einer Todesanzeige aus."
"","","0","1","0","SEID_3000_S0180_0450_X","","","","","-1","0","0","0","26","Ah. Demnach war der Mann bereits verstorben, als das Paket in Meeresfront eintraf."
"","","0","1","0","SEID_3000_S0180_0460_X","","","","","-1","0","0","0","2","Was bedeutet, dass der Postbote seine Lügen bereits begonnen hatte."
"","","0","1","0","SEID_3000_S0180_0471_X","","","","","-1","0","0","0","2","Also was nun? Geben wir das Juwel dem Kunden zurück, oder ...? Hmm. Vielleicht hat der Postbote eine Idee."
"1568","","0","2","0","SEID_3000_S0180_0490_X","","","","","0","-1","1027","0","41","Habt Ihr es gefunden?"
"","","0","1","0","SEID_3000_S0180_0500_X","","","","<CB=SEID_3000_S0180_a0080_01_03>","0","1027","-1","0","2","Ja, aber ... Es ist kompliziert."
"1569","","0","1","0","SEID_3000_S0180_0650_X","","","","","0","-1","1027","0","41","Tja, also gut. Wenn Ihr das für das Beste haltet. Ich glaube nicht, dass das alte Mädchen sich beschweren würde."
"","","0","1","0","SEID_3000_S0180_0660_X","","","","","0","1027","-1","0","2","Vermutlich hat sie das Juwel im Himmel sowieso."
"","","0","1","0","SEID_3000_S0180_0640_X","","","","<CB=SEID_3000_S0180_a0080_01_End02>","0","1027","-1","0","2","Der nächste Schritt wäre dann wohl, den Kunden zu besuchen."
"1570","","0","2","0","RID_SEAJWEL_00140","","","","","0","-1","1354","0","119","Ja? Habt Ihr die Meerjungfrauenträne gefunden?"
"","","0","1","0","SEID_3000_S0180_0580_X","","","","","0","1354","-1","0","2","Ja, das haben wir. Hier ist sie."
"","","0","1","0","RID_SEAJWEL_00120","","","","","0","-1","1354","0","119","Ach, ich habe so lange darauf gewartet! Ihr habt Euch Euren guten Ruf wirklich verdient, Herr!"
"","","0","1","0","RID_SEAJWEL_00130","","","","<CB=SEID_3000_S0180_a0080_02_End01>","0","-1","1354","0","119","Hier ist eine kleine Belohnung dafür, dass Ihr mir dieses wertvolle Andenken an meinen Großvater zurückgebracht habt."
"1571","","0","1","0","SEID_3000_S0180_0620_X","","","","","0","-1","1027","0","41","Also gut. Ich werde es neben der Ruhestätte der alten Frau vergraben."
"","","0","1","0","SEID_3000_S0180_0630_X","","","","","0","1027","-1","0","2","Danke."
"","","0","1","0","SEID_3000_S0180_0640_X","","","","<CB=SEID_3000_S0180_a0080_01_End01>","0","1027","-1","0","2","Der nächste Schritt wäre dann wohl, den Kunden zu besuchen."
"1572","","0","1","0","SEID_3000_S0180_0680_X","","","","","-1","0","0","0","26","Pah! Du würdest ein wertvolles Geschenk der Liebe nehmen und es als gewöhnlichen Tand verkaufen? Das ist ziemlich frech von dir, wenn ich das mal sagen darf."
"","","0","1","0","SEID_3000_S0180_0690_X","","","","","0","1354","-1","0","2","Wie auch immer. Wenigstens kommt die ganze Sache damit endlich zur Ruhe."
"","","0","1","0","SEID_3000_S0180_0640_X","","","","<CB=SEID_3000_S0180_a0080_01_End03>","0","1027","-1","0","2","Der nächste Schritt wäre dann wohl, den Kunden zu besuchen."
"1573","","0","2","0","RID_SEAJWEL_00140","","","","","0","-1","1354","0","119","Ja, ja? Habt Ihr mein Juwel gefunden?"
"","","0","1","0","SEID_3000_S0180_0720_X","","","","","0","1354","-1","0","2","Es tut mir leid, nein. Alle Spuren führten in eine Sackgasse."
"","","0","1","0","RID_SEAJWEL_00151","","","","","0","-1","1354","0","119","Verdammt. Ich war mir so sicher! Ich fürchte, die Erinnerungen an meinen Großvater werden so nie vollständig sein."
"","","0","1","0","SEID_3000_S0180_0740_X","","","","","0","1354","-1","0","2","Großvater?"
