"1000","","0","1","0","EID_3000_a0020g_0001_BOOKW010_X","","","","","-1","0","0","0","26","Un'altra povera vittima..."
"","","0","1","0","EID_3000_a0020g_0002_NIER020_X","","","","","-1","0","-1","0","2","Maledizione. Finirà mai?!"
"1001","","0","1","0","EID_3000_a0020g_0003_BOOKW010_X","","","","","-1","0","0","0","26","Davvero hai intenzione di abbandonarli?"
"1002","1003","0","2","0","EID_3000_a0020g_0010_NIER020_X","","","","","-1","0","-1","0","2","Qui è pericoloso. Dovresti tornare indietro."
"1003","","0","1","0","RID_VILWOMF_00040","","","","","-1","0","0","0","108","Oh, dei... Alzati, tesoro, ti prego... Alzati!"
"1004","","0","1","0","EID_3000_a0020g_0070_NIER020_X","","","","","-1","0","-1","0","2","Le Ombre ormai attaccano direttamente il villaggio."
"","","0","1","0","EID_3000_a0020g_0080_BOOKW010_X","","","","","-1","0","0","0","26","E sono persino corazzate."
"","","0","1","0","EID_3000_a0020g_0090_BOOKW010_X","","","","","-1","0","0","0","26","Questo villaggio sembra davvero peggiorare."
"","","0","1","0","EID_3000_a0020g_0100_NIER020_X","","","","","-1","0","-1","0","2","Tutta colpa del Signore delle Ombre. È cambiato tutto da quel giorno..."
"","","0","1","0","EID_3000_a0020g_0110_BOOKW010_X","","","","","-1","0","0","0","26","Cinque lunghi anni..."
"1005","","0","1","0","RID_VILWOMF_00050","","","","","-1","0","0","0","108","*singhiozza*"
"","","0","1","0","EID_3000_a0030_0066_BOOKW010_X_1","","","","","-1","0","0","0","26","Lasciamola un po' tranquilla."
"1006","","0","1","0","EID_3000_a0035g_0010_VILLNYG_X","","","","","-1","0","0","0","8","Come sei cresciuto. E anche Yonah, scommetto."
"1007","","0","1","0","EID_3000_a0035g_0020_VILLNMG_X","","","","","-1","0","0","0","8","Sai, non sei il solo a preoccuparsi per Yonah. L'intero villaggio è in pensiero!"
"1008","","0","1","0","RID_VILOLWA_00050","","","","","0","-1","1196","0","108","Forse oggi troveremo finalmente Yonah. Preghiamo che sia così."
"1009","","0","1","0","EID_3000_a0035g_0040_VILLNMG_X","","","","","-1","0","0","0","8","Quelle bestie hanno distrutto il raccolto! Che cosa farò ora?"
"1010","","0","1","0","EID_3000_a0035g_0050_VILLNMW_X","","","","","-1","0","0","0","108","Ti prego, mio figlio è affamato. Se hai una crosta di pane, un torsolo di mela... Qualunque cosa!"
"1011","","0","1","0","EID_3000_a0035g_0060_VILLNMG_X","","","","","-1","0","0","0","8","Il mio vicino mi ruba le verdure! Ci metto la mano sul fuoco!"
"1012","","0","1","0","EID_3000_a0035g_0070_VILLNMW_X","","","","","-1","0","0","0","8","Si dice che quella famiglia laggiù nasconda del cibo in cantina. Che comportamento abominevole!"
"1013","","0","1","0","EID_3000_a0035g_0080_VILLNMG_X","","","","","-1","0","0","0","8","Gli altri abitanti hanno dato fuoco alla mia casa! Mi accusano di rubare le loro verdure, ma non è vero!"
"1014","","0","1","0","EID_3000_a0035g_0090_VILLNMW_X","","","","","-1","0","0","0","108","Non ho niente! Vai a casa!"
"1015","","0","1","0","RID_DEBOL_00031","","","<CB=BGM_B_CENTER_VILLAGE_01_DEBOL_VOCAL_OFF>","","0","-1","1003","0","23","Uah. Hai un'aria... distrutta."
"","","0","1","0","EID_3000_a0035g_0110_NIER020_X","","","","","1","1003","-1","0","2","Sto bene."
"","","0","1","0","EID_3000_a0035g_0120_DEBOL010_X","","","","<CB=EID_3000_a0035g_End><LF><CB=BGM_B_CENTER_VILLAGE_01_DEBOL_VOCAL_ON>","1","-1","1003","0","23","Se lo dici tu. Comunque, Popola dice di avere una lettera per te."
"1016","1017","0","2","0","RID_POPOL_00120","","","","","0","-1","1004","0","24","Ma guardati. Sei ancora più alto di quanto ricordassi."
"","","0","1","0","EID_3000_a0040_0015_NIER020_X","","","","","1","1004","-1","0","2","Dici? Io non me ne accorgo più."
"","","0","1","0","EID_3000_a0040_0020_NIER020_X","","","","","1","1004","-1","0","2","Tu invece non sei cambiata di una virgola, Popola. Rivelami il tuo segreto."
"","","0","1","0","EID_3000_a0040_0030_POPOL010_X","","","","","1","-1","1004","0","24","Vedo che sei migliorato anche con i complimenti."
"","","0","1","0","EID_3000_a0040_0040_NIER020_X","","","","","1","1004","-1","0","2","No, davvero. Sei proprio come il primo giorno che ti ho vista."
"","","0","1","0","EID_3000_a0040_0050_POPOL010_X","","","","","1","-1","1004","0","24","Ok, però così mi metti in imbarazzo."
"1017","","0","1","0","EID_3000_a0040_0060_POPOL010_X","","","","","1","-1","1004","0","24","Comunque, tieni. Da parte di Emil."
"1018","","0","1","0","EID_3000_a0040_0061_BOOKW010_X","","","","","1","1004","1025","0","26","Bene. Credo sia giunto il momento di salvare Kainé."
"","","0","1","0","EID_3000_a0040_0062_NIER020_X","","","","","1","1004","-1","0","2","......"
"","","0","1","0","EID_3000_a0040_0070_POPOL010_X","","","","","1","-1","1004","0","24","Quindi lascerai il villaggio?"
"","","0","1","0","EID_3000_a0040_0080_NIER020_X","","","","","1","1004","-1","0","2","Perdonami. So che ultimamente le Ombre sono peggio del solito."
"","","0","1","0","EID_3000_a0040_0090_POPOL010_X","","","","<CB=EID_3000_a0040_End>","1","-1","1004","0","24","Non preoccuparti. Vai, ma fai attenzione."
"1019","","0","1","0","EID_3040_a0010_0010_BOOKW010_X","","","","","-1","0","0","0","26","La ragazza è ancora viva. Lo so, me lo sento."
"","","0","1","0","EID_3040_a0010_0020_NIER020_X","","","","","-1","0","0","0","2","Ma certo."
"1020","","0","2","0","EID_3100_a0005g_0010_BUTLER_X","","","","<CB=EID_3100_a0005g_Start>","0","-1","1028","0","34","Vi do il benvenuto, signori. Il signorino Emil vi attende nelle sue stanze."
"1021","","0","1","0","EID_3100_a0005g_0015_NIER020_X","","","","","-1","0","0","0","2","Andiamo a parlare con Emil."
"1022","1023","0","2","0","EID_3100_a0010_0010_SNOW010_X","","","","","0","-1","1001","0","35","Oh, ciao ragazzi!"
"1023","1024","0","2","0","EID_3100_a0010_011_01","","","","","0","1001","-1","0","2","Emil, da quanto tempo!<LF>... Non sei cambiato per niente."
"","","0","2","0","EID_3100_a0010_011_02","","","","","0","-1","1001","0","35","Oh, beh... È perché sono... speciale, diciamo."
"","","0","2","0","EID_3100_a0010_011_03","","","","","0","1001","-1","0","2","Beh, non hai tutti i torti."
"","","0","1","0","RID_BOOKW_00050","","","","","0","1001","1025","0","26","Allora, hai scoperto come spezzare l'incantesimo della pietrificazione?"
"1024","","0","1","0","EID_3100_a0010_0030_SNOW010_X","","","","<CB=EID_3100_a0010_01_End>","0","-1","1001","0","35","Sì! Guarda qui."
"1025","1026","0","1","0","EID_3100_a0010_0040_SNOW010_X","","","","","0","-1","1001","0","35","In questa villa c'è una sezione chiamata Sala dei progetti, e credo che..."
"","","0","1","0","EID_3100_a0010_0050_BOOKW010_X","","","","","0","0","0","0","26","Credi che questa stanza ti permetta di controllare ogni forma di magia.<LF>Giusto?"
"","","0","1","0","EID_3100_a0010_0060_SNOW010_X","","","","","0","-1","1001","0","35","Ecco, sì. E in caso contrario, almeno potrà metterci sulla strada giusta."
"1026","","0","1","0","EID_3100_a0010_0070_NIER020_X","","","","","0","1001","-1","0","2","Allora, dove si trova questa ""Sala dei progetti""?"
"","","0","1","0","EID_3100_a0010_0080_SNOW010_X","","","","","0","-1","1001","0","35","C'è un'entrata nel cortile. Non è lontana."
"","","0","1","0","EID_3100_a0010_0085_NIER020_X","","","","","0","1001","-1","0","2","Bene, andiamo."
"1027","","0","1","0","EID_3100_a0015g_0060_NIER020_X","","","","","-1","0","0","0","2","È questa?"
"1028","1029","0","1","0","EID_3100_a0020_0010_NIER020_X1","","","","","-1","0","0","0","2","""Attenzione: questa struttura..."""
"","","0","1","0","EID_3100_a0020_0010_NIER020_X2","","","","","-1","0","0","0","2","Il resto non si legge bene. Riguarda un sigillo?"
"","","0","1","0","EID_3100_a0020_0020_BOOKW010_X","","","","","-1","0","0","0","26","Chiunque si sia preso la briga di affiggere un'insegna simile dubito sia felice di vederci forzare l'ingresso."
"","","0","1","0","EID_3100_a0020_0030_SNOW010_X","","","<CB=EID_3100_a0020_SNOW_HEADACHE_MOTION>","","-1","0","0","0","35","Ngh..."
"1029","1030","0","1","0","EID_3100_a0020_0040_NIER020_X","","","","","0","1001","-1","0","2","Emil, che c'è? Tutto bene?"
"1030","","0","1","0","EID_3100_a0020_0050_SNOW010_X","","","<CB=EID_3100_a0020_SNOW_STAND_MOTION>","<CB=EID_3100_a0020_01_End>","-1","0","0","0","35","Niente... Non è niente. Sto bene."
"1031","","0","1","0","EID_3100_a0027g_0010_NIER020_X","","","","<CB=EID_3100_a0027g_TimingCheck01>","-1","0","0","0","2","E questo pezzetto di carta?"
"1032","1033","0","1","0","EID_3100_a0027g_0020_BOOKW010_X","","","","","-1","0","0","0","26","Ha tutta l'aria di essere un vecchio centro di ricerca."
"","","0","1","0","EID_3100_a0027g_0030_SNOW010_X","","","","","-1","0","0","0","35","Forse è qui che in passato... Nnngh!"
"1033","1034","0","1","0","EID_3100_a0027g_0040_SNOW010_X","","","<CB=EID_3100_a0027g_SNOW_HEADACHE_MOTION>","","-1","0","0","0","35","Urgh..."
"1034","1036","0","1","0","EID_3100_a0027g_0050_NIER020_X","","","","","-1","0","0","0","2","Emil?!"
"1035","","0","1","0","","","","","","-1","0","0","0","",""
"1036","1037","0","1","0","EID_3100_a0027g_0060_SNOW010_X","","","<CB=EID_3100_a0027g_SNOW_STAND_MOTION>","","-1","0","0","0","35","Va... Va tutto bene. Dobbiamo proseguire."
"1037","","0","1","0","EID_3100_a0027g_0070_SNOW010_X","","","","<CB=EID_3100_a0027g_01_End>","-1","0","0","0","35","Mi dispiace per i problemi..."
"1038","","2","1","0","","","","","<CB=EID_3100_a0027g_040_Select01>","-1","0","0","0","",""
"1039","","2","1","0","","","","","<CB=EID_3100_a0027g_040_Select02>","-1","0","0","0","",""
"1040","","2","1","0","","","","","<CB=EID_3100_a0030g_020_Select01>","-1","0","0","0","",""
"1041","","2","1","0","","","","","<CB=EID_3100_a0030g_020_Select02>","-1","0","0","0","",""
"1042","1043","0","1","0","EID_3100_a0030g_0001_BOOKW010_X","","","","","-1","0","0","0","26","Progetto Numero 6... Cos'era, una specie di laboratorio bellico?"
"","","0","1","0","EID_3100_a0030g_0002_NIER020_X","","","","","-1","0","0","0","2","Cosa diavolo succedeva qui?"
"1043","","0","1","0","EID_3100_a0030g_0010_SNOW010_X","","","<CB=EID_3100_a0030g_SNOW_HEADACHE_MOTION>","","-1","0","0","0","35","Nnngh... Che stavo... facendo qui...?"
"","","0","1","0","EID_3100_a0030g_0020_BOOKW010_X","","","","","-1","0","0","0","26","Dubito fortemente che Emil sia in grado di proseguire..."
"","","0","1","0","EID_3100_a0030g_0030_SNOW010_X","","","<CB=EID_3100_a0030g_SNOW_STAND_MOTION>","","-1","0","0","0","35","Sto... bene... Andiamo e basta."
"","","0","1","0","EID_3100_a0030g_0040_NIER020_X","","","","<CB=EID_3100_a0030g_01_End>","-1","0","0","0","2","......"
"1044","","0","1","0","","","","","","-1","0","0","0","",""
"1045","","0","1","0","EID_3100_a0030g_030","","","","","-1","0","0","0","35",""
"1046","","0","1","0","EID_3100_a0030g_040","","","","<CB=ESCAPE_UNDERGROUND>","-1","0","0","0","35",""
"1047","","0","1","0","EID_3100_a0040g_0001_SNOW010_X","","","<CB=EID_3100_a0040g_SNOW_HEADACHE_MOTION>","<CB=EID_3100_a0040g_START_FLASH>","-1","0","0","0","35","Nnngh... Unnngh..."
"1048","","0","1","0","EID_3100_a0040g_0002_NIER020_X","","","","","-1","0","0","0","2","Emil, sicuro di stare bene?"
"","","0","1","0","EID_3100_a0040g_0010_SNOW010_X","","","","","-1","0","0","0","35","Sono... un'arma? Ma che significa? Che cosa <FONT=ITALIC>sono</FONT>?"
"","","0","1","0","EID_3100_a0040g_0015_BOOKW010_X","","","","","-1","0","0","0","26","Sembra che stia cercando di ricordare qualcosa."
"","","0","1","0","EID_3100_a0040g_0020_NIER020_X","","","","","-1","0","0","0","2","Starai bene."
"","","0","1","0","EID_3100_a0040g_0030_SNOW010_X","","","<CB=EID_3100_a0040g_SNOW_STAND_MOTION>","","-1","0","0","0","35","Dici... Dici sul serio?"
"","","0","1","0","EID_3100_a0040g_0040_NIER020_X","","","","","-1","0","0","0","2","Il passato non ha importanza. Noi saremo al tuo fianco, sempre e comunque."
"","","0","1","0","EID_3100_a0040g_0050_BOOKW010_X","","","","<CB=EID_3100_a0040g_01_End>","-1","0","0","0","26","E comunque, non credere di essere il primo di questa combriccola con problemi esistenziali."
"1049","","0","1","0","EID_3100_a0085g_0010_SNOW020_X","","","","","-1","0","0","0","35","No! Lasciatemi stare! Non guardatemi!"
"1050","","0","1","0","EID_3100_a0100_0005_SNOW020_X","","","","","0","-1","-3","0","35","......"
"","","0","1","0","EID_3100_a0100_0010_SNOW020_X","","","","","0","-1","-3","0","35","Non importa, ormai questo è il mio aspetto."
"","","0","1","0","EID_3100_a0100_0020_SNOW020_X","","","","","0","-1","-3","0","35","All'inizio ne ero terrorizzato, ma ora ho imparato a conviverci."
"","","0","1","0","EID_3100_a0100_0030_SNOW020_X","","","","","0","-1","-3","0","35","Ho la magia che desideravo e la userò per riportare indietro Kainé."
"","","0","1","0","EID_3100_a0100_0040_NIER020_X","","","","","-1","0","-1","0","2","Emil..."
"","","0","1","0","EID_3100_a0100_0050_SNOW020_X","","","","","0","-1","-3","0","35","Dobbiamo muoverci. Ci sta aspettando."
"","","0","1","0","EID_3100_a0100_0060_SNOW020_X","","","","","0","-1","-3","0","35","Spero solo che guardandomi non rimanga pietrificata.<LF>... Dalla paura!"
"","","0","1","0","EID_3100_a0100_0070_BOOKW010_X","","","","","-1","0","0","0","26","Noto con piacere che questa trasformazione non ti ha privato del tuo tremendo senso dell'umorismo."
"1051","","0","1","0","SEID_9900_S0090_9110_X","","","","","-1","0","0","0","26","Siamo qui per vedere Emil, vero?"
"1052","","0","1","0","EID_3100_a0015g_0065_NIER020_X","","","","","-1","0","0","0","2","Dobbiamo raggiungere il cortile."
"1053","1054","0","1","0","EID_3200_a0052_0010_KAINE010_X","","","","","0","-1","-2","0","28","Merda. È molto tempo."
"","","0","1","0","EID_3200_a0052_0020_KAINE010_X","","","","","0","-1","-2","0","28","Novità su Yonah?"
"","","0","1","0","EID_3200_a0052_0030_BOOKW010_X","","","","","0","-2","1025","0","26","Nessuna. Dobbiamo riuscire a rintracciare il Signore delle Ombre."
"1054","1055","0","1","0","EID_3200_a0052_0040_NIER020_X","","","<CB=EID_3200_a0052_ACTION_01>","","0","-2","-1","0","2","Ah, ho qualcosa per te."
"","","0","1","0","EID_3200_a0052_0050_KAINE010_X","","","<CB=EID_3200_a0052_ACTION_02>","","-1","0","-2","0","28","Ma è... una Lacrima lunare?!"
"","","0","1","0","EID_3200_a0052_0060_NIER020_X","","","","","-1","0","-1","0","2","Non è bella come quella di tua nonna, ma... ci ho provato."
"1055","","0","1","0","EID_3200_a0052_0070_KAINE010_X","","","<CB=EID_3200_a0052_ACTION_03>","<CB=EID_3200_a0052_ACTION_04>","-1","0","-2","0","28","No, è meravigliosa. Grazie."
"1056","","0","1","0","EID_3200_a0052_0080_POPOL010_X","","","<CB=EID_3200_a0052_ACTION_10>","<CB=EID_3200_a0052_ACTION_10_TALK_END>","-1","0","0","0","24",""
"1057","","0","1","0","EID_3200_a0052_0090_NIER020_X","","","","","0","1346","-1","0","2",""
"","","0","1","0","EID_3200_a0052_0100_POPOL010_X","","","","<CB=EID_3200_a0052_End>","0","-1","1346","0","24",""
"1058","1059","0","1","0","EID_3200_a0060_0010_NIER020_X","","","<CB=EID_3200_NIER_TALK01>","<CB=EID_3200_NIER_TALKEND>","0","1004","-1","0","2","Cosa?! Mi stai prendendo in giro?"
"","","0","1","0","EID_3200_a0060_0020_POPOL010_X","","","","","0","-1","1004","0","24","Vi prego, cercate di capire."
"","","0","1","0","EID_3200_a0060_0030_POPOL010_X","","","","","0","-1","1004","0","24","La gente è stanca e impaurita, e...<LF>Dovete scusarmi. Mi dispiace che siate voi a pagare il prezzo più alto."
"","","0","1","0","EID_3200_a0060_0040_NIER020_X","","","<CB=EID_3200_NIER_TALK01>","<CB=EID_3200_NIER_TALKEND>","0","1004","-1","0","2","Non può essere! Non puoi permetterlo!"
"1059","1060","0","1","0","EID_3200_a0060_0050_SNOW020_X","","","","","0","-1","-3","0","35","Va tutto bene."
"","","0","1","0","EID_3200_a0060_0060_SNOW020_X","","","","","0","-1","-3","0","35","Possiamo dormire fuori."
"","","0","1","0","EID_3200_a0060_0070_NIER020_X","","","<CB=EID_3200_NIER_TALK05>","<CB=EID_3200_NIER_TALKEND>","0","-3","-1","0","2","Nessuno dormirà fuori!"
"","","0","1","0","EID_3200_a0060_0080_NIER020_X","","","<CB=EID_3200_NIER_TALK01>","<CB=EID_3200_NIER_TALKEND>","0","-3","-1","0","2","Tu e Kainé avete salvato il villaggio e ora vogliono mandarvi via?!"
"","","0","1","0","EID_3200_a0060_0090_SNOW020_X","","","","","0","-1","-3","0","35","La gente ha paura di noi. E la capisco. Voglio dire, guardami."
"1060","1061","0","1","0","EID_3200_a0060_0100_SNOW020_X","","","","","0","-1","-3","0","35","Posso sopportare qualunque cosa, purché tu resti al nostro fianco."
"","","0","1","0","EID_3200_a0060_0110_SNOW020_X","","","","","0","-1","-3","0","35","Giusto, Kainé?"
"","","0","1","0","EID_3200_a0060_0120_KAINE010_X","","","","","0","-1","-2","0","28","Tanto io sono abituata a dormire fuori."
"","","0","1","0","EID_3200_a0060_0130_NIER020_X","","","","","0","-2","-1","0","2","Ma..."
"","","0","1","0","EID_3200_a0060_0140_SNOW020_X","","","","","0","-1","-3","0","35","A più tardi."
"1061","","0","1","0","EID_3200_a0060_0151_DEBOL010_X","","","<CB=EID_3200_DEBOL_TALK>","<CB=EID_3200a0060_01_End>","0","-1","1345","0","23","Mi dispiace..."
"1062","1063","0","1","0","EID_3200_a0060_0160_BOOKW010_X","","","","","-1","0","0","0","26","Qual è il problema?"
"","","0","1","0","EID_3200_a0060_0170_NIER020_X","","","","","2","0","-1","0","2","Kainé dorme sempre fuori. Non ci avevo mai pensato prima d'ora."
"","","0","1","0","EID_3200_a0060_0180_NIER020_X","","","<CB=EID_3200a0060_Nier_no>","","2","0","-1","0","2","Non mi ero mai posto il problema."
"1063","","0","1","0","EID_3200_a0060_0190_NIER020_X","","","","","2","0","-1","0","2","Accidenti..."
"","","0","1","0","EID_3200_a0060_0200_BOOKW010_X","","","","<CB=EID_3200a0060_02_End>","-1","0","0","0","26","... Dovremmo riposare."
"1064","1065","1","1","0","EID_3200_a0070_0010_NIER020_X","","","","","-1","0","0","0","",""
"1065","1066","1","1","0","EID_3200_a0070_0020_NIER020_X","","","","","-1","0","0","0","",""
"1066","1067","1","1","0","EID_3200_a0070_0030_NIER020_X","","","","","-1","0","0","0","",""
"1067","1068","1","1","0","EID_3200_a0070_0040_NIER020_X","","","","","-1","0","0","0","",""
"1068","1069","1","1","0","EID_3200_a0070_0050_NIER020_X","","","","","-1","0","0","0","",""
"1069","1070","1","1","0","EID_3200_a0070_0060_NIER020_X","","","","","-1","0","0","0","",""
"1070","1071","1","1","0","EID_3200_a0070_0070_NIER020_X","","","","","-1","0","0","0","",""
"1071","1072","1","1","0","EID_3200_a0070_0080_NIER020_X","","","","","-1","0","0","0","",""
"1072","1073","1","1","0","EID_3200_a0070_0090_NIER020_X","","","","","-1","0","0","0","",""
"1073","","1","1","0","EID_3200_a0070_0100_NIER020_X","","","","","-1","0","0","0","",""
"1074","","0","1","0","EXID_ADE_NIER020_00010","","","<CB=NIER_Lip_open>","<CB=NIER_Lip_close>","-1","0","0","1","2","... Dovrei scusarmi con Kainé ed Emil."
"","","0","1","0","EXID_ADE_NIER020_00020","","","<CB=NIER_Lip_open>","<CB=NIER_Lip_close>","-1","0","0","1","2","Ma..."
"","","0","1","0","EXID_ADE_NIER020_00030","","","<CB=Nier_No><LF><CB=NIER_Lip_open>","<CB=NIER_Lip_close><LF><CB=Start_kaine_snow_voice>","-1","0","0","1","2","A cosa servirebbe?"
"1075","","0","1","0","EXID_ADE_NIER020_00040","","","<CB=NIER015_025_wait_3>","<CB=NIER_Lip_close><LF><CB=EID_9600_a0010_0020_END>","-1","0","0","1","2","Un attimo... Quella è...?"
"1076","1077","0","1","0","EXID_ADE_SNOW_00050","","","<CB=Camera_EID_9600_a0010_0030_03><LF><CB=SNOW020_eventSitTalk><LF><CB=KAINE015_eventSit_lp><LF><CB=SNOW_Lip_open>","<CB=SNOW_Lip_close>","0","-2","-3","1","35","Sono così felice di poter parlare di nuovo con te, Kainé!"
"","","0","1","0","EXID_ADE_KAINE_00040","","","<CB=KAINE015_eventSitTalk><LF><CB=SNOW020_eventSit_lp><LF><CB=KAINE_Lip_open>","<CB=KAINE_Lip_close>","0","-3","-2","1","28","Sì, anche io."
"","","0","1","0","EXID_ADE_SNOW_00060","","","<CB=SNOW020_eventSitTalk><LF><CB=KAINE015_eventSit_lp><LF><CB=SNOW_Lip_open>","<CB=SNOW_Lip_close>","1","-2","-3","1","35","Ho provato a salvarti in ogni modo..."
"","","0","1","0","EXID_ADE_SNOW_00070","","","<CB=SNOW_Lip_open>","<CB=SNOW_Lip_close>","1","-2","-3","1","35","Ti ho lucidata con un panno speciale, ti ho rovesciato addosso dell'acqua calda, ho..."
"","","0","1","0","EXID_ADE_KAINE_00050","","","<CB=KAINE015_eventSitTalk><LF><CB=SNOW020_eventSit_lp><LF><CB=KAINE_Lip_open>","<CB=KAINE_Lip_close>","1","-3","-2","1","28","Aspetta... Mi hai rovesciato addosso dell'<FONT=ITALIC>acqua</FONT>?"
"","","0","1","0","EXID_ADE_SNOW_00080","","","<CB=KAINE015_eventSitTalk><LF><CB=SNOW020_eventSit_lp><LF><CB=SNOW_Lip_open>","<CB=SNOW_Lip_close>","1","-2","-3","1","35","Eh eh! Sì. Ma non ha fatto altro che renderti ancora più brillante."
"1077","","0","1","0","EXID_ADE_KAINE_00060","","","<CB=KAINE015_eventSitTalk><LF><CB=SNOW020_eventSit_lp><LF><CB=KAINE_Lip_open>","<CB=KAINE_Lip_close>","1","-3","-2","1","28","......"
"","","0","1","0","EXID_ADE_KAINE_00070","","","<CB=Camera_EID_9600_a0010_0030_04><LF><CB=KAINE_Lip_open>","<CB=KAINE_Lip_close>","1","-3","-2","1","28","Ehi, Emil... Grazie per avermi salvata."
"","","0","1","0","EXID_ADE_SNOW_00090","","","<CB=SNOW020_eventSitTalk><LF><CB=KAINE015_eventSit_lp><LF><CB=SNOW_Lip_open>","<CB=SNOW_Lip_close>","1","-2","-3","1","35","Immagino tu abbia notato che sono... diverso da prima."
"","","0","1","0","EXID_ADE_KAINE_00080","","","<CB=KAINE015_eventSitTalk><LF><CB=SNOW020_eventSit_lp><LF><CB=KAINE_Lip_open>","<CB=KAINE_Lip_close>","1","-3","-2","1","28","Mi dispiace per tutto quello che è successo, Emil."
"","","0","1","0","EXID_ADE_SNOW_00100","","","<CB=SNOW020_eventSitTalk><LF><CB=KAINE015_eventSit_lp><LF><CB=SNOW_Lip_open>","<CB=SNOW_Lip_close>","1","-2","-3","1","35","Beh, in fondo, questo nuovo corpo non è così male!"
"","","0","1","0","EXID_ADE_SNOW_00110","","","<CB=SNOW_Lip_open>","<CB=SNOW_Lip_close>","1","-2","-3","1","35","Almeno posso guardarti mentre parliamo!"
"","","0","1","0","EXID_ADE_SNOW_00120","","","<CB=SNOW_Lip_open>","<CB=SNOW_Lip_close>","1","-2","-3","1","35","Ecco... perché non mi dici qualcosa di te?"
"","","0","1","0","EXID_ADE_KAINE_00090","","","<CB=Camera_EID_9600_a0010_0030_05><LF><CB=KAINE015_eventSitTalk><LF><CB=SNOW020_eventSit_lp><LF><CB=KAINE_Lip_open>","<CB=KAINE_Lip_close>","1","-3","-2","1","28","Non sono una persona interessante."
"","","0","1","0","EXID_ADE_SNOW_00130","","","<CB=SNOW020_eventSitTalk><LF><CB=KAINE015_eventSit_lp><LF><CB=SNOW_Lip_open>","<CB=SNOW_Lip_close>","1","-2","-3","1","35","Dai! Voglio solo conoscerti meglio. Per favoreee!"
"","","0","1","0","EXID_ADE_KAINE_00100","","","<CB=KAINE015_eventSitTalk><LF><CB=SNOW020_eventSit_lp><LF><CB=KAINE_Lip_open>","<CB=KAINE_Lip_close>","1","-3","-2","1","28","E va bene."
"","","0","1","0","EXID_ADE_KAINE_00110","","","<CB=Camera_EID_9600_a0010_0030_06><LF><CB=KAINE_Lip_open>","<CB=KAINE_Lip_close>","1","-3","-2","1","28","È successo tutto quando ero una bambina... prima di essere posseduta da un'Ombra."
"","","0","1","0","EXID_ADE_KAINE_00120","","","<CB=KAINE_Lip_open>","<CB=KAINE_Lip_close>","1","-3","-2","1","28","Il mio corpo è... diverso. E quando gli abitanti del mio villaggio l'hanno scoperto, hanno iniziato a trattarmi come un mostro."
"","","0","1","0","EXID_ADE_KAINE_00130","","","<CB=Camera_EID_9600_a0010_0030_07><LF><CB=KAINE_Lip_open>","<CB=KAINE_Lip_close>","1","-3","-2","1","28","Solo mia nonna mi ha accettata per quella che ero."
"","","0","1","0","EXID_ADE_KAINE_00140","","","<CB=KAINE_Lip_open>","<CB=KAINE_Lip_close>","1","-3","-2","1","28","Nonostante i continui soprusi, lei mi dava la forza per continuare."
"","","0","1","0","EXID_ADE_SNOW_00140","","","<CB=Camera_EID_9600_a0010_0030_08><LF><CB=SNOW020_eventSitTalk><LF><CB=KAINE015_eventSit_lp><LF><CB=SNOW_Lip_open>","<CB=SNOW_Lip_close>","1","-2","-3","1","35","Era una persona molto speciale per te, vero?"
"","","0","1","0","EXID_ADE_KAINE_00150","","","<CB=KAINE015_eventSitTalk><LF><CB=SNOW020_eventSit_lp><LF><CB=KAINE_Lip_open>","<CB=EID_9600_a0010_Next><LF><CB=KAINE_Lip_close>","1","-3","-2","1","28","Sì."
"1078","1079","0","1","0","EXID_ADE_SNOW_00150","","","<CB=SNOW020_eventSitTalk><LF><CB=KAINE015_eventSit_lp><LF><CB=SNOW_Lip_open>","<CB=SNOW_Lip_close>","1","-2","-3","1","35","Oh, mi è venuta un'idea!"
"","","0","1","0","EXID_ADE_SNOW_00160","","","<CB=SNOW_Lip_open>","<CB=SNOW_Lip_close>","1","-2","-3","1","35","Dato che abbiamo curato la pietrificazione, dovremmo cercare una cura per la tua possessione e per il mio corpo!"
"","","0","1","0","EXID_ADE_SNOW_00170","","","<CB=SNOW_Lip_open>","<CB=SNOW_Lip_close>","1","-2","-3","1","35","Se la cerchiamo tutti insieme, so che ce la faremo!"
"","","0","1","0","EXID_ADE_SNOW_00180","","","<CB=SNOW_Lip_open>","<CB=SNOW_Lip_close>","1","-2","-3","1","35","Sono sicuro che sarà facilissimo!"
"1079","","0","1","0","EXID_ADE_KAINE_00160","","","<CB=KAINE015_eventSitTalk><LF><CB=SNOW020_eventSit_lp>","<CB=KAINE_Lip_close>","1","-3","-2","1","28","Per festeggiare, vuoi buttarmi dell'altra acqua addosso?"
"","","0","1","0","EXID_ADE_SNOW_00190","","","<CB=Camera_EID_9600_a0010_0060_02><LF><CB=SNOW020_eventSitTalk><LF><CB=KAINE015_eventSit_lp><LF><CB=SNOW_Lip_open>","<CB=SNOW_Lip_close>","1","-2","-3","1","35","D'accordo, facciamo finta che io non ti abbia detto niente a riguardo."
"","","0","1","0","EXID_ADE_KAINE_00170","","","<CB=SNOW020_eventSitTalk><LF><CB=KAINE015_eventSitTalk>","<CB=EID_9600_a0010_End><LF><CB=KAINE_Lip_close>","1","-3","-2","1","28","Eh..."
"1080","","0","1","0","EXID_ADE_NIER020_00050","","","","","-1","0","0","1","2","......"
"1081","","0","1","0","EID_3200_a0500g_0001_BOOKW010_X","","","","","-1","0","0","0","26","Dormito bene?"
"","","0","1","0","EID_3200_a0500g_0002_NIER020_X","","","<CB=EID_3200_a0500g_Nier_Talk_F>","","-1","0","0","0","2","Certo."
"","","0","1","0","EID_3200_a0500g_0003_BOOKW010_X","","","","","-1","0","0","0","26","Quegli occhi rossi dicono il contrario."
