"1325","","0","1","0","RID_VILOLMD_00070","","","","","-1","0","0","0","8","Ich ertrage den Gedanken nicht, dass junge Menschen von Schatten getötet werden. Bitte kommt gesund und munter wieder, ja?"
"1326","","0","1","0","ID_9800_a0080g_0250_01","","","","","-1","0","0","0","2","Ich werde wiederkommen. Das schwöre ich."
"","","0","1","0","EID_9800_a0080g_0250_02","","","","","-1","0","0","0","26","Wenn unser Kampf beendet ist, wird hier sicherlich wieder Leben einkehren."
"1327","","0","1","0","RID_VILBOYB_00050","","","","","-1","0","0","0","71","Ich werde genauso stark werden wie Ihr und dann Schatten jagen!"
"1328","","0","1","0","RID_VILWIFA_00070","","","","","-1","0","0","0","108","In gefährlichen Zeiten wie diesen, müssen die Familien zusammenhalten. Also geht und holt Eure Schwester!"
"1329","","0","1","0","RID_VILWIFB_00070","","","","","-1","0","0","0","8","In letzter Zeit gibt es nur schlimme Neuigkeiten. Aber wenn Ihr Yonah zurückbringt, wird dieses Dorf das größte Fest feiern, das Ihr je gesehen habt!"
"1330","","0","1","0","RID_VILGUNA_00040","","","","","-1","0","0","0","9","Das Dorf schuldet Euch viel. Wenn wir irgendwie helfen können, dann sagt es nur."
"1331","","0","1","0","RID_VILGUC_00040","","","","","-1","0","0","0","9","Schaltet diesen Schattenfürsten aus und kommt unversehrt zurück, ja?"
"1332","","0","1","0","RID_VILYTHE_00070","","","","","-1","0","0","0","8","Die Schatten beim Dorf sind schon hart genug. Ich kann mir kaum vorstellen, wie stark der Schattenfürst sein mag!"
"1333","","0","1","0","RID_VILYTHD_00050","","","","","-1","0","0","0","8","Ihr erledigt den Schattenfürsten, und ich kümmere mich hier um alles, in Ordnung?"
"","","0","1","0","RID_VILYTHD_00060","","","","","-1","0","0","0","8","Sobald der Frieden wiederhergestellt ist, werde ich Popola sagen, was ich für sie empfinde ... also BITTE, BITTE scheitert nicht, in Ordnung?!"
"","","0","1","0","EID_9800_a0080g_0330_02","","","","","-1","0","0","0","26","Ich mache mir Sorgen um die Zukunft dieses armen Kerls."
"1334","","0","1","0","RID_VILGIRLE_00030","","","","","-1","0","0","0","171","Denkt Ihr, Yonah wird mit mir spielen, wenn sie wieder da ist?"
"1335","","0","1","0","RID_VILBOYC_00040","","","","","-1","0","0","0","71","Ist Eure Schwester süß?"
"1336","","0","1","0","RID_VILGIRLD_00030","","","","","-1","0","0","0","71","Ich will mit Yonah spielen! Bitteee?"
"1337","","0","1","0","RID_VILGUF_00020","","","","","-1","0","0","0","9","Wir haben schon alle Hände voll zu tun, nur das Dorf zu beschützen. Und Ihr zieht einfach los und tötet den Schattenfürsten!"
"1338","","0","1","0","RID_VILWIFD_00030","","","","","-1","0","0","0","108","Zeit, Eure Schwester zu retten, hm? Viel Glück."
"1339","","0","1","0","RID_VILMANG_00030","","","","","-1","0","0","0","8","Man sagt, Ihr wollt aufbrechen, um den Schattenfürsten zu töten."
"1340","","0","1","0","RID_VILMANG_00040","","","","","-1","0","0","0","8","Passt auf Euch auf, ja? Bleibt bloß am Leben!"
"1341","","0","1","0","RID_VILMANF_00040","","","","","-1","0","0","0","8","Ich hoffe, ich kann den Dorfbewohnern irgendwie helfen ..."
"1342","","0","1","0","RID_VILWIFE_00020","","","","","-1","0","0","0","108","Wenn Ihr gefährliche Orte aufsucht, dann seid bloß vorsichtig."
"1343","","0","1","0","RID_VILMANH_00030","","","","","-1","0","0","0","8","Ich weiß, dass es keinen Zweck hat, zu versuchen, Euch davon abzuhalten. Daher werde ich einfach auf Eure sichere Rückkehr warten."
"1344","","0","1","0","RID_POPOL_00170","","","","","0","-1","1004","0","24","Bitte seid vorsichtig ..."
"1345","","0","1","0","RID_DEBOL_00050","","","","","0","-1","1344","0","23","Seid vorsichtig, in Ordnung?"
"1346","","0","1","0","EID_5000_a0030_0010_KAINE010_X","","","","","0","-1","-2","0","28","Sind wir bereit?"
"","","0","1","0","EID_5000_a0030_0020_SNOW020_X","","","","","0","-1","-3","0","35","Sehen wir zu, dass wir alle lebend zurückkehren, in Ordnung?"
"","","0","1","0","EID_5000_a0030_0030_NIER020_X","","","","","1","0","-1","0","2","Klingt nach einem guten Plan."
"1347","","0","1","0","EID_6000_a0005_0010_BOOKW010_X","","","","","-1","0","0","0","26","Und nun ist der Weg frei."
"1348","","0","1","0","EID_6000_a0015g_0050_BIRD_X","","","","","-1","0","0","0","66","Zu wem spricht die wahre Stimme?"
"","","0","1","0","EID_6000_a0015g_0060_BIRD_X","","","","","-1","0","0","0","66","Wem offenbart sich die wahre Form?"
"","","0","1","0","EID_6000_a0015g_0070_BIRD_X","","","","","-1","0","0","0","66","Ihr müsst antworten."
"","","0","1","0","EID_6000_a0015g_0080_SNOW020_X","","","","","1","0","-3","0","35","Er ... Er kann sprechen!"
"","","0","1","0","EID_6000_a0015g_0090_BIRD_X","","","","","-1","0","0","0","66","Ich frage:"
"","","0","1","0","EID_6000_a0015g_0100_BIRD_X","","","","","-1","0","0","0","66","Warum sind die Menschen von der Welt verschwunden?"
"","","0","1","0","EID_6000_a0015g_0110_NIER020_X","","","","","1","0","-1","0","2","Woher zur Hölle soll ich das wissen?"
"","","0","1","0","EID_6000_a0015g_0120_BOOKW010_X","","","","","-1","0","0","0","26","Ich glaube, das ist eine Art Passwort."
"","","0","1","0","EID_6000_a0015g_0130_NIER020_X","","","","","1","0","-1","0","2","Passwort?"
"","","0","1","0","EID_6000_a0015g_0140_BOOKW010_X","","","","","-1","0","0","0","26","Ja. Die richtige Antwort sollte uns Zugang zur Burg gewähren."
"","","0","1","0","EID_6000_a0015g_0150_BOOKW010_X","","","","","-1","0","0","0","26","Ich bin sicher, das schon einmal gehört zu haben ..."
"1349","","0","1","0","EID_6000_a0015g_0155_SYS_X","","","","","-1","0","0","0","","<LIST=2439>Weil ihr Leben kurz ist.</LIST><LF><LIST=1350>Wegen einer schwarzen Krankheit.</LIST>"
"1350","","2","1","0","","","","","<CB=BIRD_QUESTION_1st_SUCCESS>","-1","0","0","0","",""
"1351","","0","1","0","EID_6000_a0015g_0170_BOOKW010_X","","","","","-1","0","0","0","26","Ich antworte: Wegen einer schwarzen Krankheit."
"","","0","1","0","EID_6000_a0015g_0180_BIRD_X","","","","","-1","0","0","0","66","Ich frage:"
"","","0","1","0","EID_6000_a0015g_0190_BIRD_X","","","","","-1","0","0","0","66","Wie können die Menschen ihr Leben verlängern?"
"1352","","0","1","0","EID_6000_a0015g_0195_SYS_X","","","","","-1","0","0","0","","<LIST=2440>Indem sie Blätter des heiligen Baums erwerben.</LIST><LF><LIST=1353>Durch die Trennung von Körper und Seele.</LIST>"
"1353","","2","1","0","","","","","<CB=BIRD_QUESTION_2nd_SUCCESS>","-1","0","0","0","",""
"1354","","0","1","0","EID_6000_a0015g_0210_BOOKW010_X","","","","","-1","0","0","0","26","Ich antworte: Durch die Trennung von Körper und Seele."
"","","0","1","0","EID_6000_a0015g_0220_BIRD_X","","","","","-1","0","0","0","66","Ich frage: Wozu sind Seelen bestimmt?"
"1355","","0","1","0","EID_6000_a0015g_0225_SYS_X","","","","","-1","0","0","0","","<LIST=2442>Sie werden in ihren entsprechenden Hüllen platziert.</LIST><LF><LIST=2441>Sie sind im gelobten Land und strahlen hell.</LIST>"
"1356","","2","1","0","","","","","<CB=BIRD_QUESTION_FAILED>","-1","0","0","0","",""
"1357","","0","1","0","EID_6000_a0015g_0251_BIRD_X","","","","","-1","0","0","0","66","Na schön."
"","","0","1","0","EID_6000_a0015g_0252_BIRD_X","","","","","-1","0","0","0","66","Ihr seid als Meister anerkannt."
"","","0","1","0","EID_6000_a0015g_0260_BIRD_X","","","","<CB=BIRD_QUESTION_SUCCESS>","-1","0","0","0","66","Ihr dürft eintreten."
"1358","1356","0","1","0","EID_6000_a0015g_0160_BOOKW010_X","","","","","-1","0","0","0","26","Ich antworte: Weil ihr Leben kurz ist."
"1359","1356","0","1","0","EID_6000_a0015g_0200_BOOKW010_X","","","","","-1","0","0","0","26","Ich antworte: Indem sie Blätter des heiligen Baums erwerben."
"1360","1356","0","1","0","EID_6000_a0015g_0240_BOOKW010_X","","","","","-1","0","0","0","26","Ich antworte: Sie sind im gelobten Land und strahlen hell."
"1361","","0","1","0","EID_6000_a0015g_0250_BOOKW010_X","","","","","-1","0","0","0","26","Mist. Offenbar habe ich einen Fehler gemacht."
"1362","","0","1","0","EID_6000_a0015g_0050_BIRD_X","","","","","-1","0","0","0","66","Zu wem spricht die wahre Stimme?"
"","","0","1","0","EID_6000_a0015g_0060_BIRD_X","","","","","-1","0","0","0","66","Wem offenbart sich die wahre Form?"
"","","0","1","0","EID_6000_a0015g_0090_BIRD_X","","","","","-1","0","0","0","66","Ich frage:"
"","","0","1","0","EID_6000_a0015g_0100_BIRD_X","","","","","-1","0","0","0","66","Warum sind die Menschen von der Welt verschwunden?"
"","","0","1","0","EID_6000_a0015g_0070_BIRD_X","","","","","-1","0","0","0","66","Ihr müsst antworten."
"1363","","0","1","0","EID_6000_a0020_0010_BOOKW010_X","","","","","-1","0","0","0","26","Hmm? Das sind die Zwillinge aus deinem Dorf."
"","","0","1","0","EID_6000_a0020_0020_NIER020_X","","","","","1","0","-1","0","2","Popola? Devola? Was macht ihr denn hier?"
"","","0","1","0","EID_6000_a0020_0031_DEBOL010_X","","","","","0","-1","1345","0","23","Sag mal, besteht eine Chance, dass ihr einfach ... zurück zum Dorf geht?"
"","","0","1","0","EID_6000_a0020_0040_POPOL010_X","","","","","0","-1","1346","0","24","Dies ist ein sehr gefährlicher Ort."
"","","0","1","0","EID_6000_a0020_0051_DEBOL010_X","","","","","1","-1","1345","0","23","Selbst wenn ihr Yonah hier findet, könnt ihr sie wahrscheinlich nicht rausholen."
"","","0","1","0","EID_6000_a0020_0060_BOOKW010_X","","","","","-1","0","0","0","26","Wie seid ihr hierhergekommen?"
"","","0","1","0","EID_6000_a0020_0071_POPOL010_X","","","","","1","-1","1346","0","24","Psst. Wir stellen im Moment die Fragen."
"1364","","2","1","0","","","","","<CB=EID_6000_a0020_Select01>","-1","0","0","0","",""
"1365","","2","1","0","","","","","<CB=EID_6000_a0020_Select02>","-1","0","0","0","",""
"1366","","2","1","0","","","","","<CB=EID_6000_a0020_Select03>","-1","0","0","0","",""
"1367","","2","1","0","","","","","<CB=EID_6000_a0030_Select01>","-1","0","0","0","",""
"1368","","2","1","0","","","","","<CB=EID_6000_a0030_Select02>","-1","0","0","0","",""
"1369","","0","1","0","EID_6000_a0020_007049_SYS_X","","","","","-1","0","0","0","","<LIST=1365>Wir sind hier, um Yonah zu retten.</LIST><LF><LIST=1366>Was macht ihr beiden hier?</LIST><LF><LIST=1364>Sie haben recht. Lasst uns ins Dorf zurückkehren.</LIST>"
"1370","","0","1","0","EXID_ADD_NIER020_00050","","","","","-1","0","0","0","2","Sie haben recht. Lasst uns ins Dorf zurückkehren."
"","","0","1","0","EID_6000_a0020_0080_BOOKW010_X","","","","","-1","0","0","0","26","Möchtest du wirklich zurückgehen?"
"1371","","0","1","0","EID_4230_a0095g_00095_SYS_X","","","","","-1","0","0","0","","<LIST=1367>Ja</LIST><LF><LIST=1368>Nein</LIST>"
"1372","","0","1","0","EXID_ADD_NIER020_00060","","","","","-1","0","0","0","2","... Ja, gehen wir zurück."
"1373","","0","1","0","EXID_ADD_NIER020_00070","","","","","-1","0","0","0","2","Nein! Yonah ist so nah!"
"1374","","0","1","0","EXID_ADD_NIER020_00030","","","","","0","1345","-1","0","2","Wir sind hier, um Yonah zu retten."
"","","0","1","0","EID_6000_a0020_0091_DEBOL010_X","","","","","0","-1","1345","0","23","Keine Chance, hm? Na ja, ich denke, wir haben keine Wahl."
"","","0","1","0","EID_6000_a0020_0101_POPOL010_X","","","","<CB=EID_6000_a0020_02_Start>","0","-1","1346","0","24","Nein, ich denke nicht. Wie schade."
"1375","","2","1","0","","","","","<CB=EID_6000_a0020_01_End>","-1","0","0","0","",""
"1376","","2","1","0","","","","","<CB=RETURN_VILLAGE>","-1","0","0","0","",""
"1377","","0","1","0","EXID_ADD_NIER020_00040","","","","","0","1346","-1","0","2","Was macht ihr beiden hier?"
"","","0","1","0","EXID_ADD_POPOL_00010","","","","<CB=EID_6000_a0020_Select03_01>","0","-1","1346","0","24","Das werde ich nicht beantworten. Das ist wohl offensichtlich."
"1378","1379","0","1","0","EID_6000_a0112_0010_NIER020_X","","","","","0","0","-1","0","2","Devola! Popola!"
"1379","","0","1","0","EID_6000_a0112_0020_DEBOL010_X","","","","","0","-1","1345","0","23","Oh, sieh an. Du hast es geschafft."
"","","0","1","0","EID_6000_a0112_0031_POPOL010_X","","","","","0","-1","1346","0","24","Wir haben so lange gewartet."
"","","0","1","0","EID_6000_a0112_0040_NIER020_X","","","<CB=snow_Nier_No>","","-1","0","0","0","2","Warum tut ihr das?!"
"","","0","1","0","EID_6000_a0112_0050_DEBOL010_X","","","","","0","-1","1345","0","23","Es begann vor tausenddreihundert Jahren."
"","","0","1","0","EID_6000_a0112_0060_POPOL010_X","","","","","0","-1","1346","0","24","Die Menschheit, die kurz vor ihrer Auslöschung stand, unternahm einen letzten, verzweifelten Rettungsversuch<LF>namens ""Projekt Gestalt""."
"","","0","1","0","EID_6000_a0112_0070_BOOKW010_X","","","","","-1","0","0","0","26","Ge...stalt ...?"
"","","0","1","0","EID_6000_a0112_0080_POPOL010_X","","","","","0","-1","1346","0","24","Erinnerst du dich immer noch nicht, Grimoire Weiss?"
"","","0","1","0","EID_6000_a0112_0090_DEBOL010_X","","","","<CB=EID_6000_a0112_01_Next>","0","-1","1345","0","23","Dann möchte ich dein Gedächtnis auffrischen."
"1380","1381","0","1","0","EID_6000_a0112_0100_BOOKW010_X","","","","","-1","0","0","0","26","Ngh ..."
"","","0","1","0","EID_6000_a0112_0110_NIER020_X","","","<CB=snow_Look_White>","","-1","0","0","0","2","Weiss!"
"","","0","1","0","EID_6000_a0112_0120_BOOKW010_X","","","","","-1","0","0","0","26","Arrrrrgh ... Mein ... Verstand ... Garrgghhh!"
"1381","1382","0","1","0","EID_6000_a0112_0130_BOOKW010_X","","","<CB=snow_White_Stop>","","-1","0","0","0","26","Ich ... Ich erinnere mich ..."
"","","0","1","0","EID_6000_a0112_0140_BOOKW010_X","","","","","-1","0","0","0","26","Devola ... Popola ... Ihr seid keine Menschen. Genau genommen ... Oh, nein ..."
"","","0","1","0","EID_6000_a0112_0150_DEBOL010_X","","","<CB=snow_Look_White_End>","","0","-1","1345","0","23","Ja, die Wahrheit kann mitunter ziemlich unangenehm sein.<LF>Möchtest du diesen Gedanken für ihn zu Ende bringen, Schwester?"
"","","0","1","0","EID_6000_a0112_0160_POPOL010_X","","","","","0","-1","1346","0","24","Wir alle hier, jede Person in diesem Raum, sind lediglich Hüllen, die von den wahren Menschen erschaffen wurden."
"","","0","1","0","EID_6000_a0112_0170_NIER020_X","","","","","0","0","-1","0","2","Was redest du da?"
"","","0","1","0","EID_6000_a0112_0180_DEBOL010_X","","","","","0","-1","1345","0","23","Hast du es <FONT=ITALIC>immer noch nicht</FONT> begriffen? Du bist kein Mensch!"
"","","0","1","0","EID_6000_a0112_0190_SNOW020_X","","","","","0","0","-3","0","35","Dann sind die Menschen also ... Ich meine, die wahren Menschen ... sind ausgestorben?"
"1382","","0","1","0","EID_6000_a0112_0200_BOOKW010_X","","","","","-1","0","0","0","26","Nein. Sie leben immer noch. Ihr kennt sie allerdings als Schatten."
"","","0","1","0","EID_6000_a0112_0210_BOOKW010_X","","","","","-1","0","0","0","26","Jeder Schatten ist ein verdrehter Überrest dessen, was einst ein Mensch war."
"","","0","1","0","EID_6000_a0112_0220_DEBOL010_X","","","","","0","-1","1345","0","23","Verrückt, hm? Jetzt lasst uns den Teil überspringen, wo ihr mit offenem Mund dasteht, und zur Sache kommen."
"","","0","1","0","EID_6000_a0112_0230_NIER020_X","","","","","-1","0","0","0","2","Moment ... Moment!"
"","","0","1","0","EID_6000_a0112_0241_DEBOL010_X","","","","","0","-1","1345","0","23","Tut mir leid, aber wir benötigen eure Hüllen.<LF>Ihre rechtmäßigen Besitzer haben schon sehr lange darauf gewartet."
"","","0","1","0","EID_6000_a0112_0250_POPOL010_X","","","","","0","-1","1346","0","24","Bitte seid nicht sauer auf uns. Wir erfüllen nur unsere Pflicht."
"","","0","1","0","EID_6000_a0112_0260_DEBOL010_X","","","","<CB=EID_6000_a0112_01_End>","0","-1","1345","0","23","Unsere endlose Existenz hat nur einen Zweck: das Leben anderer zu kontrollieren, und zwar gemäß des Willens der wahren Menschen."
"1383","","0","1","0","EID_7000_a0010_0010_NIER020_X","","","<CB=LIB_SetProhibitionTalkMotion,1>","","-1","0","-1","0","2","Geht es Yonah gut?"
"1384","1385","0","1","0","EID_7000_a0010_0020_NIER020_X","","","","","-1","0","-1","0","2","Oh Gott, nein ..."
"1385","","0","1","0","EID_7000_a0010_0030_BOOKW010_X","","","","<CB=EID_7000_a0010_02_02>","-1","0","0","0","26","Also bitte! Dem Mädchen geht es gut."
"1386","1387","0","1","0","EID_7000_a0010_0040_NIER020_X","","","","","-1","0","-1","0","2","Weiss?!"
"1387","1388","0","1","0","EID_7000_a0010_0050_NIER020_X","","","","","-1","0","-1","0","2","Wo bist du? Alles in Ordnung?"
"","","0","1","0","EID_7000_a0010_0060_BOOKW010_X","","","","","-1","0","0","0","26","Mir geht es so gut, wie nur möglich, wenn ich bedenke, dass ich meine physische Form verloren habe!"
"","","0","1","0","EID_7000_a0010_0070_BOOKW010_X","","","","","-1","0","0","0","26","Zweifellos wird meine Stimme als Nächstes schwinden, also hör gut zu!"
"","","0","1","0","EID_7000_a0010_0080_BOOKW010_X","","","","","-1","0","0","0","26","Deine Schwester ist in Sicherheit."
"","","0","1","0","EID_7000_a0010_0090_BOOKW010_X","","","","<CB=EID_7000_a0010_02_03>","-1","0","0","0","26","Trauere nicht um sie. Gib die Hoffnung nicht auf. Rufe sie stattdessen zu dir zurück."
"1388","","0","1","0","EID_7000_a0010_0100_NIER020_X","","","","","-1","0","-1","0","2","Aber wie?"
"","","0","1","0","EID_7000_a0010_0110_BOOKW010_X","","","","","-1","0","0","0","26","Nutze deine Erinnerungen. Rufe dir die Zeit, die du mit ihr verbracht hast, ins Gedächtnis."
"","","0","1","0","EID_7000_a0010_0120_BOOKW010_X","","","","","-1","0","0","0","26","Beweise ihr, dass ihr beide noch immer am Leben seid und dass euer Leben einen Sinn hat."
"","","0","1","0","EID_7000_a0010_0130_NIER020_X","","","","","-1","0","-1","0","2","Ich ... Ich weiß nicht ..."
"","","0","1","0","EID_7000_a0010_0140_BOOKW010_X","","","","<CB=EID_7000_a0010_02_04><LF><CB=LIB_SetProhibitionTalkMotion,0>","-1","0","0","0","26","Typisch ... Aber fass dir ein Herz. Ich weiß, dass du es tun kannst."
"1389","1390","0","1","0","EID_9000_a0011g_0020_NIER020_X","","","","","-1","0","-1","0","2","Kainé? Was ist los?"
"","","0","1","0","EID_9000_a0011g_0030_KAINE010_X","","","","","-1","0","-2","0","28","Hör mir zu."
"1390","","0","1","0","EID_9000_a0011g_0040_KAINE010_X","","","","","-1","0","-2","0","28","Der Schatten in meinem Inneren wächst, und ich kann ihn nicht aufhalten."
"","","0","1","0","EID_9000_a0011g_0050_KAINE010_X","","","","","-1","0","-2","0","28","Bald, ... sehr bald ... werde ich durchdrehen."
"","","0","1","0","EID_9000_a0011g_0060_TYRANN_X","","","","","-1","0","0","0","58","Ich kann mich nicht länger zurückhalten ..."
"","","0","1","0","EID_9000_a0011g_0070_NIER020_X","","","","","-1","0","-1","0","2","Kainé, du musst kämpfen! Du musst ..."
"","","0","1","0","EID_9000_a0011g_0080_KAINE010_X_R","","","","","-1","0","-2","0","28","Halt einfach die Klappe und hör mir zu!"
"1391","1392","0","1","0","EID_9000_a0030_0010_KAINE010_X","","","","","-1","0","0","0","28","Ich ... Ich ..."
"1392","","0","1","0","EID_9000_a0030_0020_TYRANN_X","","","<CB=BGM_EID_9000_a0030>","","-1","0","0","0","58","Nuuun, es gäbe da vielleicht eine Möglichkeit, sie zu retten ..."
"","","0","1","0","EID_9000_a0030_0030_NIER020_X","","","","","1","0","-1","0","2","Wer hat das gesagt?"
"","","0","1","0","EID_9000_a0030_0040_TYRANN_X","","","","","-1","0","0","0","58","Das spielt keine Rolle, also frag nicht! Sei einfach still und hör zu."
"","","0","1","0","EID_9000_a0030_0050_NIER020_X","","","","<CB=EID_9000_a0030_01_End>","1","0","-1","0","2","Moment, bist du etwa ..."
"1393","","0","1","0","EID_9000_a0030_0060_TYRANN_X","","","","","-1","0","0","0","58","Ich sagte ZUHÖREN!"
"","","0","1","0","EID_9000_a0030_0070_TYRANN_X","","","","","-1","0","0","0","58","Es gibt einen Weg, Kaines Leben zu retten. Okay?"
"","","0","1","0","EID_9000_a0030_0080_TYRANN_X","","","","","-1","0","0","0","58","Aber du musst eine schwierige Entscheidung treffen."
"","","0","1","0","EID_9000_a0030_0090_NIER020_X","","","","","1","0","-1","0","2","Ich werde alles tun, was nötig ist."
"","","0","1","0","EID_9000_a0030_0100_TYRANN_X","","","","","-1","0","0","0","58","Wenn die Zeit gekommen ist, werde ich Kaine am Boden festhalten."
"","","0","1","0","EID_9000_a0030_0110_TYRANN_X","","","","","-1","0","0","0","58","Sobald ich das tue, musst du ihr Herz durchstoßen."
"","","0","1","0","EID_9000_a0030_0120_NIER020_X","","","","","1","0","-1","0","2","Nein! Das kann ich nicht!"
"","","0","1","0","EID_9000_a0030_0130_TYRANN_X","","","","","-1","0","0","0","58","Na schön! Glaub mir nicht. Steh einfach rum und dreh Däumchen, während du sie einen grausamen Tod sterben siehst."
"","","0","1","0","EID_9000_a0030_0140_NIER020_X","","","","","1","0","-1","0","2","... Du willst, dass ich dir glaube?"
"1394","","0","1","0","EID_9000_a0040_0120_SYS_X","","","","","-1","0","0","0","","Was soll ich tun?<LF><LIST=1395>Kainés Leben beenden und sie von ihrer Last befreien.</LIST><LF><LIST=1396>Dein eigenes Leben opfern, um Kainé wieder zu einem Menschen zu machen.</LIST>"
"1395","","2","1","0","","","","","<CB=Ending_BA>","-1","0","0","0","",""
"1396","","2","1","0","","","","","<CB=Ending_BB>","-1","0","0","0","",""
"1397","1398","1","1","0","NV_ID_0521","","","<CB=BGM_EID_3200_a0015_01>","","-1","0","0","0","","Das Prasseln des Regens erfüllte das Dorf."
"","","1","1","0","NV_ID_0522","","","","","-1","0","0","0","","Die steilen Klippen in der umliegenden Gegend verstärkten das Geräusch, so dass selbst der leichteste Nieselregen wie ein Gewitter klang."
"","","1","1","0","NV_ID_0523","","","","","-1","0","0","0","","Dünne Rauchschwaden stiegen aus den Hütten auf, während die Dorfbewohner es sich in ihren Häusern bequem machten und auf das Ende des Regens warteten."
"","","1","1","0","NV_ID_0524","","","","","-1","0","0","0","","Ein einzelnes Kind jedoch trotzte dem Regenguss und wanderte nun langsam in Richtung der hölzernen Wetterfahne in Form eines Adlers im Stadtzentrum."
"","","1","1","0","NV_ID_0525","","","","","-1","0","0","0","","Das Kind erreichte die Wetterfahne, die bereits seit ewigen Zeiten existierte, und starrte sie an. <STOP>Das Gesicht des Kindes war sanft und grimmig zugleich – wie eine Teetasse, die ein Schiffsunglück überlebt hat. Diese Gesichtszüge, in Verbindung mit einer blassen weißen Haut, verliehen dem Gesicht ein nahezu geschlechtsloses Aussehen."
"","","1","1","0","NV_ID_0526","","","","","-1","0","0","0","","<FONT=ITALIC>Wenn sich der Schnabel nach Osten dreht, gehe ich heim.</FONT> <STOP><FONT=ITALIC>Wenn er weiterhin nach Westen zeigt, dann ...</FONT>"
"","","1","1","0","NV_ID_0527","","","","","-1","0","0","0","","Das Kind blinzelte. Der Regen lief ihm langsam über die kurzen Haare und begann seinen langen Abstieg zum Boden."
"1398","1399","1","1","0","NV_ID_0531","","","","","-1","0","0","0","","<FONT=ITALIC>Komm schon.</FONT> <STOP><FONT=ITALIC>Komm schon!</FONT>"
"","","1","1","0","NV_ID_0533","","","","","-1","0","0","0","","Das Kind spürte eine leichte Brise und sah zu, wie die Wetterfahne langsam zum Leben erwachte. <STOP>Nachdem sie sich einen Moment lang in verschiedene Richtungen gedreht hatte, zeigte ihr Schnabel letztendlich entschlossen nach Osten."
"","","1","1","0","NV_ID_0534","","","","","-1","0","0","0","","<FONT=ITALIC>Nach Osten?</FONT> <STOP><FONT=ITALIC>... Wirklich?</FONT>"
"","","1","1","0","NV_ID_0535","","","","","-1","0","0","0","","Ehe sich die Wetterfahne erneut bewegen konnte, kam ein spitzer Stein durch die Luft geflogen und traf das Kind am Kopf. <STOP>Die Wucht des Aufschlags warf das Kind zu Boden, während ein Hagel von Steinen um es herum niederging."
"","","1","1","0","NV_ID_0536","","","","","-1","0","0","0","","<FONT=ITALIC>Oh nein. Sie haben mich gefunden.</FONT>"
"1399","1400","1","1","0","NV_ID_0537","","","","","-1","0","0","0","","Ein herzzerreißendes Lächeln überkam das Gesicht des Kindes, während weiterhin Steine flogen. <STOP>Durch den Regen konnte man den Klang zahlreicher Schritte lauter werden hören, ehe eine Stimme erklang."
"","","1","1","0","NV_ID_0538","","","","","-1","0","0","0","","""Juu-huu! Kainé!"""
"","","1","1","0","NV_ID_0539","","","","","-1","0","0","0","","Die Stimme gehörte Dimo, er war der schlimmste Tyrann von Adlerhorst."
"","","1","1","0","NV_ID_0540","","","","","-1","0","0","0","","Als Kainé versuchte aufzustehen, kam ein letzter Stein durch den Matsch geflogen und schlug gegen ihren Fuß. <STOP>Blut triefte aus einer Wunde über ihrem Auge und vernebelte ihre Sicht, aber sie konnte die Umrisse von Dimo und seiner üblichen Bande von Idioten erkennen. <STOP>Der Junge schien angesichts des Blutes für einen Moment aus der Fassung gebracht worden zu sein, spielte dann aber schnell wieder den Draufgänger."
"","","1","1","0","NV_ID_0541","","","","","-1","0","0","0","","""Was ist los, Freak? Magst du den Regen? Magst du es, ganz nass zu werden? Oder hast du dich endlich entschieden, von zu Hause wegzulaufen?""<PAGE>"
"","","1","1","0","NV_ID_0542","","","","","-1","0","0","0","","Obwohl sie wusste, dass es vergeblich sein würde, wandte sich Kainé ab, um zu gehen. <STOP>Bevor sie mehr als ein paar Schritte zurücklegen konnte, wurde sie von den anderen Kindern umstellt, deren Augen von Grausamkeit erfüllt waren."
"","","1","1","0","NV_ID_0546","","","","","-1","0","0","0","","Kainé wusste, dass dies nicht die einzigen Augen waren, die auf ihr ruhten. Die Eltern der Quälgeister schauten aus der Sicherheit ihrer Häuser zu. Sie war an diesen Umstand gewöhnt, da sie das schon viele Male zuvor erlebt hat."
"","","1","1","0","NV_ID_0547","","","","","-1","0","0","0","","Während manche Dorfbewohner die Taten ihrer Kinder einfach ignorierten, ermutigten andere sie ganz offen.<LF><STOP>In einer Gesellschaft, die von Aberglauben und Furcht geprägt war, war Kainé etwas, das man hassen, und wenn möglich zerstören sollte."
"1400","1401","1","1","0","NV_ID_0548","","","","","-1","0","0","0","","""Ich habe nicht gesagt, dass du gehen darfst, Freak."""
