"","","0","1","0","RID_VILGUG_00030","","","","","0","-1","1214","0","9","Die Leute sagen, dass ein Schatten es in unser Dorf geschafft hat."
"","","0","1","0","RID_VILGUG_00040","","","","<CB=LIB_SET_START_SUBQUEST,1954,77,2,1214,1787>","0","-1","1214","0","9","Ich hatte gehofft, Ihr könntet ihn ausfindig machen."
"1787","","0","1","0","SEID_4430_S0020_0041_X","","","","","0","1214","-1","0","2","Dies ist kein sonderlich großer Ort. Hätten wir ihn nicht bereits sehen müssen?"
"","","0","1","0","RID_VILGUG_00050","","","","<CB=SEID_4430_S0020_a0010_01>","0","-1","1214","0","9","Ich hatte zunächst auch Zweifel, aber es gibt zu viele Augenzeugen, um die Sache noch länger zu ignorieren."
"1788","","0","1","0","RID_VILGIRLC_00020","","","","","0","-1","1226","0","171","Ich habe ein echt unheimliches Monster gesehen!"
"","","0","1","0","SEID_4430_S0020_0070_X","","","","","0","1214","-1","0","2","Sie hat es auch gesehen?"
"","","0","1","0","RID_VILGUG_00060","","","","","0","-1","1214","0","9","Anscheinend. Ich kann nicht mit Sicherheit sagen, wer es gesehen hat und wer nicht."
"","","0","1","0","RID_VILGIRLC_00030","","","","","0","-1","1226","0","171","Ich habe das Monster ganz hier in der Nähe gesehen!"
"","","0","1","0","SEID_4430_S0020_0100_X","","","","","0","1226","-1","0","2","Tatsächlich? Weißt du noch, wie das Monster ausgesehen hat?"
"","","0","1","0","RID_VILGIRLC_00040","","","","","0","-1","1226","0","171","Es war drüben beim Fluss, und es war riesig und total unheimlich! ... Das fand ich gar nicht schön."
"","","0","1","0","SEID_4430_S0020_0120_X","","","","","0","1226","-1","0","2","Drüben beim Fluss, hm? Lass uns da mal nachsehen."
"1789","","0","1","0","RID_VILGIRLC_00050","","","","","0","-1","1226","0","171","Ich habe es am Fluss gesehen. Es war RIESIG!"
"1790","","0","1","0","SEID_4430_S0020_0140_X","","","","","0","0","0","0","2","Tja, ich weiß nicht. Es sieht nicht aus, als wäre hier je ein Schatten gewesen."
"","","0","1","0","SEID_4430_S0020_0150_X","","","","","-1","0","0","0","26","Vielleicht hat das kleine Mädchen sich nicht an die richtige Stelle erinnert."
"","","0","1","0","SEID_4430_S0020_0160_X","","","","","0","0","0","0","2","Tja, vielleicht. Kinder sind darin nicht besonders gut. Wir sollten sie noch einmal befragen."
"1791","","0","2","0","RID_NIER_01030","","","","","0","1226","-1","0","2","Wir haben an der Stelle nachgesehen, wo du das Monster gesehen hast. Aber da war nichts. Bis du sicher, dass du es am Fluss gesehen hast?"
"","","0","1","0","RID_VILGIRLC_00060","","","","","0","-1","1226","0","171","Ähm ... Ach! Oh, oh! Jetzt erinnere ich mich!"
"","","0","1","0","RID_VILGIRLC_00070","","","","","0","-1","1226","0","171","Ich habe es auf dem Platz vor der Bibliothek gesehen!"
"","","0","1","0","SEID_4430_S0020_0200_X","","","","<CB=SEID_4430_S0020_a0040_End>","0","1226","-1","0","2","Also gut. Schauen wir da mal nach."
"1792","","0","1","0","RID_VILGIRLC_00080","","","","","0","-1","1226","0","171","Ich habe es hinter dem Tor zur Bibliothek gesehen!"
"1793","","0","1","0","SEID_4430_S0020_0220_X","","","","","0","0","0","0","2","Hier ist nichts. Ich nehme an, das Kind lag mal wieder daneben."
"","","0","1","0","SEID_4430_S0020_0230_X","","","","","-1","0","0","0","26","Das ist doch vergebliche Mühe. Nicht einmal ein junges Mädchen würde ein Bibliothekstor mit einem Fluss verwechseln! Vielleicht sollten wir mal die anderen Dorfbewohner befragen."
"","","0","1","0","SEID_4430_S0020_0240_X","","","","","0","0","0","0","2","Tja, stimmt wohl ..."
"1794","","0","1","0","RID_VILGIRLC_00090","","","","","0","-1","1226","0","171","Ich habe ein großes gruseliges Monster auf dem Platz vor dem Südtor gesehen!"
"1795","","0","2","0","RID_VILWIFB_00130","","","","<CB=SEID_4430_S0020_a0060_0020_End>","0","-1","1207","0","108","Ich glaube, ich habe vor ein paar Tagen einen Schatten gesehen, aber ganz sicher bin ich mir nicht. Aber was auch immer ich gesehen habe, es war kaum größer als ein Kind."
"1796","","0","2","0","RID_VILWIFE_00030","","","","<CB=SEID_4430_S0020_a0060_0030_End>","0","-1","1225","0","108","Ich habe etwas in der Nähe des Geschäftsviertels gesehen, das irgendwie wie ein Schatten aussah. Ihr wisst schon, wenn man blinzelt."
"1797","","0","2","0","RID_VILGUB_00111","","","","<CB=SEID_4430_S0020_a0060_0040_End>","0","-1","1201","0","8","Ein Schatten? Oh, ja, ich habe ihn gesehen. Hat mir ganz schön Angst eingejagt, das sage ich Euch! Seltsamerweise wurde er von einem Kind begleitet."
"1798","","0","1","0","SEID_4430_S0020_0285_X","","","","","0","0","0","0","26","Die Geschichte des Mädchens passt nicht gut zu den Augenzeugenberichten der übrigen Dorfbewohner. Ich glaube, wir sollten sie noch weiter befragen."
"1799","","0","2","0","RID_NIER_01040","","","","","0","1226","-1","0","2","Hör zu, ich bin nicht sauer. Aber du musst mir die Wahrheit sagen. Warum hast du wegen des Schattens gelogen?"
"","","0","1","0","RID_VILGIRLC_00100","","","","","0","-1","1226","0","171","Ich lüge NICHT! Ich habe ihn gesehen! Er war groß und unheimlich und ... und ... und groß!"
"","","0","1","0","SEID_4430_S0021_0310_X","","","","","-1","1226","1025","0","26","Dann sag uns Folgendes: An welchem Ort hast du den Schatten NICHT gesehen?"
"","","0","1","0","RID_VILGIRLC_00110","","","","<CB=SEID_4430_S0020_a0080_0010_End>","0","-1","1226","0","171","Ihr seid merkwürdig. Aber, ähm, ich glaube, ich habe ihn nicht in der Nähe des Nordtors oder auf dem Hügel im Westen gesehen!"
"1800","","0","1","0","RID_VILGIRLC_00120","","","","","0","-1","1226","0","171","Das Monster ist nicht am Nordtor und nicht auf dem Westhügel. Ja?"
"","","0","1","0","SEID_4430_S0020_0340_X","","","","","-1","1226","1025","0","26","Na schön."
"1801","","0","1","0","SEID_4430_S0020_0350_X","","","","","0","0","0","0","2","Da ist er."
"","","0","1","0","SEID_4430_S0020_0360_X","","","","","0","0","0","0","2","Dieses Kind muss versucht haben, ihn zu beschützen."
"","","0","1","0","SEID_4430_S0020_0370_X","","","","","-1","0","0","0","26","Eine rührende Geschichte, aber Menschen und Schatten können nicht nebenher existieren. Wir sollten dieses Monster lieber besiegen, solange wir noch können."
"","","0","1","0","SEID_4430_S0020_0380_X","","","","","0","0","0","0","2","Vermutlich."
"1802","","0","2","0","RID_VILGUG_00080","","","","<CB=SEID_4430_S0020_a0080_0050_End>","0","-1","1214","0","9","Vielen lieben Dank. Ich hatte schon schlaflose Nächte bei dem Gedanken, dass in unserer Stadt Schatten sind!"
"1803","","0","1","0","RID_VILGUG_00090","","","","","0","-1","1214","0","9","Ich hoffe, das war das letzte Mal, dass wir von Schatten im Dorf gehört haben ..."
"1804","","0","1","0","RID_VILGIRLC_00130","","","","","0","-1","1226","0","171","Hmm, hier ist er nicht. Ich frage mich, wo er wohl hin ist?"
"1805","","0","2","0","RID_NIER_01300","","","","","0","1280","-1","0","2","Hey. Wir haben uns lange nicht gesehen. Wie geht es Euch?"
"","","0","1","0","RID_SEAYTHA_00200","","","","","0","-1","1280","0","19","Großartig, danke! Meine Freesien gehen weg wie warme Semmeln!"
"","","0","1","0","SEID_4430_S0030_0030_X","","","","","0","1280","-1","0","2","Schön zu hören. Aber hey, wer ist denn das?"
"","","0","1","0","RID_SEAYTHA_00210","","","","","0","-1","1280","0","19","Das sind meine Frau und mein Sohn."
"","","0","1","0","SEID_4430_S0030_0050_X","","","","","0","1280","-1","0","2","Moment mal, Ihr habt geheiratet?"
"","","0","1","0","RID_SEAYTHA_00220","","","","<CB=LIB_SET_START_SUBQUEST,1965,78,17,1280,1806>","0","-1","1280","0","19","Ja, ich hatte beschlossen, dass es Zeit wurde, wieder in Bewegung zu kommen ... Ach, übrigens: Seid Ihr auf der Suche nach Arbeit?"
"1806","","0","1","0","SEID_4430_S0030_0070_X","","","","","0","1280","-1","0","2","Immer. Was benötigt Ihr?"
"","","0","1","0","RID_SEAYTHA_00230","","","","","0","-1","1280","0","19","Ich habe einen Kunden in Fassade, der eine Freesie braucht, und ich hatte gehofft, dass Ihr sie ausliefern könntet."
"","","0","1","0","RID_SEAYTHA_00240","","","","","0","-1","1280","0","19","Mein Kunde betreibt den Materialienladen dort. Mir ist klar, dass das recht weit weg ist, aber ..."
"","","0","1","0","SEID_4430_S0030_0100_X","","","","","0","1280","-1","0","2","Keine große Sache."
"","","0","1","0","RID_SEAYTHA_00250","","","","<CB=SEID_4430_S0030_a0010_End>","0","-1","1280","0","19","Danke!"
"1807","","0","1","0","RID_SEAYTHA_00260","","","","","0","-1","1280","0","19","Liefert für mich eine Freesie in Fassade ab, in Ordnung?"
"1808","","0","2","0","RID_NIER_01310","","","","","0","1246","-1","0","2","Erwartet Ihr eine Freesie?"
"","","0","1","0","RID_MSKMAT_00060","","","","","0","-1","1246","0","150","(Meine Güte ... Das bringt Erinnerungen zurück.)"
"","","0","1","0","SEID_4430_S0030_0150_X","","","","","0","1246","-1","0","2","Erinnerungen an was?"
"","","0","1","0","RID_MSKMAT_00070","","","","","0","-1","1246","0","150","(An viele Dinge, sowohl angenehme als auch traurige. Ich habe nämlich früher mal in Adlerhorst gelebt.)"
"","","0","1","0","SEID_4430_S0030_0170_X","","","","","0","1246","-1","0","2","Ach, dann sollte ich Euch wohl sagen ..."
"","","0","1","0","RID_MSKMAT_00080","","","","","0","-1","1246","0","150","(Dass es zerstört wurde? Ja, das ... weiß ich bereits.)"
"","","0","1","0","RID_MSKMAT_00090","","","","","0","-1","1246","0","150","(Das kleine Mädchen, das nebenan wohnte, liebte seine Freesien. Wir haben sie uns immer in die Haare gesteckt und ...)"
"","","0","1","0","RID_MSKMAT_00100","","","","","0","-1","1246","0","150","(Wie auch immer, irgendwann wurde sie von einem Schatten angegriffen.)"
"","","0","1","0","RID_MSKMAT_00110","","","","","0","-1","1246","0","150","(Bevor ich irgendwas tun konnte, verwandelte sie sich in ein Monster.)"
"","","0","1","0","RID_MSKMAT_00120","","","","","0","-1","1246","0","150","(Ich glaube nicht, dass die Erwachsenen mir geglaubt haben, aber ich weiß, was ich gesehen habe. Das weiß ich.)"
"","","0","1","0","RID_MSKMAT_00130","","","","<CB=SEID_4430_S0030_a0030_End>","0","-1","1246","0","150","(Egal, genug davon. Vielen Dank für die Blume.)"
"1809","","0","1","0","SEID_4430_S0030_0240_X","","","","","-1","0","0","0","26","Diese Geschichte klingt leider vertraut, oder?"
"","","0","1","0","SEID_4430_S0030_0250_X","","","","","-1","0","0","0","2","Ja. Das tut sie."
"1810","","0","1","0","RID_MSKMAT_00140","","","","","0","-1","1246","0","150","(Diese Blume birgt ein paar schreckliche Erinnerungen, aber auch ein paar gute.)"
"1811","","0","2","0","RID_NIER_01320","","","","","0","1280","-1","0","2","Ich habe die Freesie abgeliefert."
"","","0","1","0","RID_SEAYTHA_00270","","","","<CB=SEID_4430_S0030_a0050_01>","0","-1","1280","0","19","Ach, danke. Hier ist Euer Lohn."
"1812","","0","1","0","SEID_4430_S0030_0290_X","","","","<CB=SEID_4430_S0030_a0050_SELECT>","0","1280","-1","0","2","..."
"1813","","0","1","0","SEID_4430_S0030_0300_X","","","","","-1","0","0","0","","<LIST=1814>Erwähne seine Geliebte.</LIST><LF><LIST=1815>Erwähne sie nicht.</LIST>"
"1814","","2","1","0","","","","","<CB=SEID_4430_S0030_a0050_0030_Talk>","-1","0","0","0","",""
"1815","","2","1","0","","","","","<CB=SEID_4430_S0030_a0050_0080_Talk>","-1","0","0","0","",""
"1816","","0","1","0","SEID_4430_S0030_0310_X","","","","<CB=SEID_4430_S0030_a0050_02>","0","1280","-1","0","2","Hört zu, das wird nicht leicht zu verstehen sein, aber ich denke, Ihr habt ein Recht, es zu erfahren ..."
"1817","","0","1","0","RID_SEAYTHA_00300","","","","","0","-1","1280","0","19","Was ...? Nein. Oh, nein ..."
"","","0","1","0","SEID_4430_S0030_0330_X","","","","","-1","0","0","0","26","Tut mir leid."
"","","0","1","0","RID_SEAYTHA_00310","","","","","0","-1","1280","0","19","Wenn ich sie doch nur eher herbeigerufen hätte ..."
"","","0","1","0","SEID_4430_S0030_0350_X","","","","","-1","0","0","0","2","..."
"","","0","1","0","SEID_4430_S0030_0360_X","","","","","-1","0","0","0","26","Es ist vermutlich besser, den armen Mann erstmal alleine zu lassen."
"","","0","1","0","SEID_4430_S0030_0370_X","","","","<CB=SEID_4430_S0030_a0050_End02>","0","0","-1","0","2","Ja."
"1818","","0","1","0","RID_NIER_01330","","","","","0","1349","-1","0","2","Sagt, wo ist Euer Ehemann?"
"","","0","1","0","RID_SEAWOMF_00041","","","","","0","-1","1349","0","119","Letzte Nacht schnappte er sich ein Schwert und rannte aus dem Haus! Ich sage Euch, ich habe ihn noch nie so wütend gesehen!"
"","","0","1","0","SEID_4430_S0030_0400_X","","","","","0","1349","-1","0","2","Das klingt nicht gut."
"","","0","1","0","RID_SEAWOMF_00050","","","","<CB=SEID_4430_S0030_a0055_End>","0","-1","1349","0","119","Er wird zurückkommen. Ich weiß es genau. Und mein Kind und ich werden auf ihn warten – egal, wie lange das dauert."
"1819","","0","1","0","RID_SEAWOMF_00050","","","","","0","-1","1349","0","119","Er wird zurückkommen. Ich weiß es genau. Und mein Kind und ich werden auf ihn warten – egal, wie lange das dauert."
"1820","","0","1","0","RID_SEABOYL_00030","","","","","0","-1","1348","0","71","Wo ist Papa hingegangen?"
"1821","","0","1","0","SEID_4430_S0030_0440_X","","","","","0","1280","-1","0","2","Ihr habt eine gute Frau und einen tollen Sohn. Kümmert Euch um sie, in Ordnung?"
"","","0","1","0","RID_SEAYTHA_00280","","","","<CB=SEID_4430_S0030_a0050_End01>","0","-1","1280","0","19","Das werde ich tun! Meine Familie ist mein Ein und Alles, und ich werde tun, was immer nötig ist, um sie glücklich zu machen."
"1822","","0","1","0","RID_SEAYTHA_00290","","","","","0","-1","1280","0","19","Ich werde alles tun, was nötig ist, um meine Familie glücklich zu machen."
"1823","","0","2","0","RID_NIER_01450","","","<CB=SEID_5000_S0020_a0030_Start>","","0","1004","-1","0","2","Weißt du irgendwas über einen magischen Wahrsagerstein?"
"","","0","1","0","SEID_5000_S0020_0130_X","","","","","0","-1","1004","0","24","Ach, meinst du das Auge der Macht?"
"","","0","1","0","SEID_5000_S0020_0132_X","","","","","0","-1","1004","0","24","Und ja, ich weiß, dass der Name lustig klingt. Aber so nennt man die Dinger halt."
"","","0","1","0","SEID_5000_S0020_0134_X","","","","","0","-1","1004","0","24","Warum fragst du?"
"","","0","1","0","SEID_5000_S0020_0140_X","","","","","0","1004","-1","0","2","Ich möchte jemandem helfen. Hast du eine Ahnung, wo ich einen finden könnte?"
"","","0","1","0","SEID_5000_S0020_0150_X","","","","","0","-1","1004","0","24","Hmmm ... Tja, es gab mal welche auf dem Dach des Verschollenen Schreins. Ich möchte fast wetten, sie sind immer noch dort."
"","","0","1","0","SEID_5000_S0020_0160_X","","","","<CB=SEID_5000_S0020_a0030_End>","0","1004","-1","0","2","In Ordnung. Ich werde es mal beim Verschollenen Schrein versuchen."
"1824","","0","1","0","SEID_5000_S0020_0170_X","","","","","-1","0","0","0","2","Das muss ein Auge der Macht sein."
"","","0","1","0","SEID_5000_S0020_0180_X","","","","","0","-1","-3","0","35","Ach du meine Güte! Ich kann fühlen, wie die Magie aus ihm sprudelt!"
"","","0","1","0","SEID_5000_S0020_0190_X","","","","","0","-1","1025","0","26","Ich muss sagen, ich bin beeindruckt. Das Wahrsagen mit einem derart mächtigen Stein sollte ziemlich genaue Resultate hervorbringen."
"1825","","0","1","0","SEID_5000_S0020_0250_X","","","","","-1","0","0","0","2","Nnngh ..."
"","","0","1","0","SEID_5000_S0020_0260_X","","","","","-1","0","0","0","28","Ja, was ...? Wo sind wir?"
"","","0","1","0","SEID_5000_S0020_0270_X","","","","","-1","0","0","0","35","Etwas Vergleichbares habe ich noch nie gesehen."
"","","0","1","0","SEID_5000_S0020_0280_X","","","","","-1","0","0","0","26","Für eine Besichtigung haben wir keine Zeit! Die Schatten kommen!"
"1826","","2","1","0","","","","","","-1","0","0","0","",""
"1827","","0","2","0","RID_VILOLMA_00070","","","","","0","-1","1038","0","8","Ach, den Göttern sei Dank, Ihr seid hier! Wir haben hier Probleme."
"","","0","1","0","SEID_9900_S0010_9020_X_NIER020","","","","","0","1038","-1","0","2","Welche Art von Schwierigkeiten?"
"","","0","1","0","RID_VILOLMA_00080","","","","","0","-1","1038","0","8","Da ist ein Wildschwein in den Nordfeldern, das Dorfbewohner angreift."
"","","0","1","0","RID_VILOLMA_00090","","","","","0","-1","1038","0","8","Die Opfer haben es alle zurückgeschafft, aber wer weiß, ob wir nächstes Mal auch so viel Glück haben?"
"","","0","1","0","SEID_9900_S0010_9050_X_NIER020","","","","","0","1038","-1","0","2","Also wollt Ihr, dass ich es töte?"
"","","0","1","0","RID_VILOLMA_00100","","","","<CB=LIB_SET_START_SUBQUEST,1603,13,2,1038,1828>","0","-1","1038","0","8","Ja. Und wir würden Euch großzügig dafür entlohnen."
"1828","","0","1","0","SEID_9900_S0010_9071_X","","","","","0","1038","-1","0","2","In Ordnung."
"","","0","1","0","RID_VILOLMA_00110","","","","","0","-1","1038","0","8","Ach, und noch ein Ratschlag: Wenn Ihr es tötet, nehmt einen Hauer an Euch."
"","","0","1","0","RID_VILOLMA_00120","","","","<CB=LIB_SET_END_SUBQUEST>","0","-1","1038","0","8","Sagen wir einfach mal, der könnte nützlich werden."
"1829","","0","1","0","RID_VILOLMA_00130","","","","","0","-1","1038","0","8","Beeilung! Tötet dieses Wildschwein!"
"1830","","0","2","0","RID_VILOLMA_00140","","","","","0","-1","1038","0","8","Ihr habt das Wildschwein erlegt? Oh, vielen Dank!"
"","","0","1","0","RID_VILOLMA_00150","","","","","0","-1","1038","0","8","Und es sieht so aus, als hättet Ihr auch einen Hauer gefunden!"
"","","0","1","0","RID_VILOLMA_00160","","","","","0","-1","1038","0","8","Man sagt, dass Wildschweine in der Nähe seines Trägers zahm werden."
"","","0","1","0","RID_VILOLMA_00170","","","","","0","-1","1038","0","8","Offenbar lassen sie ihn sogar auf sich reiten!"
"","","0","1","0","RID_VILOLMA_00180","","","","<CB=B_SEID_9900_S0010_a0050_End>","0","-1","1038","0","8","Das klingt in meinen Ohren nach Unfug, aber wenn Ihr den Mumm habt, könnt Ihr es gerne ausprobieren."
"1831","","0","1","0","RID_VILOLMA_00190","","","","","0","-1","1038","0","8","Nun können wir wieder ungestört über die Felder gehen."
"1832","","0","1","0","RID_VILWOMB_00040","","","","","0","-1","1388","0","108","Niemand kauft mehr neue Kleidung. Alle wollen nur ihre alte Kleidung ausgebessert haben."
"1833","","0","1","0","RID_VILLIQ_00030","","","","","0","-1","1185","0","116","Nachdem die Kinder gestorben waren, um die sie sich am Brunnen gekümmert hatte, hat meine Großmutter nach und nach den Verstand verloren."
"","","0","1","0","RID_VILLIQ_00040","","","","","0","-1","1185","0","116","Um Euch mache ich mir Sorgen. Seid Yonah verschwunden ist, seid Ihr ein anderer Mensch."
"","","0","1","0","NID_1010_v0011_0050_X","","","","","0","1185","-1","0","2","Danke, aber um mich braucht Ihr Euch wirklich keine Sorgen zu machen."
"1834","","0","1","0","EID_all_worry02_VILLNOG_X_2","","","","","0","-1","1038","0","8","*seufz* Ich warte nun schon seit Jahren darauf, dass es mit den Verkäufen wieder aufwärts geht ..."
"1835","","0","3","0","RID_VILTOOL_00070","","","","","0","-1","1203","0","10","Ihr verlasst das Dorf? Dann vergesst nicht, Eure Vorräte aufzustocken."
"1836","","0","3","0","RID_VILTOOL_00081","","","","","0","-1","1203","0","10","Könnt Ihr hier nicht öfter einkaufen? Ich bin fast pleite!"
"1837","","0","3","0","RID_VILMAT_00040","","","","","0","-1","1187","0","11","Danke, dass Ihr gekommen seid! Ich habe ein paar großartige Materialien im Angebot!"
"1838","","0","3","0","RID_VILMAT_00050","","","","","0","-1","1187","0","11","Die Zeiten sind hart."
"1839","","0","1","0","RID_VILFLOW_00030","","","","","0","-1","1188","0","112","Ich weiß, die Welt da draußen ist hart, aber gibt es einen besseren Zeitpunkt, Blumen blühen zu lassen?"
"1840","","0","1","0","RID_VILFLOW_00040","","","","","0","-1","1188","0","112","Mein Mann meckert ständig mit mir, dass es derzeit nichts bringt, Blumen zu pflanzen."
"1841","","0","1","0","RID_NIER_00151","","","","","0","1189","-1","0","2","Fünf Jahre ist es her, dass diese Schatten angegriffen haben. Inzwischen finden sie sich überall auf den Nordfeldern."
"","","0","1","0","NID_1010_v0010_0130_X","","","","","0","1189","-1","0","2","Ich hatte den Schattenfürsten direkt vor mir, konnte ihn aber nicht erledigen ..."
"","","0","1","0","RID_VILGUNB_00030","","","","","0","-1","1189","0","9","Ach, nun kommt schon! Lacht mal wieder! Denn wenn IHR depressiv werdet, dann gibt es für uns WIRKLICH keine Hoffnung mehr!"
"1842","","0","1","0","RID_VILGUSA_00030","","","","","0","-1","1190","0","9","Zuerst fingen die Schatten an, leichte Körperrüstung zu tragen, und nun geraten auch noch die Postboten ins Hintertreffen! Ich sag Euch, das ist eine harte alte Welt."
"","","0","1","0","RID_VILGUSA_00040","","","","","0","-1","1190","0","9","Zu schade, dass wir mit Meeresfront nicht in Kontakt bleiben können. Sie waren unser Haupthandelspartner und nun scheint es, als hätten wir ständig zu wenig Lebensmittel."
"1843","","0","1","0","RID_VILGUEB_00030","","","","","0","-1","1191","0","9","Wir werden im Dorf für Sicherheit sorgen. Konzentriert Ihr Euch nur darauf, Yonah zurückzuholen."
"","","0","1","0","NID_1010_v0010_0180_X","","","","","0","1191","-1","0","2","Oh, das werde ich tun."
"1844","","0","1","0","RID_VILGUSB_00050","","","","","0","-1","1192","0","9","Schatten sind in Meeresfront ein alltäglicher Anblick geworden. Wie ich gehört habe, machen die Leute dort schwere Zeiten durch."
"1845","","0","1","0","RID_VILGUA_00020","","","","","0","-1","1193","0","9","Verlasst Ihr uns schon wieder?"
"","","0","1","0","NID_1010_v0010_0210_X","","","","","0","1193","-1","0","2","Ja. Ich bin sicher, dass ich heute eine Spur zu Yonah finde."
"1846","","0","1","0","RID_VILGUEA_00020","","","","","0","-1","1194","0","9","Immer mehr Schatten kommen neuerdings mit Licht klar. Bald wird es keinen sicheren Ort mehr auf der Welt geben!"
"1847","","0","1","0","RID_VILOLMC_00040","","","","","0","-1","1195","0","8","Puh. Nun, da ich all meine Einkäufe in einem Rutsch erledige, werden diese Taschen ziemlich schwer!"
"1848","","0","1","0","EID_all_worry02_VILLNOW_X_2","","","","","0","-1","1196","0","108","Die Älteren haben es schwer in diesen Tagen! Die Preise sind hoch, und ich kann meinen Gürtel nicht noch enger schnallen."
"1849","","0","3","0","RID_VILWEP_00040","","","","","0","-1","1197","0","14","Willkommen! Wir haben ein paar neue Waffen auf Lager!"
"1850","","0","3","0","RID_VILWEP_00050","","","","","0","-1","1197","0","14","Schmiede machen in Zeiten wie diesen ein gutes Geschäft. Das Gesetz von Angebot und Nachfrage, nehme ich an."
"1851","","0","1","0","RID_VILWIFC_00050","","","","","0","-1","1198","0","108","Möchtet Ihr etwas kaufen?"
"1852","","0","1","0","RID_VILWOME_00020","","","","","0","-1","1199","0","108","Warum musste er sterben? Was ist diese Runenpest überhaupt? Warum passiert das nur uns? Warum?!"
"","","0","1","0","NID_1010_v0010_0560_X","","","","","-1","0","0","0","2","..."
"","","0","1","0","NID_1010_v0010_0290_X","","","","","-1","0","0","0","26","Vielleicht sollten wir lieber gehen."
"1853","","0","1","0","RID_VILWOMD_00040","","","","","0","-1","1390","0","108","Da die Schatten überhandnehmen und die Tiere sterben, wird sogar Hammelfleisch teuer."
"1854","","0","1","0","RID_VILOLMB_00030","","","","","0","-1","1200","0","8","Das Einzige, woran ich in letzter Zeit denken kann, ist Essen. Ich würde alles geben, um mal wieder Fleisch essen zu können ..."
"1855","","0","1","0","RID_VILGUB_00030","","","","","0","-1","1201","0","9","Die Schatten könnten jederzeit zuschlagen, daher muss ich stets wachsam bleiben! *seufz* Ich erinnere mich noch an Zeiten, wo die Patrouillen im Geschäftsviertel ein Spaziergang waren ..."
"1856","","0","1","0","RID_VILMANA_00070","","","","","0","-1","1202","0","8","Ich nehme nicht an, dass Ihr Schafe oder Wildschweine für uns jagen könntet? Das wüssten wir wirklich zu schätzen!"
"1857","","0","1","0","RID_VILMANB_00030","","","","","0","-1","1186","0","8","Die Schatten machen es unmöglich, auf die gewohnte Weise zu jagen. Daher gehen unsere Nahrungsmittelvorräte rasant zur Neige."
"1858","","0","1","0","RID_VILFOOD_00050","","","","","0","-1","1204","0","113","Ich weiß, dass momentan nichts wirklich billig ist, aber wir haben keine Wahl."
"1859","","0","1","0","RID_VILFOOD_00060","","","","","0","-1","1204","0","113","Kommt bald wieder."
"1860","","0","1","0","RID_VILOLMD_00040","","","","","0","-1","1391","0","8","Immer mehr unserer Söhne und Töchter gehen auf die Jagd und kehren nicht zurück. Was sollen wir bloß tun?"
"1861","","0","1","0","RID_VILOLWC_00030","","","","","0","-1","1205","0","108","Ihr Kinder habt auf jeden Fall ziemlich viel Energie! Ihr werdet stolpern und hinfallen, wenn ihr weiter so herumtollt."
"","","0","1","0","NID_1010_v0010_0380_X","","","","","-1","0","0","0","2","..."
"","","0","1","0","NID_1010_v0010_0390_X","","","","","-1","0","0","0","26","Am besten lassen wir sie in Ruhe. Wo auch immer sie im Geiste jetzt ist, dort wird es ihr wohl besser gehen."
"1862","","0","1","0","RID_VILBOYB_00030","","","","","0","-1","1392","0","71","Warum darf ich das Geschäftsviertel zum Spielen nicht verlassen? Hm? Warum nicht?"
"1863","","0","1","0","RID_VILWIFA_00040","","","","","0","-1","1206","0","108","Es wird schon wieder ein Jäger vermisst! Ich mache mir solche Sorgen um meinen Mann ..."
"1864","","0","1","0","RID_VILWIFB_00050","","","","","0","-1","1207","0","108","Wenn man nicht jagen geht, muss man hungern. Aber WENN man jagen geht, töten einen die Schatten! ... Ich hasse diese Gegend."
"1865","","0","1","0","EID_all_worry03_VILLNMG_X_1","","","","","0","-1","1208","0","9","Wenn es hart auf hart kommt, werde ich dieses Dorf verlassen. Und ja, ich weiß nicht viel über die Welt da draußen, aber es <FONT=ITALIC>kann nur</FONT> besser sein als hier!"
