"","","0","1","0","SEID_3000_S0180_0400_X","","","","","-1","0","0","0","","""Temo che la malattia che devasta il mio corpo si prenderà presto la mia vita, amore. Non riuscirò a venire da te."""
"","","0","1","0","SEID_3000_S0180_0410_X","","","","","-1","0","0","0","","""Sognavo di darti la gemma di persona e sarà per sempre il mio rimpianto più grande."""
"","","0","1","0","SEID_3000_S0180_0420_X","","","","","-1","0","0","0","2","La Lacrima era un dono d'addio."
"","","0","1","0","SEID_3000_S0180_0430_X","","","","","-1","0","0","0","26","Aspetta. C'è un'altra lettera."
"","","0","1","0","SEID_3000_S0180_0440_X","","","","","-1","0","0","0","2","Sembra un necrologio."
"","","0","1","0","SEID_3000_S0180_0450_X","","","","","-1","0","0","0","26","Ah, quindi il poverino era già morto quando il pacchetto è arrivato a Frontemare."
"","","0","1","0","SEID_3000_S0180_0460_X","","","","","-1","0","0","0","2","Il che vuol dire che il postino aveva già iniziato a mentirle."
"","","0","1","0","SEID_3000_S0180_0471_X","","","","","-1","0","0","0","2","Quindi cosa facciamo ora? Riportiamo la gemma alla committente o...? Forse il postino ha un'idea."
"1568","","0","2","0","SEID_3000_S0180_0490_X","","","","","0","-1","1027","0","41","L'avete trovato?"
"","","0","1","0","SEID_3000_S0180_0500_X","","","","<CB=SEID_3000_S0180_a0080_01_03>","0","1027","-1","0","2","Sì, ma la situazione è complicata."
"1569","","0","1","0","SEID_3000_S0180_0650_X","","","","","0","-1","1027","0","41","Beh, se pensate che sia la cosa giusta da fare, allora va bene. Dubito che alla guardiana sarebbe dispiaciuto."
"","","0","1","0","SEID_3000_S0180_0660_X","","","","","0","1027","-1","0","2","Probabilmente ha ricevuto la gemma in cielo."
"","","0","1","0","SEID_3000_S0180_0640_X","","","","<CB=SEID_3000_S0180_a0080_01_End02>","0","1027","-1","0","2","Andiamo a parlare con la committente."
"1570","","0","2","0","RID_SEAJWEL_00140","","","","","0","-1","1354","0","119","Hai trovato la Lacrima di sirena?"
"","","0","1","0","SEID_3000_S0180_0580_X","","","","","0","1354","-1","0","2","Sì, eccola."
"","","0","1","0","RID_SEAJWEL_00120","","","","","0","-1","1354","0","119","Oh, ho aspettato tanto questo momento! La tua nomea è più che meritata!"
"","","0","1","0","RID_SEAJWEL_00130","","","","<CB=SEID_3000_S0180_a0080_02_End01>","0","-1","1354","0","119","Ecco una piccola ricompensa per avermi riportato il mio cimelio di famiglia."
"1571","","0","1","0","SEID_3000_S0180_0620_X","","","","","0","-1","1027","0","41","Capito. La seppellirò vicino alla tomba della sua amata."
"","","0","1","0","SEID_3000_S0180_0630_X","","","","","0","1027","-1","0","2","Grazie."
"","","0","1","0","SEID_3000_S0180_0640_X","","","","<CB=SEID_3000_S0180_a0080_01_End01>","0","1027","-1","0","2","Andiamo a parlare con la committente."
"1572","","0","1","0","SEID_3000_S0180_0680_X","","","","","-1","0","0","0","26","Vorresti prendere un regalo d'amore sincero e rivenderlo come un comune gingillo? È molto irrispettoso da parte tua."
"","","0","1","0","SEID_3000_S0180_0690_X","","","","","0","1354","-1","0","2","Almeno sarebbe la fine di tutta questa storia."
"","","0","1","0","SEID_3000_S0180_0640_X","","","","<CB=SEID_3000_S0180_a0080_01_End03>","0","1027","-1","0","2","Andiamo a parlare con la committente."
"1573","","0","2","0","RID_SEAJWEL_00140","","","","","0","-1","1354","0","119","Hai trovato la mia gemma?"
"","","0","1","0","SEID_3000_S0180_0720_X","","","","","0","1354","-1","0","2","No, mi dispiace. Sembra scomparsa nel nulla."
"","","0","1","0","RID_SEAJWEL_00151","","","","","0","-1","1354","0","119","Accidenti! Ero convinta fosse la volta buona! Temo che la memoria di mio nonno non sarà mai completa senza la Lacrima."
"","","0","1","0","SEID_3000_S0180_0740_X","","","","","0","1354","-1","0","2","Tuo nonno?"
"","","0","1","0","RID_SEAJWEL_00161","","","","<CB=SEID_3000_S0180_a0080_02_End02>","0","-1","1354","0","119","Lui era nato qui e io speravo... Ah, non importa."
"1574","","0","1","0","RID_SEAJWEL_00170","","","","","0","-1","1354","0","119","Grazie per averci provato. Forse passerò ancora un po' di tempo in questa cittadina prima di tornare a casa."
"1575","","0","2","0","RID_VILTOOL_00200","","","","","0","-1","1203","0","10","Ehi, hai visto dei ladruncoli in giro? Una banda di quei bastardi continua a rubare la mia merce!"
"","","0","1","0","SEID_3000_S0200_0020_X","","","","","0","1203","-1","0","2","È la prima volta che ne sento parlare."
"","","0","3","0","RID_VILTOOL_00210","","","","<CB=LIB_SET_START_SUBQUEST,1796,49,2,1203,1576>","0","-1","1203","0","10","Non rubano molto e quando succede è sempre del cibo. Qui è sicuramente il bene più prezioso! "
"1576","","0","1","0","SEID_3000_S0200_0040_X","","","","","0","1203","-1","0","2","Magari posso aiutarti."
"","","0","3","0","RID_VILTOOL_00220","","","","","0","-1","1203","0","10","Davvero? Te ne sarei grato!"
"","","0","1","0","SEID_3000_S0200_0060_X","","","","","-1","0","0","0","26","Hai un piano o dobbiamo scrollare ogni persona che vediamo finché troviamo quelle con della frutta in tasca?"
"","","0","1","0","SEID_3000_S0200_0090_X","","","","<CB=SEID_3000_S0200_a0010g_Start><LF><CB=LIB_SET_END_SUBQUEST>","-1","0","0","0","2","Iniziamo chiedendo in giro."
"1577","","0","3","0","RID_VILTOOL_00230","","","","","0","-1","1203","0","10","Spero abbiate più fortuna di me nello scoprire la loro identità!"
"1578","","0","1","0","SEID_3000_S0200_0306_X","","","","","-1","0","0","0","2","Mmm? Che cos'è?"
"1579","","0","1","0","SEID_3000_S0200_0181_X","","","","","-1","0","0","0","2","Una bottiglia di vino ancora piena. Fa parte della merce rubata?"
"1580","","0","1","0","","","","","","-1","0","0","0","2",""
"1581","","0","1","0","","","","","","-1","0","0","0","2",""
"","","0","1","0","","","","","","0","-1","1203","0","10",""
"","","0","1","0","","","","","","0","1203","-1","0","2",""
"","","0","1","0","","","","","","-1","0","0","0","26",""
"","","0","1","0","","","","","","0","0","0","0","2",""
"1582","","0","2","0","RID_VILGUE_00070","","","","<CB=SEID_3000_S0200_a0030g_0010_End>","0","-1","1218","0","8","Attento alla borsa! Ci sono stati molti furti in città ultimamente."
"1583","","0","2","0","RID_VILMANA_00100","","","","<CB=SEID_3000_S0200_a0030g_0020_End>","0","-1","1202","0","8","Ho sentito che sono in due e lavorano insieme! "
"1584","","0","2","0","RID_VILGUF_00030","","","","","0","-1","1219","0","9","Un furto? Mmm, ora che ci penso..."
"","","0","1","0","RID_VILGUF_00040","","","","<CB=SEID_3000_S0200_a0030g_0030_End>","-1","-1","1219","0","9","Ho intravisto un omuncolo che si muoveva furtivamente tra le ombre. Forse è l'uomo che cercate?"
"1585","","0","1","0","SEID_3000_S0201_0182_X","","","","","-1","0","0","0","2","Da quello che abbiamo scoperto, i ladri sono due. Probabilmente dei ragazzini."
"","","0","1","0","SEID_3000_S0200_0183_X","","","","","-1","0","0","0","26","Ricordi i due fratelli che gironzolano sempre intorno alla ruota idraulica? Penso che ci stiano nascondendo qualcosa."
"","","0","1","0","SEID_3000_S0200_0184_X","","","","","-1","0","0","0","2","Andiamo a farci una chiacchierata."
"1586","","0","2","0","RID_NIER_00901","","","","","0","1356","-1","0","2","Siete voi i ladruncoli?"
"","","0","1","0","RID_VILBOYE_00020","","","","","0","-1","1356","0","71","......"
"","","0","1","0","RID_VILBOYE_00030","","","","","0","-1","1356","0","71","Se ce lo stai chiedendo, sai già la risposta."
"","","0","1","0","SEID_3000_S0200_0210_X","","","","","-1","0","0","0","26","Tradito dalla tua stessa voce! Confessa! Confessa subito o l'ira di Grimoire Weiss si abbatterà su di voi!"
"","","0","1","0","RID_VILBOYE_00040","","","","","0","-1","1356","0","71","D'accordo! Siamo stati io e mio fratello!"
"","","0","1","0","SEID_3000_S0200_0230_X","","","","","0","1356","-1","0","2","Perché?"
"","","0","1","0","RID_VILBOYE_00050","","","","","0","-1","1356","0","71","Perché ce l'ha detto papà."
"","","0","1","0","SEID_3000_S0200_0250_X","","","","","-1","0","0","0","26","Vostro <FONT=ITALIC>padre</FONT> vi ha detto di rubare?"
"","","0","1","0","SEID_3000_S0200_0260_X","","","","","0","1356","-1","0","2","Sembra proprio un genitore modello. Dov'è?"
"","","0","1","0","RID_VILBOYE_00060","","","","","0","-1","1356","0","71","Probabilmente alla taverna. Lui è sempre lì."
"","","0","1","0","SEID_3000_S0200_0280_X","","","","<CB=SEID_3000_S0200_a0050_End>","0","1356","-1","0","2","Va bene."
"1587","","0","1","0","RID_VILBOYE_00070","","","","","0","-1","1356","0","71","Penso che papà sia ancora alla taverna."
"1588","","0","1","0","RID_VILBOYD_00020","","","","","0","-1","1357","0","71","Mi spiace, io non volevo farlo..."
"1589","","0","2","0","RID_NIER_00910","","","","","0","1223","-1","0","2","Ehi, hai due figli?"
"","","0","1","0","RID_VILMANG_00050","","","","","0","-1","1223","0","8","Uh? Cosss.... cossssa importa, uh? Peeeerché me lo scie... chiesci... chiediii?"
"","","0","1","0","SEID_3000_S0200_0330_X","","","","","0","1223","-1","0","2","Costringi i tuoi figli a rubare?"
"","","0","1","0","RID_VILMANG_00060","","","","","0","-1","1223","0","8","RUBAREE?! No, no! Nooon è vero. Io... Io gli hooo... chiesto di trovare del scibo... cibo per la faaamiglia!"
"","","0","1","0","RID_VILMANG_00070","","","","<CB=SEID_3000_S0200_a0070_End>","0","-1","1223","0","8","Ora... sciudi la bocca, altrimentiii.... te la sciudo iooo! IMPISCIONIII!"
"1590","","0","1","0","RID_VILMANG_00080","","","","","0","-1","1223","0","8","Non vedete che sono occupato?"
"1591","","0","2","0","RID_VILTOOL_00240","","","","","0","-1","1203","0","10","Hai trovato il colpevole?"
"","","0","1","0","SEID_3000_S0200_0410_X","","","","","0","1203","-1","0","2","Sì. Ma è... complicato. "
"","","0","3","0","RID_VILTOOL_00250","","","","","0","-1","1203","0","10","... Due fratelli costretti a rubare dal padre ubriacone? Beh, sicuramente non me l'aspettavo."
"","","0","1","0","SEID_3000_S0200_0430_X","","","","","0","1203","-1","0","2","Non avrebbero dovuto derubarti, ma non penso sia solo colpa loro."
"","","0","3","0","RID_VILTOOL_00260","","","","","0","-1","1203","0","10","Hai ragione. Parlerò con gli altri commercianti per spiegare la situazione."
"","","0","1","0","SEID_3000_S0200_0451_X_1","","","","","0","1203","-1","0","2","Grazie."
"","","0","1","0","SEID_3000_S0200_0451_X_2","","","","","0","1203","-1","0","2","Oh, e penso che sia opportuno allontanarli dal padre."
"","","0","3","0","RID_VILTOOL_00270","","","","","0","-1","1203","0","10","Non so chi potrebbe accoglierli, la gente qui non se la passa tanto bene. Però farò girare la voce e troveremo un modo."
"","","0","3","0","RID_VILTOOL_00280","","","","<CB=SEID_3000_S0200_a0080_End>","0","-1","1203","0","10","Ah, dimenticavo. Ecco la tua ricompensa. È quello che io e gli altri commercianti siamo riusciti a racimolare, spero sia abbastanza."
"1592","","0","3","0","RID_VILTOOL_00300","","","","<CB=SEID_3000_S0200_a0090_End>","0","-1","1203","0","10","Abbiamo risolto. I due bambini staranno con Popola."
"1593","","0","1","0","RID_VILBOYE_00080","","","","","0","-1","1356","0","71","Mi dispiace tanto per tutti i problemi che vi abbiamo causato."
"1594","","0","1","0","RID_VILBOYD_00030","","","","","0","-1","1357","0","71","Ehi, dov'è papà?"
"1595","","0","1","0","RID_VILMANG_00090","","","","","0","-1","1223","0","8","... Oh, sei tu? Lasciami in pace!"
"","","0","1","0","RID_VILMANG_00100","","","","","0","-1","1223","0","8","Che tristezza senza quei ragazzini che scorrazzano in giro..."
"1596","","0","1","0","RID_VILTOOL_00290","","","","","0","-1","1203","0","10","Cercherò qualcuno che possa accogliere i due fratelli."
"1597","","0","2","0","RID_NIER_01250","","","","","0","1310","-1","0","2","Sono contento di rivederti. Sembra che tu stia meglio."
"","","0","1","0","RID_SEAMANE_00290","","","","","0","-1","1310","0","19","Non posso rinunciare così al mio sogno! Il mal di mare è un tormento, ma riuscirò a sconfiggerlo. "
"","","0","1","0","SEID_3000_S0210_0030_X","","","","","0","1310","-1","0","2","Ah, sì? Come pensi di fare?"
"","","0","1","0","RID_SEAMANE_00300","","","","","0","-1","1310","0","19","Beh, prima di tutto, sto lavorando a una cura a base di erbe!"
"","","0","1","0","RID_SEAMANE_00310","","","","","0","-1","1310","0","19","Devo ancora perfezionarla, perché non sono ancora sicuro di aver scelto gli ingredienti giusti."
"","","0","1","0","SEID_3000_S0210_0060_X","","","","","0","1310","-1","0","2","Capisco."
"","","0","1","0","RID_SEAMANE_00320","","","","","0","-1","1310","0","19","Ehi, ti dispiacerebbe aiutarmi a recuperare un ingrediente?"
"","","0","1","0","RID_SEAMANE_00330","","","","<CB=LIB_SET_START_SUBQUEST,1806,50,17,1310,1598>","0","-1","1310","0","19","Puoi comprarlo all'emporio di amenità a Facciata. Non te lo chiederei se non fossi l'unica persona che conosco che può andarci."
"1598","","0","1","0","SEID_3000_S0210_0090_X","","","","","0","1310","-1","0","2","Ti aiuto volentieri."
"","","0","1","0","RID_SEAMANE_00340","","","","<CB=LIB_SET_END_SUBQUEST>","0","-1","1310","0","19","Fantastico! Ho bisogno di una foglia di mandragola. E grazie!"
"1599","","0","1","0","RID_SEAMANE_00350","","","","","0","-1","1310","0","19","Ho bisogno di una foglia di mandragola. Grazie ancora!"
"1600","","0","2","0","RID_NIER_01260","","","","","0","1236","-1","0","2","Ho saputo che vendete le foglie di mandragola."
"","","0","1","0","RID_MSKSTR_00400","","","","","0","-1","1236","0","48","(Una foglia di mandragola? Oh, no! Non me l'aspettavo proprio da uno come te!)"
"","","0","1","0","SEID_3000_S0210_0140_X","","","","","0","1236","-1","0","2","Come, prego?"
"","","0","1","0","RID_MSKSTR_00410","","","","","0","-1","1236","0","48","(Nessun problema, nessun problema! Siamo tutti maschietti qui, eh?)"
"","","0","1","0","SEID_3000_S0210_0160_X","","","","<CB=SEID_3000_S0210_a0030_End>","0","1236","-1","0","2","Ma di che diavolo stai parlando? Lasciamo perdere. Torniamo dal committente."
"1601","","0","2","0","RID_NIER_01270","","","","","0","1310","-1","0","2","Ti ho portato la foglia di mandragola."
"","","0","1","0","RID_SEAMANE_00360","","","","<CB=SEID_3000_S0210_a0050_01>","0","-1","1310","0","19","Fantastico! Eccoti i soldi per la foglia e un piccolo extra per il viaggio."
"1602","","0","1","0","RID_SEAMANE_00370","","","","<CB=SEID_3000_S0210_a0050_End>","0","-1","1310","0","19","Questa è la chiave per sconfiggere il mal di mare. Lo so!"
"1603","","0","2","0","SEID_3000_S0210_0210_X","","","","","0","1310","-1","0","2","Come sta venendo la cura?"
"","","0","1","0","RID_SEAMANE_00380","","","","","0","-1","1310","0","19","Oh, è... Beh, è interessante."
"","","0","1","0","RID_SEAMANE_00390","","","","","0","-1","1310","0","19","Pensavo mi aiutasse con il mal di mare, invece ho creato un... Beh, chiamiamolo energizzante, eh?... Mia moglie ne è entusiasta!"
"","","0","1","0","SEID_3000_S0210_0240_X","","","","","0","1310","-1","0","2","Stavo bene anche senza saperlo..."
"","","0","1","0","RID_SEAMANE_00400","","","","","0","-1","1310","0","19","Senti, voglio provarci ancora. Ti dispiace andare a fare un'altra commissione per me?"
"","","0","1","0","SEID_3000_S0210_0260_X","","","","","0","1310","-1","0","2","Nessun problema."
"","","0","1","0","RID_SEAMANE_00410","","","","<CB=SEID_3000_S0210_a0060_End>","0","-1","1310","0","19","Fantastico! Questa volta ho bisogno di olio di rospo che puoi comprare all'Armeria dei due fratelli al Cumulo di ciarpame."
"1604","","0","1","0","RID_SEAMANE_00420","","","","","0","-1","1310","0","19","Solo olio di rospo che puoi comprare al Cumulo di ciarpame. E grazie!"
"1605","","0","2","0","EID_3000_S0210_0290_X","","","","","2","-1","1008","0","36","Benvenuto. Come posso aiutarti?"
"","","0","1","0","SEID_3000_S0210_0300_X","","","","","2","1008","-1","0","2","Ho bisogno di una fiala di olio di rospo per una medicina."
"","","0","3","0","SEID_3000_S0210_0310_X","","","","","2","-1","1008","0","36","Hai in programma di stare sveglio tutta notte? Buona fortuna, allora!"
"","","0","1","0","SEID_3000_S0210_0320_X","","","","","2","1008","-1","0","2","... Cosa?"
"","","0","3","0","SEID_3000_S0210_0330_X","","","","","2","-1","1008","0","36","Immagino non sia facile uccidere le Ombre in lungo e in largo! Scommetto che lo usi spesso."
"","","0","1","0","SEID_3000_S0210_0340_X","","","","<CB=SEID_3000_S0210_a0070_End>","2","1008","-1","0","2","Non capisco di cosa stai parlando, ma non voglio neanche saperlo. Torniamo dal committente."
"1606","","0","2","0","RID_NIER_01280","","","","","0","1310","-1","0","2","Ecco il tuo olio di rospo."
"","","0","1","0","RID_SEAMANE_00430","","","","<CB=SEID_3000_S0210_a0090_01>","0","-1","1310","0","19","Ottimo! Ecco il tuo pagamento."
"1607","","0","1","0","RID_SEAMANE_00440","","","","<CB=SEID_3000_S0210_a0090_End>","0","-1","1310","0","19","Questa è la chiave per sconfiggere il mal di mare. Lo so!"
"1608","","0","2","0","SEID_3000_S0210_0390_X","","","","","0","1310","-1","0","2","Ciao, hai avuto fortuna con la nuova medicina?"
"","","0","1","0","RID_SEAMANE_00450","","","","","0","-1","1310","0","19","Eh, non proprio..."
"","","0","1","0","RID_SEAMANE_00460","","","","","0","-1","1310","0","19","Sembra che io abbia creato una sostanza stimolante. Chi la assume può stare sveglio per una settimana intera. L'ho chiamata Notti bianche!"
"","","0","1","0","SEID_3000_S0210_0420_X","","","","","0","1310","-1","0","2","Forse dovresti cambiare lavoro e diventare uno speziale."
"","","0","1","0","RID_SEAMANE_00470","","","","","0","-1","1310","0","19","Sai che non è una brutta idea? D'ora in poi, basta navi: aprirò una spezieria!"
"","","0","1","0","SEID_3000_S0210_0440_X","","","","<CB=SEID_3000_S0210_a0100_End>","0","1310","-1","0","2","Beh... Buona fortuna!"
"1609","","0","1","0","RID_SEAMANE_00480","","","","","0","-1","1310","0","19","In fondo, ho già due medicine! È un buon inizio, vero?"
"1610","","0","1","0","RID_SEAMANE_00490","","","","","0","-1","1310","0","19","Il mio energizzante e Notti bianche stanno andando a ruba! Perché non ci ho pensato prima?"
"1611","","0","2","0","RID_VILGUH_00030","","","","","0","-1","1222","0","9","Aiuto! AIUTO! Oddio, qualcuno mi aiuti!"
"","","0","1","0","SEID_3000_S0220_0020_X","","","","","0","1222","-1","0","2","Che c'è?!"
"","","0","1","0","RID_VILGUH_00040","","","","","0","-1","1222","0","9","C'è un'Ombra gigantesca vicino al ponte nella pianura settentrionale! "
"","","0","1","0","RID_VILGUH_00050","","","","<CB=LIB_SET_START_SUBQUEST,1817,51,2,1222,1612>","0","-1","1222","0","9","Quella maledetta ha quasi ammazzato mia moglie e mia figlia!"
"1612","","0","1","0","SEID_3000_S0220_0050_X","","","","","0","1222","-1","0","2","Ci penso io!"
"","","0","1","0","RID_VILGUH_00060","","","","<CB=LIB_SET_END_SUBQUEST>","0","-1","1222","0","9","Appare e scompare come il vento. Puoi passare giorni nella pianura settentrionale senza vederla e poi, all'improvviso..."
"1613","","0","1","0","RID_VILGUH_00070","","","","","0","-1","1222","0","9","Quella bastarda deve soffrire come sto soffrendo io ora! Ti prego, uccidila. Ti pagherò quanto vuoi, basta che l'ammazzi!"
"1614","","0","2","0","RID_NIER_00920","","","","","0","1222","-1","0","2","Abbiamo ucciso l'Ombra sul ponte! "
"","","0","1","0","RID_VILGUH_00080","","","","","0","-1","1222","0","9","... Mia figlia è morta mentre eravate via."
"","","0","1","0","RID_VILGUH_00090","","","","<CB=SEID_3000_S0220_a0050_End>","0","-1","1222","0","9","Tieni. Prendi i miei soldi. Tanto ora non ne ho più bisogno."
"1615","","0","1","0","RID_VILGUH_00100","","","","","0","-1","1222","0","9","Perché gli dei ci hanno maledetto?"
"1616","","0","2","0","SEID_3000_S0230_0010_X","","","","","0","-1","1027","0","41","Ehi, avete sentito la notizia?"
"","","0","1","0","SEID_3000_S0230_0020_X","","","","","0","1027","-1","0","2","Di cosa si tratta?"
"","","0","1","0","SEID_3000_S0230_0030_X","","","","","0","-1","1027","0","41","C'è un'Ombra gigantesca nella pianura meridionale... e dicono che mangi i POSTINI!"
"","","0","1","0","SEID_3000_S0230_0040_X","","","","","0","1027","-1","0","2","È una follia. Le Ombre non mangiano le persone."
"","","0","1","0","SEID_3000_S0230_0050_X","","","","","0","-1","1027","0","41","Sarà, ma la gente dice che i corpi che lascia sono smembrati e mangiucchiati."
"","","0","1","0","SEID_3000_S0230_0055_X","","","","","0","-1","1027","0","41","Siamo tutti troppo spaventati per consegnare la posta con quell'abominio a piede libero!"
"","","0","1","0","SEID_3000_S0230_0060_X","","","","<CB=LIB_SET_START_SUBQUEST,1822,52,17,1027,1617>","-1","0","0","0","26","Le Ombre stanno diventando sempre più pericolose."
"1617","","0","1","0","SEID_3000_S0230_0070_X","","","","<CB=LIB_SET_END_SUBQUEST>","0","1027","-1","0","2","Va bene. Vedrò cosa posso fare."
"1618","","0","1","0","SEID_3000_S0230_0080_X","","","","","0","-1","1027","0","41","Aiutaci, ti prego. O nessuno riceverà più la posta!"
"1619","","0","2","0","RID_NIER_01220","","","","","0","1027","-1","0","2","Ho ucciso l'Ombra nella pianura meridionale."
"","","0","1","0","SEID_3000_S0230_0100_X","","","","","0","-1","1027","0","41","Oh, grazie! Grazie! "
"","","0","1","0","SEID_3000_S0230_0110_X","","","","<CB=SEID_3000_S0230_a0050_End>","0","-1","1027","0","41","Non so come farò con tutti i postini che si sono dimessi, ma risolverò la situazione in qualche modo... Questa è la tua ricompensa."
"1620","","0","2","0","RID_SEAOLMB_00410","","","","<CB=LIB_SET_START_SUBQUEST,1827,53,17,1167,9999>","-1","-1","1167","0","19","Questa volta ho bisogno di tre scinchi. Sono anche chiamati pesci delle sabbie perché vivono negli oceani sabbiosi. Puoi catturarli vicino alla banchina."
"1621","","0","2","0","RID_NIER_01120","","","","","-1","1167","-1","0","2","Eccoti i pesci."
"","","0","1","0","RID_SEAOLMB_00431","","","","","-1","-1","1167","0","19","Perdincibacco, dammi tre scinchi e ti bacio gli stinchi! Non ho più molto da insegnarti, piantagrane."
"","","0","1","0","SEID_1320_S0170_0040_X","","","","","-1","1167","-1","0","2","Meglio così! Mi stavo stufando del tuo allenamento folle!"
"","","0","1","0","RID_SEAOLMB_00440","","","","<CB=SEID_3000_S0240_a0030_01>","-1","-1","1167","0","19","Chi hai chiamato folle, ragazzino? Voi giovani siete tutti lunghe spade, risvoltini e paroloni. Nessuno di voi è stato in guerra! Non sapete quando sia difficile!"
"1622","","0","1","0","SEID_1320_S0170_0060_X","","","","","-1","0","0","0","","......"
"","","0","1","0","SEID_1320_S0170_0070_X","","","","","-1","0","0","0","","........."
"1623","","0","1","0","SEID_1320_S0171_0080_X","","","","","-1","1167","-1","0","2","Hai visto quella mossa?"
"","","0","1","0","SEID_1320_S0170_0090_X","","","","<CB=SEID_3000_S0240_a0030_End01>","-1","0","0","0","26","Quello non è un pescatore: si muove come un assassino professionista. Inizio ad avere più paura del vecchio che delle Ombre."
"1624","","0","1","0","RID_SEAOLMB_00420","","","","<CB=SEID_3000_S0240_a0030_End02>","-1","-1","1167","0","19","Buona fortuna con i tre scinchi!"
"1625","","0","2","0","RID_SEAOLMB_00450","","","","<CB=LIB_SET_START_SUBQUEST,1830,54,17,1167,9999>","-1","-1","1167","0","19","Questa volta ho bisogno di tre pesci reali! Il tempo scorre, muoviti!"
"1626","","0","2","0","RID_NIER_01130","","","","","-1","1167","-1","0","2","Credo di aver capito come si fa."
"","","0","1","0","RID_SEAOLMB_00470","","","","","-1","-1","1167","0","19","Perdindirindina, i pesci reali mi mettono le ali! Sembra proprio che il ragazzino sia diventato un vero pescatore!"
"","","0","1","0","RID_SEAOLMB_00481","","","","<CB=SEID_3000_S0250_a0030_01>","-1","-1","1167","0","19","Ma pensi di poter prendere il mio posto? Forza! Andiamo!"
"1627","","0","1","0","SEID_1320_S0180_0050_X","","","","","-1","0","0","0","","......"
"","","0","1","0","SEID_1320_S0180_0060_X","","","","","-1","0","0","0","","........."
"1628","","0","1","0","RID_SEAOLMB_00490","","","","","-1","-1","1167","0","19","Ah ah ah ah! E sto usando solo la mano sinistra!"
"","","0","1","0","SEID_1320_S0180_0080_X","","","","<CB=SEID_3000_S0250_a0030_End01>","-1","1167","-1","0","2","Non stiamo più parlando di pesca..."
"1629","","0","1","0","RID_SEAOLMB_00460","","","","<CB=SEID_3000_S0250_a0030_End02>","-1","1167","1167","0","19","Buona fortuna con i tre pesci reali!"
"1630","","0","2","0","RID_SEAOLMB_00500","","","","","-1","-1","1167","0","19","Ho una richiesta speciale per te! Vai e cattura due marlin blu."
"","","0","1","0","SEID_1320_S0190_0020_X","","","","","-1","1167","-1","0","2","Cos'hanno di tanto speciale?"
"","","0","1","0","RID_SEAOLMB_00510","","","","<CB=LIB_SET_START_SUBQUEST,1833,55,17,1167,9999>","-1","-1","1167","0","19","In tutta la mia vita, ne ho catturato solo uno. Portami quei pesci e ti chiamerò mastro pescatore!"
"1631","","0","2","0","SEID_1320_S0200_0020_X","","","","","-1","1167","-1","0","2","Sono questi i pesci che mi hai chiesto?"
"","","0","1","0","RID_SEAOLMB_00530","","","","","-1","-1","1167","0","19","Ma che... Non avrei mai pensato che fosse possibile."
"","","0","1","0","RID_SEAOLMB_00540","","","","<CB=SEID_3000_S0260_a0030_01>","-1","-1","1167","0","19","Ben fatto, mastro pescatore. Sembra che mi sia rimasta solo una tecnica da insegnarti."
"1632","","0","1","0","SEID_1320_S0190_0070_X","","","","","-1","0","0","0","","......"
"","","0","1","0","SEID_1320_S0190_0080_X","","","","","-1","0","0","0","","........."
"1633","","0","1","0","RID_SEAOLMB_00550","","","","<CB=SEID_3000_S0260_a0030_End01>","-1","-1","1167","0","19","Ti ho insegnato tutto quello che sapevo, ma ciò non vuol dire che non ci sia più niente da imparare! Il mondo è vasto e ci sono pesci che nessun uomo ha mai visto."
"1634","","0","1","0","RID_SEAOLMB_00520","","","","<CB=SEID_3000_S0260_a0030_End02>","-1","-1","1167","0","19","Buona fortuna con i tre marlin blu!"
