"","","0","1","0","RID_MSKWOMA_00120","","","","<CB=SEID_1410_S0030_a0050>","0","-1","1119","0","146","(Der Empfänger ist der Wächter im Südosten. Die Nachricht lautet: ""Nur der Adel darf die Schatzkammer betreten."")"
"1634","1635","0","1","0","RID_NIER_01560","","","","","0","1119","-1","0","2","""Kinderbetreuung kann Spaß machen."""
"1635","","0","1","0","RID_MSKWOMA_00100","","","","<CB=SEID_1410_S0030_a0020_Start>","0","-1","1119","0","146","(Tut mir leid, aber das ist falsch. Ihr werdet noch einmal von vorne beginnen müssen.)"
"1636","1637","0","1","0","RID_NIER_01570","","","","","0","1119","-1","0","2","""Kinderbetreuung kann einfach sein."""
"1637","","0","1","0","RID_MSKWOMA_00100","","","","<CB=SEID_1410_S0030_a0020_Start>","0","-1","1119","0","146","(Tut mir leid, aber das ist falsch. Ihr werdet noch einmal von vorne beginnen müssen.)"
"1638","","0","2","0","RID_NIER_00760","","","","","0","1125","-1","0","2","Seid Ihr der vierte Empfänger?"
"","","0","1","0","RID_MSKSOLG_00050","","","","<CB=SEID_1410_S0030_04_Select>","0","-1","1125","0","47","(Das bin ich. Sagt mir Eure Nachricht.)"
"1639","","0","1","0","SEID_1410_S0030_0470_X","","","","","-1","0","0","0","2","<LIST=1667>Nur Tiere dürfen die Schatzkammer betreten.</LIST><LF><LIST=1668>Nur gewöhnliche Bürger dürfen die Schatzkammer betreten.</LIST><LF><LIST=1669>Nur der Adel darf die Schatzkammer betreten.</LIST>"
"1640","","2","1","0","SEID_1410_S0030_a0060g_0012_010","","","","","-1","0","0","0","",""
"1641","1642","0","1","0","RID_NIER_01580","","","","","0","1125","-1","0","2","Das ist, ähm, ""Nur Tiere dürfen die Schatzkammer betreten""."
"1642","","0","1","0","RID_MSKSOLG_00060","","","","<CB=SEID_1410_S0030_a0020_Start>","0","-1","1125","0","47","(Falsch. Selbst wenn Ihr die Nachricht vergessen habt, solltet Ihr darauf kommen, wenn Ihr ein wenig nachdenkt. Viel Glück beim nächsten Mal.)"
"1643","1644","0","1","0","RID_NIER_01590","","","","","0","1125","-1","0","2","Das ist, ähm, ""Nur gewöhnliche Bürger dürfen die Schatzkammer betreten""."
"1644","","0","1","0","RID_MSKSOLG_00060","","","","<CB=SEID_1410_S0030_a0020_Start>","0","-1","1125","0","47","(Falsch. Selbst wenn Ihr die Nachricht vergessen habt, solltet Ihr darauf kommen, wenn Ihr ein wenig nachdenkt. Viel Glück beim nächsten Mal.)"
"1645","1646","0","1","0","RID_NIER_01600","","","","","0","1125","-1","0","2","Das ist, ähm, ""Nur der Adel darf die Schatzkammer betreten""."
"1646","","0","1","0","RID_MSKSOLG_00070","","","","","0","-1","1125","0","47","(Richtig. In der Schatzkammer werden die wertvollsten Objekte unseres Volkes verwahrt, und nur der Adel hat das Recht, sie zu berühren. Nun zu Eurer letzten Nachricht.)"
"","","0","1","0","RID_MSKSOLG_00080","","","","<CB=SEID_1410_S0030_a0060>","0","-1","1125","0","47","(Der Empfänger ist eine langatmige Person. Die Nachricht lautet: ""Treibsand"".)"
"1647","","0","2","0","RID_NIER_00770","","","","","0","1117","-1","0","2","Seid Ihr der fünfte Empfänger?"
"","","0","1","0","RID_MSKMANE_00090","","","","<CB=SEID_1410_S0030_05_Select>","0","-1","1117","0","46","(Oh ja, ich bin der fünfte und letzte Empfänger! Fabelhaft, dass Ihr es so weit gebracht habt! Also, ich bin verblüfft! Bitte nennt jetzt Eure Nachricht.)"
"1648","","0","1","0","SEID_1410_S0030_0550_X","","","","","-1","0","0","0","2","<LIST=1670>Schatten</LIST><LF><LIST=1671>Treibsand</LIST><LF><LIST=1672>Geschichte</LIST>"
"1649","","2","1","0","SEID_1410_S0030_a0070g_0012_010","","","","","-1","0","0","0","",""
"1650","1651","0","1","0","RID_NIER_01610","","","","","0","1117","-1","0","2","""Schatten""!"
"1651","","0","1","0","RID_MSKMANE_00100","","","","<CB=SEID_1410_S0030_a0020_Start>","0","-1","1117","0","46","(Ach, wie schade! Das ist falsch! Aber gebt nicht auf! Der Schlüssel zu erfolgreicher Forschung ist Beharrlichkeit! Also versucht es einfach immer weiter!)"
"1652","1653","0","1","0","RID_NIER_01620","","","","","0","1117","-1","0","2","""Treibsand""!"
"1653","1654","0","1","0","RID_MSKMANE_00110","","","","","0","-1","1117","0","46","(Korrekt! Erstaunlich! Und da wir schon bei dem Thema sind, erlaubt mir, Euch von den tiefen historischen Verbindungen zwischen Treibsand und diesem Nachrichtenritual zu erklären. Denn Ihr müsst verstehen, dass ...)"
"1654","","0","1","0","RID_MSKMANE_00120","","","","","0","-1","1117","0","","..."
"","","0","1","0","RID_MSKMANE_00130","","","","","0","-1","1117","0","","......"
"","","0","1","0","RID_MSKMANE_00140","","","","","0","-1","1117","0","","........."
"","","0","1","0","SEID_1410_S0030_0584_X","","","","<CB=SEID_1410_S0030_a0080_Start>","0","1117","1025","0","26","Er hört sich wohl gerne selber reden."
"1655","1656","0","1","0","RID_NIER_01630","","","","","0","1117","-1","0","2","""Geschichte""!"
"1656","","0","1","0","RID_MSKMANE_00100","","","","<CB=SEID_1410_S0030_a0020_Start>","0","-1","1117","0","46","(Ach, wie schade! Das ist falsch! Aber gebt nicht auf! Der Schlüssel zu erfolgreicher Forschung ist Beharrlichkeit! Also versucht es einfach immer weiter!)"
"1657","","0","2","0","RID_MSKSOLF_00240","","","","","0","-1","1098","0","47","(Ihr habt fünf Personen Eure Nachrichten überbracht. Diese Einwohner unserer Stadt wissen nun eine ganze Menge mehr über Euch.)"
"","","0","1","0","RID_MSKSOLF_00250","","","","","0","-1","1098","0","47","(Hier ist Eure Belohnung für die Erledigung.)"
"","","0","1","0","SEID_1410_S0030_0610_X","","","","","-1","0","-1","0","2","Hat das wirklich geholfen, Verbindungen aufzubauen?"
"","","0","1","0","SEID_1410_S0030_0620_X","","","","","-1","0","0","0","26","Ich verstehe diese Stadt ganz und gar nicht."
"1658","","2","1","0","SEID_1410_S0030_a0030g_0013_Sele","","","<CB=SEID_1410_S0030_01_Select01>","","-1","0","0","0","",""
"1659","","2","1","0","SEID_1410_S0030_a0030g_0014_Sele","","","<CB=SEID_1410_S0030_01_Select02>","","-1","0","0","0","",""
"1660","","2","1","0","SEID_1410_S0030_a0030g_0015_Sele","","","<CB=SEID_1410_S0030_01_Select03>","","-1","0","0","0","",""
"1661","","0","1","0","SEID_1410_S0030_a0040g_0013_Sele","","","<CB=SEID_1410_S0030_02_Select01>","","-1","0","0","0","",""
"1662","","2","1","0","SEID_1410_S0030_a0040g_0014_Sele","","","<CB=SEID_1410_S0030_02_Select02>","","-1","0","0","0","",""
"1663","","2","1","0","SEID_1410_S0030_a0040g_0015_Sele","","","<CB=SEID_1410_S0030_02_Select03>","","-1","0","0","0","",""
"1664","","2","1","0","SEID_1410_S0030_a0050g_0013_Sele","","","<CB=SEID_1410_S0030_03_Select01>","","-1","0","0","0","",""
"1665","","2","1","0","SEID_1410_S0030_a0050g_0014_Sele","","","<CB=SEID_1410_S0030_03_Select02>","","-1","0","0","0","",""
"1666","","2","1","0","SEID_1410_S0030_a0050g_0015_Sele","","","<CB=SEID_1410_S0030_03_Select03>","","-1","0","0","0","",""
"1667","","2","1","0","SEID_1410_S0030_a0060g_0013_Sele","","","<CB=SEID_1410_S0030_04_Select01>","","-1","0","0","0","",""
"1668","","2","1","0","SEID_1410_S0030_a0060g_0014_Sele","","","<CB=SEID_1410_S0030_04_Select02>","","-1","0","0","0","",""
"1669","","2","1","0","SEID_1410_S0030_a0060g_0015_Sele","","","<CB=SEID_1410_S0030_04_Select03>","","-1","0","0","0","",""
"1670","","2","1","0","SEID_1410_S0030_a0070g_0013_Sele","","","<CB=SEID_1410_S0030_05_Select01>","","-1","0","0","0","",""
"1671","","2","1","0","SEID_1410_S0030_a0070g_0014_Sele","","","<CB=SEID_1410_S0030_05_Select02>","","-1","0","0","0","",""
"1672","","2","1","0","SEID_1410_S0030_a0070g_0015_Sele","","","<CB=SEID_1410_S0030_05_Select03>","","-1","0","0","0","",""
"1673","","0","2","0","RID_MSKWOMI_00040","","","","","0","-1","1103","0","146","(Mögt Ihr Euch anhören, vor welchen Problemen ich stehe, Reisender?)"
"","","0","1","0","SEID_1410_S0070_0020_X","","","","","0","1103","-1","0","2","Was gibt es denn?"
"","","0","1","0","RID_MSKWOMI_00050","","","","","0","-1","1103","0","146","(Meine Tochter hat bald Geburtstag, und ich möchte ihr etwas Besonderes kochen.)"
"","","0","1","0","RID_MSKWOMI_00060","","","","<CB=LIB_SET_START_SUBQUEST,1708,39,8,1103,1674>","0","-1","1103","0","146","(Aber Regel 8.614 besagt, dass Eltern keine Nahrungsmittel für die Geburtstagsfeier ihrer Kinder kaufen dürfen. Könnt Ihr mir vielleicht aushelfen?)"
"1674","","0","1","0","SEID_1410_S0070_0050_X","","","","","0","1103","-1","0","2","In solch einer Angelegenheit? Natürlich!"
"","","0","1","0","RID_MSKWOMI_00070","","","","","0","-1","1103","0","146","(Vielen lieben Dank.)"
"","","0","1","0","RID_MSKWOMI_00080","","","","","0","-1","1103","0","146","(Ich brauche zehn runde, gestreifte Lebensmittel.)"
"","","0","1","0","SEID_1410_S0070_0080_X","","","","","-1","0","0","0","26","Ähm, ich denke, da müsst Ihr schon etwas genauer sein."
"","","0","1","0","RID_MSKWOMI_00090","","","","","0","-1","1103","0","146","(Es tut mir leid, aber Regel 27.229 besagt, dass man, wenn man jemanden mit dem Kauf einer Sache beauftragt, den Namen des gewünschten Gegenstandes nicht nennen darf.)"
"","","0","1","0","SEID_1410_S0070_0100_X","","","","<CB=SEID_1410_S0030_a0070g_Start><LF><CB=LIB_SET_END_SUBQUEST>","0","1103","-1","0","2","Also, DAS ist wirklich eine verrückte Regel. Sollte ich aber herausbekommen, was es ist, werde ich es Euch bringen."
"1675","","0","2","0","RID_NIER_00780","","","","","0","1103","-1","0","2","Sind diese Wassermelonen vielleicht, was Ihr haben wolltet?"
"","","0","1","0","RID_MSKWOMI_00100","","","","","0","-1","1103","0","146","(Ja! Vielen Dank!)"
"","","0","1","0","SEID_1410_S0070_0130_X","","","","","0","1103","-1","0","2","Gut. Ich hoffe, Ihr könnt Eurer Tochter etwas Leckeres machen."
"","","0","1","0","RID_MSKWOMI_00110","","","","<CB=SEID_1410_S0070_a0030_End01>","0","-1","1103","0","146","(Oh, sie liebt Wassermelonenkuchen mehr als alles andere. Nehmt jetzt bitte diese Belohnung.)"
"1676","","0","2","0","RID_NIER_00790","","","","","0","1103","-1","0","2","Ist hierbei etwas von dem, was Ihr haben möchtet?"
"","","0","1","0","RID_MSKWOMI_00120","","","","","0","-1","1103","0","146","(Nein, tut mir leid.)"
"","","0","1","0","SEID_1410_S0070_0170_X","","","","<CB=SEID_1410_S0070_a0030_End02>","0","1103","-1","0","2","Na toll. Nun gut, dann werde ich wohl weitersuchen müssen."
"1677","","0","2","0","RID_VILRAFA_00010","","","","","0","-1","1358","0","8","Entschuldigung, habt Ihr meinen Sohn gesehen?"
"","","0","1","0","SEID_1410_S0130_0020_X","","","","","0","1358","-1","0","2","Ich glaube nicht. Was ist denn los?"
"","","0","1","0","RID_VILRAFA_00021","","","","","0","-1","1358","0","8","Zu Hause fand ich eine Notiz. Darauf stand, dass er fortgeht und ich nicht nach ihm suchen solle. Was, wenn er das Dorf verlassen hat?!"
"","","0","1","0","RID_VILRAFA_00030","","","","","0","-1","1358","0","8","Bitte, Ihr müsst mir helfen! Ich zahle Euch, was immer Ihr wollt!"
"","","0","1","0","RID_VILRAFA_00040","","","","<CB=LIB_SET_START_SUBQUEST,1712,40,2,1358,1678>","0","-1","1358","0","8","Mein Sohn sollte nicht schwer zu finden sein. Er trägt einen ziemlich seltsamen Hut. Den sieht man schon aus großer Entfernung."
"1678","","0","1","0","SEID_1410_S0130_0050_X","","","","<CB=LIB_SET_END_SUBQUEST>","0","1358","-1","0","2","Gut. Wenn ich ihn sehe, werde ich ihm sagen, dass sein Vater sich Sorgen um ihn macht."
"1679","","0","1","0","RID_VILRAFA_00050","","","","","0","-1","1358","0","8","Bitte. Lasst mich sofort wissen, wenn Ihr ihn findet!"
"1680","","0","2","0","RID_NIER_00510","","","","","0","1359","-1","0","2","Hey. Bist du der Junge, der von zu Hause weggelaufen ist?"
"","","0","1","0","RID_VILRASN_00010","","","","","0","-1","1359","0","19","Hä? Oh, Mann, woher wisst Ihr ..."
"","","0","1","0","SEID_1410_S0130_0090_X","","","","","0","1359","-1","0","2","Dein Vater ist ganz krank vor Sorge. Warum bist du denn weggelaufen?"
"","","0","1","0","RID_VILRASN_00020","","","","","0","-1","1359","0","19","Weil er will, dass ich den Familienbetrieb übernehme oder so. Und das werde ich nicht tun, Mann! Ich bin ein Rebell!"
"","","0","1","0","SEID_1410_S0130_0110_X","","","","","-1","0","0","0","26","Ja, das sehen wir. Tja, vielleicht solltest du deinen Vater wissen lassen, dass es dir gut geht, und ihm erklären, warum du fortgelaufen bist."
"","","0","1","0","RID_VILRASN_00030","","","","","0","-1","1359","0","19","Ach, Mann, ständig müssen mich die Leute nerven! Ja, na schön. Ich mach's. Aber erstmal müsst Ihr etwas für MICH tun, Mann!"
"","","0","1","0","RID_VILRASN_00040","","","","","0","-1","1359","0","19","Der Typ, der die Taverne betreibt, hilft mir schon, seit ich hergekommen bin. Und ich würde ihm gerne etwas Schönes geben."
"","","0","1","0","RID_VILRASN_00050","","","","","0","-1","1359","0","19","Ich dachte, ich könnte vielleicht etwas für ihn kochen oder so. Aber ich habe keinerlei Zutaten, daher ... na ja."
"","","0","1","0","SEID_1410_S0130_0150_X","","","","","0","1359","-1","0","2","Wenn du dadurch schneller zu deinem Vater zurückkehrst, werde ich dir gerne helfen. Was brauchst du denn?"
"","","0","1","0","RID_VILRASN_00060","","","","","0","-1","1359","0","19","Dieser Typ, Mann, der isst nichts als Fisch. Andauernd, jeden Tag, Fisch, Fisch, Fisch. Daher dachte ich, er möchte vielleicht mal Fleisch oder so probieren. So zur Abwechslung."
"","","0","1","0","RID_VILRASN_00070","","","","","0","-1","1359","0","19","Könntet Ihr mir fünf Stücke Hammelfleisch und drei Stücke Ziegenfleisch besorgen?"
"","","0","1","0","RID_VILRASN_00080","","","","<CB=SEID_1410_S0130_a0020_End>","0","-1","1359","0","19","Die Pfannen und Löffel und so besorge ich selber, also bringt das Fleisch einfach irgendwann zu ihm, Mann."
"1681","","0","1","0","RID_NIER_00520","","","","","0","1351","-1","0","2","Haltet durch. Ich werde Eure Sachen schon bald haben."
"","","0","1","0","RID_SEALIQ_00050","","","","<CB=SEID_1410_S0130_a0040_End02>","0","-1","1351","0","16","Mein ""Zeug""? Und was für ein Zeug soll das bitte sein ...?"
"1682","","0","2","0","RID_NIER_00531","","","","","0","1351","-1","0","2","Hallo! Seit Ihr der Typ, der sich um diesen Ausreißer kümmert?"
"","","0","1","0","RID_SEALIQ_00060","","","","","0","-1","1351","0","16","Ausreißer? Wovon redet Ihr da?"
"","","0","1","0","SEID_1410_S0130_0195_X","","","","","-1","0","0","0","2","..."
"","","0","1","0","SEID_1410_S0130_0200_X","","","","","-1","0","0","0","26","Anscheinend wurden wir übers Ohr gehauen."
"","","0","1","0","SEID_1410_S0130_0210_X","","","","<CB=SEID_1410_S0130_a0040_End01>","-1","0","0","0","2","Ach, das ist wohl ein schlechter Scherz! Ernsthaft? Puh ...<LF>Ich nehme an, wir können seiner Familie zumindest mitteilen, dass er am Leben ist."
"1683","","0","2","0","RID_NIER_00540","","","","","0","1358","-1","0","2","Hallo. Ist Euer Sohn schon zurückgekehrt?"
"","","0","1","0","RID_VILRAFA_00060","","","","","0","-1","1358","0","8","Nein, ich habe ihn nicht gesehen. Ach, wo könnte er nur stecken?!"
"","","0","1","0","SEID_1410_S0130_0240_X","","","","","0","1358","-1","0","2","Er ist in Meeresfront. Na ja, da war er, bevor er wieder weggelaufen ist."
"","","0","1","0","RID_VILRAFA_00070","","","","","0","-1","1358","0","8","Oje. Hat er Euch eine raffinierte Geschichte erzählt und anschließend um Hilfe gebeten?"
"","","0","1","0","RID_VILRAFA_00080","","","","","0","-1","1358","0","8","Dieser Junge ist ... Na ja, er ist ein dreckiger Lügner. Das hätte ich vielleicht erwähnen sollen."
"","","0","1","0","SEID_1410_S0130_0270_X","","","","","0","1358","-1","0","2","Also war die ganze Geschichte nur erfunden. Er hat uns ordentlich reingelegt und ist uns dann entwischt ..."
"","","0","1","0","SEID_1410_S0130_0280_X","","","","","-1","0","0","0","26","Das wirst du wohl kaum auf dir sitzen lassen, daher sollten wir nach Meeresfront zurückkehren. Vielleicht finden wir noch die ein oder andere Spur."
"","","0","1","0","SEID_1410_S0130_0290_X","","","","<CB=SEID_1410_S0130_a0060_End>","0","1358","-1","0","2","Gute Idee. So können wir ihn nicht davonkommen lassen."
"1684","","0","2","0","RID_SEAMANK_00080","","","","","0","-1","1135","0","19","Ihr sucht nach einem kleinen Ausreißer?"
"","","0","1","0","RID_SEAMANK_00090_mainA","","","","","0","-1","1135","0","19","Da war vorhin ein seltsamer Junge, der den Leuten Fragen gestellt hat. Ich glaube, er wollte wissen, wie man in Fassade hineinkommt."
"","","0","1","0","SEID_1410_S0130_0315_X","","","","<CB=SEID_1410_S0130_a0070g_0010_End>","0","1135","-1","0","2","Fassade, hm? Vielleicht sollten wir mal nachsehen."
"1685","","0","2","0","RID_MSKWIFB_00050","","","","","0","-1","1090","0","146","(Ein Mann ist kürzlich in dieses Haus eingezogen. Er trägt immer einen ziemlich seltsamen Hut!)"
"","","0","1","0","RID_MSKWIFB_00060","","","","<CB=SEID_1410_S0130_a0070g_0020_End>","0","-1","1090","0","146","(Erstaunlicherweise fügt er sich perfekt ein. Er spricht sogar unsere Sprache und kennt viele unserer Regeln.)"
"1686","","0","2","0","RID_MSKWIFA_00060","","","","<CB=SEID_1410_S0130_a0070g_0030_End>","0","-1","1091","0","146","(Wie ich hörte, ist der neue Außenstehende vor einem fürchterlichen Leben in seiner Heimat geflohen.)"
"1687","","0","2","0","RID_NIER_00550","","","","","0","1359","-1","0","2","Hey, du! Du kommst mit mir."
"","","0","1","0","RID_VILRASN_00100","","","","","0","-1","1359","0","19","Ach, Mann! Warum müsst Ihr mir überhaupt nachlaufen?"
"1688","","0","1","0","RID_VILRASN_00110","","","","","0","-1","1359","0","19","Na schööön. Lasst mich packen und dann werde ich ...<LF>OH MEIN GOTT! DA IST EIN RIESIGER SCHATTEN HINTER EUCH!"
"1689","","0","1","0","SEID_1410_S0130_0380_X","","","","","-1","0","0","0","2","Ach, willst du mich schon wieder VERSCHAUKELN?!"
"","","0","1","0","SEID_1410_S0130_0391_X","","","","","-1","0","0","0","26","Er will zweifelsohne aus der Stadt fliehen, aber er kann noch nicht weit gekommen sein."
"1690","","0","1","0","RID_VILRASN_00120","","","","","0","-1","1359","0","19","Ach, Maaaann! Schon wieder?! Also gut, geht klar. Ich muss nur kurz ..."
"1691","","0","1","0","RID_VILRASN_00160","","","","","0","-1","1359","0","19","Ich hätte nie gedacht, dass ich wirklich Wölfen begegne ..."
"","","0","1","0","SEID_1410_S0130_0480_X","","","","","0","1359","-1","0","2","Bist du jetzt bereit, nach Hause zu gehen?"
"","","0","1","0","RID_VILRASN_00170","","","","","0","-1","1359","0","19","Ja, Mann. Verdammt! Dieser Abenteuermist ist irgendwie viel zu aufregend für mich. Dann bleibe ich eben zu Hause."
"","","0","1","0","SEID_1410_S0130_0500_X","","","","","-1","0","0","0","2","Sehr gut. Lass uns das deiner Familie erzählen."
"1692","1693","0","1","0","RID_NIER_00560","","","","","-1","0","0","0","2","... Hier ist niemand."
"","","0","1","0","SEID_1410_S0130_0520_X","","","","","-1","0","0","0","26","Offenbar haben sie uns eine Nachricht hinterlassen."
"","","0","1","0","EID_9999_NoSound","","","","","-1","0","0","0","","""Dank Eurer Hilfe ist mein Sohn zurückgekehrt, um den Familienbetrieb zu übernehmen."""
"","","0","1","0","EID_9999_NoSound","","","","","-1","0","0","0","","""Wir haben uns entschieden, in ein neues Land zu ziehen, um von vorne anzufangen und ihn auszubilden, damit er den Familienbetrieb weiterführen kann."""
"1693","","0","1","0","SEID_1410_S0130_0550_X","","","","","-1","0","0","0","2","Tja, das ist irgendwie ... enttäuschend. Ich frage mich, was das überhaupt für ein Betrieb war."
"","","0","1","0","RID_VILGUB_00070","","","","","0","-1","1058","0","9","Hey! Seid Ihr mit den Leuten befreundet, die hier gelebt haben?!"
"1694","","0","1","0","SEID_1410_S0130_0570_X","","","","","-1","1058","-1","0","2","Nein, nicht wirklich. Warum?"
"","","0","1","0","RID_VILGUB_00080","","","","","0","-1","1058","0","9","Weil sie sich überall im Dorf Geld geliehen haben und dann aus der Stadt verschwunden sind!"
"","","0","1","0","RID_VILGUB_00090","","","","","0","-1","1058","0","9","Offenbar war ihr Sohn weggelaufen, um einem Leben als Verbrecher zu entrinnen, aber irgendwer hat ihn zurückgebracht."
"","","0","1","0","SEID_1410_S0130_0590_X","","","","","-1","1058","-1","0","2","... Oha, dann wissen wir jetzt wohl, womit sich der Familienbetrieb befasst."
"","","0","1","0","SEID_1410_S0130_0600_X","","","","","-1","0","0","0","26","Und für dieses absurde Abenteuer sind wir nicht einmal bezahlt worden! Na ja. Dann sollten wir es wohl als hohes Lehrgeld verbuchen und weitermachen."
"1695","","0","1","0","RID_VILRASN_00090","","","","","0","-1","1359","0","19","Die Pfannen und Löffel und den Kram kann ich selber besorgen, also bringt das Fleisch einfach irgendwann zu ihm, Mann."
"1696","","0","1","0","SEID_1410_S0130_0402_X","","","","","-1","0","0","0","26","Also hat er sich als Maskenmensch getarnt, hm? Kein Wunder, dass wir die Spur verloren haben."
"","","0","1","0","SEID_1410_S0130_0404_X","","","","","-1","0","0","0","2","Er hat viel auf sich genommen, um uns abzuschütteln. Ich kann es kaum erwarten, ihn endlich zu erwischen."
"1697","","0","2","0","SEID_1410_S0130_0406_X","","","","<CB=SEID_1410_S0130_a0110_End>","-1","0","0","0","26","Er ist auf dem Weg zur Oststraße! Wir müssen ihn erwischen, bevor er die Wüste verlässt!"
"1698","","0","2","0","RID_MSKSTR_00070","","","","","0","-1","1094","0","48","(Hey, mögt Ihr einem armen Tropf einen Gefallen tun?)"
"","","0","1","0","SEID_1450_S0070_0020_X","","","","","0","1094","-1","0","2","Oha. Ihr klingt ziemlich niedergeschlagen."
"","","0","1","0","RID_MSKSTR_00080","","","","","0","-1","1094","0","48","(Ich habe meine Frau betrogen, und sie hat es herausgefunden. Dann hat sie mich vor die Tür gesetzt.)"
"","","0","1","0","SEID_1450_S0070_0040_X","","","","","-1","0","0","0","26","Hoffentlich erwartet Ihr kein Mitleid von uns!"
"","","0","1","0","RID_MSKSTR_00090","","","","","0","-1","1094","0","48","(Nein, nein. Ich weiß, ich war ein selbstsüchtiger Idiot. Ich will nur, dass sie mich zurücknimmt. Daher hoffte ich, ihr ein Geschenk überreichen zu können.)"
"","","0","1","0","RID_MSKSTR_00100","","","","","0","-1","1094","0","48","(Ich möchte ihr einen Mantel aus Wolfshäuten anfertigen, aber ich konnte die notwendigen Materialien nicht auftreiben.)"
"","","0","1","0","SEID_1450_S0070_0070_X","","","","","0","1094","-1","0","2","Also sollen wir ein paar Wölfe für Euch erlegen?"
"","","0","1","0","RID_MSKSTR_00110","","","","<CB=LIB_SET_START_SUBQUEST,1724,41,8,1094,1699>","0","-1","1094","0","48","(Das war die Idee. Kann ich auf Euch zählen?)"
"1699","","0","1","0","SEID_1450_S0070_0090_X","","","","","0","1094","-1","0","2","Na ja, Ihr scheint Euch ja im Klaren zu sein, dass Ihr das selbst verbockt habt. Dann können wir wohl auch helfen."
"","","0","1","0","RID_MSKSTR_00120","","","","<CB=LIB_SET_END_SUBQUEST>","0","-1","1094","0","48","(Vielen Dank. Ich benötige lediglich zehn Wolfshäute.)"
"1700","","0","2","0","RID_NIER_00800","","","","","0","1094","-1","0","2","Ich habe Eure zehn Wolfshäute."
"","","0","1","0","RID_MSKSTR_00140","","","","","0","-1","1094","0","48","(Vielen Dank. Jetzt muss ich nur noch den Mantel nähen und alles wiedergutmachen.)"
"","","0","1","0","SEID_1450_S0070_0130_X","","","","","0","1094","-1","0","2","Ähm, sie ist so richtig sauer auf Euch, oder? Wird sie Euch überhaupt lange genug zu Wort kommen lassen, sodass Ihr das Geschenk überreichen könnt?"
"","","0","1","0","RID_MSKSTR_00150","","","","","0","-1","1094","0","48","(Hrm. Letztes Mal, als ich zu ihr ging, hat sie IN DER TAT Dinge nach mir geworfen. Also ... vielleicht könnt Ihr sie für mich fragen?)"
"","","0","1","0","SEID_1450_S0070_0150_X","","","","","0","1094","-1","0","2","Also bitte! Wirklich? *seufz* Tja, die Nachricht überbringen – nun gut. Aber das Geschenk muss von Euch kommen."
"","","0","1","0","RID_MSKSTR_00160","","","","<CB=SEID_1450_S0070_a0030_End01>","0","-1","1094","0","48","(Natürlich, natürlich. Tut mir leid, dass Ihr so viel Mühe mit mir habt. Wie auch immer, sie hält sich in der Etage über uns auf.)"
"1701","","0","1","0","RID_MSKSTR_00130","","","","<CB=SEID_1450_S0070_a0030_End02>","0","-1","1094","0","48","(Ich benötige zehn Wolfshäute ... Und danke.)"
"1702","","0","2","0","RID_NIER_00810","","","","","0","1111","-1","0","2","Hallöchen. Ich, äh, habe eine Nachricht für Euch."
"","","0","1","0","RID_MSKWOMC_00050","","","","","0","-1","1111","0","146","(Ich wette, die ist von diesem nichtsnutzigen Betrüger, der sich mein Ehemann schimpft!)"
"","","0","1","0","SEID_1450_S0070_0200_X","","","","","0","1111","-1","0","2","Ähm, ja. Wie auch immer, er richtet aus, er weiß, dass er etwas Falsches getan hat und möchte Euch als Entschuldigung ein Geschenk machen."
"","","0","1","0","RID_MSKWOMC_00060","","","","","0","-1","1111","0","146","(Ha, das PASST zu ihm!)"
"","","0","1","0","RID_MSKWOMC_00070","","","","","0","-1","1111","0","146","(Er hätte es besser wissen müssen und gar nicht erst fremdgehen dürfen. Er ist viel zu dumm, um so etwas unbemerkt durchzuziehen.)"
"","","0","1","0","RID_MSKWOMC_00080","","","","<CB=SEID_1450_S0070_a0050_Start>","0","-1","1111","0","146","(Und doch klingt es, als hätte er seine Lektion gelernt. Vielleicht kann ich ihm also dieses eine Mal vergeben.)"
"1703","","0","1","0","RID_MSKSTR_00180","","","","","0","-1","1094","0","48","(Ich konnte alles wieder in Ordnung bringen ... mehr oder weniger. Wie auch immer, danke sehr. Ohne Eure Hilfe hätte ich es nicht geschafft.)"
"","","0","1","0","SEID_1450_S0070_0250_X","","","","","0","1094","-1","0","2","Aber Ihr werdet sie nicht erneut betrügen, in Ordnung?"
"","","0","1","0","RID_MSKSTR_00190","","","","<CB=SEID_1450_S0070_a0050_End>","0","-1","1094","0","48","(Oh, das werde ich nicht! Von jetzt an werde ich mein ganzes Leben ihrem Glück widmen!)"
"1704","","0","1","0","RID_MSKSTR_00170","","","","","0","-1","1094","0","48","(Meine Frau ist in der Etage über uns. Könntet Ihr sie bitte zur Vernunft bringen?)"
